,id,sentence,comment_cut,score,ratio
529,lX03TICGpzY,"Jesus is coming back soon, please repent!!!<br><br><br>•Why Salvation?: So I’m sure your probably familiar with the story of Adam and Eve, (them disobeying God, committing the original sin eating the fruit from the forbidden tree of knowledge of good and evil). Us, being their earthly descendants we are all vulnerable to temptation to sin and have sinned (sin: which is a moral flaw/crime against God). In the story of Moses, God gives what is called the moral law(the Ten Commandments) the Bible says “the wages of sin is death” breaking these laws we are punished by death/hell. We’ve all broken at least one of these commandments. So God sends Jesus(the son of God) who lives a perfect and sinless life. Jesus offers himself as a sacrifice in place of the punishment that we deserve for breaking the Moral Law. So right before Jesus passes away on the cross, he says “it is finished” which means the punishment for our sins was fulfilled. Then Jesus dies. He raises from the dead, three days later, signifying he had defeated death, which is the wages for sin.   (John <a href=""https://www.youtube.com/watch?v=lX03TICGpzY&amp;t=3m16s"">3:16</a>) sums up why God offered his Son as a sacrifice for our sin.<br><br><br>••How to get saved: Romans 10:9 “that if you confess with your mouth the Lord Jesus and believe in your heart that God has raised Him from the dead, you will be saved.”<br><br>Ask God for forgiveness, repent and ask him into your Heart and Life in the name of Jesus. Repent: to feel such regret for sins or crimes as produces amendment of life, to be sorry, regretful.<br><br>When you do this God will begin to make changes in your life, this means you are “born again” When you actually pray and try to get rid of sin your life, you’ll start to see a change. This process will last throughout you whole life if you are really committed. God knows our hearts and intentions better then we know ourselves. I hope this is a major blessing. I hope you really take into account what I said and really think and pray on these things. God Bless!","['Jesus', 'is', 'coming', 'back', 'soon', 'please', 'repentWhy', 'Salvation', 'So', 'Im', 'sure', 'your', 'probably', 'familiar', 'with', 'the', 'story', 'of', 'Adam', 'and', 'Eve', 'them', 'disobeying', 'God', 'committing', 'the', 'original', 'sin', 'eating', 'the', 'fruit', 'from', 'the', 'forbidden', 'tree', 'of', 'knowledge', 'of', 'good', 'and', 'evil', 'Us', 'being', 'their', 'earthly', 'descendants', 'we', 'are', 'all', 'vulnerable', 'to', 'temptation', 'to', 'sin', 'and', 'have', 'sinned', 'sin', 'which', 'is', 'a', 'moral', 'flawcrime', 'against', 'God', 'In', 'the', 'story', 'of', 'Moses', 'God', 'gives', 'what', 'is', 'called', 'the', 'moral', 'lawthe', 'Ten', 'Commandments', 'the', 'Bible', 'says', 'the', 'wages', 'of', 'sin', 'is', 'death', 'breaking', 'these', 'laws', 'we', 'are', 'punished', 'by', 'deathhell', 'Weve', 'all', 'broken', 'at', 'least', 'one', 'of', 'these', 'commandments', 'So', 'God', 'sends', 'Jesusthe', 'son', 'of', 'God', 'who', 'lives', 'a', 'perfect', 'and', 'sinless', 'life', 'Jesus', 'offers', 'himself', 'as', 'a', 'sacrifice', 'in', 'place', 'of', 'the', 'punishment', 'that', 'we', 'deserve', 'for', 'breaking', 'the', 'Moral', 'Law', 'So', 'right', 'before', 'Jesus', 'passes', 'away', 'on', 'the', 'cross', 'he', 'says', 'it', 'is', 'finished', 'which', 'means', 'the', 'punishment', 'for', 'our', 'sins', 'was', 'fulfilled', 'Then', 'Jesus', 'dies', 'He', 'raises', 'from', 'the', 'dead', 'three', 'days', 'later', 'signifying', 'he', 'had', 'defeated', 'death', 'which', 'is', 'the', 'wages', 'for', 'sin', 'John', '316', 'sums', 'up', 'why', 'God', 'offered', 'his', 'Son', 'as', 'a', 'sacrifice', 'for', 'our', 'sinHow', 'to', 'get', 'saved', 'Romans', '109', 'that', 'if', 'you', 'confess', 'with', 'your', 'mouth', 'the', 'Lord', 'Jesus', 'and', 'believe', 'in', 'your', 'heart', 'that', 'God', 'has', 'raised', 'Him', 'from', 'the', 'dead', 'you', 'will', 'be', 'savedAsk', 'God', 'for', 'forgiveness', 'repent', 'and', 'ask', 'him', 'into', 'your', 'Heart', 'and', 'Life', 'in', 'the', 'name', 'of', 'Jesus', 'Repent', 'to', 'feel', 'such', 'regret', 'for', 'sins', 'or', 'crimes', 'as', 'produces', 'amendment', 'of', 'life', 'to', 'be', 'sorry', 'regretfulWhen', 'you', 'do', 'this', 'God', 'will', 'begin', 'to', 'make', 'changes', 'in', 'your', 'life', 'this', 'means', 'you', 'are', 'born', 'again', 'When', 'you', 'actually', 'pray', 'and', 'try', 'to', 'get', 'rid', 'of', 'sin', 'your', 'life', 'youll', 'start', 'to', 'see', 'a', 'change', 'This', 'process', 'will', 'last', 'throughout', 'you', 'whole', 'life', 'if', 'you', 'are', 'really', 'committed', 'God', 'knows', 'our', 'hearts', 'and', 'intentions', 'better', 'then', 'we', 'know', 'ourselves', 'I', 'hope', 'this', 'is', 'a', 'major', 'blessing', 'I', 'hope', 'you', 'really', 'take', 'into', 'account', 'what', 'I', 'said', 'and', 'really', 'think', 'and', 'pray', 'on', 'these', 'things', 'God', 'Bless']",0.0,0.0
530,lX03TICGpzY,"@Maryam Azizah, those words are in the bible.","['Maryam', 'Azizah', 'those', 'words', 'are', 'in', 'the', 'bible']",0.0,0.0
531,lX03TICGpzY,what?,['what'],0.0,0.0
532,lX03TICGpzY,I think i commented this on other trailer but i&#39;ll comment again. Please bring this to netflix,"['I', 'think', 'i', 'commented', 'this', 'on', 'other', 'trailer', 'but', 'i', '39', 'll', 'comment', 'again', 'Please', 'bring', 'this', 'to', 'netflix']",-0.26430840810639306,-0.12
533,lX03TICGpzY,Yeah ✌ I haven&#39;t watched English in awhile now. 😆 Korea is invading Netflix  and I love it! 😆😍,"['Yeah', 'I', 'haven', '39', 't', 'watched', 'English', 'in', 'awhile', 'now', 'Korea', 'is', 'invading', 'Netflix', 'and', 'I', 'love', 'it']",-0.26430840810639306,-0.12
534,lX03TICGpzY,🙌 agree,['agree'],0.0,0.0
535,lX03TICGpzY,Agree 👍🏼,['Agree'],0.0,0.0
536,lX03TICGpzY,You&#39;re the best Yoo Ah In..🥰🥰🥰,"['You', '39', 're', 'the', 'best', 'Yoo', 'Ah', 'In']",-0.26430840810639306,-0.14
537,lX03TICGpzY,Love Yoo Ah In,"['Love', 'Yoo', 'Ah', 'In']",0.0,0.0
538,lX03TICGpzY,"Oh boi, now this is a trailer.","['Oh', 'boi', 'now', 'this', 'is', 'a', 'trailer']",0.0,0.0
539,lX03TICGpzY,Ain sssi is tge best,"['Ain', 'sssi', 'is', 'tge', 'best']",0.0,0.0
540,lX03TICGpzY,"Hey dude, idk if you read comments, but what is going on with the movie &quot;Call&quot; that was supposed to come out earlier this year. I know it got taken off the schedule cuz of COVID but since then it&#39;s been crickets. Any word on that release?","['Hey', 'dude', 'idk', 'if', 'you', 'read', 'comments', 'but', 'what', 'is', 'going', 'on', 'with', 'the', 'movie', 'quotCallquot', 'that', 'was', 'supposed', 'to', 'come', 'out', 'earlier', 'this', 'year', 'I', 'know', 'it', 'got', 'taken', 'off', 'the', 'schedule', 'cuz', 'of', 'COVID', 'but', 'since', 'then', 'it', '39', 's', 'been', 'crickets', 'Any', 'word', 'on', 'that', 'release']",-0.26430840810639306,-0.1
541,lX03TICGpzY,"Call by park shin hye is rumoured to be on netflix soon, hot cancelled earlier this year because of corona. And the other female lead is the woman who plays burning with yoo ah in. I saw the call trailer and her acting was soo good , really cant wait","['Call', 'by', 'park', 'shin', 'hye', 'is', 'rumoured', 'to', 'be', 'on', 'netflix', 'soon', 'hot', 'cancelled', 'earlier', 'this', 'year', 'because', 'of', 'corona', 'And', 'the', 'other', 'female', 'lead', 'is', 'the', 'woman', 'who', 'plays', 'burning', 'with', 'yoo', 'ah', 'in', 'I', 'saw', 'the', 'call', 'trailer', 'and', 'her', 'acting', 'was', 'soo', 'good', 'really', 'cant', 'wait']",0.0,0.0
542,lX03TICGpzY,Yo cant wait,"['Yo', 'cant', 'wait']",0.0,0.0
543,KqQ7QXAIs70,٩,[],0.0,-0.0
544,KqQ7QXAIs70,"조리있는 영화소개, 꼭 챙겨 보고싶네요.","['조리', '있는', '영화', '소개', '꼭', '챙겨', '보고싶네요']",0.08877608387345143,0.05
545,KqQ7QXAIs70,"감사합니다. 벌써 IPTV 에 나와서 아쉽지만, 정말 좋은 영화였어요.","['감사합니다', '벌써', 'IPTV', '에', '나와서', '아쉽지만', '정말', '좋은', '영화', '였어요']",4.836190823476999,2.42
546,KqQ7QXAIs70,봐야지하고 맘만 먹다보니 벌써 vod시장에 나왔더라구요 호불호가 많이 갈리던데 짬을 내서 꼭 찾아봐야겠습니다 좋은 영상 잘봤습니다,"['봐야지하고', '맘', '만', '먹다', '보니', '벌써', 'vod', '시장', '에', '나왔더라구요', '호불호', '가', '많이', '갈리던데', '짬', '을', '내서', '꼭', '찾아봐야겠습니다', '좋은', '영상', '잘', '봤습니다']",7.3981217185227806,3.13
547,KqQ7QXAIs70,ضضضضضض,[],0.0,-0.0
548,U4oKV0dyrZM,리뷰 해석남겨주신분들 중에서 가장 와닿네요  보고나니  한번 더 보고싶은 영화예요,"['리뷰', '해석', '남겨', '주신', '분들', '중', '에서', '가장', '와', '닿네요', '보고나니', '한번', '더', '보고싶은', '영화', '예요']",1.36299207594862,0.62
549,U4oKV0dyrZM,감사합니다 뀨님!,"['감사합니다', '뀨님']",0.32363939317907575,0.25
550,U4oKV0dyrZM,전 그 마지막 허무한 느낌이너무 좋던데요........ 그것땜에계속 돌려보눈쥬유ㅠㅠㅠㅠㅠㅠㅠㅠㅠㅠ,"['전', '그', '마지막', '허무한', '느낌', '이', '너무', '좋던데요', '그것', '땜', '에', '계속', '돌려보눈쥬유']",-1.6347117225263992,-0.77
551,U4oKV0dyrZM,네 허무하긴한데  게속 여운이 남더라구요 이런 영화가 많이 나오면 좋겠어요,"['네', '허무하긴한데', '게속', '여운', '이', '남더라구요', '이런', '영화', '가', '많이', '나오면', '좋겠어요']",1.2652467322364895,0.61
552,U4oKV0dyrZM,존나 별로였어요 이해안가는것도 많았구여<br>그 중 여자아이가 유아인 없을때 집밖으로 도망나오고 경찰을 찾기위해 돌아다니다가 결국 유아인이 먼저 찾아서 다시 집으로 돌아가고.. 그 후 순찰중인 여경찰이 유아인집으로 왔을때 왜 여자아이는 여경찰에게 도망치는 모습이 없었죠? 흙에 묻을때도 표정이 아무렇지 않은 모습도 궁금하네요,"['존나', '별로', '였어요', '이', '해안가', '는', '것', '도', '많았구여', '그', '중', '여자아이', '가', '유아인', '없을', '때', '집밖', '으로', '도망', '나오고', '경찰', '을', '찾기', '위해', '돌아다니다가', '결국', '유아인', '이', '먼저', '찾아서', '다시', '집', '으로', '돌아가고', '그', '후', '순찰중', '인', '여', '경찰', '이', '유아인', '집', '으로', '왔을', '때', '왜', '여자아이', '는', '여', '경찰', '에게', '도망치는', '모습', '이', '없었죠', '흙', '에', '묻을', '때', '도', '표정', '이', '아무렇지', '않은', '모습', '도', '궁금하네요']",-2.2230685948327618,-0.78
553,U4oKV0dyrZM,열린결말... 진짜 완전 황당한 결말... 이영화때문에 사라진 내 시간이 아까워 죽을뻔함.,"['열린', '결말', '진짜', '완전', '황당한', '결말', '이영화', '때문', '에', '사라진', '내', '시간', '이', '아까워', '죽', '을', '뻔함']",-1.37507357542595,-0.62
554,U4oKV0dyrZM,허무함도 있었던거같아요 잘가다 급하게 끝난 느낌이었죠..,"['허무함도', '있었던거', '같아요', '잘', '가다', '급하게', '끝난', '느낌이었죠']",0.21493839578120466,0.11
555,U4oKV0dyrZM,"<a href=""https://www.youtube.com/watch?v=U4oKV0dyrZM&amp;t=4m55s"">4:55</a>완전 공감이에요 <br>분명 범죄인데 ,,,들키지 말았으면 하는 마음이 더 커지게되더라구여ㅠ","['455', '완전', '공감', '이에요', '분명', '범죄', '인데', '들키지', '말았으면', '하는', '마음', '이', '더', '커지게', '되더라', '구', '여']",-3.9738093418015015,-1.78
556,U4oKV0dyrZM,공감해주셔서 감사합니다 댓글두요 .. 구독해주시면 큰 힘이됩니다,"['공감', '해주셔서', '감사합니다', '댓글', '두', '요', '구독', '해주시면', '큰', '힘', '이', '됩니다']",0.7657662142643165,0.37
557,U4oKV0dyrZM,자켓의미 궁금했는데...해소됬어요!,"['자켓', '의미', '궁금했는데', '해소', '됬어요']",0.31873811688320053,0.19
558,U4oKV0dyrZM,주인공인데 왜 대사..말이 없나요?,"['주인공', '인데', '왜', '대', '사', '말', '이', '없나요']",-0.25808814737098146,-0.14
559,U4oKV0dyrZM,"유아인 역할이 말을 안하는 설정입니다 ! <a href=""https://www.youtube.com/watch?v=U4oKV0dyrZM&amp;t=07m08s"">07:08</a> 에 보시면 감독이 인터뷰한거 나옵니다^^","['유아인', '역할', '이', '말', '을', '안', '하는', '설정', '입니다', '0708', '에', '보시', '면', '감독', '이', '인터뷰', '한', '거', '나옵니다']",1.2458282762497173,0.55
560,U4oKV0dyrZM,진짜 대사가 들리는듯하다는 말이 공감됩니다,"['진짜', '대사', '가', '들리는듯', '하다는', '말', '이', '공감', '됩니다']",3.183922914746714,1.63
561,U4oKV0dyrZM,공감해주셔서 감사합니다^^댓글두요,"['공감', '해주셔서', '감사합니다', '댓글', '두', '요']",-0.08001311855597204,-0.04
562,U4oKV0dyrZM,마지막에 굳이 피묻은 셔츠를 입고간 이유가 무엇인가요?,"['마지막', '에', '굳이', '피', '묻은', '셔츠', '를', '입', '고간', '이유', '가', '무엇', '인가요']",-0.09431028967262445,-0.04
563,U4oKV0dyrZM,아마 몸만큰 어린이같은 태인이라 주변상황을 다 보지못해서 그런거같습니다 그리고 감독은  관객이 &#39;왜그렇게했을까&#39;하는극과극 아이러니를 계속 생각할 수있게 의도한 연출인것 같아요,"['아마', '몸', '만', '큰', '어린이', '같은', '태인', '이라', '주변', '상황', '을', '다', '보지', '못', '해서', '그런거', '같습니다', '그리고', '감독', '은', '관객', '이', '39', '왜', '그렇게', '했을까', '39', '하는', '극', '과극', '아이러니', '를', '계속', '생각', '할', '수', '있게', '의도', '한', '연출', '인', '것', '같아요']",0.2651786917801655,0.1
564,U4oKV0dyrZM,굿,['굿'],0.0,0.0
565,U4oKV0dyrZM,재명 역은  약간사이코. . 아닌가요,"['재', '명', '역은', '약간', '사이코', '아닌가요']",0.5768262642541819,0.32
566,U4oKV0dyrZM,리뷰 잘봤습니다. 영화보러 가고싶어지네요,"['리뷰', '잘', '봤습니다', '영화', '보러', '가고싶어지네요']",4.879305810515136,2.74
567,U4oKV0dyrZM,댓글감사합니다 !  기존영화는 다른느낌이예요  시간되시면 꼭 보시길 바랍니다.,"['댓글', '감사합니다', '기존', '영화', '는', '다른', '느낌', '이', '예요', '시간', '되시면', '꼭', '보시길', '바랍니다']",-0.6654927173684777,-0.31
568,U4oKV0dyrZM,장가회장님 출소하고 이런일하고계셧구나...,"['장가', '회장', '님', '출', '소하', '고', '이런', '일', '하고', '계셧', '구나']",0.3486030530141553,0.17
569,U4oKV0dyrZM,나는!!,"['나', '는']",0.0,0.0
570,U4oKV0dyrZM,해석이 좋네요 진짜루 자켓보고 저도 뭘까생각했었는데,"['해석', '이', '좋네요', '진짜루', '자켓', '보고', '저', '도', '뭘', '까', '생각', '했었는데']",1.1513851854024648,0.55
571,U4oKV0dyrZM,감사합니다^^!,['감사합니다'],0.32363939317907575,0.32
572,U4oKV0dyrZM,망고님    넘 잘봤습니다  꼭 영화를 보고싶네요~~,"['망고', '님', '넘', '잘', '봤습니다', '꼭', '영화', '를', '보고싶네요']",2.626174146935623,1.34
573,U4oKV0dyrZM,꼭 보시길 추천드립니다 댓글감사합니다,"['꼭', '보시길', '추천', '드립니다', '댓글', '감사합니다']",-0.11028350479432453,-0.06
574,U4oKV0dyrZM,유아인연기대박ㅇ라는데 간만에 영화보러가야겠네요 재밌어보여요,"['유아인', '연', '기', '대박', '라는', '데', '간만', '에', '영화', '보러가야겠네요', '재밌어', '보여요']",1.5934742805490743,0.77
575,U4oKV0dyrZM,유아인연기가 정말좋았습니다 추천드립니다 댓글감사합니다,"['유아인', '연기', '가', '정말', '좋았습니다', '추천', '드립니다', '댓글', '감사합니다']",0.458015339475813,0.23
576,j8JVQdF76Fk,Please set ENG sub :) / Click or touch the edge of the screen to set subtitles.,"['Please', 'set', 'ENG', 'sub', 'Click', 'or', 'touch', 'the', 'edge', 'of', 'the', 'screen', 'to', 'set', 'subtitles']",0.0,0.0
577,j8JVQdF76Fk,살찌우고 빼고 다시찌우고 빠질까봐 또찌우고.   비단 살뿐만이랴. 대사없는 연기 진짜 대단하다 유아인👍몰입감최고였음,"['살찌우고', '빼고', '다시', '찌우고', '빠질까봐', '또', '찌우고', '비단', '살', '뿐', '만이', '랴', '대사', '없는', '연기', '진짜', '대단하다', '유아인', '몰입', '감', '최고', '였음']",8.909409263236236,3.8
578,j8JVQdF76Fk,"살을 금방뺏어.,. 대박","['살', '을', '금방', '뺏어', '대박']",-0.08248491470364555,-0.05
579,j8JVQdF76Fk,"I heard many sources about Yoo Ah In&#39;s perspective on woman. He always questioned about woman empowerment. Why did woman been treated lesser than a man when it comes to entertainment industry. Then today I see him uplift woman again. How he speak to the director truly shows his respect and high considerations towards woman. He even correct the director when she keep mentioning that she makes mistake.<br>When the director said that she felt sorry for him for being a reason of his body shaping, he then want to stop discussing the topic. I knew he don&#39;t want her feeling even more guilty..<br>Respect, considerate and mature. he is a  pretty decent grown up man.🥰","['I', 'heard', 'many', 'sources', 'about', 'Yoo', 'Ah', 'In', '39', 's', 'perspective', 'on', 'woman', 'He', 'always', 'questioned', 'about', 'woman', 'empowerment', 'Why', 'did', 'woman', 'been', 'treated', 'lesser', 'than', 'a', 'man', 'when', 'it', 'comes', 'to', 'entertainment', 'industry', 'Then', 'today', 'I', 'see', 'him', 'uplift', 'woman', 'again', 'How', 'he', 'speak', 'to', 'the', 'director', 'truly', 'shows', 'his', 'respect', 'and', 'high', 'considerations', 'towards', 'woman', 'He', 'even', 'correct', 'the', 'director', 'when', 'she', 'keep', 'mentioning', 'that', 'she', 'makes', 'mistakeWhen', 'the', 'director', 'said', 'that', 'she', 'felt', 'sorry', 'for', 'him', 'for', 'being', 'a', 'reason', 'of', 'his', 'body', 'shaping', 'he', 'then', 'want', 'to', 'stop', 'discussing', 'the', 'topic', 'I', 'knew', 'he', 'don', '39', 't', 'want', 'her', 'feeling', 'even', 'more', 'guiltyRespect', 'considerate', 'and', 'mature', 'he', 'is', 'a', 'pretty', 'decent', 'grown', 'up', 'man']",-0.26430840810639306,-0.09
580,j8JVQdF76Fk,Very well said!,"['Very', 'well', 'said']",0.0,0.0
581,j8JVQdF76Fk,"Thanks for the sub!<br>YAI is the best, omg I just cant stop smilling haha","['Thanks', 'for', 'the', 'subYAI', 'is', 'the', 'best', 'omg', 'I', 'just', 'cant', 'stop', 'smilling', 'haha']",0.0,0.0
582,j8JVQdF76Fk,오 난 감독이 먼저 살찌우는거 요구한 줄 알았는데 유아인 아이디어구나..,"['오', '난', '감독', '이', '먼저', '살찌우는거', '요구', '한', '줄', '알았는데', '유아인', '아이디어', '구나']",1.4556593022956823,0.69
583,j8JVQdF76Fk,"Love YAI.. thanks for the eng sub<br>Devoted, humble, yet awesome people doing lovely job","['Love', 'YAI', 'thanks', 'for', 'the', 'eng', 'subDevoted', 'humble', 'yet', 'awesome', 'people', 'doing', 'lovely', 'job']",0.0,0.0
584,OEGWIR53zmE,"Just watched it, the film delivers superb dark concept, and Yoo Ah In is simply unbelievable with his whole body acting","['Just', 'watched', 'it', 'the', 'film', 'delivers', 'superb', 'dark', 'concept', 'and', 'Yoo', 'Ah', 'In', 'is', 'simply', 'unbelievable', 'with', 'his', 'whole', 'body', 'acting']",0.0,0.0
585,OEGWIR53zmE,@izUku tsks chinese subs,"['izUku', 'tsks', 'chinese', 'subs']",0.0,0.0
586,OEGWIR53zmE,@jayant97 dramacool?,"['jayant', '97', 'dramacool']",0.0,0.0
587,OEGWIR53zmE,@izUku online,"['izUku', 'online']",0.0,0.0
588,OEGWIR53zmE,where did you watch that?,"['where', 'did', 'you', 'watch', 'that']",0.0,0.0
589,OEGWIR53zmE,"Netflix,  I beg you!!!!🥺","['Netflix', 'I', 'beg', 'you']",0.0,0.0
590,OEGWIR53zmE,I loved Burning and enjoyed its slow pace which served to increase the dread and anticipation for me. I&#39;ll be hunting for a place to see Voice of Silence online.,"['I', 'loved', 'Burning', 'and', 'enjoyed', 'its', 'slow', 'pace', 'which', 'served', 'to', 'increase', 'the', 'dread', 'and', 'anticipation', 'for', 'me', 'I', '39', 'll', 'be', 'hunting', 'for', 'a', 'place', 'to', 'see', 'Voice', 'of', 'Silence', 'online']",-0.26430840810639306,-0.11
591,OEGWIR53zmE,"i dont care what role Yoo Ah In plays in i will watch it slow burn, fast past whatever just point me to the site an i want to see him. hey also can you please give us a heads up as to where these movies you tell us about are playing maybe please😉","['i', 'dont', 'care', 'what', 'role', 'Yoo', 'Ah', 'In', 'plays', 'in', 'i', 'will', 'watch', 'it', 'slow', 'burn', 'fast', 'past', 'whatever', 'just', 'point', 'me', 'to', 'the', 'site', 'an', 'i', 'want', 'to', 'see', 'him', 'hey', 'also', 'can', 'you', 'please', 'give', 'us', 'a', 'heads', 'up', 'as', 'to', 'where', 'these', 'movies', 'you', 'tell', 'us', 'about', 'are', 'playing', 'maybe', 'please']",0.0,0.0
592,OEGWIR53zmE,Dónde se pueden ver las películas que subes,"['Dnde', 'se', 'pueden', 'ver', 'las', 'pelculas', 'que', 'subes']",0.0,0.0
593,OEGWIR53zmE,Yoo Ah-In is in a league of his own.  Thank God he wasn’t sporting the usual hairstyle of most Korean actors in this movie.,"['Yoo', 'AhIn', 'is', 'in', 'a', 'league', 'of', 'his', 'own', 'Thank', 'God', 'he', 'wasnt', 'sporting', 'the', 'usual', 'hairstyle', 'of', 'most', 'Korean', 'actors', 'in', 'this', 'movie']",0.0,0.0
594,OEGWIR53zmE,@MrAuditore96 No worries.,"['MrAuditore', '96', 'No', 'worries']",0.0,0.0
595,OEGWIR53zmE,"@mrsoz oh lawl, my bad man hahah; you saying &quot;in this movie&quot; made me think you referred to its entirety; thanks for the clarification though!","['mrsoz', 'oh', 'lawl', 'my', 'bad', 'man', 'hahah', 'you', 'saying', 'quotin', 'this', 'moviequot', 'made', 'me', 'think', 'you', 'referred', 'to', 'its', 'entirety', 'thanks', 'for', 'the', 'clarification', 'though']",0.0,0.0
596,OEGWIR53zmE,@Eda See my reply to @MrAuditore96.  Cheers.,"['Eda', 'See', 'my', 'reply', 'to', 'MrAuditore', '96', 'Cheers']",0.0,0.0
597,OEGWIR53zmE,@MrAuditore96  No I haven’t watched it yet...I was referring to his acting abilities in general and the bit about his hairstyle I was commenting on from the clip.  According to MDL the film was released on Oct 15 so I guess it won’t be too long before someone uploads it to a site like Kissasian etc.,"['MrAuditore', '96', 'No', 'I', 'havent', 'watched', 'it', 'yetI', 'was', 'referring', 'to', 'his', 'acting', 'abilities', 'in', 'general', 'and', 'the', 'bit', 'about', 'his', 'hairstyle', 'I', 'was', 'commenting', 'on', 'from', 'the', 'clip', 'According', 'to', 'MDL', 'the', 'film', 'was', 'released', 'on', 'Oct', '15', 'so', 'I', 'guess', 'it', 'wont', 'be', 'too', 'long', 'before', 'someone', 'uploads', 'it', 'to', 'a', 'site', 'like', 'Kissasian', 'etc']",0.0,0.0
598,OEGWIR53zmE,where did you watched it <br>i really wanna watch it,"['where', 'did', 'you', 'watched', 'it', 'i', 'really', 'wanna', 'watch', 'it']",0.0,0.0
599,OEGWIR53zmE,Best film,"['Best', 'film']",0.0,0.0
600,OEGWIR53zmE,Does anyone know when/where it is released? Where can we watch it?  Thanks,"['Does', 'anyone', 'know', 'whenwhere', 'it', 'is', 'released', 'Where', 'can', 'we', 'watch', 'it', 'Thanks']",0.0,0.0
601,OEGWIR53zmE,"It&#39;s already released in s.kor theaters, probably for online(illegal) mid november... i do hope netflix bought this tho","['It', '39', 's', 'already', 'released', 'in', 'skor', 'theaters', 'probably', 'for', 'onlineillegal', 'mid', 'november', 'i', 'do', 'hope', 'netflix', 'bought', 'this', 'tho']",-0.26430840810639306,-0.11
602,OEGWIR53zmE,I love Yoo Ah In..not only is he good looking but such a talented actor. Not scared of portraying unconventional roles. You&#39;re the best Yoo Ah in..🥰🥰,"['I', 'love', 'Yoo', 'Ah', 'Innot', 'only', 'is', 'he', 'good', 'looking', 'but', 'such', 'a', 'talented', 'actor', 'Not', 'scared', 'of', 'portraying', 'unconventional', 'roles', 'You', '39', 're', 'the', 'best', 'Yoo', 'Ah', 'in']",-0.26430840810639306,-0.11
603,OEGWIR53zmE,Yoo Ah-In is such a talented actor and I can&#39;t wait to see his performance in this movie 😁,"['Yoo', 'AhIn', 'is', 'such', 'a', 'talented', 'actor', 'and', 'I', 'can', '39', 't', 'wait', 'to', 'see', 'his', 'performance', 'in', 'this', 'movie']",-0.26430840810639306,-0.11
604,OEGWIR53zmE,I really dont mind spoiler ..,"['I', 'really', 'dont', 'mind', 'spoiler']",0.0,0.0
605,OEGWIR53zmE,"the only good korean films I&#39;ve watched this year is still The Man Standing Next, Peninsula, and Deliver Us From Evil. I hope Voice of Silence is good. Any recommendation of 2020 korean films?","['the', 'only', 'good', 'korean', 'films', 'I', '39', 've', 'watched', 'this', 'year', 'is', 'still', 'The', 'Man', 'Standing', 'Next', 'Peninsula', 'and', 'Deliver', 'Us', 'From', 'Evil', 'I', 'hope', 'Voice', 'of', 'Silence', 'is', 'good', 'Any', 'recommendation', 'of', '2020', 'korean', 'films']",-0.26430840810639306,-0.1
606,OEGWIR53zmE,"Memories of murder, montage, dark figure of crime, extream job","['Memories', 'of', 'murder', 'montage', 'dark', 'figure', 'of', 'crime', 'extream', 'job']",0.0,0.0
