,id,sentence,comment_cut,score,ratio
212,bvr2MC9h6Mc,어릴적에 이런류 본것 같은데 기억이 안남 외화인데 아이는 벽장속인지 집속인지 사라지고 부모는 심령술사 부부(?)<br>불러서 아이를 되찾는 영화인데 워낙 어릴적이라 기억이 가물가물 혹시 아시는분 있나요? 엑소시스트인가?,"['어릴', '적', '에', '이런', '류', '본것', '같은데', '기억', '이', '안남', '외화', '인데', '아이', '는', '벽장', '속', '인지', '집', '속', '인지', '사라지고', '부모', '는', '심령', '술사', '부부', '불러서', '아이', '를', '되찾는', '영화', '인데', '워낙', '어릴', '적', '이라', '기억', '이', '가물가물', '혹시', '아시', '는', '분', '있나요', '엑소시스트', '인가']",3.376811684060578,1.27
213,bvr2MC9h6Mc,90년대 주말의 명화에서 봄,"['90년', '대', '주말', '의', '명화', '에서', '봄']",-0.15966797909938624,-0.09
214,bvr2MC9h6Mc,인시디어스 아님?,"['인시디어스', '아님']",-0.22785309410930787,-0.18
215,bvr2MC9h6Mc,하정우 앞에서 신과함께드립?? ㅋㅋㅋ<br>공포영화 아니구만 이거 ㅋㅋㅋㅋㅋ,"['하정우', '앞', '에서', '신', '과', '함께', '드립', '공포영화', '아니구만', '이', '거']",2.438486898788146,1.19
216,bvr2MC9h6Mc,이거 시사회로 봤는데 생각보다 너무 별로였다.. 이 배우들로 이런 영화를 만들다니... 뭐 미스터주 안 본게 어디야,"['이', '거', '시사회', '로', '봤는데', '생각', '보다', '너무', '별로', '였다', '이', '배우', '들', '로', '이런', '영화', '를', '만들다니', '뭐', '미스', '터주', '안', '본게', '어디', '야']",1.6271087465087881,0.68
217,bvr2MC9h6Mc,"<a href=""https://www.youtube.com/watch?v=bvr2MC9h6Mc&amp;t=5m12s"">5:12</a> 베낄게 없어서 그걸ㅋㅋㅋㅋㅋㅋ","['512', '베', '낄게', '없어서', '그걸']",-1.5905594087229185,-0.94
218,bvr2MC9h6Mc,이영화는 그냥 망작입니다 하정우는 왜 갈수록 연기가 퇴보하는 느낌인지...뭐 하여간 연기를 떠나서 연출도 개판이고 돈아까운 영화에요,"['이영화', '는', '그냥', '망작', '입니다', '하정우', '는', '왜', '갈수록', '연기', '가', '퇴보하는', '느낌', '인지', '뭐', '하여간', '연기', '를', '떠나서', '연출', '도', '개판', '이고', '돈', '아까운', '영화', '에요']",1.9153879696344256,0.79
219,bvr2MC9h6Mc,하정우 연기 스타일 자체가 좀 클리셰적이고 큰 틀에서 벗어난 적이 없어서 더 그런듯 대부분 배역이 다 비슷비슷한 상황에서 비슷비슷한 감정표현을 하는거밖에 본적없음,"['하정우', '연기', '스타일', '자체', '가', '좀', '클리셰', '적', '이고', '큰', '틀', '에서', '벗어난', '적', '이', '없어서', '더', '그런듯', '대부분', '배역', '이', '다', '비슷', '비슷한', '상황', '에서', '비슷', '비슷한', '감정', '표현', '을', '하는거밖에', '본적', '없음']",-6.315552920889609,-2.49
220,bvr2MC9h6Mc,연기퇴보에 큰 공감,"['연', '기', '퇴보', '에', '큰', '공감']",0.33950826272543516,0.19
221,bvr2MC9h6Mc,예전부터 그랬지만 요즘들어 특히 하정우는 출연한 영화들에서 배역이 아닌 하정우 자체만 보이는 느낌이에요. 그래서 저는 하정우가 출연한 영화는 몰입이 떨어지는 편이라 거릅니다. 연기에 지나치게 직업적이고 사무적으로 임하는 느낌이랄까요.,"['예전', '부터', '그랬지만', '요즘', '들어', '특히', '하정우', '는', '출연', '한', '영화', '들', '에서', '배역', '이', '아닌', '하정우', '자체', '만', '보이는', '느낌', '이에요', '그래서', '저', '는', '하정우', '가', '출연', '한', '영화', '는', '몰입', '이', '떨어지는', '편이', '라', '거릅니', '다', '연기', '에', '지나치게', '직업', '적', '이고', '사무', '적', '으로', '임', '하는', '느낌', '이', '랄', '까요']",-3.1272873781209642,-1.15
222,bvr2MC9h6Mc,@리브라이언 당신같은 사람들땜에 배우들이 망가지는거임.,"['리브', '라이언', '당신', '같은', '사람', '들', '땜', '에', '배우', '들', '이', '망가지는거', '임']",0.6201852593039596,0.29
223,bvr2MC9h6Mc,돈아까운 영화,"['돈', '아까운', '영화']",0.3231201926194692,0.22
224,bvr2MC9h6Mc,하정우 까내릴 필요는 없죠<br>연기 잘하는 배우들은 많은데<br>걍 한국영화 꽝카드가 너무 많을뿐,"['하정우', '까', '내릴', '필요', '는', '없죠', '연기', '잘', '하는', '배우', '들', '은', '많은데', '걍', '한국영', '화', '꽝', '카드', '가', '너무', '많을', '뿐']",1.3045467773673267,0.56
225,bvr2MC9h6Mc,@김김 한국영화 제작자들이 대부분 상업영화를 고수하고 있잖아요.전체적인 틀이 바뀌지 않는이상 계속될 문제임,"['김김', '한국영', '화', '제작자', '들', '이', '대부분', '상업', '영화', '를', '고수', '하고', '있잖아요', '전체', '적', '인', '틀', '이', '바뀌지', '않는', '이상', '계속', '될', '문제', '임']",-4.1376500434659516,-1.73
226,bvr2MC9h6Mc,많이 그러네,"['많이', '그러네']",0.09138316689809398,0.07
227,bvr2MC9h6Mc,그 연기 잘하는 배우 하나 믿고 아무리 못만든 영화여도 어지간하게만 만들면 빨아주며 1000만 가까이 혹은 1000만 넘게 봐주니까 한국영화가 이 지경까지 온거라고 생각이 드네요. 배우들 깔 필요 없다기보단 배우들에게도 책임이 어느정도 있다고 봅니다. 배우가 무슨 아무생각없이 영화고르는 사람들도 아니고 무조건 한국영화가 꽝카드가 많다고 배우 탓은 없다는건 좀 그러네요,"['그', '연기', '잘', '하는', '배우', '하나', '믿고', '아무리', '못', '만든', '영화', '여', '도', '어지간하게만', '만들면', '빨아주며', '1000만', '가까이', '혹은', '1000만', '넘게', '봐주니까', '한국영', '화가', '이', '지경', '까지', '온거라고', '생각', '이', '드네', '요', '배우', '들', '깔', '필요', '없', '다기', '보단', '배우', '들', '에게도', '책임', '이', '어느', '정도', '있다고', '봅니다', '배우', '가', '무슨', '아무', '생각', '없이', '영화', '고르는', '사람', '들', '도', '아니고', '무조건', '한국영', '화가', '꽝', '카드', '가', '많다고', '배우', '탓', '은', '없다는건', '좀', '그러네요']",4.2083952619500655,1.47
228,bvr2MC9h6Mc,기생충 말고 도대체 한국영화 왜 이러냐ㅠㅠ<br>대충 만들어서 상영관 양아치처럼 늘려 알바 대량으로 써서 손익분기점만 넘기면 다냐? 시간도 돈도 너무 아깝다ㅠㅠ,"['기생충', '말고', '도대체', '한국영', '화', '왜', '이러냐', '대충', '만들어서', '상영', '관', '양', '아치', '처럼', '늘려', '알바', '대량', '으로', '써서', '손익', '분기점', '만', '넘기면', '다냐', '시간', '도', '돈', '도', '너무', '아깝다']",-6.766837985060109,-2.73
229,bvr2MC9h6Mc,손익분기점 넘으면 다죠,"['손익', '분기점', '넘으면', '다', '죠']",0.0,0.0
230,bvr2MC9h6Mc,장르에 대한 이해도를 넘어서 대부분의 감독들은 알수 없는 이유로 시나리오를 급하게 쓰고 (제작사의 입김이든 시간이든 어떤 이유에서든간에 이해못합니다) 이것이 봉준호 감독의 봉테일이라고 불리는 병적인 디테일 부분에서 지나치게 허술한 부분이 많아지죠. 이것은 곧 각본의 부실이 되고 각본의 부실은 완성도 낮은 영화가 되고..,"['장르', '에', '대한', '이해도', '를', '넘어서', '대부분', '의', '감독', '들', '은', '알수', '없는', '이유', '로', '시나리오', '를', '급하게', '쓰고', '제작사', '의', '입김', '이든', '시간', '이든', '어떤', '이유', '에', '서든', '간', '에', '이해', '못', '합니다', '이', '것', '이', '봉준호', '감독', '의', '봉테', '일이', '라고', '불리는', '병적', '인', '디테일', '부분', '에서', '지나치게', '허', '술', '한', '부분', '이', '많아지죠', '이', '것', '은', '곧', '각본', '의', '부실', '이', '되고', '각본', '의', '부실', '은', '완성', '도', '낮은', '영화', '가', '되고']",3.868553975171823,1.35
231,bvr2MC9h6Mc,하정우는 그냥 마동석 마이너 업그레이드 버전 이상도 이하도 아닌듯.<br>왜케 고평가 받는지 의문,"['하정우', '는', '그냥', '마동석', '마이너', '업그레이드', '버전', '이상', '도', '이하', '도', '아닌듯', '왜케', '고', '평가', '받는지', '의문']",0.5292952911696587,0.24
232,bvr2MC9h6Mc,범죄와의전쟁에서 정점을 찍고 더테러라이브까지는 좋았으나 점점 하향곡선을 타면서 신과함께서 부터 연기가 조금씩 불안해지죠...그러더니 결국 클로젯에서 터진거죠...저는 클로젯보고 깜짝놀랐습니다...저게 진짜 하정우가 연기하는건가...하구요..,"['범죄', '와의', '전쟁', '에서', '정점', '을', '찍고', '더테러라이브', '까지는', '좋았으나', '점점', '하향', '곡선', '을', '타면서', '신', '과', '함', '께서', '부터', '연기', '가', '조금씩', '불안해지죠', '그러더니', '결국', '클로젯', '에서', '터진거죠', '저', '는', '클로젯보', '고', '깜짝', '놀랐습니다', '저', '게', '진짜', '하정우', '가', '연기', '하는건', '가하구요']",-4.884639926347141,-1.85
233,bvr2MC9h6Mc,더 테러라이브에서도<br>롱테이크인데 긴장감을 조금도<br>안떨어뜨리고 계속 관객들을 휘몰아치는 연기는일품이었지요.<br><br>사실 저는 신과함께부터 연기가 좀 불안했었다고 생각함.<br>처음에 cg범벅 영화가 어색해서 그러나 싶었는데,"['더', '테러', '라이브', '에서도', '롱', '테이크', '인데', '긴장감', '을', '조금', '도안', '떨어뜨리고', '계속', '관객', '들', '을', '휘', '몰아치는', '연기', '는', '일품', '이었지요', '사실', '저', '는', '신', '과', '함께', '부터', '연기', '가', '좀', '불안했었다고', '생각', '함', '처음', '에', 'cg', '범벅', '영화', '가', '어색해서', '그러나', '싶었는데']",4.948927058362164,1.87
234,bvr2MC9h6Mc,@ㅇ ㅇㅅㅇ 하정우 연기 개잘하는 배운데 요새 슬럼픈가봄ㅠ,"['하정우', '연기', '개잘', '하는', '배운데', '요새', '슬럼', '픈', '가봄']",1.3648615087731557,0.7
235,bvr2MC9h6Mc,ANAVARgiveup TRENhard eatCLEN +1987등등 있긴 한데 ㅠㅠ,"['ANAVARgiveup', 'TRENhard', 'eatCLEN', '1987등', '등', '있긴', '한데']",0.18927667885222937,0.1
236,bvr2MC9h6Mc,추격자 비스티보이즈 등 쌉 명연기들 때문,"['추격자', '비스티보이즈', '등', '쌉', '명연기', '들', '때문']",1.346336258670564,0.73
237,bvr2MC9h6Mc,개봉날 조조로봤는데 너무 실망스러웠음.... 유치하고 CG도구리고 하정우 김남길데려다가 고작......... ㅠㅠ 내가 개봉하기만 얼마나 기다렸는데!!!!!!!!,"['개봉', '날', '조조', '로', '봤는데', '너무', '실망', '스러웠음', '유치하고', 'CG', '도구', '리', '고', '하정우', '김남길', '데려다가', '고작', '내', '가', '개봉', '하기만', '얼마나', '기다렸는데']",-2.090338002349805,-0.89
238,bvr2MC9h6Mc,정우형..... 이렇게가다간 먹방이나 찍어야되요. ㅠㅠㅠㅠㅠㅠ,"['정우', '형', '이렇게', '가다간', '먹방', '이나', '찍어야되', '요']",0.21755551314380345,0.11
239,bvr2MC9h6Mc,100만가능,"['100만', '가능']",0.0,0.0
240,bvr2MC9h6Mc,ㅋㅋㅋㅋㅋㅋㅋㅋㅋㅋ,[],0.0,-0.0
241,bvr2MC9h6Mc,라이너님 혹시 쇼킹한 리뷰에서 미스터주 리뷰하실 생각은 없으신가요,"['라이너', '님', '혹시', '쇼킹', '한', '리뷰', '에서', '미스', '터주', '리뷰', '하실', '생각', '은', '없으신', '가요']",1.3046647502475723,0.6
242,bvr2MC9h6Mc,요즘 하정우 점점 망삘배우화 되네..... 요몇년 출연작들 너무 그닥임,"['요즘', '하정우', '점점', '망삘', '배우', '화', '되네', '요', '몇', '년', '출연', '작', '들', '너무', '그닥임']",-2.963813258694106,-1.36
243,bvr2MC9h6Mc,다 먹고 살자고 하는 건데 돈만 잘 받음 됐지 뭐~ 영화 좀 보는 사람들은 포스터만 봐도 감 와서 알아서 거름 ㅋㅋ,"['다', '먹고', '살', '자고', '하는', '건데', '돈', '만', '잘', '받음', '됐지', '뭐', '영화', '좀', '보는', '사람', '들', '은', '포스터', '만', '봐도', '감', '와서', '알아서', '거름']",4.445295394346415,1.85
244,bvr2MC9h6Mc,흠... 그래서 나니아 연대기에서도 벽장을 통해서 이동한건가,"['흠', '그래서', '나니아', '연대기', '에서도', '벽장', '을', '통해', '서', '이', '동', '한', '건가']",1.0031464248073971,0.47
245,bvr2MC9h6Mc,리뷰 잘 봤습니다~,"['리뷰', '잘', '봤습니다']",2.409440591277084,1.63
246,bvr2MC9h6Mc,하정우와 김남길 조합 자체는 참 신선한데...ㅠㅠㅎㅎ,"['하정우', '와', '김남길', '조합', '자체', '는', '참', '신선한데']",2.4293319823522115,1.28
247,bvr2MC9h6Mc,1등,['1등'],0.0,0.0
248,ITWWNHwyV7Q,난 하정우배우가 왜? 왜? 라는 문구가 떠나지 않는중<br>이따위 쓰레기 영화에?<br>아카데미 상이나 받기전에라도 나오던가..,"['난', '하정우', '배우', '가', '왜', '왜', '라는', '문구', '가', '떠나지', '않는', '중이', '따위', '쓰레기', '영화', '에', '아카데미', '상이', '나', '받기전에라도', '나오던가']",-0.029488885641674262,-0.01
249,ITWWNHwyV7Q,난 진짜 잼썼ㄴ데..,"['난', '진짜', '잼', '썼데']",-0.061774467145250866,-0.04
250,ITWWNHwyV7Q,김남길 배우님 보러가서 딱 김남길 배우님만 보고 왔습니다,"['김남길', '배우', '님', '보러가서', '딱', '김남길', '배우', '님', '만', '보고', '왔습니다']",0.8701441693831914,0.43
251,ITWWNHwyV7Q,사람마다 다 다르게 느낄수 있잖아요 너무 강요하진 마세요,"['사람', '마다', '다', '다르게', '느낄수', '있잖아요', '너무', '강요', '하진', '마세요']",2.0781436619321934,1.04
252,ITWWNHwyV7Q,음 이영화가 그정도로가치가없었나요?<br>애들 연기하는거보고  다르게봤는데<br>너무 저평가하시는듯,"['음', '이영화', '가', '그', '정도', '로', '가치', '가', '없었나요', '애', '들', '연기', '하는거', '보고', '다르게', '봤는데', '너무', '저', '평가', '하시는듯']",1.9916187865870838,0.87
253,ITWWNHwyV7Q,하정우 이제 빨 다떨어졌나 작품들이 계속 실망스럽네<br>솔직히 신과함께도 천만은 찍었지만 영화자체는 그닥...실망..,"['하정우', '이제', '빨', '다', '떨어졌나', '작품', '들', '이', '계속', '실망', '스럽네', '솔직히', '신', '과', '함께', '도', '천만', '은', '찍었지만', '영화', '자체', '는', '그', '닥', '실망']",1.7371696547586235,0.72
254,ITWWNHwyV7Q,나는 재밌게 잘 봄... 해외영화 짬뽕이라도 나두 이런 한국영화 보고 싶단 말이죠... 그림충이라 이렇게 말 하지만 입시도 시작할땐 카피부터 시작해요 점점 자기꺼로 발전해가는가죠 클로젯 감독도 신인으로 알고있는데 이걸 토대로 발전할 수 있지 않을까요? 물론 감독이 참고영화가 없다는 건 당황스럽긴 하지만..ㅋㅋ,"['나', '는', '재밌게', '잘', '봄', '해외', '영화', '짬뽕', '이라도', '나', '두', '이런', '한국영', '화', '보고', '싶단', '말', '이', '죠', '그림', '충', '이라', '이렇게', '말', '하지만', '입시', '도', '시작', '할', '땐', '카피', '부터', '시작', '해요', '점점', '자기', '꺼', '로', '발전', '해가는가죠', '클로젯', '감독', '도', '신인', '으로', '알고있는데', '이', '걸', '토대', '로', '발전', '할', '수', '있지', '않을까요', '물론', '감독', '이', '참고', '영화', '가', '없다는', '건', '당황', '스럽긴', '하지만']",2.032521254657372,0.72
255,ITWWNHwyV7Q,도대체 재밌게 보신 영화는 무엇인가요?,"['도대체', '재밌게', '보신', '영화', '는', '무엇', '인가요']",1.1578484182644884,0.63
256,ITWWNHwyV7Q,그냥 고발하자..할리우드에..개쪽팔아야 이런짓 안하지..,"['그냥', '고발', '하자', '할리우드', '에', '개쪽', '팔', '아야', '이런', '짓', '안', '하지']",1.3984921189678576,0.67
257,ITWWNHwyV7Q,발 없는 새 이분 지극히 주관적인 평가이다. 나도 이 영화 솔직히 보진 않았지만 중요한 것은 재미있게 봤다는 사람이 많다는 것이다. 스토리가 어떻고 연출이 어떻고 장면 처리가 어떻고 뭐고간에 ... 영화라는 자체는 일단 재미있게 보기위해 만들어 졌다는 거다. 부족하면 다른영화에서 조금 힌트를 얻을 수도 있는거고 비슷하게 만들수도 있는 것이다. 이런 영화가 있으면 저런 영화가 있는 법이다. 영상 만든이가 죽고 못사는 마블 히어로 영화는 마틴스콜세이지 감독이 오히려 영화가 아니라고 말하기까지 않았는가. 많은 영향력을 가진 유투버라면 리뷰에 좀 더 신중을 가했으면 좋겠다는 생각이 든다. 그리고 영상 보시는 분들은 지극히  주인장의 주관적인 개똥철학이 담긴 리뷰란걸 망각하지 마시길 바랍니다.,"['발', '없는', '새', '이분', '지극히', '주관', '적', '인', '평가', '이다', '나도', '이', '영화', '솔직히', '보진', '않았지만', '중요한', '것', '은', '재미있게', '봤다는', '사람', '이', '많다는', '것', '이다', '스토리', '가', '어떻고', '연출', '이', '어떻고', '장면', '처리', '가', '어떻고', '뭐', '고간', '에', '영화', '라는', '자체', '는', '일단', '재미있게', '보기', '위해', '만들어', '졌다는', '거', '다', '부족하면', '다른', '영화', '에서', '조금', '힌트', '를', '얻을', '수도', '있는거고', '비슷하게', '만들수도', '있는', '것', '이다', '이런', '영화', '가', '있으면', '저런', '영화', '가', '있는', '법', '이다', '영상', '만든이가', '죽고', '못', '사는', '마블', '히어로', '영화', '는', '마틴', '스콜', '세이지', '감독', '이', '오히려', '영화', '가', '아니라고', '말', '하기까지', '않았는가', '많은', '영향력', '을', '가진', '유투', '버', '라면', '리뷰', '에', '좀', '더', '신중', '을', '가했으면', '좋겠다는', '생각', '이', '든다', '그리고', '영상', '보시', '는', '분', '들', '은', '지극히', '주인', '장', '의', '주관', '적', '인', '개똥', '철학', '이', '담긴', '리뷰', '란걸', '망각', '하지', '마시길', '바랍니다']",20.33536161496145,6.47
258,ITWWNHwyV7Q,개인적으로 ㄹㅇ 재밌고 김남길 개잘생겼다하고 봤는데 아쉬운게 하나 있다면 그 미진이...? 제일 센 놈 걔가 항상 분노해있다가 엄마 봤다고 갑자기 엄청 착해지고 하정우가 안아도 가만히 있는게 쪼금 아쉬웠음 그래도 이거만 보고 엄청 걱정하진 마요 전 개인적으로 재밌었음 김남길 존잘,"['개인', '적', '으로', '재밌고', '김남길', '개', '잘생겼다하고', '봤는데', '아쉬운게', '하나', '있다면', '그', '미진', '이', '제일', '센', '놈', '걔', '가', '항상', '분노해있다가', '엄마', '봤다고', '갑자기', '엄청', '착해지고', '하정우', '가', '안아도', '가만히', '있는게', '쪼금', '아쉬웠음', '그래도', '이', '거만', '보고', '엄청', '걱정', '하진', '마', '요', '전', '개인', '적', '으로', '재밌었음', '김남길', '존잘']",4.5375553245457665,1.69
259,ITWWNHwyV7Q,근데 어느나라 영화판이든 망작들이 즐비한 와중 명작들이 간간히 있는건 똑같을듯<br>우리가 존재조차 모르는 수많은 망작은<br>수익이 안되니 수입을 안해오니 모르는거고<br>우리가 보는건 어느정도 흥행이 보증될 법 한 것들 위주로 가지고 오니 더 차이가 나 보일수 밖에,"['근데', '어느', '나라', '영', '화판', '이든', '망작', '들', '이', '즐비한', '와중', '명작', '들', '이', '간간히', '있는건', '똑같을듯', '우리', '가', '존재', '조차', '모르는', '수많은', '망', '작은', '수익', '이', '안되니', '수입', '을', '안', '해오니', '모르는거', '고우리', '가', '보는건', '어느', '정도', '흥행', '이', '보증', '될', '법', '한', '것', '들', '위주', '로', '가지', '고', '오니', '더', '차이', '가', '나', '보일수', '밖에']",8.388748702361505,3.04
260,ITWWNHwyV7Q,"<a href=""https://www.youtube.com/watch?v=ITWWNHwyV7Q&amp;t=1m42s"">1:42</a> ㅋㅋㅋㅋㅋㅋㅋㅋㅋㅋㅋㅋㅋㅋㅋㅋ 영화를 전혀 보질 않는 사람이라면 그럴수 있죠 ㅋㅋㅋㅋㅋㅋㅋㅋㅋㅋ","['142', '영화', '를', '전혀', '보질', '않는', '사람', '이', '라면', '그럴수', '있죠']",1.6930807451443735,0.83
261,ITWWNHwyV7Q,전 이거 보고 바바둑영화 생각났어욭ㅌㅋㅋㅋㅋㅋㅋ,"['전', '이', '거', '보고', '바', '바둑', '영화', '생각났어', '욭']",0.20860797885066784,0.11
262,ITWWNHwyV7Q,..영화ㅜㅜ 이거 흐윽 .. 표만날림,"['영화', '이', '거', '흐윽', '표', '만', '날림']",0.13384351376723988,0.07
263,ITWWNHwyV7Q,사슴신은 겟아웃보다는 링이 먼저 떠오르던데...,"['사슴', '신은', '겟아웃', '보다는', '링', '이', '먼저', '떠오르던데']",0.18927667885222937,0.1
264,ITWWNHwyV7Q,작중후반에 귀신세계로 가는건 연출도 멋지고 좋았는데 <br>뭔가 감독이 신과함께를 너무 감명깊게 봐서 이것저것 섞은 신과함께같은 영화,"['작', '중후', '반', '에', '귀', '신세계', '로', '가는건', '연출', '도', '멋지고', '좋았는데', '뭔가', '감독', '이', '신', '과', '함께', '를', '너무', '감명', '깊게', '봐서', '이', '것', '저', '것', '섞은', '신', '과', '함께', '같은', '영화']",5.45734345587351,2.17
265,ITWWNHwyV7Q,아파트 공화국에서 벽장이라니 비선실세 무속신앙의 나라에서 오컬트를 과학적인 접근이라니 <br>관객한데 데자뷰 느끼게 해주는것도 아니고<br>봉준호를 제외한 요즘 한국영화감독이라는 이 개새끼들은 다같이 심형래새끼같냐,"['아파트', '공화국', '에서', '벽장', '이라니', '비', '선실세', '무속신앙', '의', '나라', '에서', '오컬트', '를', '과학', '적', '인', '접근', '이라니', '관객', '한', '데', '데자뷰', '느끼게', '해주는것도', '아니고', '봉준호', '를', '제외', '한', '요즘', '한국', '영화감독', '이라는', '이', '개새끼', '들', '은', '다', '같이', '심형래', '새끼', '같냐']",-0.9205740638959009,-0.35
266,ITWWNHwyV7Q,진짜재미없엇음. 개인적으로는 김남길 연기도 엄청 어색하고 어색해보였는데,"['진짜', '재미없', '엇음', '개인', '적', '으로는', '김남길', '연기', '도', '엄청', '어색하고', '어색', '해보였는데']",-0.19803151598576058,-0.09
267,ITWWNHwyV7Q,"예고만 봐서는 뻔한 망작 느낌나서 안 보려고 했는데 사람들 평이 좋길래 예상이 빗나갔나했지만, 역시나ㅠㅠ 하정우는 왜 계속 이런 영화만 찍는건지. 곡성, 장화홍련 이런 영화 좋잖아~ 왜 자꾸 헐리웃 따라 해 ㅠㅠ","['예고', '만', '봐', '서는', '뻔한', '망작', '느낌나서', '안', '보려고', '했는데', '사람', '들', '평이', '좋길래', '예상', '이', '빗나갔나', '했지만', '역시', '나', '하정우', '는', '왜', '계속', '이런', '영화', '만', '찍는', '건지', '곡성', '장화홍련', '이런', '영화', '좋잖아', '왜', '자꾸', '헐리웃', '따라', '해']",-3.814806100109868,-1.47
268,ITWWNHwyV7Q,양산형 사업용영화,"['양산', '형', '사업', '용', '영화']",-0.4567158949556759,-0.27
269,ITWWNHwyV7Q,공포영화를 찍다가 우리가 모두 알고 있는 신파로 빠지는ㅋㅋㅋㅋㅋㅋㅋㅋㅋ<br><br>차라리 인시디어스가 안 떠올랐음 몰라도 장면장면마다 인시디어스와 오버랩 되어서 너무 많이 실망했네요<br><br>중후반부에 김남길이 칼 부딪히며 걸어오는 장면에서 오 질생겼다 빼고는 기억에 남는 장면도 없는 영화<br><br>전체적으로 실망했습니다 클로젯,"['공포영화', '를', '찍다가', '우리', '가', '모두', '알', '고', '있는', '신파', '로', '빠지는', '차라리', '인시디어스', '가', '안', '떠올랐음', '몰라도', '장면', '장면', '마다', '인시디어스', '와', '오버', '랩', '되어서', '너무', '많이', '실망했네요', '중후', '반', '부', '에', '김남길', '이', '칼', '부딪히며', '걸어오는', '장면', '에서', '오', '질', '생겼다', '빼고는', '기억', '에', '남는', '장면', '도', '없는', '영화', '전체', '적', '으로', '실망했습니다', '클로젯']",2.8257838537995923,1.03
270,ITWWNHwyV7Q,난 재밌던데??? 그냥 한국영화는 눈에 불을켜고 까시는듯?,"['난', '재밌던데', '그냥', '한국영', '화', '는', '눈', '에', '불', '을', '켜고', '까시는듯']",-2.2126577283348596,-1.06
