,id,sentence,comment_cut,score,ratio
811,Ejr97lO1Wr8,삼총사 셜록 작은아씨들등 내용은 같은데 그 당시 핫한배우로 구성되어 주기적으로 나오는 몇주년 축하기념용 같은 수익보장된 재탕영화...로미오와 줄리엣도 나올때가 된것 같은데...,"['삼총사', '셜록', '작은아씨', '들', '등', '내용', '은', '같은데', '그', '당시', '핫', '한', '배우', '로', '구성', '되어', '주', '기적', '으로', '나오는', '몇', '주년', '축하', '기념', '용', '같은', '수익', '보장', '된', '재탕', '영화', '로미오', '와', '줄리엣', '도', '나올', '때', '가', '된것', '같은데']",0.07531094336663968,0.03
812,Ejr97lO1Wr8,안녕하세요 라이너님 언제나 귀한 리뷰영상 잘보고 있습니다. 다름이 아니라 댓글을 다 읽으신다고 하시길래 개인적인 건의가 있어 댓글을 남깁니다 다름이 아니라 영화 리뷰영상을 만들어 주실때 따로 평점란을 올려 주실수 있으신가요? 왜냐하면 개인적으로 라이너님 영상리뷰 평점을 보고 영화를 보르는데 평점을 볼려다 끝 부분에서  스포를 당하는 경우가 있어서요 ㅠㅠㅠ 혹시 괜찮으시다면 따로 해당 영화 평점란을 만들어 주시면 감사하겠습니다! 언제나 리뷰 잘챙겨보고 있고요 언제나 빠르고 귀한 영상들 늘 감사합니다!,"['안녕하세요', '라이너', '님', '언제나', '귀한', '리뷰', '영상', '잘', '보고', '있습니다', '다름이', '아니라', '댓글', '을', '다', '읽으', '신다고', '하시길래', '개인', '적', '인', '건의', '가', '있어', '댓글', '을', '남깁니다', '다름이', '아니라', '영화', '리뷰', '영상', '을', '만들어', '주실', '때', '따로', '평점', '란', '을', '올려', '주', '실수', '있으신', '가요', '왜냐하면', '개인', '적', '으로', '라이너', '님', '영상', '리뷰', '평점', '을', '보고', '영화', '를', '보르', '는', '데', '평점', '을', '볼려다', '끝', '부분', '에서', '스포', '를', '당하는', '경우', '가', '있어서요', '혹시', '괜찮으시다면', '따로', '해당', '영화', '평점', '란', '을', '만들어', '주시', '면', '감사하겠습니다', '언제나', '리뷰', '잘', '챙겨', '보고', '있고요', '언제나', '빠르고', '귀한', '영상', '들', '늘', '감사합니다']",-21.469650019379976,-7.18
813,Ejr97lO1Wr8,처음에는 현재 -과거가 교차되는줄 알았는데 후반에 장면이 두번 번복되서 나오는거 보고 현재-조가 쓴 소설이 교차된다고 느꼈는데 저만 그런건가요?<br>마지막에 조가  교수와 재회하러 비맞으며 뛰어 가던 장면 다음에 편집장이 여주인공은 결혼해야 된다 말하고 다시 아까랑 똑같은 조가 뛰어가는 장면이 반복으로 나오고 키스하는게 나왔는데 이거 보고 여태껏  나온 장면들이 소설속 내용이라고 생각하게 되더라구요....,"['처음', '에는', '현재', '과거', '가', '교차', '되는줄', '알았는데', '후반', '에', '장면', '이', '두', '번', '번복', '되서', '나오는거', '보고', '현재', '조가', '쓴', '소설', '이', '교차', '된다고', '느꼈는데', '저만', '그런', '건가', '요', '마지막', '에', '조가', '교수', '와', '재회', '하러', '비', '맞으며', '뛰어', '가던', '장면', '다음', '에', '편집장', '이', '여', '주인공', '은', '결혼', '해야', '된다', '말', '하고', '다시', '아까랑', '똑같은', '조가', '뛰어가는', '장면', '이', '반복', '으로', '나오고', '키스', '하는게', '나왔는데', '이', '거', '보고', '여태껏', '나온', '장면', '들', '이', '소설', '속', '내용', '이라고', '생각', '하게', '되더라구요']",-27.37257370046138,-9.39
814,Ejr97lO1Wr8,작은아씨들 잘 봤어요,"['작은아씨', '들', '잘', '봤어요']",0.4721786625632336,0.29
815,Ejr97lO1Wr8,결혼 이야기 도 리뷰해주세요,"['결혼', '이야기', '도', '리뷰', '해주세요']",-2.123052112256799,-1.25
816,Ejr97lO1Wr8,저는 라이너님 팬입니다 정말 재미있게 영상을보고 있어요 <br>그리고 저는 이전부터 위노나 팬입니다 죠니뎁하고 연인사이 였을때부터요 <br>이번영상  정말 잘봤습니다 다만 수정부분이 있는데 작은아씨들의 그전영화는 위노나라이더의 작은아씨들로 규정하는건 어렵다보네요 1994년작 영화도 명작인데 그 영화는 질리언 암스트롱의 작은아씨들로 마지막부분에 소개하는게 맞는게 아닌가하는 생각이 듭니다 유명하기론 위노나가 더 유명할수있지만 이영화는 질리언 영화이고 질리언도 8년만의정사와 샬롯그레이를 만든 훌륭한 감독이기때문입니다 <br>예를들어 시간이 한참 지난뒤 영화비교하는데 송강호의 기생충이라 말씀하시는거와 비슷한 비유가 아닐까 생각이 드네요^^<br>태클이 아니라 워낙 라이너님 팬이라 영상보고 글을 남깁니다 노여워 마세요^^,"['저', '는', '라이너', '님', '팬', '입니다', '정말', '재미있게', '영상', '을', '보고', '있어요', '그리고', '저', '는', '이전', '부터', '위노나', '팬', '입니다', '죠니뎁', '하고', '연인', '사이', '였을', '때', '부터', '요', '이번', '영상', '정말', '잘', '봤습니다', '다만', '수', '정부', '분', '이', '있는데', '작은아씨', '들', '의', '그', '전', '영화', '는', '위노나', '라이더', '의', '작은아씨', '들', '로', '규정', '하는건', '어렵다', '보네요', '1994년', '작', '영화', '도', '명작', '인데', '그', '영화', '는', '질리언', '암스트롱', '의', '작은아씨', '들', '로', '마지막', '부분', '에', '소개', '하는게', '맞는게', '아닌', '가하는', '생각', '이', '듭니', '다', '유명하기', '론', '위노나', '가', '더', '유명할수있지만', '이영화', '는', '질리언', '영화', '이고', '질리언', '도', '8년', '만의정사와', '샬롯', '그레이', '를', '만든', '훌륭한', '감독', '이', '기', '때문', '입니다', '예', '를', '들어', '시간', '이', '한참', '지난', '뒤', '영화', '비교', '하는데', '송강호', '의', '기생충', '이라', '말씀', '하시는거와', '비슷한', '비유', '가', '아닐까', '생각', '이', '드', '네', '요', '태클', '이', '아니라', '워낙', '라이너', '님', '팬', '이라', '영상', '보고', '글', '을', '남깁니다', '노', '여', '워', '마세요']",-37.43101731126447,-11.77
817,Ejr97lO1Wr8,주옥같은 대사도 넘 많았던.... 위로가 되는 영화였어요,"['주옥', '같은', '대사도', '넘', '많았던', '위로', '가', '되는', '영화', '였어요']",-2.0651703160226225,-1.03
818,Ejr97lO1Wr8,라이너님 gv 참석하려면 어디서 예매해야하나요?,"['라이너', '님', 'gv', '참석', '하려면', '어디서', '예매', '해야하나요']",-1.4324178540083303,-0.75
819,Ejr97lO1Wr8,씨네Q홈페이지나 앱으로 예매하면 됩니다. 3월 영화는 아직 안정해져서 예매도 아직이네요.,"['씨', '네', 'Q', '홈페이지', '나', '앱', '으로', '예매', '하면', '됩니다', '3월', '영화', '는', '아직', '안정', '해져서', '예매', '도', '아직', '이네요']",-0.0011499393461538165,-0.0
820,Ejr97lO1Wr8,조가 로리의 고백을 거절한게 단지 그녀가 처한 경제적인 이유에 있다고 생각되진 않았어요. 자신이 가진 진취적이고 도전적인 성향이 당시 &quot;여성의 결혼&quot;이 가진 의미와 맞지 않는다고 어린 조는 느꼈을거같아요. 물론 나중에 자신의 마음을 다시금 깨닫게 되긴하지만요.,"['조가', '로리', '의', '고백', '을', '거절', '한', '게', '단지', '그녀', '가', '처', '한', '경제', '적', '인', '이유', '에', '있다고', '생각', '되진', '않았어요', '자신', '이', '가진', '진취', '적', '이고', '도전', '적', '인', '성향', '이', '당시', 'quot', '여성', '의', '결혼', 'quot', '이', '가진', '의미', '와', '맞지', '않는다고', '어린', '조', '는', '느꼈을거', '같아요', '물론', '나중', '에', '자신', '의', '마음', '을', '다시금', '깨닫게', '되긴', '하지', '만요']",-4.563148532019463,-1.63
821,Ejr97lO1Wr8,"나 개인적으로 조랑 그 남자애랑 되길 바랬는데 왜 에이미야,,,, 진짜 조랑 남자애랑 완전 잘 어울리는데ㅠㅠ","['나', '개인', '적', '으로', '조랑', '그', '남자', '애', '랑', '되길', '바랬는데', '왜', '에이미', '야', '진짜', '조랑', '남자', '애', '랑', '완전', '잘', '어울리는데']",-0.1529906310787783,-0.07
822,Ejr97lO1Wr8,어린 시절 여러번 반복해서 읽었던 책이에요.  흑백 영화로도 본 기억이 나네요,"['어린', '시절', '여러', '번', '반복', '해서', '읽었던', '책', '이에요', '흑백', '영화로', '도', '본', '기억', '이', '나네요']",-5.979451119782563,-2.71
823,Ejr97lO1Wr8,조조래빗도 괜찮은 영화긴 했지만  그래도 각색상은 이 영화가 받아야 했다고 생각함..,"['조', '조', '래빗', '도', '괜찮은', '영화', '긴', '했지만', '그래도', '각', '색상', '은', '이', '영화', '가', '받아야', '했다고', '생각', '함']",-3.014375146985623,-1.32
824,Ejr97lO1Wr8,공감,['공감'],-0.08598511332785463,-0.09
825,Ejr97lO1Wr8,에이미가 정말 미웠네요~ <br>하지만 영화는 너무너무 예쁘고 제게 힐링이었습니다!,"['에이미', '가', '정말', '미웠네요', '하지만', '영화', '는', '너무', '너무', '예쁘고', '제', '게', '힐링', '이었습니다']",0.37363462210323717,0.17
826,Ejr97lO1Wr8,"다정하고따뜻하다가 또 현재시점에서는 먹먹했던... 수없이 변주되어왔지만 이번 작은 아씨들진짜 좋았어요. 전 개인적으로 조가 이성으로 로리를 사랑한것은 아닌것같아요. 가족으로, 또래친구로는 너무 사랑했지만 로리가 고백할때 조가 한 말이 진심이지 않았을까요. .. 추후 모두가 떠나가는것같아서 로리마저 잃을까 두려운 마음이 때늦은 러브레터를 쓴 마음이 아니었나.. 생각하기도 합니다.","['다정하고', '따뜻하다가', '또', '현재', '시점', '에서는', '먹', '먹', '했던', '수없이', '변주', '되어', '왔지만', '이번', '작은', '아씨', '들', '진짜', '좋았어요', '전', '개인', '적', '으로', '조가', '이성', '으로', '로리', '를', '사랑', '한', '것', '은', '아닌것', '같아요', '가족', '으로', '또래', '친구', '로는', '너무', '사랑', '했지만', '로리', '가', '고백', '할', '때', '조가', '한', '말', '이', '진심', '이지', '않았을까요', '추후', '모두', '가', '떠나가는것', '같아서', '로리', '마저', '잃을까', '두려운', '마음', '이', '때늦은', '러브레터', '를', '쓴', '마음', '이', '아니었나', '생각', '하기도', '합니다']",-18.23084579744982,-6.34
827,Ejr97lO1Wr8,예쁩니다  그맘~~~~,"['예쁩니다', '그', '맘']",0.0,0.0
828,Ejr97lO1Wr8,사전정보없이 영화봤는데 이제야 재대로 이해가 돼네요..   항상 관심있게 보고 있어요..  ^^,"['사', '전', '정보', '없이', '영화', '봤는데', '이제야', '재', '대로', '이해', '가', '돼네요', '항상', '관심', '있게', '보고', '있어요']",-3.3753239639515504,-1.51
829,Ejr97lO1Wr8,ㄹㅇ 미국판 응답하라 1994 같은 느낌 ㅋㅋ 별로 기대도 안했는데 생각보다 더 아름답고 평화롭고 따뜻했어요,"['미국', '판', '응답', '하', '라', '1994', '같은', '느낌', '별로', '기대도', '안', '했는데', '생각', '보다', '더', '아름답고', '평화', '롭고', '따뜻했어요']",-0.5936953538657501,-0.26
830,Ejr97lO1Wr8,오늘도 좋은 리뷰 잘보았어요. 타오르는 여인의 초상 기다릴게요,"['오늘', '도', '좋은', '리뷰', '잘', '보았어요', '타오르는', '여인', '의', '초상', '기다릴게요']",2.5672971211428894,1.26
831,Ejr97lO1Wr8,나의 사랑스러운 아씨들,"['나', '의', '사랑스러운', '아씨', '들']",1.8513732189875043,1.09
832,Ejr97lO1Wr8,저는 과거와 현재 교차하는 연출이 너무 스무스하고 인상적이어서 좋았던 작품이었어요. 그리고 배우들 캐스팅이랑 연기력이 너무 좋아서 매력적인 영화라고 생각합니다.,"['저', '는', '과거', '와', '현재', '교차', '하는', '연출', '이', '너무', '스무', '스', '하고', '인상', '적', '이어서', '좋았던', '작품', '이었어요', '그리고', '배우', '들', '캐스팅', '이랑', '연기력', '이', '너무', '좋아서', '매력', '적', '인', '영화', '라고', '생각', '합니다']",-3.895147747373421,-1.53
833,Ejr97lO1Wr8,82년생 김지영을 여자 입장에서 억지로 옹호하려다 충분히 깨닫고 시야가 넓어지시는거같아서 점점 발전하는거 같네요,"['82년', '생', '김지영', '을', '여자', '입장', '에서', '억지로', '옹호', '하려다', '충분히', '깨닫고', '시야', '가', '넓어지시는거', '같아서', '점점', '발전', '하는거', '같네요']",-7.893398619612735,-3.43
834,Ejr97lO1Wr8,영화 너무 좋아서 원작도 찾아보고싶어졌어요 소설은 또 다른느낌으로 좋을거같아요,"['영화', '너무', '좋아서', '원작', '도', '찾아보고싶어졌어요', '소설', '은', '또', '다른', '느낌', '으로', '좋을거', '같아요']",-0.5333866347908087,-0.25
835,Ejr97lO1Wr8,어릴때 원작을 무척 재밌게 보기도 했고 좋아하는 분위기라 많이 기대했전 영화였는데 보는 내내 기가 빨리는 기분이었습니다. 타오르는 여인의 초상은 마음이 풍만해지는 느낌잉닜는데 말이죠..  작품성과는 별개로 어릴땐 그냥 가볍기만 했던 메세지들이 많이 무겁게 다가왔달까요,"['어릴', '때', '원작', '을', '무척', '재밌게', '보기', '도', '했고', '좋아하는', '분위기', '라', '많이', '기대했전', '영화', '였는데', '보는', '내내', '기', '가', '빨리', '는', '기분', '이었습니다', '타오르는', '여인', '의', '초상', '은', '마음', '이', '풍만해지는', '느낌', '잉닜', '는데', '말', '이', '죠', '작품', '성', '과는', '별개', '로', '어릴', '땐', '그냥', '가볍기만', '했던', '메세지', '들', '이', '많이', '무겁게', '다가왔', '달까', '요']",-2.338011471994423,-0.85
836,Ejr97lO1Wr8,"아마도 시간 순서를 이어붙이는 부분에서 이 영화는 약간 난잡하고 맺고 끊음이 확실하지 않은 편이기 때문에, 관객 입장에서는 긴 시간동안 긴장을 하고 봐야 했어야 했고, 그래서 기가 빨리는 느낌을 겪은 것이 아닐까 싶네요. 저 역시 그랬으니까요. 물론 영화는 이런 점만 제외하고 모든 부분에서 고평가합니다.","['아마도', '시간', '순서', '를', '이어', '붙이는', '부분', '에서', '이', '영화', '는', '약간', '난잡하고', '맺고', '끊음', '이', '확실하지', '않은', '편', '이기', '때문', '에', '관객', '입장', '에서는', '긴', '시간', '동안', '긴장', '을', '하고', '봐야', '했어야', '했고', '그래서', '기', '가', '빨리', '는', '느낌', '을', '겪은', '것', '이', '아닐까', '싶네요', '저', '역시', '그랬으니까', '요', '물론', '영화', '는', '이런', '점', '만', '제외', '하고', '모든', '부분', '에서', '고', '평가', '합니다']",-9.295458939946027,-3.31
837,Ejr97lO1Wr8,"메리, 퀸오브더 스코트랜드라는 영화도 있는데 그영화도 볼만함..","['메리', '퀸', '오브', '더', '스코트랜드', '라는', '영화', '도', '있는데', '그', '영화', '도', '볼', '만', '함']",-0.4379013762288422,-0.2
838,Ejr97lO1Wr8,시얼샤로넌을 보면서 21세기 버전의 메릴 스트립이란 생각이 들더군요... 플로렌스퓨를 보며 이 영화에서 느낀건 스칼렛 요한슨을 연상시킬 만큼 목소리가 너무 개성있고 좋더군요...  더빙쪽에 진출해도 잘해낼꺼 같습니다...,"['시', '얼샤', '로', '넌', '을', '보면서', '21', '세기', '버전', '의', '메릴', '스트립', '이란', '생각', '이', '들더군요', '플로렌스', '퓨', '를', '보며', '이', '영화', '에서', '느낀건', '스칼렛', '요한슨', '을', '연상', '시킬', '만큼', '목소리', '가', '너무', '개성', '있고', '좋더군요', '더빙', '쪽', '에', '진출', '해도', '잘', '해낼꺼', '같습니다']",-0.5148102165254944,-0.19
839,Ejr97lO1Wr8,"읽으면서 영화를 보는 듯한 느낌이 들면 좋은 소설이고, 영화를 보면서 소설을 읽는 듯한 느낌이 들면 좋은 영화라고 배웠습니다. 저에겐 이 영화가 딱 그런 생각이 들더군요. 라이너님도 같은 생각을 한 지점이 있는 것 같아 반갑네요. 리뷰 잘 봤습니다!","['읽으면서', '영화', '를', '보는', '듯', '한', '느낌', '이', '들면', '좋은', '소설', '이고', '영화', '를', '보면서', '소설', '을', '읽는', '듯', '한', '느낌', '이', '들면', '좋은', '영화', '라고', '배웠습니다', '저', '에겐', '이', '영화', '가', '딱', '그런', '생각', '이', '들더군요', '라이너', '님', '도', '같은', '생각', '을', '한', '지점', '이', '있는', '것', '같아', '반갑네요', '리뷰', '잘', '봤습니다']",-1.439305826542685,-0.53
840,Ejr97lO1Wr8,"내게 전자는 남아있는 나날들, 후자는 작은 아씨들!","['내게', '전자', '는', '남아있는', '나날', '들', '후자', '는', '작은', '아씨', '들']",-0.29725356202499387,-0.15
841,Ejr97lO1Wr8,전자는 이방인 후자는 오만과 편견,"['전자', '는', '이방인', '후자', '는', '오만', '과', '편견']",-2.0,-1.05
842,Ejr97lO1Wr8,페미라고 ㅈㄹ하는 놈들은 흑인차별 이야기에도 피씨적이라고 ㅈㄹ하겠지 웩,"['페미', '라고', '하는', '놈', '들', '은', '흑인', '차별', '이야기', '에도', '피씨', '적', '이라고', '하겠지', '웩']",-4.491388414289755,-2.06
843,Ejr97lO1Wr8,국민학교때 책장에 꽂혀있던 작은아씨들...<br>여자형제가 없었기 때문일까...별로 기대되는 책은 아니었는데<br>막상 읽기 시작하니 재밌어서 한번에 쭈욱 읽었던 책이에요<br>그뒤로 TV에서 해주는 애니로도 봤었고<br>위노나라이더가 나온 영화도 극장에서 봤었습니다<br>이미 알고있고 여러번 본 이야기인데도 이상하게 나오면 보고싶은 영화입니다<br>딸내미랑 주중에 같이 보러가야겠네요,"['국민학교', '때', '책장', '에', '꽂혀있던', '작은아씨', '들', '여자형제', '가', '없었기', '때문', '일까', '별로', '기대', '되는', '책', '은', '아니었는데', '막상', '읽기', '시작', '하니', '재밌어서', '한번', '에', '쭈욱', '읽었던', '책', '이에요', '그', '뒤', '로', 'TV', '에서', '해주는', '애니', '로', '도', '봤었고', '위노나', '라이더', '가', '나온', '영화', '도', '극장', '에서', '봤었습니다', '이미', '알고있고', '여러', '번', '본', '이야기', '인데', '도', '이상하게', '나오면', '보고싶은', '영화', '입니다', '딸내미', '랑', '주중', '에', '같이', '보러가야겠네요']",-27.2942584535038,-9.66
844,Ejr97lO1Wr8,"친구와 이 영화를 보고 맛있는 순두부를 떠먹었다는 느낌을 받았습니다. 자극적인 장면, 설정없이도 이렇게 좋은 영화를 만들 수 있구나하는 느낌이 드는 훌륭한 영화였습니다.","['친구', '와', '이', '영화', '를', '보고', '맛있는', '순두부', '를', '떠', '먹었다는', '느낌', '을', '받았습니다', '자극', '적', '인', '장면', '설정', '없이도', '이렇게', '좋은', '영화', '를', '만들', '수', '있구나하는', '느낌', '이', '드는', '훌륭한', '영화', '였습니다']",6.2993044808828955,2.5
845,Ejr97lO1Wr8,한국에선 이번에 개봉하는가봐요. 저는 해외에 살아서 작년에 봤는데 제 인생 영화라고 감히 뽑고 싶어요. 아버지가 전쟁터에 있다면 보통 할리우드 영화에선 전쟁터를 먼저 보여주고 시작할텐데 그런것도 없었고 잔잔하지만 너무 잔잔하지만은 않은 영화라 너무 좋았습니다.,"['한국', '에선', '이번', '에', '개봉', '하는', '가봐요', '저', '는', '해외', '에', '살아서', '작년', '에', '봤는데', '제', '인생', '영화', '라고', '감히', '뽑고', '싶어요', '아버지', '가', '전쟁', '터', '에', '있다면', '보통', '할리우드', '영화', '에선', '전쟁', '터', '를', '먼저', '보여주고', '시작', '할텐데', '그런', '것', '도', '없었고', '잔잔하지만', '너무', '잔잔하지만은', '않은', '영화', '라', '너무', '좋았습니다']",-9.892024123947973,-3.65
846,Ejr97lO1Wr8,정말 너무나 만족스러웠던 영화....해피엔딩에 만족할 수 있다니...여자 클린트 이스트우드가 나온듯 하네요...,"['정말', '너무나', '만족스러웠던', '영화', '해피엔딩', '에', '만족할', '수', '있다니', '여자', '클린트', '이스트', '우드', '가', '나온듯', '하네요']",-1.5512559323566173,-0.7
847,Ejr97lO1Wr8,@Minnie Cho 흠....연출한 영화들이 여성관련한 주제가 많아서 썼는데 쓰고나서 적절하지 않은 표현 아닌가 싶긴 했어요...불편하셨다면 죄송합니다...&#39;제2의 클린트 이스트우드&#39; 라고 수정하고 싶은데 비판 리플이 퇴색될거 같아서 그냥 두겠습니다.,"['Minnie', 'Cho', '흠', '연출', '한', '영화', '들', '이', '여', '성', '관련', '한', '주제가', '많아서', '썼는데', '쓰고나서', '적절하지', '않은', '표현', '아닌가', '싶긴', '했어요', '불편하셨다면', '죄송합니다', '39', '제', '2', '의', '클린트', '이스트', '우드', '39', '라고', '수정', '하고', '싶은데', '비판', '리플', '이', '퇴색', '될거', '같아서', '그냥', '두겠습니다']",-15.306910140556425,-5.79
848,Ejr97lO1Wr8,클린트 이스트우드면 클린트 이스트우드지 여자 클린트 이스트우드는 뭐에용,"['클린트', '이스트', '우드', '면', '클린트', '이스트', '우드', '지', '여자', '클린트', '이스트', '우드', '는', '뭐', '에', '용']",-3.16208927004166,-1.43
849,Ejr97lO1Wr8,훗날 에이미는 사이비 종교에 빠지고 마는데....,"['훗날', '에이미', '는', '사이비', '종교', '에', '빠지고', '마는데']",-0.42457503014401055,-0.22
850,Ejr97lO1Wr8,히잌!!! ㄷㄷㄷ,['히잌'],0.0,0.0
851,Ejr97lO1Wr8,Elijah Christian 미드소마 얘기하는듯합니다.,"['Elijah', 'Christian', '미드', '소마', '얘기', '하는듯', '합니다']",-2.3241785400833095,-1.26
852,Ejr97lO1Wr8,@Elijah Kim 다른영화 이야기요,"['Elijah', 'Kim', '다른', '영화', '이야기', '요']",-0.9532774600276614,-0.54
853,Ejr97lO1Wr8,1917 리뷰해주세요,"['1917', '리뷰', '해주세요']",-0.9923196808848829,-0.67
854,Ejr97lO1Wr8,점수가 짜군요! 뭔가 아쉬운 느낌!<br>타오르는 여인들의 초상도 기다리겠습니다.,"['점수', '가', '짜군요', '뭔가', '아쉬운', '느낌', '타오르는', '여인', '들', '의', '초상', '도', '기다리겠습니다']",-2.053849956116639,-0.97
855,Ejr97lO1Wr8,"소설을 읽고(유년시절 지나 메그의 결혼식, 베스의 결말, 조의 뉴욕행, 에이미의 파리행까지 모두나오는 2편까지) 보면 정말 그 많은 내용을 어떻게 저렇게 재현했을까 싶을 정도로 감동적인 영화였습니다~~ 다만 내용을 모르는 사람은 정신없었다고도 하고 교차편집 때문에 베스가 죽은것조차 잘 몰랐다고 하더군요 <br>에이미의 재발견이라고 많이 말하던데 조를 응원하면서도 에이미가 쟁취한 사랑에 대해서는 그럴만한 자격이 충분하다고 생각합니다<br>좋은 영화 리뷰 감사합니다^^","['소설', '을', '읽고', '유년', '시절', '지나', '메그', '의', '결혼식', '베스', '의', '결말', '조의', '뉴욕', '행', '에이미', '의', '파리', '행', '까지', '모두', '나오는', '2', '편', '까지', '보면', '정말', '그', '많은', '내용', '을', '어떻게', '저렇게', '재현', '했을까', '싶을', '정도', '로', '감동', '적', '인', '영화', '였습니다', '다만', '내용', '을', '모르는', '사람', '은', '정신', '없었다고도', '하고', '교차', '편집', '때문', '에', '베스', '가', '죽은것조차', '잘', '몰랐다고', '하더군요', '에이미', '의', '재', '발견', '이라고', '많이', '말', '하던데', '조를', '응원', '하면서도', '에이미', '가', '쟁취', '한', '사랑', '에', '대해', '서는', '그럴만', '한', '자격', '이', '충분하다고', '생각', '합니다', '좋은', '영화', '리뷰', '감사합니다']",-24.704251817133848,-8.34
