,id,sentence,comment_cut,score,ratio
636,IQ-w-xTvTJE,뭔가 약간 한국버전 인시디어스 이런 느낌 예고편만 보면 느낌을 받았음,"['뭔가', '약간', '한국', '버전', '인시디어스', '이런', '느낌', '예고편', '만', '보면', '느낌', '을', '받았음']",1.1173340946553796,0.53
637,IQ-w-xTvTJE,민호님 영상 속에 오류요.. 딸 이름은 이안이가 아니라 딸 이나 입니다!!,"['민호', '님', '영상', '속', '에', '오류', '요', '딸', '이름', '은', '이', '안이', '가', '아니라', '딸', '이나', '입니다']",-3.568150688934545,-1.6
638,IQ-w-xTvTJE,"차라리 하정우가 아내잃고나서 바로 새장가 들 준비하면서 연애하고 다녔다면 설정이 이해라도 간다. 근데 저게 아이한테 관심이 없는거라고? 우리나라 남자들, 가장들 진짜불쌍하다","['차라리', '하정우', '가', '아내', '잃고나서', '바로', '새장', '가', '들', '준비', '하면서', '연애', '하고', '다녔다면', '설정', '이', '이해', '라도', '간다', '근데', '저', '게', '아이', '한테', '관심', '이', '없는거라고', '우리나라', '남자', '들', '가장', '들', '진짜', '불쌍하다']",3.097143455700974,1.22
639,IQ-w-xTvTJE,하정우딸 이나 인데요,"['하정우', '딸', '이나', '인데요']",0.2841811808824074,0.18
640,IQ-w-xTvTJE,어둑시니..페니와이즈가 생각이나네요,"['어둑시', '니', '페니와이즈', '가', '생각', '이나', '네', '요']",0.31677889055920233,0.17
641,IQ-w-xTvTJE,"@민호타우르스 아 항상 좋은 영상, 정보 감사드립니다!","['민호', '타', '우르', '스', '아', '항상', '좋은', '영상', '정보', '감사', '드립니다']",6.081574787652575,2.98
642,IQ-w-xTvTJE,세계 곳곳에 다른 이름으로 존재하더라고요. 소설 속 페니 와이즈도 영향을 받았을 거 같아요.,"['세계', '곳곳', '에', '다른', '이름', '으로', '존재', '하더라고요', '소설', '속', '페니', '와이즈', '도', '영향', '을', '받았을', '거', '같아요']",-0.3371686905271065,-0.15
643,IQ-w-xTvTJE,저는 오히려 하정우 캐릭터 설정이 훌륭했다고 봐요. 적당히 인형이나 던져주면서 딸이 몇살인지도 모른채 방치하고 가끔 귀찮아서 딸이 없어졌으면 생각하는 아빠. 님 말대로 이정도였기에 딸을 찾으려고 애쓰고 딸도 아빠의 노력으로 나중엔 밝게 변했겠죠?하정우가 박성웅 같았다면 딸 없어졌다고 찾기나 했겠어요?,"['저', '는', '오히려', '하정우', '캐릭터', '설정', '이', '훌륭했다고', '봐요', '적당히', '인형', '이나', '던져주면서', '딸', '이', '몇', '살인', '지도', '모른', '채', '방치', '하고', '가끔', '귀찮아서', '딸', '이', '없어졌으면', '생각', '하는', '아빠', '님', '말', '대로', '이', '정도', '였기에', '딸', '을', '찾으려고', '애쓰고', '딸도', '아빠', '의', '노력', '으로', '나중', '엔', '밝게', '변했겠죠', '하정우', '가', '박성웅', '같았다면', '딸', '없어졌다고', '찾기', '나', '했겠어요']",3.8619212361153368,1.4
644,IQ-w-xTvTJE,"ㄴㄴ 극중 퇴마사의 대사 중에,<br>하정우 당신 가끔 딸이 사라져 줬으면 좋겠다거나, 사랑을 주지 않았던 적 있죠? 애들은 그걸 본능으로 다 알아요.<br><br>라는 대사가 있듯이 하정우도 본의아니게 딸에게 많은 실수를 한거고<br>아이의 입장에서 생각해본다면 안좋은<br>아빠죠 충분히.<br><br>물론 다수의 사람들은 하정우도 공황장애잇는데 최대한 노력한다고 생각하겠지만 아이 본인의 입장을 중점으로 봐야합니다.","['극', '중', '퇴마사', '의', '대사', '중', '에', '하정우', '당신', '가끔', '딸', '이', '사라져', '줬으면', '좋겠다거나', '사랑', '을', '주지', '않았던', '적', '있죠', '애', '들', '은', '그걸', '본능', '으로', '다', '알아요', '라는', '대사', '가', '있듯이', '하정우', '도', '본의', '아니게', '딸', '에게', '많은', '실수', '를', '한거고', '아이', '의', '입장', '에서', '생각', '해본다면', '안좋은', '아빠', '죠', '충분히', '물론', '다수', '의', '사람', '들', '은', '하정우', '도', '공황장애', '잇는데', '최대한', '노력', '한다고', '생각', '하겠지만', '아이', '본인', '의', '입장', '을', '중점', '으로', '봐', '야합니다']",5.995399473207861,2.08
645,IQ-w-xTvTJE,솜솜 박성웅은 오히려 명진이가 자신에게 해를 입힐까봐 온갖 부적을 가져다 놓고 외면 하고 있었던것 처럼 보였어요 명진이라는 아이가 너무 안쓰럽더라구요 ㅜㅜ,"['솜솜', '박성웅', '은', '오히려', '명진', '이', '가', '자신', '에게', '해', '를', '입힐까봐', '온갖', '부적', '을', '가져다', '놓고', '외면', '하고', '있었던것', '처럼', '보였어요', '명진', '이라는', '아이', '가', '너무', '안쓰럽더라구요']",-1.5799674490961146,-0.65
646,IQ-w-xTvTJE,난다무서웠어요,"['난다', '무서웠어요']",0.0,0.0
647,IQ-w-xTvTJE,어둑시니? 다크시니?!  야옹아!!!!!,"['어둑시', '니', '다크', '시', '니', '야옹', '아']",0.378553357704456,0.21
648,IQ-w-xTvTJE,100번째 댓글이다!!!,"['100', '번째', '댓글', '이다']",0.7956831306659927,0.5
649,IQ-w-xTvTJE,깜놀하는 부분이 너무무섭든데 ㅜㅜ,"['깜놀', '하는', '부분', '이', '너무', '무섭든', '데']",-0.9390140787849717,-0.51
650,IQ-w-xTvTJE,졸라무섭던데,"['졸라', '무섭던데']",0.0,0.0
651,IQ-w-xTvTJE,방금 보고 나왔는데 무당 갑툭튀 말고는 무서운게 거의없음,"['방금', '보고', '나왔는데', '무당', '갑툭튀', '말고는', '무서운게', '거의', '없음']",-2.087360884464153,-1.07
652,IQ-w-xTvTJE,그 장면까진 무서웠음 ㅋㅋ,"['그', '장면', '까진', '무서웠음']",1.240435914142888,0.77
653,IQ-w-xTvTJE,설문조사 만약 하면 모두<br>옷장너머로 갈듯한 느낌?,"['설문조사', '만약', '하면', '모두', '옷장', '너머', '로', '갈듯', '한', '느낌']",0.36523881584545975,0.18
654,IQ-w-xTvTJE,이거 무슨 내용인지도 모르고 하정우님 나오시길래 액션인갑다 하고 생각없이 봤는데 초반부부터 바로 놀래키는 거 나와서 바지에 오줌 쌀 뻔함; 깜빡이도 없이 들어옵니다 진짜,"['이', '거', '무슨', '내용', '인지도', '모르고', '하정우', '님', '나오시길래', '액션', '인', '갑다', '하고', '생각', '없이', '봤는데', '초반', '부', '부터', '바로', '놀래', '키', '는', '거', '나와서', '바지', '에', '오줌', '쌀', '뻔함', '깜빡이도', '없이', '들어옵니다', '진짜']",-1.0678037747331968,-0.42
655,IQ-w-xTvTJE,저도 예전에 영화 &#39;요로나의 저주&#39; 혼자 봤었어요.. 물론 영화가 끝나고 난후에 알았지만ㅋㅋ <br>클로젯의 영화 제목을 바꿔야겠네요.. 어둑시니라고.. 어둑시니가 더 잘 어울리는 듯 합니다 ㅎ   이 영화 평이 너무 안 좋아서 저는 아직 안 봤는데 민호님 리뷰 보고 더 안 보고 싶어졌어요~ ㅠ <br>암튼 신종코로나의 위협에서도 열심히이신 민호님께 감사합니다^^,"['저', '도', '예전', '에', '영화', '39', '요', '로나', '의', '저주', '39', '혼자', '봤었어요', '물론', '영화', '가', '끝나고', '난후', '에', '알았지만', '클로젯', '의', '영화', '제목', '을', '바꿔야겠네요', '어둑시니', '라고', '어둑시니', '가', '더', '잘', '어울리는', '듯', '합니다', '이', '영화', '평이', '너무', '안', '좋아서', '저', '는', '아직', '안', '봤는데', '민호', '님', '리뷰', '보고', '더', '안', '보고', '싶어졌어요', '암튼', '신종', '코로나', '의', '위협', '에서도', '열심히', '이신', '민호', '님', '께', '감사합니다']",9.274348293561696,3.29
656,IQ-w-xTvTJE,요즘 여자들 중 형편없는 여자들의 눈으로 바라보는 아빠란 존재의 기준에 맞춘 역할을 요구하는 듯 함... 경제활동도 유지를 하면서도 언제든 가족을 위해 시간을 내어주는 슈퍼맨 같은 비현실 적인 아빠... 그런 기준에서라면 하정우는 못난 아빠가 되니까...,"['요즘', '여자', '들', '중', '형편', '없는', '여자', '들', '의', '눈', '으로', '바라보는', '아빠', '란', '존재', '의', '기준', '에', '맞춘', '역할', '을', '요구', '하는', '듯', '함', '경제활동', '도', '유지', '를', '하면서도', '언제', '든', '가족', '을', '위해', '시간', '을', '내어주는', '슈퍼맨', '같은', '비', '현실', '적', '인', '아빠', '그런', '기준', '에서', '라면', '하정우', '는', '못', '난', '아빠', '가', '되니까']",2.4644163107132933,0.9
657,IQ-w-xTvTJE,다크시니는 학교괴담이 짱임<br>힘겨운날엔,"['다크', '시', '니', '는', '학교괴담', '이', '짱', '임', '힘겨운', '날', '엔']",0.18927667885222937,0.09
658,IQ-w-xTvTJE,"마지막에 민호 님께서는 아빠의 입장에서 &#39;가정을 중요시했냐&#39;를 평가하시는데 &#39;심적으로 다친 초등학생 딸 아이&#39;에게 있어서는 충분히 아빠가 자신(가정)에게 무관심하다고 느낄 수 있는 요소들은 몇 가지 있었다고 생각해요. (스포 있음.)<br><br>딸 아이의 입장에서 보면<br><br>1) 아빠는 자기 딸의 친한 친구에 대해서도 잘 모르며 물어 보려고도 하지 않는다. (김남길이 하정우한테 딸이 좋아하는 거는 알고 있냐, 딸의 친구들은 알고 있냐고 할 때 하정우는 노코멘트 였었죠.)<br><br>2) 아빠는 나보다 일이 더 중요하다. (자신은 혼자 놔두고 일하러 간다.)<br><br>3) 자신을 아끼고 자신도 아꼈던 엄마가 사고로 죽음. (이때 충격이 심하게 컸다면 [&#39;아빠보다 엄마&#39;이던 아이에게 엄마가 죽고 아빠만 남음.] 이 사고가 뇌리에 박히면서 혼란스러웠을 수 있음.)<br><br>4) 아빠는 나를 귀찮고 무관심하게 여기는 것 같다.<br>(자신을 외로운 집에 놔두고 낯선 사람이랑 잘 지내보라고 한다.)<br><br>이 영화에서 중요한 것은 어리며 여린 아이의 입장을 확인하고 받아들이는 것이 아닐까요??","['마지막', '에', '민호', '님', '께서는', '아빠', '의', '입장', '에서', '39', '가정', '을', '중요시', '했냐', '39', '를', '평가', '하시는데', '39', '심', '적', '으로', '다친', '초등학생', '딸', '아이', '39', '에게', '있어서는', '충분히', '아빠', '가', '자신', '가정', '에게', '무관심하다고', '느낄', '수', '있는', '요소', '들', '은', '몇', '가지', '있었다고', '생각', '해요', '스포', '있음', '딸', '아이', '의', '입장', '에서', '보면', '1', '아빠', '는', '자기', '딸', '의', '친한', '친구', '에', '대해', '서도', '잘', '모르며', '물어', '보려고도', '하지', '않는다', '김남길', '이', '하정우', '한테', '딸', '이', '좋아하는', '거', '는', '알', '고', '있냐', '딸', '의', '친구', '들', '은', '알', '고', '있냐고', '할', '때', '하정우', '는', '노코멘트', '였었죠', '2', '아빠', '는', '나', '보다', '일이', '더', '중요하다', '자신', '은', '혼자', '놔두고', '일', '하러', '간다', '3', '자신', '을', '아끼고', '자신', '도', '아꼈던', '엄마', '가', '사고', '로', '죽음', '이', '때', '충격', '이', '심하게', '컸다면', '39', '아빠', '보다', '엄마', '39', '이던', '아이', '에게', '엄마', '가', '죽고', '아빠', '만', '남음', '이', '사고', '가', '뇌리', '에', '박히면서', '혼란', '스러웠을', '수', '있음', '4', '아빠', '는', '나를', '귀찮고', '무관심하게', '여기는', '것', '같다', '자신', '을', '외로운', '집', '에', '놔두고', '낯선', '사람', '이랑', '잘', '지', '내', '보라', '고', '한다이', '영화', '에서', '중요한', '것', '은', '어리며', '여린', '아이', '의', '입장', '을', '확인', '하고', '받아들이는', '것', '이', '아닐까', '요']",14.305701798561271,4.34
659,IQ-w-xTvTJE,이건 입장의 차이라고 봅니다 저희가 영화를 볼때 하정우씨의 시점에서 영화가 진행됩니다 이게 아빠라는 캐릭터에게 몰입할수있게 도와주지만 반대로 자신의 행동에 타당성이 부여됩니다 그래서 딸과 아빠 2명의 입장에서 보면 한쪽에 편파적이지 않게 바라볼수 있을겁니다,"['이건', '입장', '의', '차이', '라고', '봅니다', '저희', '가', '영화', '를', '볼때', '하정우', '씨', '의', '시점', '에서', '영화', '가', '진행', '됩니다', '이', '게', '아빠', '라는', '캐릭터', '에게', '몰입', '할수있게', '도와주지만', '반대', '로', '자신', '의', '행동', '에', '타당성', '이', '부여', '됩니다', '그래서', '딸', '과', '아빠', '2', '명의', '입장', '에서', '보면', '한쪽', '에', '편파', '적', '이지', '않게', '바라볼수', '있을', '겁니다']",3.020879807284789,1.1
660,IQ-w-xTvTJE,상담사로써 저도 자녀에 대해 하정우가 연기했던 캐릭터와 같은 아버지를 여럿 상담했습니다. 하정우가 연기한 아버지 캐릭터가 확실히 물질적인 필요는 채워주었지만 정서적인 필요를 채워주는 아버지는 아니었습니다. 그리고 발달심리학적으로는 물질적인 것보다는 정서적 채움이 더 필요하다고 보고있지요. 이 경우에는 아버지들이 자녀와 소통하는 방법에 대해 상담을 받거나 교육을 받는 것도 필요합니다. 아버지가 나쁜 사람이라기 보다는 자녀와 소통하는 방법을 모르고 자기 방식대로만 사랑해주려다 발생한다고 보고 있습니다.,"['상담사', '로써', '저', '도', '자녀', '에', '대해', '하정우', '가', '연기', '했던', '캐릭터', '와', '같은', '아버지', '를', '여럿', '상담', '했습니다', '하정우', '가', '연기', '한', '아버지', '캐릭터', '가', '확실히', '물질', '적', '인', '필요', '는', '채워주었지만', '정서', '적', '인', '필요', '를', '채워주는', '아버지', '는', '아니었습니다', '그리고', '발달심리학', '적', '으로는', '물질', '적', '인', '것', '보다는', '정서', '적', '채움이', '더', '필요하다고', '보고있지요', '이', '경우', '에는', '아버지', '들', '이', '자녀', '와', '소통', '하는', '방법', '에', '대해', '상담', '을', '받거나', '교육', '을', '받는', '것', '도', '필요합니다', '아버지', '가', '나쁜', '사람', '이라기', '보다는', '자녀', '와', '소통', '하는', '방법', '을', '모르고', '자기', '방식', '대로', '만', '사랑', '해주려다', '발생', '한다고', '보고', '있습니다']",11.021565471875162,3.66
661,IQ-w-xTvTJE,"캠프 보내려하고 낯선 사람이랑 지내보라고 하는 데에 이나 의견은 1도 반영되지 않았죠. 그래놓고 인형으로 때울라 그러고. 명진이처럼 학대당한 건 아니지만, 이나에게도 자기 아빠가 심적으로 의지할 수 없는 존재였을 수 있다고 생각합니다","['캠프', '보내려하고', '낯선', '사람', '이랑', '지', '내', '보라', '고', '하는', '데', '에', '이나', '의견', '은', '1', '도', '반영', '되지', '않았죠', '그래놓고', '인형', '으로', '때울라', '그러고', '명진', '이', '처럼', '학대', '당', '한', '건', '아니지만', '이나', '에게도', '자기', '아빠', '가', '심', '적', '으로', '의지', '할', '수', '없는', '존재', '였을', '수', '있다고', '생각', '합니다']",3.3749504355005766,1.25
662,IQ-w-xTvTJE,캠프보낼려고 하는것도 한 몫했다고 봄,"['캠프', '보낼려고', '하는것도', '한', '몫', '했다고', '봄']",-0.2668981890883314,-0.14
663,IQ-w-xTvTJE,어둑시니는 도깨비이며 거지어린이모습으로 나타나 관심을 안주면 사람 머리를 으깨어버린다고 합니다,"['어둑시니', '는', '도깨비', '이며', '거지', '어린이', '모습', '으로', '나타나', '관심', '을', '안주', '면', '사람', '머리', '를', '으', '깨어', '버린다고', '합니다']",0.9943458330673729,0.43
664,IQ-w-xTvTJE,근데 이안이 아니고 이나아닌가여?,"['근데', '이안', '이', '아니고', '이나', '아닌가여']",-1.9235059947508286,-1.08
665,IQ-w-xTvTJE,스크립트 작성 중에 이름을 헷갈렸네요 ㅎㅎ,"['스크립트', '작성', '중', '에', '이름', '을', '헷갈렸네요']",-2.0,-1.08
666,IQ-w-xTvTJE,첨에 무서워서 눈가리고 있다가 친구가 자꾸 손 끄집어 내려서 봤는데 귀신 나오고부터는 아이들 더 챙겨주고싶지 막 무섭거나 하지는않음,"['첨', '에', '무서워서', '눈가', '리', '고', '있다가', '친구', '가', '자꾸', '손', '끄', '집어', '내려서', '봤는데', '귀신', '나오고부터는', '아이', '들', '더', '챙겨주고싶지', '막', '무섭거나', '하지는', '않음']",-3.0182354085215755,-1.26
667,IQ-w-xTvTJE,"<a href=""https://www.youtube.com/watch?v=IQ-w-xTvTJE&amp;t=3m23s"">3:23</a>에서 인형이 32개인데 32명의 아이들하고 관계가있는거임?","['323', '에서', '인형', '이', '32', '개', '인데', '32', '명의', '아이', '들', '하고', '관계', '가', '있는거', '임']",-0.01737422278225642,-0.01
668,IQ-w-xTvTJE,실종 어린이 32명. 맞는 듯.,"['실종', '어린이', '32', '명', '맞는', '듯']",0.757106715408912,0.43
669,IQ-w-xTvTJE,(대충 감.탄.),"['대충', '감탄']",2.1892766788522264,1.68
670,IQ-w-xTvTJE,그럼 도라에몽은 거기서 사는거네,"['그럼', '도라에몽', '은', '거기', '서', '사는거네']",-0.40128272987068647,-0.23
671,IQ-w-xTvTJE,공감ㅎㅎ,['공감'],0.33950826272543516,0.34
672,IQ-w-xTvTJE,귀신이 중반부에나오나요 후반부에나오나요??,"['귀신', '이', '중반', '부', '에나', '오나요', '후반', '부', '에나', '오나요']",0.15758259267052982,0.08
673,IQ-w-xTvTJE,클로젯이 보여주려는 교훈처럼 민호님도 관심받고 자라야 더 훌륭한 리뷰어가 되겠죠?,"['클로젯', '이', '보여주려는', '교훈', '처럼', '민호', '님', '도', '관심', '받고', '자라야', '더', '훌륭한', '리뷰', '어', '가', '되겠죠']",5.023198051888175,2.25
674,IQ-w-xTvTJE,저도 어둑시니인가 봅니다 ㅎㅎ 관심 좀 주세요 ㅎㅎ,"['저', '도', '어둑시니', '인가', '봅니다', '관심', '좀', '주세요']",-0.5337963781766629,-0.28
675,IQ-w-xTvTJE,근데 어이없는게 듣보잡 유튜버가 이거 썸네일에 이러면 왜 스포하냐고 했을텐데 민호타우르스라서 아무말도 못함,"['근데', '어이없는게', '듣보잡', '유튜버', '가', '이', '거', '썸네일', '에', '이러면', '왜', '스포', '하냐고', '했을텐데', '민호', '타', '우르', '스', '라서', '아무', '말', '도', '못', '함']",-1.8527668135901088,-0.78
676,IQ-w-xTvTJE,@민호타우르스 죄송합니다,"['민호', '타', '우르', '스', '죄송합니다']",-1.8724977882930214,-1.1
677,IQ-w-xTvTJE,"저라고 딱히 스포하면 욕을 덜 먹고 그런 건 아닌데 ㅎㅎ 어차피 귀신 영화란 건 다 아는 사실이고, 3초 얘기 하고 지나가는 걸로 끝인 어둑시니라는 귀신 이름 자체는 영화를 보는 데에 큰 스포는 아니거든요. 그리고 내용적인 부분은 영상 시작할 때 스포 주의 문구를 넣었습니다...이쁘게 봐주세용","['저', '라고', '딱히', '스포', '하면', '욕', '을', '덜', '먹고', '그런', '건', '아닌데', '어차피', '귀신', '영', '화란', '건', '다', '아는', '사실', '이고', '3초', '얘기', '하고', '지나가는', '걸', '로', '끝', '인', '어둑시니', '라는', '귀신', '이름', '자체', '는', '영화', '를', '보는', '데', '에', '큰', '스포', '는', '아니거든요', '그리고', '내용', '적', '인', '부분', '은', '영상', '시작', '할', '때', '스포', '주의', '문구', '를', '넣었습니다', '이쁘게', '봐주세용']",-4.852095773393828,-1.74
678,IQ-w-xTvTJE,"<a href=""https://www.youtube.com/watch?v=IQ-w-xTvTJE&amp;t=2m05s"">2:05</a> 그렇게 딸은 나니아로 가고..","['205', '그렇게', '딸', '은', '나니아', '로', '가고']",0.5287849415776673,0.29
679,IQ-w-xTvTJE,ㅋㅋㅋㅋㅋ 코리안 나니아 연대기,"['코리안', '나니아', '연대기']",0.378553357704456,0.26
680,IQ-w-xTvTJE,부기맨인줄요ㅋ,"['부기맨', '인', '줄', '요']",0.0,0.0
681,IQ-w-xTvTJE,???:영화&#39;신과함께&#39; 봤어요?,"['영화', '39', '신', '과', '함께', '39', '봤어요']",2.5680118181555605,1.39
682,IQ-w-xTvTJE,???:방탄소년단?블랙핑크?,"['방탄소년단', '블랙', '핑크']",0.0,0.0
683,IQ-w-xTvTJE,난 이해함 ㅋㅋ,"['난', '이해', '함']",0.307814176543736,0.21
684,IQ-w-xTvTJE,난 이해했는데 안 웃겼음,"['난', '이해', '했는데', '안', '웃겼음']",0.7228585630764172,0.43
685,IQ-w-xTvTJE,"저랑 같이간 친구들은 못알아들어서 웃지도 못했는데..,","['저', '랑', '같', '이간', '친구', '들', '은', '못', '알아', '들어서', '웃지도', '못', '했는데']",1.4150443865326812,0.67
686,IQ-w-xTvTJE,이때 웃었음 ㅋㅋㅋ,"['이', '때', '웃었음']",0.0,0.0
687,IQ-w-xTvTJE,이안이 아니구 이나여ㅎㅎ 저도 개봉당일 영화관에서 보고왔는데 명진이가 본모습을 드러낸 후부턴 공포가 확가시는 느낌이 있었어요ㅠ 그점에선 아쉬움이남지만 진짜 배우분들 연기는 끝내주게 잘하시더라구요ㅎ,"['이안', '이', '아니구', '이나', '여', '저', '도', '개봉', '당일', '영화관', '에서', '보고왔는데', '명진', '이', '가', '본', '모습', '을', '드러낸', '후', '부턴', '공포', '가', '확', '가시는', '느낌', '이', '있었어요', '그', '점', '에선', '아쉬움', '이남', '지만', '진짜', '배우', '분들', '연기', '는', '끝내주게', '잘', '하시더라구요']",-0.4578916763765547,-0.17
688,IQ-w-xTvTJE,아 제가 이름을 헷갈렸네요 ^-^;;,"['아', '제', '가', '이름', '을', '헷갈렸네요']",-2.0,-1.12
689,IQ-w-xTvTJE,어둑시니 ! 귀신을 귀신이 ~ 귀시니~ 라고 부르는 것 같아 귀여워요(?),"['어둑시', '니', '귀신', '을', '귀신', '이', '귀', '시', '니', '라고', '부르는', '것', '같아', '귀여워요']",0.7254126292272156,0.34
690,IQ-w-xTvTJE,@보라돌이 시니야~ 노래틀어줘,"['보라돌이', '시', '니야', '노래', '틀어줘']",0.0,0.0
691,IQ-w-xTvTJE,아하 ! 감사합니다 .<br>한국 요괴 중 &quot; ~ 시니&quot; 가 붙는 요괴가 또 두억시니가 있네요,"['아하', '감사합니다', '한국', '요괴', '중', 'quot', '시', '니', 'quot', '가', '붙는', '요괴', '가', '또', '두', '억', '시', '니', '가', '있네요']",0.30093184746835405,0.13
692,IQ-w-xTvTJE,어둠 + 신위(귀신) = 어둑시니,"['어둠', '신위', '귀신', '어둑시', '니']",0.8756442131004213,0.52
693,IQ-w-xTvTJE,오히려 어린애귀신보고 친구랑 쟤귀엽다..했었는데..,"['오히려', '어린', '애', '귀', '신', '보고', '친구', '랑', '쟤', '귀엽다', '했었는데']",3.279888187026508,1.61
694,IQ-w-xTvTJE,ㄹㅇ...그 때부터 하나도 안 무서워지는 영화,"['그', '때', '부터', '하나', '도', '안', '무서워지는', '영화']",0.06953654539013363,0.04
695,IQ-w-xTvTJE,한국애들 진짜 반 이상은 옷장에 살고 있겠닼ㅋㅋㅋㅋ진짜 ㅇㅈ,"['한국', '애', '들', '진짜', '반', '이상은', '옷장', '에', '살', '고', '있겠', '닼', '진짜']",0.3167788905592051,0.15
696,IQ-w-xTvTJE,"@태연,Lh 투기발뺌 상황이라는게 사람에게 정말 중요합니다","['태연', 'Lh', '투기', '발뺌', '상황', '이라는', '게', '사람', '에게', '정말', '중요합니다']",-1.2403456108406241,-0.61
697,IQ-w-xTvTJE,하정우는 운전 잘했는데...?트럭이 차선 넘고 박은거 아닌가요...잘못봤나...,"['하정우', '는', '운전', '잘', '했는데', '트럭', '이', '차선', '넘고', '박은거', '아닌가요', '잘', '못', '봤나']",3.8885022462673176,1.81
698,IQ-w-xTvTJE,"@민호타우르스ㅡ 아직 식견이 짧으시네요 최악의 아빠가 아닌건 누구라도 이견이 없을 겁니다. 하지만 결국 아빠의 운전실수로 엄마가 죽고, 아빠는 나를 다른 곳에 보내려 하고, 일에 더 신경쓰는 등등 아이의 입장에서+ 세세한걸 다 따진다면 하정우도 본의아니게 딸에게 상처를 많이 줬다고 생각합니다. ((수정ㅡ 교통사고는<br>하정우말고 트럭과실이라네요ㅜ","['민호', '타', '우르', '스', '아직', '식견', '이', '짧으시네요', '최악', '의', '아빠', '가', '아닌건', '누구', '라도', '이견', '이', '없을', '겁니다', '하지만', '결국', '아빠', '의', '운전', '실수', '로', '엄마', '가', '죽고', '아빠', '는', '나를', '다른', '곳', '에', '보내려', '하고', '일', '에', '더', '신경', '쓰는', '등등', '아이', '의', '입장', '에서', '세세한', '걸', '다', '따진다면', '하정우', '도', '본의', '아니게', '딸', '에게', '상처', '를', '많이', '줬다고', '생각', '합니다', '수정', '교통사고', '는', '하정우', '말고', '트럭', '과실', '이라네요']",3.6174808482850342,1.27
