,id,sentence,comment_cut,score,ratio
0,-rOQmLrl90A,침입자 봤던 나로써의 평은 <br><br>통신사 맴버쉽으로 공짜로본 영화라 다행이다,"['침입', '자', '봤던', '나로', '써의', '평', '은', '통신사', '맴버쉽', '으로', '공짜', '로', '본', '영화', '라', '다행', '이다']",0.9027853502390306,0.4
1,-rOQmLrl90A,자기말을 무조건 듣게 만드는 약ㅋㅋㅋㅋ<br>스릴러 영화가 아니라 ㅎㅌㅁ 동인지네ㅋㅋㅋ,"['자기말을', '무조건', '듣게', '만드는', '약', '스릴러', '영화', '가', '아니라', '동인지', '네']",0.8424519788070779,0.41
2,-rOQmLrl90A,중반까지는 진짜 재밌었음. 근데 후반부 엔딩이 허무했을 뿐이지,"['중반', '까지는', '진짜', '재밌었음', '근데', '후반', '부', '엔딩', '이', '허무했을', '뿐', '이지']",-0.9733518193098263,-0.47
3,-rOQmLrl90A,반전이 아니 결말이 진심 개망인 영화였다. 어이가 없어서...,"['반전', '이', '아니', '결말', '이', '진심', '개', '망인', '영화', '였다', '어이', '가', '없어서']",-1.8132271762034586,-0.86
4,-rOQmLrl90A,영화 봤는데....더럽게 재미없음.........,"['영화', '봤는데', '더럽게', '재미없음']",-1.0473715586926253,-0.65
5,-rOQmLrl90A,정말 재미있는 영화는 만들기가 참 어렵나 봐요. 한국 관객이 눈이 높은 건지 영화 만드는 사람들이 못 만드는 건지 잘 모르겠음,"['정말', '재미있는', '영화', '는', '만들기', '가', '참', '어렵나', '봐요', '한국', '관객', '이', '눈', '이', '높은', '건지', '영화', '만드는', '사람', '들', '이', '못', '만드는', '건지', '잘', '모르겠음']",6.342154659529005,2.63
6,-rOQmLrl90A,감독이 약을 자주 먹었었나?<br>근데 왜 저런 스토리에 투자를 해준거야?,"['감독', '이', '약', '을', '자주', '먹었었나', '근데', '왜', '저런', '스토리', '에', '투자', '를', '해준거야']",0.021787037815235777,0.01
7,-rOQmLrl90A,무열아 대본을 끝까지 읽고 출연결정하자,"['무열', '아', '대본', '을', '끝', '까지', '읽고', '출연', '결정', '하자']",1.2686015277934188,0.63
8,-rOQmLrl90A,기생충+겟아웃+한드+종교  ..?<br>편한도구가 들어가면 작품의질이 떨어진다 라는 말이<br>와닿네요,"['기생충', '겟아웃한드', '종교', '편한', '도구', '가', '들어가면', '작품', '의', '질', '이', '떨어진다', '라는', '말', '이', '와', '닿네요']",2.0280225699939765,0.91
9,-rOQmLrl90A,영화 설명해주는건 좋은데 볼려고 했던 영화 스포를 당하네..,"['영화', '설명', '해주는건', '좋은데', '볼려고', '했던', '영화', '스포', '를', '당하네']",-2.2562708960778184,-1.13
10,-rOQmLrl90A,이분 혹시 영화 비판만 전문적으로하는 유튜버신지...<br>보는것마다 비판평만있는거같아서요,"['이분', '혹시', '영화', '비판', '만', '전문', '적', '으로', '하는', '유', '튜버', '신지', '보는것마다', '비판', '평', '만', '있는거', '같아서요']",-1.7670978790029932,-0.78
11,-rOQmLrl90A,후반부 좀 아쉽긴 했는데 괜찮았네요,"['후반', '부', '좀', '아쉽긴', '했는데', '괜찮았네요']",-0.05787158355316821,-0.03
12,-rOQmLrl90A,"앞부분부터 영화 리뷰까지 공들여서 영상 하나하나 만드시는 느낌이 확 나네요 구독하고 갑니다,,ㅎㅎ","['앞', '부분', '부터', '영화', '리뷰', '까지', '공', '들', '여서', '영상', '하나', '하나', '만드시는', '느낌', '이', '확', '나네요', '구독', '하고', '갑니다']",1.4285428035005605,0.62
13,-rOQmLrl90A,클리셰 뜻이 뭔가요??,"['클리셰', '뜻', '이', '뭔가', '요']",0.2920159660423367,0.17
14,-rOQmLrl90A,스토리 엉망. 전개성 엉망. 진짜일까 가짜일까를 찾는 과정이 엄청 지루했어요... 진짜 시간낭비..,"['스토리', '엉망', '전개', '성', '엉망', '진짜', '일까', '가짜', '일까', '를', '찾는', '과정', '이', '엄청', '지루했어요', '진짜', '시간', '낭비']",-5.4637057125656545,-2.42
15,-rOQmLrl90A,진짜 좋은배우들 가져다가 이거밖에 못찍는게..영화보는내내 정말 구리다 라고 생각했습니다ㅋㅋ 저는 정신과의사의 최면화법부터 어이가 없었는데. 그 어떤 최면술사가 그런화법으로 최면을 거는지 이해가 안갈정도,"['진짜', '좋은', '배우', '들', '가져다가', '이', '거', '밖에', '못', '찍는게', '영화', '보는내내', '정말', '구리', '다', '라고', '생각', '했습니다', '저', '는', '정신', '과의', '사의', '최면', '화법', '부터', '어이', '가', '없었는데', '그', '어떤', '최면술', '사가', '그런', '화법', '으로', '최면', '을', '거', '는', '지', '이해', '가', '안', '갈', '정도']",7.189450642046708,2.7
16,-rOQmLrl90A,송지효연기잘하든데 크로젯보다는훨나았음,"['송지효', '연기', '잘', '하든데', '크로', '젯', '보다는', '훨', '나', '았음']",2.4188179649781096,1.21
17,-rOQmLrl90A,초반부터 몰입감 거의 없었다.<br>유전자검사 한다니까 토달았는데 몇분후에 간호사로 나온다. 의심할만함.<br>딸과 무용학원에 같이 간다는데 아빠가 좋아 고모가 좋아?라고 딸에게 어처구니 없는 질문을 함. 의심 또는 거부감이 들만 함.<br>그 이후 조금 더 보다가 말았다.,"['초반', '부터', '몰입', '감', '거의', '없었다', '유전자', '검사', '한다니까', '토', '달았는데', '몇', '분후', '에', '간호사', '로', '나온다', '의심', '할만', '함딸', '과', '무용', '학원', '에', '같이', '간다는데', '아빠', '가', '좋아', '고모', '가', '좋아라고', '딸', '에게', '어처구니', '없는', '질문', '을', '함', '의심', '또는', '거부', '감', '이', '들만', '함그', '이후', '조금', '더', '보다가', '말았다']",3.0791118158695925,1.14
18,-rOQmLrl90A,토요일새벽에 tv에서 재방했던 비디오여행에서 광고해준걸보고 뒷내용이 너무 궁금해서 바로 다음날 보러갔었죠... 결과는...<br>다시는 출발 비디오여행을 믿지않으리...,"['토요일', '새벽', '에', 'tv', '에서', '재방', '했던', '비디오', '여행', '에서', '광고', '해', '준걸', '보고', '뒷', '내용', '이', '너무', '궁금해서', '바로', '다음', '날', '보러', '갔었죠', '결과', '는', '다시는', '출발', '비디오', '여행', '을', '믿지', '않으리']",-2.2332310117289964,-0.89
19,-rOQmLrl90A,정신과에서 최면 치료? 에이~ 너무 갔다~결국 영화도 갔다~,"['정신과', '에서', '최면', '치료', '에이', '너무', '갔다', '결국', '영화', '도', '갔다']",0.23485489466634085,0.12
20,-rOQmLrl90A,I liked it.,"['I', 'liked', 'it']",0.0,0.0
21,-rOQmLrl90A,I wish they showed the dna result at the end.,"['I', 'wish', 'they', 'showed', 'the', 'dna', 'result', 'at', 'the', 'end']",0.0,0.0
22,-rOQmLrl90A,아.. 살아있다 사라진시간 보다 괜찮나요??,"['아', '살아있다', '사', '라진시', '간', '보다', '괜찮나요']",0.20889933738519093,0.11
23,-rOQmLrl90A,아뇨 초반이 괜찮다는데 글쎄요.. 저는 발레학원씬까지만 딱 괜찮았다고 봅니다 물론 초반입니다. 중반부터 개구림,"['아뇨', '초반', '이', '괜찮다는데', '글쎄요', '저', '는', '발레학원', '씬', '까지만', '딱', '괜찮았다고', '봅니다', '물론', '초반', '입니다', '중반', '부터', '개', '구림']",0.9171068635974192,0.4
24,-rOQmLrl90A,딱 초중반까지만 볼만해요 그 후부턴 노답,"['딱', '초', '중반', '까지만', '볼', '만해', '요', '그', '후', '부턴', '노답']",-2.4177986747703843,-1.18
25,-rOQmLrl90A,ㅎ 초중반 좋았는데 나중은 돌려봤음 ㅎ,"['초', '중반', '좋았는데', '나중', '은', '돌려', '봤음']",-0.579869135657742,-0.31
26,-rOQmLrl90A,영화 나름 재밌음. 아쉬운건 송지효 발성...이번 연기는 정말 좋았는데 낮은 목소리 때문인지 발성이 최악이더라..못알아 듣겠음.. 발음은 좋은거 같은데 웅얼거리게 들림.. 런닝맨에 10번절하고 요즘 런닝맨도 대충하던데 최선을 다해 뛰어보자...,"['영화', '나름', '재밌음', '아쉬운건', '송지효', '발성', '이번', '연기', '는', '정말', '좋았는데', '낮은', '목소리', '때문', '인지', '발성', '이', '최악', '이', '더', '라', '못', '알아', '듣겠음', '발음', '은', '좋은', '거', '같은데', '웅얼거리', '게', '들림', '런닝맨', '에', '10', '번', '절하', '고', '요즘', '런닝맨', '도', '대충', '하던데', '최선', '을', '다해', '뛰어', '보자']",1.8485364609794408,0.69
27,-rOQmLrl90A,나만 재밌게 봤나...,"['나', '만', '재밌게', '봤나']",0.8000143865196523,0.5
28,-rOQmLrl90A,"이분 리뷰보면 정말 편하게 비평한다. 상당수 느끼는건데,  비평을 위한 억지 비평 만들기란 느낌! 제대로 할거면 감독들과 일대일로 붙어서 라이브로 맞짱 뜨시죠!","['이분', '리뷰', '보면', '정말', '편하게', '비평', '한다', '상당수', '느끼는건데', '비평', '을', '위', '한', '억지', '비평', '만들기', '란', '느낌', '제대로', '할거면', '감독', '들', '과', '일대일', '로', '붙어서', '라이브', '로', '맞짱', '뜨시죠']",1.5866141505948785,0.64
29,-rOQmLrl90A,"님의 영화보는 수준이 낮아서 좋게보이는거에요. 그 어떤 영화 리뷰어, 평론가들도 좋다고 말 못합니다","['님', '의', '영', '화보', '는', '수준', '이', '낮아서', '좋게', '보이는거에요', '그', '어떤', '영화', '리뷰', '어', '평론가', '들', '도', '좋다고', '말', '못', '합니다']",4.566141431740119,1.95
30,-rOQmLrl90A,오늘. 다운받아서 봤는데...ㅋㅋㅋ 뭐 이딴 개ㅂㅅ 같은 영화가 다 있나...ㅉㅉ,"['오늘', '다운', '받아서', '봤는데', '뭐', '이딴', '개', '같은', '영화', '가', '다', '있나']",1.8139724186689326,0.87
31,-rOQmLrl90A,"전반적으로 송지효의 대사처리가 아쉬웠어요..  계속해서 웅얼거리는 듯해서, 대사가 다른 배우들에 비해서 잘 안들렸어요.","['전반', '적', '으로', '송지효', '의', '대', '사', '처리', '가', '아쉬웠어요', '계속', '해서', '웅얼거리', '는', '듯', '해서', '대사', '가', '다른', '배우', '들', '에', '비', '해서', '잘', '안', '들렸어요']",5.790818038776959,2.38
32,-rOQmLrl90A,"어디서 보고 가져온 건 많은, 꽤 볼만한 영화라고 생각했는데.. 현실성만 살리면 스릴러가 제대로 표현될까요. 이 영화는 허용할 수 있는 범위에서 비현실성을 유예시킨거같고, 종교를 끌어들인 건 감독으로서 어쩔 수 없는 선택을 한 거 같아요. 좀 무리이긴 했지만. 막판에 강한걸 터뜨려야 한다는 압박이 있지 않았을까요","['어디서', '보고', '가져온', '건', '많은', '꽤', '볼', '만', '한', '영화', '라고', '생각', '했는데', '현실', '성', '만', '살리면', '스릴러', '가', '제대로', '표현', '될까', '요', '이', '영화', '는', '허용', '할', '수', '있는', '범위', '에서', '비', '현실', '성', '을', '유예', '시킨거', '같고', '종교', '를', '끌어', '들인', '건', '감독', '으로서', '어쩔', '수', '없는', '선택', '을', '한', '거', '같아요', '좀', '무리이긴', '했지만', '막판', '에', '강한', '걸', '터뜨려야', '한다는', '압박', '이', '있지', '않았을까요']",6.427994101811125,2.27
33,-rOQmLrl90A,아 그렇군요. 볼려고 했는데..,"['아', '그렇군요', '볼려고', '했는데']",0.1710044706253882,0.11
34,-rOQmLrl90A,다들 연기 별로,"['다', '들', '연기', '별로']",0.5985538079119207,0.37
35,-rOQmLrl90A,재미 없구만 송지효 연기도 어슬프고 그냥 사이비종교,"['재미', '없구만', '송지효', '연기', '도', '어슬프', '고', '그냥', '사이비종교']",2.9153664929644116,1.49
36,-rOQmLrl90A,애초에 송지효가 주연이면 당연히 그 영활 보질 말았어야지 대충 주연이랑 시놉만 봐도 똥망할 영화인지 아닌지 80%는 파악 되던데,"['애초', '에', '송지효', '가', '주연', '이면', '당연히', '그', '영활', '보질', '말았어야지', '대충', '주연', '이랑', '시놉', '만', '봐도', '똥', '망할', '영화', '인지', '아닌지', '80', '는', '파악', '되던데']",-4.767732360552949,-1.97
37,-rOQmLrl90A,이런 시나리오를 택하는 사람들의 촉은 멀까? 개똥촉? 차라리 보험금을 노리고 일어난 일이라 그러지. 갑자기 뭔 말도 안되는 소리를 지껄이는거야 관객이 우습나?관객이 쓰는 돈이 우스워? 싫어하지 않던 배우든인데 저기 나온 사람들까지 다 싫어지네,"['이런', '시나리오', '를', '택하', '는', '사람', '들', '의', '촉', '은', '멀까', '개똥촉', '차라리', '보험금', '을', '노리', '고', '일어난', '일이', '라', '그러지', '갑자기', '뭔', '말', '도', '안되는', '소리', '를', '지껄이는거야', '관객', '이', '우습나', '관객', '이', '쓰는', '돈', '이', '우스워', '싫어하지', '않던', '배우든인데', '저기', '나온', '사람', '들', '까지', '다', '싫어지네']",-0.06469235818117525,-0.02
38,-rOQmLrl90A,송지효 등장 하자 런닝맨 생각나서 이 영화 끝까지 못보겠다는 느낌 받음.,"['송지효', '등장', '하자', '런닝맨', '생각나서', '이', '영화', '끝', '까지', '못', '보겠다는', '느낌', '받음']",1.075469974587602,0.51
39,-rOQmLrl90A,쓰레기 영화...,"['쓰레기', '영화']",0.09128446394581695,0.07
40,-rOQmLrl90A,"초반은 진짜 흥미로웠어요.약간 겟 아웃 느낌나면서..근데 진짜 갑분싸 ㅠ 산으로 가고 말더군요.작가가 나중엔 쓸게 없어졌나 싶었어요.근데, 그래서 진짜 동생이 맞나요? 어떻게 생각하세요?","['초반', '은', '진짜', '흥미로웠어요', '약간', '겟', '아웃', '느낌나면서', '근데', '진짜', '갑', '분', '싸', '산', '으로', '가고', '말더군요', '작가', '가', '나중', '엔', '쓸게', '없어졌나', '싶었어요', '근데', '그래서', '진짜', '동생', '이', '맞나요', '어떻게', '생각', '하세요']",1.4501835864968857,0.58
41,-rOQmLrl90A,연기 때문에 5점 줌. 연기 아니였으면 0점이었음.,"['연기', '때문', '에', '5', '점', '줌', '연기', '아니였으면', '0', '점', '이었음']",0.4996823948887441,0.24
42,-rOQmLrl90A,나는 후반부 되게 신선했는데 ‥댓글처럼 재산때문이나  행복한 가정이 부러워서   그런거였으면  다들 뻔하고뻔한 스릴러라고 했을껄? 항상 느낀건   경찰들은 진짜 쓸데없다‥,"['나', '는', '후반', '부', '되게', '신선했는데', '댓글', '처럼', '재산', '때문', '이나', '행복한', '가정', '이', '부러워서', '그런거였으면', '다', '들', '뻔하고', '뻔한', '스릴러', '라고', '했을껄', '항상', '느낀건', '경찰', '들', '은', '진짜', '쓸데없다']",0.7215354785582868,0.29
43,-rOQmLrl90A,놀이공원 풍선아저씨가 자꾸 나오길래 범인인줄 알았는데 아무것도 아니네,"['놀이', '공원', '풍선', '아저씨', '가', '자꾸', '나오길래', '범인', '인', '줄', '알았는데', '아무', '것', '도', '아니네']",-2.964317776123135,-1.36
44,-rOQmLrl90A,송지효아줌마 동생역이아니고. 큰누님 아님?  너무 나이드셨던데 페이스가,"['송지효', '아줌마', '동생', '역이아니고', '큰', '누님', '아님', '너무', '나이', '드셨던데', '페이스', '가']",-0.3563458683324633,-0.17
45,-rOQmLrl90A,"신천지, 대순지리회가 이렇게 무섭습니다.신천지, 대순지리회가 이렇게 무섭습니다.신천지, 대순지리회가 이렇게 무섭습니다.신천지, 대순지리회가 이렇게 무섭습니다.신천지, 대순지리회가 이렇게 무섭습니다.신천지, 대순지리회가 이렇게 무섭습니다.신천지, 대순지리회가 이렇게 무섭습니다.신천지, 대순지리회가 이렇게 무섭습니다.","['신천지', '대', '순', '지리', '회', '가', '이렇게', '무섭습니다', '신천지', '대', '순', '지리', '회', '가', '이렇게', '무섭습니다', '신천지', '대', '순', '지리', '회', '가', '이렇게', '무섭습니다', '신천지', '대', '순', '지리', '회', '가', '이렇게', '무섭습니다', '신천지', '대', '순', '지리', '회', '가', '이렇게', '무섭습니다', '신천지', '대', '순', '지리', '회', '가', '이렇게', '무섭습니다', '신천지', '대', '순', '지리', '회', '가', '이렇게', '무섭습니다', '신천지', '대', '순', '지리', '회', '가', '이렇게', '무섭습니다']",1.66135836388121,0.59
46,-rOQmLrl90A,사라진시간 리뷰는 언제쯤?<br>기다립니다,"['사', '라진시', '간', '리뷰', '는', '언제', '쯤', '기다립니다']",0.04806178503661673,0.03
47,-rOQmLrl90A,아 괜히봤다 그래서 평점2점으로 결정<br>  개인마다 취향이 다르지만  차라리 사이비종교의침입이라고 제목정하지,"['아', '괜히', '봤다', '그래서', '평점', '2', '점', '으로', '결정', '개인', '마다', '취향', '이', '다르지만', '차라리', '사이비종교', '의', '침입', '이라고', '제목', '정', '하', '지']",3.4149251683719823,1.45
48,-rOQmLrl90A,너무 갔음 ㅋㅋㅋ,"['너무', '갔음']",0.09489066153445011,0.07
49,-rOQmLrl90A,그냥 오마주ㅋㅋㅋㅋ감독이 공부더해야겠네 빽이있거나 돈이많거나 중 하나겠네 ㅋㅋㅋ,"['그냥', '오마주', '감독', '이', '공부', '더해야겠네', '빽', '이', '있거나', '돈', '이', '많거나', '중', '하나', '겠네']",0.2775152516982601,0.13
50,-rOQmLrl90A,"저는 보다가 그냥 나왔어요. 개연성 제로였어요. 너무 재미 없었죠. 송지효는 미스캐스팅 같구요. 계속 런닝맨에서 웃는 모습이 떠올라 몰입을 방해했구요. 진짜 문제는 스토리, 플롯이 엉망이었던 것 같아요. 영화 보다가 끝까지 안보고 나온건 정말 오랜만이었죠. 그냥 배우, 스탭... 다 고생만 했네요. ㅜㅜ","['저', '는', '보다가', '그냥', '나왔어요', '개연', '성', '제로', '였어요', '너무', '재미', '없었죠', '송지효', '는', '미스캐스팅', '같구요', '계속', '런닝맨', '에서', '웃는', '모습', '이', '떠올라', '몰입', '을', '방해', '했구요', '진짜', '문제', '는', '스토리', '플롯', '이', '엉망', '이었던', '것', '같아요', '영화', '보다가', '끝', '까지', '안보', '고', '나온건', '정말', '오랜만', '이었죠', '그냥', '배우', '스탭', '다', '고생', '만', '했네요']",10.235503236930178,3.75
