,id,sentence,comment_cut,score,ratio
0,A6Vn67Sdmig,담백하게 찌질하고 현실감 쩔었다.,"['담백하게', '찌질하고', '현', '실감', '쩔었다']",0.0,0.0
1,A6Vn67Sdmig,"<a href=""https://www.youtube.com/watch?v=A6Vn67Sdmig&amp;t=9m03s"">9:03</a><br>재훈의 과거에서<br>오태식이 실화냐고ㅋㅋㅋㅋ","['903', '재훈', '의', '과거', '에서', '오태식', '이', '실화', '냐', '고']",0.36317452905573344,0.18
2,A6Vn67Sdmig,가지.. 포기.. 세수.. 보고싶었어..,"['가지', '포기', '세수', '보고싶었어']",-1.0,-0.62
3,A6Vn67Sdmig,초중반까지 재밌게 보았으나 중반 이후 무너져버려 안타깝던 영화입니다. 공효진의 매력으로 마지막까지 끌고간 영화,"['초', '중반', '까지', '재밌게', '보았으나', '중반', '이후', '무너져', '버려', '안타깝던', '영화', '입니다', '공효진', '의', '매력', '으로', '마지막', '까지', '끌', '고간', '영화']",4.260774548637009,1.83
4,A6Vn67Sdmig,리뷰 감솨~내스퇄이아니라 리뷰로 ..,"['리뷰', '감솨', '내', '스퇄', '이', '아니라', '리뷰', '로']",2.5675821459916697,1.35
5,A6Vn67Sdmig,전 영화 한편 보고 싶어서 혼자 봤는데요. <br>킬링타임용이었지만 군더더기 없이 참 깔끔하더라고요! 대사가 평범하지만...적당히 유쾌하고..진지하지도 가볍지도 않아요.,"['전', '영화', '한편', '보고', '싶어서', '혼자', '봤는데요', '킬링타임', '용이었지만', '군더더기', '없이', '참', '깔끔하더라고요', '대사', '가', '평범하지만', '적당히', '유쾌하고', '진지하지도', '가볍지도', '않아요']",5.07932299597747,2.19
6,A6Vn67Sdmig,요새 한국영화중에 오랜만에 재밌게봤네요<br>몇몇 설정들이 ‘그 분들’이 줄창 주장하는 여성들이 사회에서 격는 어려움과 맞닿아있지만 과하지않고 적당히 공감할수있었습니다 실제로 저런일들이 주변에 많기도하구요<br>웃음도있고 자아성찰도하게되는 영화였네요<br>마지막으로 공효진은 사랑입니다...,"['요새', '한국영', '화중', '에', '오랜', '만', '에', '재밌게', '봤네요', '몇몇', '설정', '들', '이', '그', '분', '들', '이', '줄창', '주장', '하는', '여성', '들', '이', '사회', '에서', '격는', '어려움', '과', '맞닿아있지만', '과', '하지', '않고', '적당히', '공감', '할수있었습니다', '실제', '로', '저런', '일', '들', '이', '주변', '에', '많기', '도하', '구', '요', '웃음', '도', '있고', '자아', '성찰', '도하', '게', '되는', '영화', '였네요', '마지막', '으로', '공효진', '은', '사랑', '입니다']",7.001977573892721,2.5
7,A6Vn67Sdmig,유열의 음악쓰레기에 비하면 선녀지..,"['유열', '의', '음악', '쓰레기', '에', '비', '하면', '선녀', '지']",-0.010652656446739517,-0.01
8,A6Vn67Sdmig,조커 역시 입소문보다는 그냥저냥 볼만한정도였는데<br>이딴영화 볼바엔 차라리 조커 2번 보겠음,"['조커', '역시', '입', '소문', '보다는', '그냥', '저', '냥', '볼', '만', '한', '정도', '였는데', '이딴', '영화', '볼바', '엔', '차라리', '조커', '2', '번', '보겠음']",1.5999160176136964,0.68
9,A6Vn67Sdmig,"하나같이 과장되고 작위적이며, 저질개그에<br>등장인물들의 행동이 전혀 납득이 안되던 영화<br>저 회사는 일안하고 만날 술만마시나","['하나같이', '과장', '되고', '작위', '적', '이며', '저', '질', '개그', '에', '등장인물', '들', '의', '행동', '이', '전혀', '납득', '이', '안되던', '영화', '저', '회사', '는', '일안하고', '만날', '술', '만', '마시나']",1.1916133090812675,0.49
10,A6Vn67Sdmig,어제  봤어요 ㅎ   문정역이랑   장지역 사이에 있는메가박스에서   봤는데   대각선으로  보이는  커피가게가  여기나오는  커피가게  더라고요 ㅋㅋ  같이본  친구가  얘기해줘서  알았음ㅋ  엄청괜찮았어요  이영화 ㅎㅎㅎ,"['어제', '봤어요', '문정역', '이랑', '장지역', '사이', '에', '있는', '메가박스', '에서', '봤는데', '대각선', '으로', '보이는', '커피가게', '가', '여기', '나오는', '커피가게', '더라고요', '같', '이본', '친구', '가', '얘기', '해줘서', '알았음', '엄청', '괜찮았어요', '이영화']",6.3467640463942505,2.56
11,A6Vn67Sdmig,항상 영화보고 리뷰 챙겨봅니다 공감되고 이해되게 영상 잘만드십니다 감사합니다,"['항상', '영화', '보고', '리뷰', '챙겨', '봅니다', '공감', '되고', '이해', '되게', '영상', '잘', '만드십니다', '감사합니다']",6.489971383308951,3.02
12,A6Vn67Sdmig,이 영화보고와서 라이너님 영상보니 또 새롭네요 진짜 많이 웃었고 재밌게 봤어요 😊👍🏻,"['이', '영화', '보고와서', '라이너', '님', '영', '상보', '니', '또', '새롭네요', '진짜', '많이', '웃었고', '재밌게', '봤어요']",3.580695702369793,1.65
13,A6Vn67Sdmig,와...신나게 까일줄알고 기대하며 들어왔는데... 예상외네요. 이로써 더 확실하게 &#39;보통&#39;의 기준이 천차만별이라는걸 알게 됐습니닷ㅠㅠ 최고의 배우들의 최고의 연기력으로 아깝고 저급한 시나리오를 완성했다는 느낌이었어요. 현실적이고 일상같은 느낌의 스토리가 싫은건 아니디만....상업영화를 보는 목적이 어느정도의 픽션을 기대하고 보는것 아닐까해욤!(저는 그렇습니다) 그런 기준에서... 밍숭맹숭한 비싼영화를 굳이 시간들여서 본 느낌이었답니닷,"['와', '신나게', '까', '일줄', '알', '고', '기대하며', '들어왔는데', '예상외', '네', '요', '이로써', '더', '확실하게', '39', '보통', '39', '의', '기준', '이', '천차만별', '이라', '는걸', '알', '게', '됐', '습', '니', '닷', '최고', '의', '배우', '들', '의', '최고', '의', '연기력', '으로', '아깝고', '저급한', '시나리오', '를', '완성', '했다는', '느낌이었어요', '현실', '적', '이고', '일상', '같은', '느낌', '의', '스토리', '가', '싫은건', '아니', '디', '만', '상업', '영화', '를', '보는', '목적', '이', '어느', '정도', '의', '픽션', '을', '기대하고', '보는것', '아닐까', '해욤저', '는', '그렇습니다', '그런', '기준', '에서', '밍숭맹숭', '한', '비싼', '영화', '를', '굳이', '시간', '들', '여서', '본', '느낌이었답니', '닷']",11.631448718455347,3.94
14,A6Vn67Sdmig,뎃글 다 본다고 해서 남깁니다. 공효진 동생 공효성 51사단 군대 선임(취사병)입니다. 그때 공효진 51사단 동생때문에 왔었죠. 한마디만 하겠습니다. 동생은 거무틱틱하게 불어있는 돼지처럼 생겼습니다. 근데 공효진은 외계인같은 머리에 완벽합니다. 이쁨^^ 참고로 공효진 동생 성격이 지랄입니다. 이건 리얼입니다^^ 보고싶다~~~^^ 51사단~,"['뎃글', '다', '본다고', '해서', '남깁니다', '공효진', '동생', '공', '효성', '51', '사단', '군대', '선임', '취사', '병', '입니다', '그때', '공효진', '51', '사단', '동생', '때문', '에', '왔었죠', '한마디', '만', '하겠습니다', '동생', '은', '거무', '틱', '틱', '하', '게', '불어있는', '돼지', '처럼', '생겼습니다', '근데', '공효진', '은', '외계인', '같은', '머리', '에', '완벽합니다', '이쁨', '참고', '로', '공효진', '동생', '성격', '이', '지랄', '입니다', '이건', '리얼', '입니다', '보고싶다', '51', '사단']",-3.1280970730503785,-1.12
15,A6Vn67Sdmig,"개인적으론 연애 영화에서 설레임 같은걸 느끼 보고 싶었으나..<br>캐릭터 설정의 나이대가 좀 있어서 그런지, 아예 없었던것 같아서 아쉬웠습니다.<br>소소한 웃음. 소소한 연애 영화로 느껴졌습니다.<br>리뷰 제목이 &quot;소주냄새를 타고 이루어진 것&quot;이라 해서 술좀 먹나 보다 했는데,  징하게 너무 자주 먹더군요 ㅋㅋ<br>영화를 보는 내내 술 배우고 싶어지는 영화였습니다. ㅎㅎ","['개인', '적', '으론', '연애', '영화', '에서', '설레임', '같은걸', '느끼', '보고', '싶었으나', '캐릭터', '설정', '의', '나이', '대가', '좀', '있어서', '그런지', '아예', '없었던것', '같아서', '아쉬웠습니다', '소소한', '웃음', '소소한', '연애', '영화로', '느껴졌습니다', '리뷰', '제목', '이', 'quot', '소', '주', '냄새', '를', '타고', '이루어진', '것', 'quot', '이라', '해서', '술좀', '먹나', '보다', '했는데', '징', '하게', '너무', '자주', '먹더군요', '영화', '를', '보는', '내내', '술', '배우고', '싶어지는', '영화', '였습니다']",16.024001783844184,5.75
16,A6Vn67Sdmig,"저도 오늘 보고 왔는데, 제일 공감이 되는건 마지막 공효진씨 대사 (보고 싶었어) 가 너무 좋았던거네요ㅎㅎ 간만에 국내영화보고 만족!","['저', '도', '오늘', '보고', '왔는데', '제일', '공감', '이', '되는건', '마지막', '공효진', '씨', '대사', '보고', '싶었어', '가', '너무', '좋았던거네요', '간만', '에', '국내', '영화', '보고', '만족']",7.776405254144787,3.27
17,A6Vn67Sdmig,로맨틱보다는 코미디에 가깝습니다ㅋㅋㅋㅋ  현실반영은 공감되어서 좋았어요.<br>둘의 이야기를 더 깊게 보여주지는 않은 것 같아서 저는 그게 아쉬웠네요.,"['로맨틱', '보다는', '코미디', '에', '가깝습니다', '현실', '반영은', '공감', '되어서', '좋았어요', '둘', '의', '이야기', '를', '더', '깊게', '보여주지는', '않은', '것', '같아서', '저', '는', '그게', '아쉬웠네요']",3.0636080188374257,1.29
18,A6Vn67Sdmig,공블리+라이너 평점 5점? 이건 영화관에서 봐도 돈 아깝지 않은 영화군요,"['공', '블리', '라이너', '평점', '5', '점', '이건', '영화관', '에서', '봐도', '돈', '아깝지', '않은', '영화', '군', '요']",-0.15114279670996106,-0.07
19,A6Vn67Sdmig,이 영화 보고 완벽한 타인도 봐보세욬ㅋㅋㅋㅋ,"['이', '영화', '보고', '완벽한', '타인', '도', '봐보세욬']",3.049588185336731,1.65
20,A6Vn67Sdmig,ㅋㅋㅋㅋ 한국 로맨스영화인데 <br>라이너 리뷰 제목이 긍정적이다?<br>바로 보러갑니다.,"['한국', '로맨스영화', '인데', '라이너', '리뷰', '제목', '이', '긍정', '적', '이다', '바로', '보러', '갑니다']",4.090036112506642,1.93
21,A6Vn67Sdmig,ㅋㅋ재훈이 전여친이 왜 돌아왔냐면요 ㅋㅋㅋ 왠지 모르시겠어요??,"['재훈', '이', '전여친', '이', '왜', '돌아왔냐', '면', '요', '왠지', '모르시겠어요']",-0.8379107299583446,-0.42
22,A6Vn67Sdmig,뭔데요?,"['뭔', '데', '요']",0.0,0.0
23,A6Vn67Sdmig,"취향차이가 있는 부분인건가. 전 코미디 타율얘기부터 전혀 공감을 못하겠어요. 전혀 웃기지도 않고, 상황은 인위적이고 연애는 술을 마셔야만 전개되고. 로맨틱 코미디가 아니라 드렁큰 코미디라고 바꿔야 하지 않을까... 역대급 코미디도 아니었고 힘이 빠질 영화도 아니었습니다. 처음부터 힘이 없었으니까요.","['취향', '차이', '가', '있는', '부분', '인', '건가', '전', '코미디', '타율', '얘기', '부터', '전혀', '공감', '을', '못', '하겠어요', '전혀', '웃기지도', '않고', '상황', '은', '인위', '적', '이고', '연애', '는', '술', '을', '마셔야만', '전개', '되고', '로맨틱', '코미디', '가', '아니라', '드렁큰', '코미디', '라고', '바꿔야', '하지', '않을까', '역대', '급', '코미디', '도', '아니었고', '힘', '이', '빠질', '영화', '도', '아니었습니다', '처음', '부터', '힘', '이', '없었으니까', '요']",9.873216938912002,3.56
24,A6Vn67Sdmig,凄く嬉しかったです🎵16年前からの再共演😆💕✨有り難うございます😃大好きな二人を見守って、応援しています❗️👊😄📢<br>まわりのベテランキャストの皆さん！素敵なキャストの演技も最高😃⤴️⤴️カンギョン兄さん😃も素晴らしい！皆さん！身体に気をつけて無理しないで下さいね。沢山のファンの皆さん、感謝します🎵,['16'],0.0,0.0
25,A6Vn67Sdmig,공효진이 정말 사랑스럽게 나온다.,"['공효진', '이', '정말', '사랑', '스럽게', '나온다']",2.942174151076623,1.65
26,A6Vn67Sdmig,방금 보고 나와서 리뷰 잘 봤습니다!<br><br>마지막 판타지부분을 빼면 굉장히 우리네 이야기처럼 느껴져서 간만에 여러 생각을 하며 보게 되었어요,"['방금', '보고', '나와서', '리뷰', '잘', '봤습니다', '마지막', '판타지', '부분', '을', '빼면', '굉장히', '우리네', '이야기', '처럼', '느껴져서', '간만', '에', '여러', '생각', '을', '하며', '보게', '되었어요']",8.793437000433345,3.69
27,A6Vn67Sdmig,게임 하나 할까??,"['게임', '하나', '할까']",0.825074899461761,0.56
28,A6Vn67Sdmig,라이너님 평이 나쁘지않길래 어제 보고 왔어요<br>개인적으로는 돈이 아까운영화였습니다 웃음포인트는 다 웃겼는데 전체적인 내용이 너무재미가없어요 극혐에 더 가까웠습니다 일단 김래원이 갑자기 공효진을 좋아하는게 제일 이해가 안가고 공효진이 갑자기 들이대는것도 전후사정과 맞지않았어요,"['라이너', '님', '평이', '나쁘지', '않길래', '어제', '보고', '왔어요', '개인', '적', '으로는', '돈', '이', '아까운', '영화', '였습니다', '웃음', '포인트', '는', '다', '웃겼는데', '전체', '적', '인', '내용', '이', '너무', '재미', '가', '없어요', '극혐', '에', '더', '가까웠습니다', '일단', '김래원', '이', '갑자기', '공효진', '을', '좋아하는게', '제일', '이해', '가', '안', '가고', '공효진', '이', '갑자기', '들이', '대는것도', '전후', '사정', '과', '맞지', '않았어요']",10.33292511614148,3.76
29,A6Vn67Sdmig,리뷰 잘봤습니다. 로맨스영화 별로 안좋아하는데 라이너님 평보고 보러가야겠습니다. 날씨 추운데 건강 잘챙기세요 라이너님 ㅎㅎ,"['리뷰', '잘', '봤습니다', '로맨스영화', '별로', '안', '좋아하는데', '라이너', '님', '평보', '고', '보러가야겠습니다', '날씨', '추운데', '건강', '잘', '챙기세요', '라이너', '님']",4.904458355521663,2.15
30,A6Vn67Sdmig,안타깝네요. 이 나라 영화가 로맨틱코미디마저 잘하지 못한다면.<br>과연 어떤 영화를 봐야 한다는건지.<br>과연 어떤 영화를 기대해야하는건지.,"['안타깝네요', '이', '나라', '영화', '가', '로맨틱코미디', '마저', '잘', '하지', '못', '한다면', '과연', '어떤', '영화', '를', '봐야', '한다는', '건', '지', '과연', '어떤', '영화', '를', '기대해야하는', '건지']",6.042986528068774,2.52
31,A6Vn67Sdmig,"좋은 평은 많으니 아쉬운 것을 말하면1. 영화 보면 중간 중간 페미니즘 적 요소가 들어가 있는데 그건 빼도 문제가 없다는 생각 ... 대표적인 것이 요즘 젊은이들은 가부장제 끝물에 귀하게 자라서 책임은 안 지려 하고 권리만 누리려 한다 대사가 있느데 ... 그건 반대로 하면 여성의 사회 진출 처음이라 권리는 챙기고 싶은데 그에 대한 책임은 지기 싫어하는 여성이라  남녀 갈등 특히 연애에서 갈등이 심각해진다는 분석도 나오고 있는데, 굳이 그 대사를 왜 넣었는지 모르겠음. 그냥 찌질이 하나 만났다고 인생 액땜한다 생각해 정도의 대사면 충분한데 .. 그 외에도 중간 중간 그런 대사들이 들어가는데 저게 과연 필요한지부터 의문임.. 특히 화장실 씬은 제대로 이해는 하고 썼는지부터가 의문....2. 공효진 연기가 아쉽다는 생각. 아 연기 못한다는 이야기는 아님. 공효진은 최적의 연기를 보여줌. 그런데 공효진이 다른 영화 출연한 것과 비교하면, 돈 적게드는 로코를 빼면, 솔직히 캐릭터에 잘 녹아들지 못하거나 영화와 겉돈다는 느낌을 받음. 즉 출자금액 작은 로코에 최적화되었다는 말인데 .... 이건 점점 나이가 들어감에 따라 분명한 한계가 오는 것임. 잘 하고 영화에 잘 녹아들었다는 것은 분명히 느꼈는데 뭔가 아쉬움도 느껴졌음하지만 재밌었고역시 연애는 남의 연애 구경이 제일 재밌다는 것을 느낌","['좋은', '평', '은', '많으니', '아쉬운', '것', '을', '말', '하면', '1', '영화', '보면', '중간', '중간', '페미니즘', '적', '요소', '가', '들어가', '있는데', '그건', '빼도', '문제', '가', '없다는', '생각', '대표', '적', '인', '것', '이', '요즘', '젊은이', '들', '은', '가부장제', '끝물', '에', '귀하게', '자라서', '책임', '은', '안', '지려', '하고', '권리', '만', '누리려', '한다', '대사', '가', '있느데', '그건', '반대', '로', '하면', '여성', '의', '사회', '진출', '처음', '이라', '권리', '는', '챙기고', '싶은데', '그', '에', '대한', '책임', '은', '지기', '싫어하는', '여성', '이라', '남녀', '갈등', '특히', '연애', '에서', '갈등', '이', '심각해진다는', '분석', '도', '나오고', '있는데', '굳이', '그', '대사', '를', '왜', '넣었는지', '모르겠음', '그냥', '찌질', '이', '하나', '만났다고', '인생', '액땜', '한다', '생각', '해', '정도', '의', '대사', '면', '충분한데', '그', '외', '에도', '중간', '중간', '그런', '대사', '들', '이', '들어가는데', '저', '게', '과연', '필요한지부터', '의문', '임', '특히', '화장실', '씬', '은', '제대로', '이해', '는', '하고', '썼는지부터가', '의문', '2', '공효진', '연기', '가', '아쉽다는', '생각', '아', '연기', '못', '한다는', '이야기', '는', '아님', '공효진', '은', '최적', '의', '연기', '를', '보여줌', '그런데', '공효진', '이', '다른', '영화', '출연', '한', '것', '과', '비교', '하면', '돈', '적게', '드는', '로코', '를', '빼면', '솔직히', '캐릭터', '에', '잘', '녹', '아들', '지', '못', '하', '거나', '영화', '와', '겉돈', '다는', '느낌', '을', '받음', '즉', '출자', '금액', '작은', '로코', '에', '최적화', '되었다는', '말', '인데', '이건', '점점', '나이', '가', '들어감에', '따라', '분명한', '한계', '가', '오는', '것임', '잘', '하고', '영화', '에', '잘', '녹아', '들었다는', '것', '은', '분명히', '느꼈는데', '뭔가', '아쉬움', '도', '느껴졌음', '하지만', '재밌었고', '역시', '연애', '는', '남', '의', '연애', '구경이', '제일', '재밌다는', '것', '을', '느낌']",,
32,A6Vn67Sdmig,여자친구랑 같이 자동차극장에서 봤는데 되게 재밌었어요 ㅋㅋㅋㅋ 마지막에 둘이서 만나는 장면이 반대로 뭔가 헤어지는 연인같은 아련한 느낌으로 나온것도 되게 좋았던거 같아요,"['여자친구', '랑', '같이', '자동차극장', '에서', '봤는데', '되게', '재밌었어요', '마지막', '에', '둘이서', '만나는', '장면', '이', '반대', '로', '뭔가', '헤어지는', '연인', '같은', '아련한', '느낌', '으로', '나온것도', '되게', '좋았던거', '같아요']",3.8408746803835356,1.58
33,A6Vn67Sdmig,이영화는 봐야겠네요,"['이영화', '는', '봐야겠네요']",0.5675821459916697,0.38
34,A6Vn67Sdmig,배우들의 연기 스토리 재미...하지만 술이 아니면 극 전개가 이어지거나 진행이 되지 않는 영화라 생각이 드네요.<br>극의 장치가 술이 아니더라도 많이 있었을 텐데 작가나 감독은 너무 쉬운 길과 아이템만 골라서 영화를 만들어버린 것같습니다.<br>하지만 가볍게 볼 수 있어서 그것만으로도 만족.,"['배우', '들', '의', '연기', '스토리', '재미', '하', '지만', '술', '이', '아니면', '극', '전개', '가', '이어지거나', '진행', '이', '되지', '않는', '영화', '라', '생각', '이', '드', '네', '요', '극', '의', '장치', '가', '술', '이', '아니더라도', '많이', '있었을', '텐데', '작가', '나', '감독', '은', '너무', '쉬운', '길', '과', '아이템', '만', '골', '라서', '영화', '를', '만들어', '버린', '것', '같습니다', '하지만', '가볍게', '볼', '수', '있어서', '그것', '만으로도', '만족']",12.63163170430315,4.52
35,A6Vn67Sdmig,술안마시는 사람에게는 공감이 전혀 안되는 영화였네요ㅠ<br>맨날 술마시는 주인공들도 술 마시고 필름 끊기고 물건 주워오고 동물 주워오고 연락하고 밖에서 주사부리고 하는거 전부 현실감 없는 판타지에 술주정뱅이 같아서ㅠ...<br>민폐남녀로 보였음 흑<br>설렘 0프로,"['술', '안', '마시는', '사람', '에게는', '공감', '이', '전혀', '안되는', '영화', '였네요', '맨날', '술', '마시는', '주인공', '들', '도', '술', '마시고', '필름', '끊기고', '물건', '주워오고', '동물', '주워오고', '연락', '하고', '밖', '에서', '주사', '부리고', '하는거', '전부', '현', '실감', '없는', '판타지', '에', '술', '주정뱅이', '같아서', '민폐', '남녀', '로', '보였음', '흑', '설렘', '0', '프로']",0.9929878620593775,0.37
36,A6Vn67Sdmig,매불쇼 듣고 구독합니다 ㅡㅎ 라이너님 재밌어요 ㅡㅎㅎ,"['매', '불쇼', '듣고', '구독', '합니다', '라이너', '님', '재밌어요']",0.7423690854800016,0.39
37,A6Vn67Sdmig,"20대 후반 여성 직장인으로 본 이 영화는 시종일관 웃으면서도 짜증이 났어요. 너무 현실과 같았거든요ㅋㅋㅋㅋ <br>말끝마다 꼰대가 되기 싫고, 꼰대가 아닌 깨어있는척 하지만 주말에 등산가자, 별 이유를 다 만들어 회식하자는 무능한 대표 + 식사때마다 같은 식당에 가면서도 굳이 남여 따로 그룹핑해 앉아 먹는 모습 + 여직원들끼리 친해보이고 공감해주는듯한 장면들 후 결국 여자를 깎아내리는건 다른 여직원이었던것 + 그런 소동에도 불구하고 거의 마지막 치킨집 회식때 다시 과장님~ 하며 친한듯 보이는 여직원들 = 그래서 이 영화를 보며 완벽한 타인이 떠오른 거 같아요.","['20', '대', '후반', '여성', '직장인', '으로', '본', '이', '영화', '는', '시종일관', '웃으면서도', '짜증', '이', '났어요', '너무', '현실', '과', '같았거든요', '말끝', '마다', '꼰대', '가', '되기', '싫고', '꼰대', '가', '아닌', '깨어있는', '척', '하지만', '주말', '에', '등산', '가자', '별', '이유', '를', '다', '만들어', '회식', '하자는', '무능한', '대표', '식사', '때', '마다', '같은', '식당', '에', '가면서도', '굳이', '남여', '따로', '그룹', '핑해', '앉아', '먹는', '모습', '여직원', '들', '끼리', '친', '해보이고', '공감', '해주는듯', '한', '장면', '들', '후', '결국', '여자', '를', '깎아', '내리는건', '다른', '여직원', '이었던것', '그런', '소동', '에도', '불구', '하고', '거의', '마지막', '치킨', '집', '회식', '때', '다시', '과장', '님', '하며', '친한듯', '보이는', '여직원', '들', '그래서', '이', '영화', '를', '보며', '완벽한', '타인', '이', '떠오른', '거', '같아요']",11.061041424539194,3.65
38,A6Vn67Sdmig,저는8점 많이좋았고 또보고싶은영화였네요~^^,"['저', '는', '8', '점', '많이', '좋았고', '또', '보고싶은', '영화', '였네요']",0.40871859546388045,0.2
39,A6Vn67Sdmig,보구싶어 고민하다... 오늘 보러갑니당~~~^^,"['보구싶어', '고민', '하다', '오늘', '보러', '갑니당']",0.2972535620249944,0.17
40,A6Vn67Sdmig,평범한사람이 겪을 수 있는 가장 로맨틱한 경험을 모아 놓은 영화,"['평범한', '사람', '이', '겪을', '수', '있는', '가장', '로맨틱', '한', '경험', '을', '모아', '놓은', '영화']",4.523634673028895,2.11
41,A6Vn67Sdmig,뭔 영화가 술쳐먹고 필름 끊기다 끝남 ㅋㅋㅋ 필름 끊어버리고싶었음,"['뭔', '영화', '가', '술', '쳐', '먹고', '필름', '끊기다', '끝남', '필름', '끊어', '버리고싶었음']",0.7457329660437774,0.36
42,A6Vn67Sdmig,이 영화를 보고나니 한재림감독의 연애의 목적이 다시 한번 보고 싶어지더군요.,"['이', '영화', '를', '보고나니', '한재림', '감독', '의', '연애', '의', '목적', '이', '다시', '한번', '보고', '싶어지더군요']",6.415320252731839,2.95
43,A6Vn67Sdmig,저도 이영화 재밌게봤어요~,"['저', '도', '이영화', '재밌게', '봤어요']",2.01065265644674,1.18
44,A6Vn67Sdmig,이 영화를 보면 재미 있는건 아닌데 그냥 볼만함,"['이', '영화', '를', '보면', '재미', '있는건', '아닌데', '그냥', '볼', '만', '함']",3.610568674060439,1.77
45,A6Vn67Sdmig,공효진 볼려고 본 영화. 영화자체는.. 걍 뭐..,"['공효진', '볼려고', '본', '영화', '영화', '자체', '는', '걍', '뭐']",0.9341205556111761,0.48
