,id,sentence,comment_cut,score,ratio
0,bvr2MC9h6Mc,하정우의 연기는 더테러 라이브 부터 더 이상 앞으로 나아가지 못하는듯 하다.,"['하정우', '의', '연기', '는', '더', '테러', '라이브', '부터', '더', '이상', '앞', '으로', '나아가지', '못', '하는듯', '하다']",1.3981083073208047,0.63
1,bvr2MC9h6Mc,옷장이 연기 젤 잘하더라,"['옷장', '이', '연기', '젤', '잘', '하더라']",1.7537533130566394,0.99
2,bvr2MC9h6Mc,예고편보고 거른영화네요<br>좀...서양공포영화 느낌이나서...,"['예고편', '보고', '거른', '영화', '네', '요', '좀', '서양', '공포영화', '느낌', '이나', '서']",0.4733684638251705,0.23
3,bvr2MC9h6Mc,하정우 결혼할려고 돈 모으나 영화 그냥 막 찍음,"['하정우', '결혼', '할려고', '돈', '모으나', '영화', '그냥', '막', '찍음']",0.9319078865016114,0.48
4,bvr2MC9h6Mc,신과 함께 드립 이거 진짜 시롸예요??????????????? ㅎㄷㄷ 진정한 공포다리...,"['신', '과', '함께', '드립', '이', '거', '진짜', '시롸', '예요', '진정한', '공포', '다리']",0.6644450146910381,0.32
5,bvr2MC9h6Mc,고라니에서 터졌땈ㅋㅋㅋㅋㅋㅋㅋㅋㅋㅋ,"['고라니', '에서', '터졌땈']",-0.5999958039490961,-0.41
6,bvr2MC9h6Mc,"<a href=""https://www.youtube.com/watch?v=bvr2MC9h6Mc&amp;t=14m59s"">14:59</a>",['1459'],0.0,0.0
7,bvr2MC9h6Mc,볼만은 했음 여러가지 섞여나온느낌이라,"['볼', '만은', '했음', '여러가지', '섞여', '나온', '느낌', '이라']",-0.6291573888989435,-0.33
8,bvr2MC9h6Mc,요즘 한국 영화판 보면 참 안타까움.. 감독들이 약빨고 새롭게 영화를 만들어도 거의 흥행에 실패해버리니까 안전성 추구하려고 전에 있던 거 가져와서 짬봉파티만 하고 배우들도 그냥 자기 자신을 연기하는 것 같음;,"['요즘', '한국', '영', '화판', '보면', '참', '안타까', '움', '감독', '들', '이', '약', '빨', '고', '새롭게', '영화', '를', '만들어도', '거의', '흥행', '에', '실패해', '버리니까', '안전성', '추구', '하려고', '전', '에', '있던', '거', '가져와서', '짬봉', '파티', '만', '하고', '배우', '들', '도', '그냥', '자기', '자신', '을', '연기', '하는', '것', '같음']",9.67844027882134,3.63
9,bvr2MC9h6Mc,"기생충을 보고 한국영화계에서도 이 정도의 영화가 나올수 있는구나 싶었지만 그 이후에 나온게 백두산,클로젯.....<br>하정우 씨는 연기 잠시 쉬시는 것도 좋으신거 같아요...","['기생충', '을', '보고', '한국', '영화계', '에서도', '이', '정도', '의', '영화', '가', '나올수', '있는구나', '싶었지만', '그', '이후', '에', '나온게', '백두산', '클로', '젯', '하정우', '씨', '는', '연기', '잠시', '쉬시는', '것', '도', '좋으신', '거', '같아요']",2.368247960207576,0.95
10,bvr2MC9h6Mc,하정우는 최근 영화 뭐 다 졸작인거 같네,"['하정우', '는', '최근', '영화', '뭐', '다', '졸작', '인거', '같네']",1.371290417986176,0.7
11,bvr2MC9h6Mc,이거 아동폭력 방지영화아닌가요?,"['이', '거', '아동', '폭력', '방지영', '화', '아닌가요']",-4.401282729870689,-2.39
12,bvr2MC9h6Mc,&#39;정직한 후보&#39;의 님의 의견도 개인적으로 듣고 싶습니다.,"['39', '정직한', '후보', '39', '의', '님', '의', '의견', '도', '개인', '적', '으로', '듣고', '싶습니다']",0.14714914241481028,0.07
13,bvr2MC9h6Mc,요즘 하정우의 연기<br><br><br><br><br><br><br>왜 참으면서 다이어트 하지?<br>재밌는 상상 한 번 해보자구,"['요즘', '하정우', '의', '연기', '왜', '참으면서', '다이어트', '하지', '재밌는', '상상', '한', '번', '해보자구']",3.2889856399365325,1.56
14,bvr2MC9h6Mc,클로젯 극장에서 봤네요,"['클로젯', '극장', '에서', '봤네요']",0.46993652460255275,0.29
15,bvr2MC9h6Mc,"<a href=""https://www.youtube.com/watch?v=bvr2MC9h6Mc&amp;t=2m08s"">2:08</a> &quot;어바웃 타임&quot;이란 영화의 한 장면입니다.수작이죠. 추천!!","['208', 'quot', '어바웃', '타임', 'quot', '이란', '영화', '의', '한', '장면', '입니다', '수작', '이', '죠', '추천']",0.3332999753351004,0.15
16,bvr2MC9h6Mc,이번에 권상우 주연 &quot;히트&quot;도.......ㅅ  ㅣ 발 스럽죠!!,"['이번', '에', '권상우', '주연', 'quot', '히트', 'quot', '도', '발', '스럽죠']",-0.8574575978112497,-0.43
17,bvr2MC9h6Mc,하정우씨는 모르겠고 아역배우분들은 꽤 잘한것같았음,"['하정우', '씨', '는', '모르겠고', '아역배우', '분들', '은', '꽤', '잘', '한것', '같았음']",2.96051996124782,1.45
18,bvr2MC9h6Mc,중 후반가면 하정우가 연기를 안하는 듯 한 연기를 보여준다는데..   저놈의 신과 함께 드립 떄문 이었나..  감독이나 제작자가 어거지로 우겨넣었구만 보니까;;;,"['중', '후반', '가면', '하정우', '가', '연기', '를', '안', '하는', '듯', '한', '연기', '를', '보여준다는데', '저', '놈', '의', '신', '과', '함께', '드립', '떄문', '이었나', '감독', '이나', '제작자', '가', '어거지', '로', '우겨', '넣었구만', '보', '니까']",3.590574883323354,1.43
19,bvr2MC9h6Mc,점점 영화보는 수준은 올라가는데 늘 상업적이고 똑같은 연기를 하는 하정우.. 안타깝다 시나리오안목도 없는데 이젠 연기에 힘도 없고 ㅠ 믿거배우가 될까 걱정이됩니다,"['점점', '영', '화보', '는', '수준', '은', '올라가는데', '늘', '상업', '적', '이고', '똑같은', '연기', '를', '하는', '하정우', '안타깝다', '시나리오', '안목', '도', '없는데', '이', '젠', '연기', '에', '힘', '도', '없고', '믿거', '배우', '가', '될까', '걱정', '이', '됩니다']",0.9260438154145774,0.36
20,bvr2MC9h6Mc,개인적으로 하정우 배우를 좋아하는데... 요즘에는 점점 거르는 영화가 많아지는군요ㅠㅠ,"['개인', '적', '으로', '하정우', '배우', '를', '좋아하는데', '요즘', '에는', '점점', '거르', '는', '영화', '가', '많아지는군요']",2.454964816590463,1.13
21,bvr2MC9h6Mc,명작은 가뭄에 콩 나오듯이 나오고 망작은 새해부터 끊임없이 쏟아져 나오는거 보니까 한국영화 망한거 아닐까? 너무 걱정된다ㅠㅠ 일년에 영화관 고작 한 두번 정도만 가게 되고 나중에는 영화관에 한국영화 보러 잘 안 갈거 같다.,"['명작', '은', '가뭄', '에', '콩', '나오듯이', '나오고', '망', '작은', '새해', '부터', '끊임없이', '쏟아져', '나오는거', '보', '니까', '한국영', '화', '망한거', '아닐까', '너무', '걱정', '된다', '일', '년', '에', '영화관', '고작', '한', '두', '번', '정도', '만', '가게', '되고', '나중', '에는', '영화관', '에', '한국영', '화', '보러', '잘', '안', '갈거', '같다']",-1.081044150332795,-0.41
22,bvr2MC9h6Mc,"영화, 게임 등은 결국 예술,창작의 영역과 돈만보는 장사치의 영역이 혼합될수밖에 없는데<br>시스템을 갈아엎을수 없는 한, 현시스템으로는 헐리우드나 다른나라도 근본적인 딜레마와 부작용은 비슷함.<br>결국은 두가지의 비율이 핵심인데 이나라에는 확실히 스레기가 더 많은걸 보니 후자쪽으로 치우친듯.<br><br><br>열심히 잼있는걸 만들어서 돈도 왕창벌자 와 능력은 안되니 스레기로 사기쳐서 돈쉽게 벌어보자의 차이인가<br>한국영화 봐달라고 눈물콧물질질짜길래 열심히 봐줬더니 이딴거 만들어서 들이미네","['영화', '게임', '등', '은', '결국', '예술', '창작', '의', '영역', '과', '돈', '만', '보는', '장사치', '의', '영역', '이', '혼합', '될수밖에', '없는데', '시스템', '을', '갈아엎을수', '없는', '한', '현', '시스템', '으로는', '헐리우드', '나', '다른', '나라', '도', '근본', '적', '인', '딜레마', '와', '부작용', '은', '비슷함', '결국', '은', '두', '가지', '의', '비율', '이', '핵심', '인데', '이나라', '에는', '확실히', '스레기', '가', '더', '많은걸', '보니', '후자', '쪽', '으로', '치우친듯', '열심히', '잼있는걸', '만들어서', '돈', '도', '왕창', '벌자', '와', '능력', '은', '안되니', '스레기', '로', '사기', '쳐서', '돈', '쉽게', '벌어', '보자의', '차이', '인가', '한국영', '화', '봐', '달라', '고', '눈물', '콧물', '질질', '짜길래', '열심히', '봐', '줬더니', '이딴', '거', '만들어서', '들이', '미네']",4.708310492460599,1.57
23,bvr2MC9h6Mc,클로젯재미있는데 왜 그럼니까,"['클로', '젯', '재미있는데', '왜', '그럼니까']",-0.5905594087229158,-0.35
24,bvr2MC9h6Mc,ㄴㄴ,[],0.0,-0.0
25,bvr2MC9h6Mc,멍청한 지도자는 그 바탕에 그 수준에 적합한 국민이 있는 거고  쓰레기 영화에는 그에 준하는 수준 낮은 관객들이 있기 때문에 양산이 가능하다,"['멍청한', '지도자', '는', '그', '바탕', '에', '그', '수준', '에', '적합한', '국민', '이', '있는', '거고', '쓰레기', '영화', '에는', '그', '에', '준', '하는', '수준', '낮은', '관객', '들', '이', '있기', '때문', '에', '양산', '이', '가능하다']",3.4676864337810693,1.38
26,bvr2MC9h6Mc,아무것도 생산하지 않고 타인의 생산물을 비판하는것이 업이된다라......모든걸 알고있다는듯 오만한 태도로 일관하면 내 업을 이어나갈수 있게 해준 이들에 대한 예의가 아니지 않을까......,"['아무', '것', '도', '생산', '하지', '않고', '타인', '의', '생산', '물', '을', '비판', '하는것이', '업', '이', '된다', '라모', '든', '걸', '알고있다는듯', '오만한', '태도', '로', '일관', '하면', '내', '업', '을', '이', '어나', '갈수', '있게', '해준', '이', '들', '에', '대한', '예의', '가', '아니지', '않을까']",2.604414759598754,1.0
27,bvr2MC9h6Mc,난 사운드가 너무 커서 귀 아프더라 ㅡㅡ,"['난', '사운드', '가', '너무', '커서', '귀', '아프더라']",-1.307663933683562,-0.71
28,bvr2MC9h6Mc,대한민국 장르감독들은 봉준호한테 싸다구좀 맞아야 할것같다,"['대한민국', '장르', '감독', '들', '은', '봉준호', '한테', '싸다구', '좀', '맞아야', '할것', '같다']",1.4247011563961196,0.69
29,bvr2MC9h6Mc,난 특히 연출이 너무 별로 였음 벽장 통과하니까 무슨 놀이공원 귀신의 집 같은게 나오냐,"['난', '특히', '연출', '이', '너무', '별로', '였음', '벽장', '통과', '하니까', '무슨', '놀이', '공원', '귀신', '의', '집', '같은게', '나오냐']",1.2551546662741278,0.56
30,bvr2MC9h6Mc,하정우 연기 어색하단거 느낀게 저뿐만이 아니었군요 하정우 연기덕와 어색한 귀신분장 등등덕에 영화가 더 b급으로 느껴지더군요 슬픈연기를하는데 무표정으로 슬픈연기를 하고 자빠진거보고 어이가없었음 ;;,"['하정우', '연기', '어색하단', '거', '느낀게', '저', '뿐', '만이', '아니었군요', '하정우', '연', '기', '덕', '와', '어색한', '귀신', '분장', '등등', '덕', '에', '영화', '가', '더', 'b', '급', '으로', '느껴지더군요', '슬픈', '연기', '를', '하는데', '무표정', '으로', '슬픈', '연기', '를', '하고', '자빠진거', '보고', '어이', '가', '없었음']",4.341223093328071,1.65
31,bvr2MC9h6Mc,에라이 넌 페미 눈치 본거때매 그 후에 리뷰하는거랑 비교되서 별로다,"['에', '라이', '넌', '페미', '눈치', '본거', '때매', '그', '후', '에', '리뷰', '하는거랑', '비교', '되서', '별로', '다']",1.3476661241318333,0.61
32,bvr2MC9h6Mc,하정우 참 개인적으로 좋아하는 배우인데 .....작품을 고르는 눈이 참 요즘에 참 ....하정우씨 안경좀 끼세요 작품 고르는 눈에요 안그러면 다쳐요 ㅋㅋ,"['하정우', '참', '개인', '적', '으로', '좋아하는', '배우', '인데', '작품', '을', '고르는', '눈', '이', '참', '요즘', '에', '참', '하정우', '씨', '안경', '좀', '끼세요', '작품', '고르는', '눈', '에요', '안', '그러면', '다쳐요']",4.343006854612206,1.76
33,bvr2MC9h6Mc,가볍게 보기엔 재미있게 본 가족 영화라고 생각함,"['가볍게', '보기', '엔', '재미있게', '본', '가족', '영화', '라고', '생각', '함']",1.9917697913004315,1.0
34,bvr2MC9h6Mc,"공부안하고 영화 찍으면, 이렇게 찍는 듯. 관객들이 우스운거지. 대충 베겨도 모르겠거니.... 영화 만들지 말고 대필작가를 하지,","['공', '부안', '하고', '영화', '찍으면', '이렇게', '찍는', '듯', '관객', '들', '이', '우스운거지', '대충', '베겨', '도', '모르겠거니', '영화', '만들지', '말고', '대필작가', '를', '하지']",0.13431219348918422,0.06
35,bvr2MC9h6Mc,"귀신영화로 가지 말고, 정신과 약을 제대로 먹지 못해서 망상과 환각에 시달리고 신경쇠약에 이르러 아주 미쳐버리고 마는 아버지를 주인공으로 함 영화로 가는게 그나마 괜찮았을 듯 하네요. 어차피 이것도 장회홍련전이나 매드니스, 조커 등등의 짜깁기였을 테지만.에휴.<br>하배우 연기는.....요새 프로포폴 투약 의혹 나오던데, 뭔가 약물효과 떨어져서 약간 다운된 그런 분위기처럼 보여요..","['귀신', '영화로', '가지', '말고', '정신과', '약', '을', '제대로', '먹지', '못', '해서', '망상', '과', '환각', '에', '시달리고', '신', '경', '쇠약', '에', '이르러', '아주', '미쳐', '버리고', '마는', '아버지', '를', '주인공', '으로', '함', '영화로', '가는게', '그나마', '괜찮았을', '듯', '하네요', '어차피', '이', '것', '도', '장회홍련전', '이나', '매드', '니스', '조커', '등등', '의', '짜깁기', '였을', '테', '지만에', '휴', '하', '배우', '연기', '는', '요새', '프로포폴', '투약', '의혹', '나오던데', '뭔가', '약물', '효과', '떨어져서', '약간', '다운', '된', '그런', '분위기', '처럼', '보여요']",2.075805466980422,0.73
36,bvr2MC9h6Mc,사람 깜짝 놀래키면서 장난질이나 치는 영화<br>무서워서 놀란게 아니라 소리때문에 깜짝 놀라서 어이없고 화가남 <br>중간에 어처구니가 없어서 소리내어 웃음 <br>마지막엔 꼴에 무슨 메세지를 넣겠다고 하는데 정말 이딴 영화를 만들어서 낸다는게 화가남,"['사람', '깜짝', '놀래', '키', '면서', '장난', '질', '이나', '치는', '영화', '무서워서', '놀란', '게', '아니라', '소리', '때문', '에', '깜짝', '놀라서', '어이없고', '화가', '남', '중간', '에', '어처구니', '가', '없어서', '소리내어', '웃음', '마지막', '엔', '꼴', '에', '무슨', '메세지', '를', '넣겠다고', '하는데', '정말', '이딴', '영화', '를', '만들어서', '낸다는게', '화가', '남']",-10.662936936692923,-4.0
37,bvr2MC9h6Mc,중요하지 않은 부분에는 너무 힘을 주고 중요한 부분은 집중이 안되서 영화에 몰입이 안되었고 하정우배우님은 더 다크한 연기를 해주었으면 좋지 않았을까 하는 아쉬움이 큰 영화였습니다.,"['중요하지', '않은', '부분', '에는', '너무', '힘', '을', '주고', '중요한', '부분', '은', '집중', '이', '안되서', '영화', '에', '몰입', '이', '안되었고', '하정우', '배우', '님', '은', '더', '다크', '한', '연기', '를', '해주었으면', '좋지', '않았을까', '하는', '아쉬움', '이', '큰', '영화', '였습니다']",3.982479526925524,1.55
38,bvr2MC9h6Mc,....4점이나?,"['4', '점', '이나']",-0.06177446714525364,-0.04
39,bvr2MC9h6Mc,신과 함께도 cj인가요?<br>드립력 놀랍다는.,"['신', '과', '함께도', 'cj', '인가요', '드립', '력', '놀랍다는']",1.158389445279601,0.61
40,bvr2MC9h6Mc,롯데엔터 입니다,"['롯데', '엔', '터', '입니다']",0.2726530131767802,0.17
41,bvr2MC9h6Mc,고라니가  또 죽었네 ᆢ  어린이들 사랑으로 키우자는 ᆢ신과 함께 봐야지<br>깜짝 놀라고 싶은  취향 저격,"['고라니', '가', '또', '죽었네', '어린이', '들', '사랑', '으로', '키우자는', '신', '과', '함께', '봐야지', '깜짝', '놀라고', '싶은', '취향', '저격']",0.45350300353989176,0.2
42,bvr2MC9h6Mc,설명하신거처럼 벽장에서의 공포는 너무뻔한 설정인데 올레티비에서 <br>감독의 상상력이니 뭐니하면서 설명하는거보고 저건 &quot;절대 안봐야지&quot;<br>하고 생각함 ㅋ,"['설명', '하신거처럼', '벽장', '에서의', '공포', '는', '너무', '뻔한', '설정', '인데', '올레', '티비', '에서', '감독', '의', '상상력', '이니', '뭐', '니', '하면서', '설명', '하는거', '보고', '저건', 'quot', '절대', '안', '봐야지', 'quot', '하고', '생각', '함']",-5.905837638388677,-2.36
43,bvr2MC9h6Mc,항상 개봉작 나오면 보기전에 컬쳐쇼크 먼저 체크하는데 ..돈을 아끼게 해주셔서 감사합니다,"['항상', '개봉', '작', '나오면', '보기전에', '컬쳐쇼크', '먼저', '체크', '하는데', '돈', '을', '아끼게', '해주셔서', '감사합니다']",2.0498807014708733,0.96
44,bvr2MC9h6Mc,"아!,!, 진짜 바바둑영화랑 비슷하네요.. 그래도 궁금하네요ㅎㅎㅎ","['아', '진짜', '바', '바둑', '영화', '랑', '비슷하네요', '그래도', '궁금하네요']",2.4664694474172957,1.26
45,bvr2MC9h6Mc,박성웅 나오고나서 영화가 산으로가버림,"['박성웅', '나오고나서', '영화', '가', '산', '으로가', '버림']",-0.0005410270151179064,-0.0
46,bvr2MC9h6Mc,영화관에서 이거 보다가 나가고 싶어서 죽을뻔했습니다....진짜 돈낭비한기분ㅠ,"['영화관', '에서', '이', '거', '보다가', '나가고', '싶어서', '죽', '을', '뻔했습니다', '진짜', '돈', '낭비한', '기분']",1.0396374536356223,0.48
47,bvr2MC9h6Mc,하정우님은 중반이후 연기 하기 싫어서 책을 그냥 읽었다는게 정설!!,"['하정우', '님', '은', '중반', '이후', '연기', '하기', '싫어서', '책', '을', '그냥', '읽었다는게', '정설']",-1.7365313416437635,-0.82
48,bvr2MC9h6Mc,철저한 비판을 목적으로 한다는 미명하에 대부분 까대기만하는 이 채널을 나는 철저하게 비판합니다.,"['철저한', '비판', '을', '목적', '으로', '한다는', '미명', '하', '에', '대부분', '까대', '기만', '하', '는', '이', '채널', '을', '나', '는', '철저하게', '비판', '합니다']",-1.2129513443835993,-0.52
49,bvr2MC9h6Mc,맨날 이런 상업적인 영화 지쳐간다..먼가 돈떨어져서 그럴만한소재로 a급배우들 몇대려다가 매꾸는 급하디급한영화 ...오새 다 충무로가 이런듯함. 볼만한영화가 너무너무 안나와...,"['맨날', '이런', '상업', '적', '인', '영화', '지쳐', '간다', '먼가', '돈', '떨어져서', '그럴만', '한', '소재', '로', 'a', '급', '배우', '들', '몇대', '려', '다가', '매', '꾸는', '급하디', '급한', '영화', '오', '새', '다', '충무로', '가', '이런듯', '함', '볼', '만', '한', '영화', '가', '너무', '너무', '안나', '와']",-0.8031903244581426,-0.3
50,bvr2MC9h6Mc,"이런 영화가 있는지도 몰랐는데, 우연히 극장개봉작을 보다가 하정우 보고 바로 보러 가려고 했다.. 근데 뭔가 느낌이 쎄했다. 이병헌 영화라면 협녀 조차 극장에서 봤던 내가 백두산은 보면 안되겠다 느낀 그 쎄함 이었다. 그리고 그 느낌이 맞았다. 난 천재 였다.","['이런', '영화', '가', '있는지도', '몰랐는데', '우연히', '극장', '개', '봉작', '을', '보다가', '하정우', '보고', '바로', '보러', '가려고', '했다', '근데', '뭔가', '느낌', '이', '쎄', '했다', '이병헌', '영화', '라면', '협녀', '조차', '극장', '에서', '봤던', '내', '가', '백두산', '은', '보면', '안되겠다', '느낀', '그', '쎄', '함', '이었다', '그리고', '그', '느낌', '이', '맞았다', '난', '천재', '였다']",4.633587131870586,1.72
51,bvr2MC9h6Mc,이집 잘한다~ 어디서 배꼈어ㅋㅋㅋㅋ 아 뿜었다ㅋㅋㅋ,"['이집', '잘', '한다', '어디서', '배', '꼈어', '아', '뿜었다']",2.158389445279604,1.13
52,bvr2MC9h6Mc,하정우 연기 너무 건조해서 친아빠 아닌 줄..,"['하정우', '연기', '너무', '건조해서', '친아빠', '아닌', '줄']",0.7611577938281187,0.41
53,bvr2MC9h6Mc,"라이너님! 항상 리뷰가  올라오면 기대하고 재밌게 시청하는 구독자 입니다..<br>그런데, 이 영화의 영화 평점을  4점 씩이나 주신것은.. 음!<br>너무 후하게 주셨네요..<br>전에 미드웨이도 4점 주시던데..<br>설마 같은수준 이라 생각 하시는지요??<br>참고로 미드웨이 영화의 제 평점은 10점 만점에 6점, 크로젯 은 10점 만점에 2점 입니다..<br>(물론 평점이란 지극히 개인의 주관적 생각이니까요..)","['라이너', '님', '항상', '리뷰', '가', '올라오면', '기대하고', '재밌게', '시청', '하는', '구', '독자', '입니다', '그런데', '이', '영화', '의', '영화', '평점', '을', '4', '점', '씩', '이나', '주신것은', '음', '너무', '후', '하게', '주셨', '네', '요전', '에', '미드', '웨이', '도', '4', '점', '주시던데', '설마', '같은', '수준', '이라', '생각', '하시는지요', '참고', '로', '미드', '웨이', '영화', '의', '제', '평점', '은', '10', '점', '만점', '에', '6', '점', '크로젯', '은', '10', '점', '만점', '에', '2', '점', '입니다', '물론', '평점', '이란', '지극히', '개인', '의', '주관', '적', '생각', '이니까', '요']",3.943605663951017,1.36
54,bvr2MC9h6Mc,저도 미드웨이 봣는데 3점 크로젯 5점이요... 크로젯이 낫네요 정말 사람마다 다 다른듯...,"['저', '도', '미드', '웨이', '봣는데', '3', '점', '크로젯', '5', '점', '이', '요', '크로젯', '이', '낫네요', '정말', '사람', '마다', '다', '다른듯']",0.716205900472116,0.31
55,bvr2MC9h6Mc,"저는 보면서 또 고만고만한 한국영화네 싶었지만, 옷장에 갇혀 울던 아역배우의 연기는 무서웠습니다.  여동생이 있는 오빠여서 그런가 겁을 집어먹은 어린 여자아이의 울음소리는 어릴적 동생이 울던 기억과 겹치면서 공포스러웠네요.","['저', '는', '보면서', '또', '고만고만한', '한국영', '화', '네', '싶었지만', '옷장', '에', '갇혀', '울던', '아역배우', '의', '연기', '는', '무서웠습니다', '여동생', '이', '있는', '오빠', '여서', '그', '런가', '겁', '을', '집어', '먹은', '어린', '여자아이', '의', '울음소리', '는', '어릴', '적', '동생', '이', '울던', '기억', '과', '겹', '치면', '서', '공포', '스러웠네요']",-9.894083493596593,-3.72
56,bvr2MC9h6Mc,다작을 해서 그런가? 뭔가 많이 지치고 힘들어보임 요새 하정우는.,"['다작', '을', '해서', '그', '런가', '뭔가', '많이', '지치고', '힘들어', '보임', '요새', '하정우', '는']",-1.4552799462524537,-0.69
57,bvr2MC9h6Mc,주인공딸과 같은나이의 딸이 있는 부모로써 하정우의 연기가 너무 실망스러웠다. 첫장면에서 숲속을 찾을때 부터 뭐지?아빠라면 저런 상황에서 앞이 안보일텐데...숲속에서 보물찾기하는줄..그게 결국 영화끝까지...클리쉐범벅.연기력부족. 아쉽다,"['주인공', '딸', '과', '같은나이의', '딸', '이', '있는', '부모', '로써', '하정우', '의', '연기', '가', '너무', '실망', '스러웠다', '첫', '장면', '에서', '숲속', '을', '찾을', '때', '부터', '뭐', '지', '아빠', '라면', '저런', '상황', '에서', '앞', '이', '안보', '일텐데', '숲속', '에서', '보물찾기', '하는줄', '그게', '결국', '영화', '끝', '까지', '클리', '쉐', '범벅', '연기력', '부족', '아쉽다']",-4.876467691370782,-1.81
58,bvr2MC9h6Mc,라이너님 명탐정 코난 목소리라서 듣기 좋네요,"['라이너', '님', '명탐정', '코난', '목소리', '라서', '듣기', '좋네요']",0.6296045037019362,0.33
59,bvr2MC9h6Mc,한국 공포는 공포가 아니라 신파<br>촌스럽기 짝이 없음,"['한국', '공포', '는', '공포', '가', '아니라', '신파', '촌스럽기', '짝', '이', '없음']",-4.786718416650525,-2.34
60,bvr2MC9h6Mc,"점프스퀘어, 뻔하고 급한 착한 결말. 외국 공포영화를 안보던 관객들에겐 먹힐지 모르겠네요. 안일따리안일따. 리뷰 잘봤습니다","['점프스퀘어', '뻔하고', '급한', '착한', '결말', '외국', '공포영화', '를', '안', '보던', '관객', '들', '에겐', '먹힐지', '모르겠네요', '안일', '따리', '안일', '따', '리뷰', '잘', '봤습니다']",5.623063405879879,2.4
61,bvr2MC9h6Mc,솔직히 등장인물만 외국인으로 바꾸면 누구나 서양 공포영화로 볼 것 같아요,"['솔직히', '등장인물', '만', '외국인', '으로', '바꾸면', '누구', '나', '서양', '공포영화', '로', '볼', '것', '같아요']",1.3480073553851502,0.63
