,id,sentence,comment_cut,score,ratio
100,A6Vn67Sdmig,배우 김래원의 재발견에 의의를 뒀습니다ㅎㅎ<br>1년배기 이상 커플~30대 중후반 직딩까지 잔을 비우고 다시 채우면서 즐겁게 볼 수 있는 알꼬르 영화더군요,"['배우', '김래원', '의', '재', '발견', '에', '의의', '를', '뒀습니다', '1년', '배기', '이상', '커플', '30', '대', '중후', '반', '직딩', '까지', '잔', '을', '비우고', '다시', '채우면서', '즐겁게', '볼', '수', '있는', '알꼬르', '영화', '더군요']",10.892176573006429,4.37
101,A6Vn67Sdmig,저 정도 술주정이 귀엽다고요;;; 결혼한 사이라도 이혼을 권하고 싶을 수준이던데.,"['저', '정도', '술', '주정이', '귀엽다고요', '결혼', '한', '사이', '라도', '이혼', '을', '권하고', '싶을', '수준', '이던', '데']",0.2866009055782549,0.13
102,A6Vn67Sdmig,"공효진은 다른 역할을 맡고 싶어하지만, 적어도 지금까지는 적절한 역할이 딱 있는듯","['공효진', '은', '다른', '역할', '을', '맡고', '싶어하지만', '적어도', '지금', '까지는', '적절한', '역할', '이', '딱', '있는듯']",5.2125027350433015,2.4
103,A6Vn67Sdmig,만화같고 풋풋한 연애가아닌 정말 현실30대 농후한 연애를 보는거같았음,"['만화', '같고', '풋풋한', '연애', '가', '아닌', '정말', '현실', '30', '대', '농후', '한', '연애', '를', '보는거', '같았음']",3.605159780496728,1.64
104,A6Vn67Sdmig,"<a href=""https://www.youtube.com/watch?v=A6Vn67Sdmig&amp;t=2m20s"">2:20</a> 개인적으로 좋아하는 배우네요 닥터후","['220', '개인', '적', '으로', '좋아하는', '배우네요', '닥터후']",2.972936860891774,1.61
105,A6Vn67Sdmig,가장보통의연애.조커<br>둘다 봤는데 둘다 돈값합니다<br>진짜 꿀잼입니다..이거보고<br>안웃을수가없는게 깨알웃음엄청나고<br>너무 괜찮아요,"['가장', '보통', '의', '연애', '조커', '둘다', '봤는데', '둘다', '돈값', '합니다', '진짜', '꿀잼', '입니다이거', '보고안', '웃을수가', '없는게', '깨알', '웃음', '엄청나고', '너무', '괜찮아요']",9.687560398686157,4.17
106,A6Vn67Sdmig,작위적인 개그가 없고 보기좋았어요ㅋㅋㅋㅋ현실에서 볼법하고 있을법한 일들,"['작위', '적', '인', '개그', '가', '없고', '보기', '좋았어요', '현실', '에서', '볼법', '하고', '있을', '법', '한', '일', '들']",0.2521253825482939,0.11
107,A6Vn67Sdmig,마셔도 너무 많이 마심. 훗날 캐릭터의 건강이 걱정되는 영화는 처음이였음.,"['마셔도', '너무', '많이', '마심', '훗날', '캐릭터', '의', '건강', '이', '걱정', '되는', '영화', '는', '처음', '이', '였음']",0.5465256852872217,0.25
108,A6Vn67Sdmig,저는 4점입니다.  여윽시 똑같은 궤도의 그저그런 국산영화입니다.  그냥 킬링 타임용인데 조커 보고 난 다음날 본지라 같은 티켓값을 냈다는게 무척이나 아까웠습니다.,"['저', '는', '4', '점', '입니다', '여윽시', '똑같은', '궤도', '의', '그', '저', '그런', '국산', '영화', '입니다', '그냥', '킬링', '타', '임용', '인데', '조커', '보고', '난', '다음', '날', '본', '지라', '같은', '티켓', '값', '을', '냈다는게', '무척', '이나', '아까웠습니다']",0.6629812449907259,0.26
109,A6Vn67Sdmig,김래원여친 돌아온장면 리뷰땜시 영화보고 다시 댓글달아야겠네요,"['김래원', '여친', '돌아온', '장면', '리뷰', '땜시', '영화', '보고', '다시', '댓글달아야겠네요']",3.6412854768042973,1.82
110,A6Vn67Sdmig,"커플이 아니더라도 재미있게 볼 수 있습니다.<br>부모님과 보고 왔는데, 잘 웃다 왔습니다.<br>혼자 온 분도 꽤 봤습니다. 커플 아니더라도 괜찮다는 말을 전합니다.<br><br>재훈 전 여친의 등장은 너무 소름 끼치더군요. 이런 사람이 있을 수도 있지만, 이해하기 어려웠죠.<br><br>재훈 캐릭터는 실제 저렇게 마시는 분을 본 적 있어서, 가능은 합니다.<br>특히, 재훈처럼 회사에 뒷배가 있거나 술상무 역활을 한다면 가능하죠. 하지만 실제 저렇게 생활하면, 알코올성 치매 옵니다.<br><br>선영의 퇴사는 좋은 결말인지 잘 모르겠습니다. <br>송별회 장면은 정말 판타지 같았습니다.<br>다만, 현실에서 직장인은 전날 판타지를 겪어도 다음날 멀쩡하게 출근한다는 걸 보여주기 위한 장치였나 싶기도 하네요.<br><br>공효진 배우에게 잘 맞는 옷 중 하나가 이번 역할인 거 같아요.<br>김래원 배우도 오랜만에 영화에서 어울리는 모습이었네요.","['커플', '이', '아니더라도', '재미있게', '볼', '수', '있습니다', '부모님', '과', '보고', '왔는데', '잘', '웃다', '왔습니다', '혼자', '온', '분도', '꽤', '봤습니다', '커플', '아니더라도', '괜찮다는', '말', '을', '전', '합니다', '재훈', '전', '여친', '의', '등장', '은', '너무', '소름', '끼치더군요', '이런', '사람', '이', '있을', '수도', '있지만', '이해', '하기', '어려웠죠', '재훈', '캐릭터', '는', '실제', '저렇게', '마시는', '분', '을', '본', '적', '있어서', '가능', '은', '합니다', '특히', '재훈', '처럼', '회사', '에', '뒷', '배', '가', '있거나', '술', '상무', '역활', '을', '한다면', '가능하죠', '하지만', '실제', '저렇게', '생활', '하면', '알코올', '성', '치매', '옵니다', '선영', '의', '퇴사', '는', '좋은', '결말', '인지', '잘', '모르겠습니다', '송별', '회', '장면', '은', '정말', '판타지', '같았습니다', '다만', '현실', '에서', '직장인', '은', '전날', '판타지', '를', '겪어도', '다음', '날', '멀쩡하게', '출근', '한다는', '걸', '보여주기', '위', '한', '장치', '였나', '싶기도', '하네요', '공효진', '배우', '에게', '잘', '맞는', '옷', '중', '하나', '가', '이번', '역할', '인', '거', '같아요', '김래원', '배우도', '오랜', '만', '에', '영화', '에서', '어울리는', '모습', '이었네요']",33.28771915610343,10.54
111,A6Vn67Sdmig,까는데 보고 싶네,"['까는데', '보고', '싶네']",0.5876462922887882,0.4
112,A6Vn67Sdmig,뻔한 영화겠거니 생각하고 기대없이 봤는데 가볍게 웃으며 볼 수 있어 정말 만족했어요 ㅎㅅㅎ,"['뻔한', '영화', '겠거니', '생각', '하고', '기대', '없이', '봤는데', '가볍게', '웃으며', '볼', '수', '있어', '정말', '만족했어요']",5.2857282121858145,2.43
113,A6Vn67Sdmig,??의외네요...점수를 생각보다 높게 줘서zzz글쎄 전 이 영화가 뭘 말하고자 하는지 모르겠음...스토리는 없음,"['의외', '네', '요', '점수', '를', '생각', '보다', '높게', '줘서', 'zzz', '글쎄', '전', '이', '영화', '가', '뭘', '말', '하고자', '하는지', '모르겠음', '스토리', '는', '없음']",1.398960532743093,0.59
114,A6Vn67Sdmig,양자물리학 해주세요 몇점나오는지궁금 ㅋㅋㅋ 전1점,"['양자물리학', '해주세요', '몇', '점', '나', '오는', '지궁', '금', '전', '1', '점']",0.1486267810124985,0.07
115,A6Vn67Sdmig,고등학생인 저로써는 공감이 하나도 안되고 모든 어른들이 하는 연애가 술 없이는 안된다는 내용으로 받아드려져서 그저 술마시고 취하고 연애하는 영화로밖에 안보이더군요.. 딱 2~30대를 저격해서 나온 영화같네요,"['고등학생', '인', '저', '로써', '는', '공감', '이', '하나', '도', '안되고', '모든', '어른', '들', '이', '하는', '연애', '가', '술', '없이는', '안된다는', '내용', '으로', '받아', '드려져서', '그저', '술', '마시고', '취하', '고', '연애', '하는', '영화로', '밖에', '안', '보이더군요', '딱', '230', '대를', '저격', '해서', '나온', '영화', '같네요']",6.933982394561272,2.63
116,A6Vn67Sdmig,그럴 수 밖에 없는 게 주인공들의 나이가 35세로 되어있고 직장인들의 이야기를 쓰고 있음. 고등학생이 겪어보지 못했으니 공감할 수가 없죠. 고등학생이면 소주를 원칙적으로 못마시는 나이임.,"['그럴', '수', '밖에', '없는', '게', '주인공', '들', '의', '나이', '가', '35', '세로', '되어있고', '직장인', '들', '의', '이야기', '를', '쓰고', '있음', '고등학생', '이', '겪어', '보지', '못', '했으니', '공감', '할', '수가', '없죠', '고등학생', '이', '면', '소주', '를', '원칙', '적', '으로', '못', '마시는', '나이', '임']",3.2653199363840724,1.24
117,A6Vn67Sdmig,등급은 15세 이상 관람가 내용은 25세 이상 관람가.<br>고등학생부터 대학생까지 전혀 공감이 되질 않는 영화라 생각이 되네요.,"['등급', '은', '15', '세', '이상', '관람', '가', '내용', '은', '25', '세', '이상', '관람', '가', '고등학생', '부터', '대학생', '까지', '전혀', '공감', '이', '되질', '않는', '영화', '라', '생각', '이', '되네요']",2.65095614114792,1.08
118,A6Vn67Sdmig,그런듯ㅋㅋ 29살인 저는 너무 공감이가서 재밋엇음,"['그런듯', '29', '살인', '저', '는', '너무', '공감', '이', '가서', '재밋엇음']",-0.7056007852002737,-0.35
119,A6Vn67Sdmig,라이너님 영화관 돈 아낄려고 뭐 개봉하면 라이너님 채널로 달려갑니다. 근데 퍼펙트맨이 없어서 혹시나 하고 봤는데 진짜 개 졸 망 작 인 네 요. 그것도 여친이랑 스위트 좌석에서 봤는데요. 염치 없지만 빠르게 영상을 올려 주신다면 그 돈으로 치킨을 먹겠습니다. 라이너 짱!,"['라이너', '님', '영화관', '돈', '아낄려고', '뭐', '개봉', '하면', '라이너', '님', '채널', '로', '달려갑니다', '근데', '퍼펙트', '맨', '이', '없어서', '혹시', '나', '하고', '봤는데', '진짜', '개', '졸', '망', '작', '인', '네', '요', '그것', '도', '여친', '이랑', '스위트', '좌석', '에서', '봤는데요', '염치', '없지만', '빠르게', '영상', '을', '올려', '주신다면', '그', '돈', '으로', '치킨', '을', '먹겠습니다', '라이너', '짱']",-0.6792819788884485,-0.25
120,A6Vn67Sdmig,저도  공효진 누나  광팬이라  재밋게  보고  왔는데  라이너님  평점이  무려  5점이라니 ㅋㅋㅋㅋㅋ 라이너님도  잼잇게  보셧나보네요,"['저', '도', '공효진', '누나', '광팬', '이라', '재밋', '게', '보고', '왔는데', '라이너', '님', '평점', '이', '무려', '5', '점', '이라니', '라이너', '님', '도', '잼', '잇게', '보셧', '나', '보네요']",2.043804927483487,0.85
121,A6Vn67Sdmig,로코퀸,"['로코', '퀸']",0.2866009055782546,0.22
122,A6Vn67Sdmig,와 이건 꼭봐야하는건 아닌데 보면 재밋는 영화,"['와', '이건', '꼭', '봐', '야하는건', '아닌데', '보면', '재밋는', '영화']",1.380000898648666,0.71
123,A6Vn67Sdmig,라이너님에게 이정도 평가를 받았다니 볼만한 영화인거같네요 한번 꼭 볼게요^^ 좋은 영화 리뷰 감사합니다,"['라이너', '님', '에게', '이정', '도', '평가', '를', '받았다니', '볼', '만', '한', '영화', '인거', '같네요', '한번', '꼭', '볼게요', '좋은', '영화', '리뷰', '감사합니다']",7.108907495099509,3.06
124,A6Vn67Sdmig,오랜만에 재밌게본 한국 로코임,"['오랜', '만', '에', '재밌게', '본', '한국', '로코', '임']",3.0241151454759,1.59
125,A6Vn67Sdmig,공효진 너무 매력있게 나옴.<br>오바하지 않고 적당한 개그와 적당한 설렘.<br>아주 좋은 로맨틱영화. 커플 썸남썸녀에게 추천합니다.,"['공효진', '너무', '매력', '있게', '나옴오', '바하', '지', '않고', '적당한', '개그', '와', '적당한', '설렘아주', '좋은', '로맨틱영화', '커플', '썸남썸녀', '에게', '추천', '합니다']",7.390697291954115,3.21
126,A6Vn67Sdmig,그니까 형 10점만점에 5점이면 가서보라는거지?,"['그니까', '형', '10', '점', '만점', '에', '5', '점', '이', '면', '가서', '보라', '는', '거지']",-0.5675821459916693,-0.26
127,A6Vn67Sdmig,오 오랜만에 로맨틱 영화가 평점이 좋네요. <br>예고편만 보고 별로일꺼 같았는데. <br>개인적으로는 공효진씨 나온 러브픽션 좋아하는데. ㅎㅎ그러고 보면 공효진배우는 뭔가 사랑이야기에서 더욱 그 매력이 빛나는듯 해요.,"['오', '오랜', '만', '에', '로맨틱', '영화', '가', '평점', '이', '좋네요', '예고편', '만', '보고', '별로', '일꺼', '같았는데', '개인', '적', '으로는', '공효진', '씨', '나온', '러브픽션', '좋아하는데', '그러고', '보면', '공효진', '배우는', '뭔가', '사랑', '이야기', '에서', '더욱', '그', '매력', '이', '빛나는듯', '해', '요']",9.70385720956089,3.75
128,A6Vn67Sdmig,벌새제외하고 라이너님이 추천하는 한국영화는 정말 오랫만이네요 ㅋㅋ,"['벌새', '제외', '하고', '라이너', '님', '이', '추천', '하는', '한국영', '화', '는', '정말', '오랫', '만이', '네', '요']",-3.0442335857507485,-1.38
129,A6Vn67Sdmig,요즘 제일 보고 싶은 영화!,"['요즘', '제일', '보고', '싶은', '영화']",2.4287827417609993,1.43
130,A6Vn67Sdmig,보통사람들이 보통 상상하거나 경험하는 보통의 연애를 다 모아서 만든 보통이란 이름의 판타지영화<br>그래도 재밌게 봤으니 내일은 명작전 클래식을 영화관에서 보러가야지<br>혼자서 🙋🏻‍♂️,"['보통사람', '들', '이', '보통', '상상', '하', '거나', '경험', '하는', '보통', '의', '연애', '를', '다', '모아서', '만든', '보통', '이란', '이름', '의', '판타지영화', '그래도', '재밌게', '봤으니', '내일', '은', '명', '작전', '클래식', '을', '영화관', '에서', '보러가야지', '혼자', '서']",7.603496835883295,2.99
131,A6Vn67Sdmig,진정한 알코올 로맨스!! 영화보는 내내 어디선가 소주냄새가 날 거 같았어요ㅋㅋㅋ<br>재밌게 봤는데 몇 장면들은 뭔가 안전장치(?) 마냥 뻔해보였어요ㅜㅜ<br>특히 선영이가 송별회식에 와서 얘기하는 장면은 그다지 재밌지도 않고 속 시원하지도 않고 그렇다고 바뀌는 것도 없고~~~ 그래도 오랜만에 재밌게 본 로맨스영화네요ㅎㅎ<br>역시 술은 소주! 라는 생각이ㅋ<br><br>방금 영화보고 나왔는데 때마침 딱 리뷰가!! 신기합니다ㅋ<br>리뷰 잘 봤습니다~ 내일 매불쇼 방송 있는 날이네요! 생방 사수하겠습니다ㅋ,"['진정한', '알코올', '로맨스', '영', '화보', '는', '내내', '어디', '선', '가', '소', '주', '냄새', '가', '날', '거', '같았어요', '재밌게', '봤는데', '몇', '장면', '들', '은', '뭔가', '안전', '장치', '마냥', '뻔', '해보였어요', '특히', '선영', '이', '가', '송별', '회식', '에', '와서', '얘기', '하는', '장면', '은', '그다지', '재밌지도', '않고', '속', '시원하지도', '않고', '그렇다고', '바뀌는', '것', '도', '없고', '그래도', '오랜', '만', '에', '재밌게', '본', '로맨스영화', '네', '요', '역시', '술', '은', '소주', '라는', '생각', '이', '방금', '영화', '보고', '나왔는데', '때마침', '딱', '리뷰', '가', '신기합니다', '리뷰', '잘', '봤습니다', '내일', '매', '불쇼', '방송', '있는', '날이네요', '생방', '사수', '하겠습니다']",27.358353734275674,9.28
132,A6Vn67Sdmig,음 먼저 외도하고 먼저 애교를 부리며 달래는 전여친을 두번이나 만나봐서.. 전여친의 백허그장면은 개인적으로 이 영화에서 가장 현실적인 장면 중 하나라 소름돋았습니다. 전 오히려 극중 30대중반의 두 어르신 남녀가 모텔방에서 다음날 아침에 몰래빠져나와 아무일없었던척한다는 설정이 너무 유치하더라구요.. tv드라마도 아니고;; 라이너님말대로 술에 의존하지 않고는 한발도 나아가지 못하는 진행이 후반부로 갈수록 피로감을 더해줬습니다. 술에 의존하지않고 두사람이 좀더 건설적인 대화를 하는 장면을 후반부에 한번이라도 보여줬더라면~,"['음', '먼저', '외도', '하고', '먼저', '애교', '를', '부리', '며', '달래는', '전여친', '을', '두', '번', '이나', '만나', '봐서', '전여친', '의', '백허그', '장면', '은', '개인', '적', '으로', '이', '영화', '에서', '가장', '현실', '적', '인', '장면', '중', '하나라', '소름', '돋았습니다', '전', '오히려', '극', '중', '30', '대중', '반의', '두', '어르신', '남녀', '가', '모텔', '방', '에서', '다음', '날', '아침', '에', '몰래', '빠져나와', '아무', '일', '없었던', '척', '한다는', '설정', '이', '너무', '유치하더라구요', 'tv', '드라마', '도', '아니고', '라이너', '님', '말', '대로', '술', '에', '의존', '하지', '않고는', '한', '발도', '나아가지', '못', '하는', '진행', '이', '후반', '부로', '갈수록', '피로', '감', '을', '더', '해줬습니다', '술', '에', '의존', '하지', '않고', '두', '사람', '이', '좀더', '건설', '적', '인', '대화', '를', '하는', '장면', '을', '후반', '부', '에', '한번', '이라도', '보여줬더라면']",-3.964348983258767,-1.29
133,A6Vn67Sdmig,전오히려 아침에 몰래빠져나오는게 젤현실적이였는데..,"['전', '오히려', '아침', '에', '몰래', '빠져나오는게', '젤', '현실', '적', '이', '였는데']",-1.1486267810124957,-0.56
134,A6Vn67Sdmig,저만 소리가 깨지나요....?,"['저만', '소리', '가', '깨지나요']",0.0,0.0
135,A6Vn67Sdmig,라이너님 5점은 괜찮다는 것이네요. 힘을내요 미스터리 4점은 좀 의외였는데 ㅎㅎ,"['라이너', '님', '5', '점', '은', '괜찮다는', '것', '이네', '요', '힘', '을', '내', '요', '미스터리', '4', '점', '은', '좀', '의외', '였는데']",0.363174529055736,0.16
136,A6Vn67Sdmig,진짜 마지막에 보고싶었어 그 장면에서 왜케 울컥하던지 ㅎㅎ....,"['진짜', '마지막', '에', '보고싶었어', '그', '장면', '에서', '왜케', '울컥', '하던지']",1.8988386903568202,0.95
137,A6Vn67Sdmig,"하아... 항상 라이너님 리뷰  잘보고 있는데.. 이건 한마디 남기게 됩니다.<br>전 이 영화를 보고 &#39;설마 이것을 재미있다고 하는 사람이 있을까? &#39; 라는 질문이 남았었습니다.  혹시 이영화를 좋게 평하는 사람이 있다면 주관을 넘어 안목의 결여에 연결시킬 정도였습니다.<br>구시대적 연출과 대사, 잡다하고 텅텅빈 스토리 전개... 작위적이고 신선하지않은, 더하여 시원하지도 않은 결말.. <br>주변 캐릭터 매력??  그냥 없다고 보는게 나을정도였습니다.<br>두 주연배우는 좋았습니다. <br>그럼에도, 감상 후  같이 본사람들끼리 욕하기 바빴네요... 영화관을 나가는 사람도 있었구요.(이유는 모르지만)<br>저는 유투버의 영상에 &#39;댓글&#39;다는 사람으로서 전파력이 약해 제가 하는 말에 얼마나 힘이 실릴진 모르겠지만 이영화는 공감하기 힘들고, 로코를 보고 있는데 단 1도 설렘을 느끼지 못하는 본인을 발견하게 될수도 있습니다.<br><br>흥행하는 이유를 로코물의 부재가 길어져 많은 사람들이 로코물에 대한 갈증이 커져서 나타나는 현상쯤으로 생각했었는데... <br>(그 이유로 저도 이 영화를 보게되었죠)<br>흠.. 우선 저에게는  정말 엉터리같은 영화였습니다.  다른 의견이시더라도 틀리게 보지마시고 참고하시어 혹 영화를 보고 난 후  영화가 엉터리같다 느끼셨다하더라도 타당한 감정임을 아시는데 보탬이 되셨으면 합니다.","['하아', '항상', '라이너', '님', '리뷰', '잘', '보고', '있는데', '이건', '한마디', '남기게', '됩니다전', '이', '영화', '를', '보고', '39', '설마', '이', '것', '을', '재미있다고', '하는', '사람', '이', '있을까', '39', '라는', '질문', '이', '남았었습니다', '혹시', '이영화', '를', '좋게', '평', '하는', '사람', '이', '있다면', '주관', '을', '넘어', '안목', '의', '결여', '에', '연결', '시킬', '정도', '였습니다', '구시대', '적', '연출', '과', '대사', '잡다하고', '텅텅빈', '스토리', '전개', '작위', '적', '이고', '신선하지', '않은', '더하여', '시원하지도', '않은', '결말', '주변', '캐릭터', '매력', '그냥', '없다고', '보는게', '나을', '정도', '였습니다', '두', '주연', '배우는', '좋았습니다', '그럼에도', '감상', '후', '같이', '본', '사람', '들', '끼리', '욕', '하기', '바빴네요', '영화관', '을', '나가는', '사람', '도', '있었구요', '이유', '는', '모르지만', '저', '는', '유투버', '의', '영상', '에', '39', '댓글', '39', '다는', '사람', '으로서', '전파', '력', '이', '약해', '제', '가', '하는', '말', '에', '얼마나', '힘', '이', '실릴진', '모르겠지만', '이영화', '는', '공감', '하기', '힘들고', '로코', '를', '보고', '있는데', '단', '1', '도', '설렘을', '느끼지', '못', '하는', '본인', '을', '발견', '하게', '될수도', '있습니다', '흥행', '하', '는', '이유', '를', '로코', '물의', '부재', '가', '길어져', '많은', '사람', '들', '이', '로코', '물', '에', '대한', '갈증', '이', '커져서', '나타나는', '현상', '쯤', '으로', '생각', '했었는데', '그', '이유', '로', '저', '도', '이', '영화', '를', '보게', '되었죠', '흠', '우선', '저', '에게는', '정말', '엉터리', '같은', '영화', '였습니다', '다른', '의견', '이', '시더', '라도', '틀리게', '보지', '마시고', '참고', '하시어', '혹', '영화', '를', '보고', '난', '후', '영화', '가', '엉터리', '같다', '느끼셨다하더라도', '타당', '한', '감정', '임', '을', '아시는데', '보탬', '이', '되셨으면', '합니다']",30.28724036005803,9.02
138,A6Vn67Sdmig,같은 연배인데 공효진 김래원 조합은 처음 보는거 같네,"['같은', '연배', '인데', '공효진', '김래원', '조합', '은', '처음', '보는거', '같네']",2.276378689074103,1.14
139,A6Vn67Sdmig,이거 진짜 재밌음,"['이', '거', '진짜', '재밌음']",1.0954034834284363,0.68
140,A6Vn67Sdmig,전여친 개쓰레기 나 같았으면 쌍욕 했을것,"['전여친', '개', '쓰레기', '나', '같았으면', '쌍욕', '했을것']",-0.9865375109708405,-0.53
141,A6Vn67Sdmig,리뷰을 보니 흥행각의 국산영화인것 같네요...<br>커플들이 좋아하는 연애 영화인데 재미까지 있다니...난 못 보겠군...<br>라이너님의 좋은 리뷰 잘 보고 갑니당,"['리뷰', '을', '보니', '흥행', '각의', '국산', '영화인', '것', '같네요', '커플', '들', '이', '좋아하는', '연애', '영화', '인데', '재미', '까지', '있다니난', '못', '보겠군', '라이너', '님', '의', '좋은', '리뷰', '잘', '보고', '갑니당']",16.235027781271803,6.59
142,A6Vn67Sdmig,라이너가 5점 평점이면<br>아주 볼만한 영화이다,"['라이너', '가', '5', '점', '평점', '이', '면', '아주', '볼', '만', '한', '영화', '이다']",0.09544500607034856,0.05
143,A6Vn67Sdmig,문고리 부순다는 장면에서 샤이닝ㅋㅋㅋㅋ 갑자기 나와서 웃었네요 편집자님 센스 굿,"['문', '고리', '부', '순다', '는', '장면', '에서', '샤이닝', '갑자기', '나와서', '웃었네요', '편집자', '님', '센스', '굿']",0.2252004044899747,0.1
144,A6Vn67Sdmig,쓰레기 였어요,"['쓰레기', '였어요']",0.1486267810124985,0.11
145,A6Vn67Sdmig,애인있으신분들은 편하고 재미있게 감상하시기 좋은 영화입니다ㅋㅋㅋ썸타는 사이에 보면 어색해질수도..ㅋㅋㅋㅋ,"['애인', '있으', '신분', '들', '은', '편하고', '재미있게', '감상', '하시기', '좋은', '영화', '입니다', '썸', '타는', '사이', '에', '보면', '어색해질', '수도']",10.109672314681992,4.44
146,A6Vn67Sdmig,왜용?,['왜용'],0.0,0.0
147,A6Vn67Sdmig,요즘 은근히 여자감독이 영화를 잘만든다.,"['요즘', '은근', '히', '여자', '감독', '이', '영화', '를', '잘', '만든다']",3.705972157488872,1.85
148,A6Vn67Sdmig,요즘 멜로는 안땡기는데 볼만하려나,"['요즘', '멜로', '는', '안', '땡기는데', '볼', '만', '하려나']",0.29725356202499187,0.16
149,A6Vn67Sdmig,"감독이 의도적으로 자ㅈ, 보ㅈ 공효진(여자)이 말하게 한것 같은데.. 하나도 안먹혔습니다. 여자들도 기겁하고 남자도 불쾌하고 웃기지도 않고. 영화는 잼나게 봤습니다","['감독', '이', '의도', '적', '으로', '자', '보', '공효진', '여자', '이', '말', '하게', '한', '것', '같은데', '하나', '도', '안', '먹혔습니다', '여자', '들', '도', '기겁', '하고', '남자', '도', '불쾌하고', '웃기지도', '않고', '영화', '는', '잼나게', '봤습니다']",6.878575922927363,2.73
150,A6Vn67Sdmig,리뷰 잘 봤습니다~,"['리뷰', '잘', '봤습니다']",3.6764481184492626,2.49
