,id,sentence,comment_cut,score,ratio
0,f4i0OJTcdAc,"1,2른 오늘 다봤는데...","['12', '른', '오늘', '다', '봤는데']",1.173797210967502,0.69
1,f4i0OJTcdAc,택티컬한 근접 총기액션을 기대하고 보고온 저는 실망이 더 크네요 ㅠ<br>첨에 칼 오지게 꽂는장면이랑 댕댕이씬은 일품이었음<br>이 두 씬만..,"['택티컬', '한', '근접', '총', '기', '액션', '을', '기대하고', '보고온', '저', '는', '실망', '이', '더', '크네요', '첨', '에', '칼', '오지', '게', '꽂는', '장면', '이랑', '댕댕', '이', '씬', '은', '일품', '이었음', '이', '두', '씬', '만']",-3.929994099613651,-1.56
2,f4i0OJTcdAc,물론 9mm가 위력이 떨어지는 탄이긴 하지만 저정도 거리에서 쏘면 9mm로도 위력이 충분합니다 보통 9mm가 왜 위력이 약하다라는 이유가 근거리가 아닌 근중거리에서 방탄복을 입으적에게 위력이 약하다고 하는겁니다,"['물론', '9', 'mm', '가', '위력', '이', '떨어지는', '탄이긴', '하지만', '저', '정도', '거리', '에서', '쏘면', '9', 'mm', '로', '도', '위력', '이', '충분합니다', '보통', '9', 'mm', '가', '왜', '위력', '이', '약하다라는', '이유', '가', '근거리', '가', '아닌', '근', '중거리', '에서', '방탄복', '을', '입으', '적', '에게', '위력', '이', '약하다고', '하는', '겁니다']",1.3428568190291617,0.5
3,f4i0OJTcdAc,"★제가 느낀 존 윅의 비밀!!(BGM)이 있습니다. 지역이나 환경 분위기마다. Hz명상음악과 유사하고 옴만트라음악나 몽골명상음악등 BGM에 주목해보시면 1.2.3편 모든 베이스가 명상음악 느낌입니다. 명상유저는 오호? 하실것 같네요^^ㅋ 대사 대신 액션, 집중도는 명상음이 한몴(눈을 감고들어보세요^^오옴~), 이 요소로 집중되는 이유가 아닌가 싶습니다. 쉴틈없이 화려한 액션과는 다르게 반전 매력으로 느껴져서 댓글 남겨봅니다.","['제', '가', '느낀', '존', '윅', '의', '비밀', 'BGM', '이', '있습니다', '지역', '이나', '환경', '분위기', '마다', 'Hz', '명상', '음악', '과', '유사하고', '옴', '만트라', '음악', '나', '몽골', '명상', '음악', '등', 'BGM', '에', '주목', '해보시면', '123', '편', '모든', '베이스', '가', '명상', '음악', '느낌', '입니다', '명상', '유저', '는', '오호', '하실것', '같네요', '대사', '대신', '액션', '집중', '도', '는', '명상', '음', '이', '한몴눈', '을', '감고', '들어', '보세요', '오', '옴', '이', '요소', '로', '집중', '되는', '이유', '가', '아닌가', '싶습니다', '쉴', '틈', '없이', '화려한', '액션', '과는', '다르게', '반전', '매력', '으로', '느껴져서', '댓글', '남겨', '봅니다']",12.667031973211238,4.32
4,f4i0OJTcdAc,윈스턴이 마지막으로 존윅을 쏜 탄이 파라벨룸탄이라서? 살상력이 약하니까 그냥 이런생각이 들었습니다. 리뷰 감사합니다.,"['윈스턴', '이', '마지막', '으로', '존윅', '을', '쏜', '탄이', '파라벨룸', '탄이라서', '살상', '력', '이', '약하니까', '그냥', '이런', '생각', '이', '들었습니다', '리뷰', '감사합니다']",2.3578321665186377,1.02
5,f4i0OJTcdAc,액션은 초반 칼날리는 장면이 제일 멋있었다<br>액션으로 보자면 이번 3편 만한게 없는듯,"['액션', '은', '초반', '칼', '날리는', '장면', '이', '제일', '멋있었다', '액션', '으로', '보자면', '이번', '3', '편', '만', '한', '게', '없는듯']",0.5312640997506997,0.23
6,f4i0OJTcdAc,존윅이라는 영화에서 존윅이 존윅스럽지못했음<br><br>액션은 맘에들었는데  스토리전개가 좀... 어거지 개그씬도 우겨넣어서 눈살찌푸러짐,"['존윅', '이라는', '영화', '에서', '존윅', '이', '존윅', '스럽지', '못', '했음', '액션', '은', '맘', '에', '들었는데', '스토리', '전개', '가', '좀', '어거지', '개그씬', '도', '우겨', '넣어서', '눈살', '찌', '푸러', '짐']",0.05566355118537522,0.02
7,f4i0OJTcdAc,존윅은 스토리로 보는 게 아님,"['존윅', '은', '스토리', '로', '보는', '게', '아님']",0.4207242026865416,0.23
8,f4i0OJTcdAc,좋아유♥♥♥♥♥,"['좋', '아유']",0.0,0.0
9,f4i0OJTcdAc,으아아아 망할 난 12살인데!아아아아아아아악!이런 젠장!!!!!!!!!!!,"['으아아', '아', '망할', '난', '12', '살', '인데', '아아', '아아', '아아', '아', '악', '이런', '젠장']",-3.231770964557106,-1.51
10,f4i0OJTcdAc,솔직히 존윅은  존윅은 cqb보러 가는 영화인데 마지막 카타나 들고 설치는 건 좀 에바였음,"['솔직히', '존윅', '은', '존윅', '은', 'cqb', '보러', '가는', '영화', '인데', '마지막', '카타나', '들고', '설치는', '건', '좀', '에바', '였음']",-0.24076043968969996,-0.11
11,f4i0OJTcdAc,근데 브금 메이플에서 들었던거 같은데<br>기분탓인가?,"['근데', '브금', '메이플', '에서', '들었던거', '같은데', '기분', '탓', '인가']",2.2466875841944387,1.15
12,f4i0OJTcdAc,영화로썬 괜찮았는데 존윅으로썬 좀 아쉽더라고요.,"['영화로', '썬', '괜찮았는데', '존윅', '으로', '썬', '좀', '아쉽더라고요']",0.5556553872547136,0.29
13,f4i0OJTcdAc,yeah~,['yeah'],0.0,0.0
14,f4i0OJTcdAc,부자가되자,"['부자', '가', '되자']",1.0,0.68
15,f4i0OJTcdAc,존위3는 4를 위한 발판이라생각해요 암튼 극장에서봐야될영화입니다 스토리를떠나서 액션조아하시면 무조건 극장에서보시기를,"['존위', '3', '는', '4', '를', '위', '한', '발판', '이라', '생각', '해', '요', '암튼', '극장', '에서', '봐야', '될', '영화', '입니다', '스토리', '를', '떠나서', '액션', '조아하시면', '무조건', '극장', '에서', '보시', '기를']",-2.171562392519659,-0.88
16,f4i0OJTcdAc,최고장로 씬은 빼는 게 오히려 영화의 간지에 훨씬 더 많은 도움이 됐을 것 같다는 아쉬움이 듭니다. 더 담백하고 쌈마이하게 가길 바랐는데 ㅠ,"['최고', '장로', '씬', '은', '빼는', '게', '오히려', '영화', '의', '간지', '에', '훨씬', '더', '많은', '도움', '이', '됐을', '것', '같다는', '아쉬움', '이', '듭니', '다', '더', '담백하고', '쌈', '마이', '하', '게', '가길', '바랐는데']",4.969853652126514,1.99
17,f4i0OJTcdAc,"뭐랄까 . 더하지도 빼지도 않은 군더더기 없는 정확한 꿀리뷰 느낌 , 굿굿","['뭐랄까', '더하지도', '빼지도', '않은', '군더더기', '없는', '정확한', '꿀', '리뷰', '느낌', '굿굿']",2.5718718392213935,1.26
18,f4i0OJTcdAc,매크리 뜬 것도 보여 줘야하는데 ㅋㅋㅋ,"['매', '크리', '뜬', '것', '도', '보여', '줘야하는데']",0.03563993722011857,0.02
19,f4i0OJTcdAc,동전 건네면서 구독 붙인거 왜 이렇게 웃기냐곹ㅋㅌㅋㅋㅋㅋㅋ 환타는 모피어스 때문 읍읍,"['동전', '건네면서', '구독', '붙인거', '왜', '이렇게', '웃기냐', '곹', '환타', '는', '모', '피어스', '때문', '읍읍']",-0.13135608200976945,-0.06
20,f4i0OJTcdAc,뇌절 맞절 큰절 ㅇㅈ,"['뇌절', '맞절', '큰절']",0.0,0.0
21,f4i0OJTcdAc,액션 진짜 별로던데...,"['액션', '진짜', '별로', '던데']",0.7000369747889664,0.44
22,f4i0OJTcdAc,레이드 배우 섭외해서 레이드 처럼 대결을 하는것만 봐도 1.2 보다 3이 훨씬 대작이구만 훨씬 더 많이 두들겨 맞고. 감독이 출신이 출신인 만큼 이 쪽으로 많이 보고 분석하고 쿨하게 가져와서 튜닝도 하고 멋지다 멋져,"['레이드', '배우', '섭외', '해서', '레이드', '처럼', '대결', '을', '하는것만', '봐도', '12', '보다', '3', '이', '훨씬', '대작', '이구만', '훨씬', '더', '많이', '두', '들', '겨', '맞고', '감독', '이', '출신', '이', '출신', '인', '만큼', '이', '쪽', '으로', '많이', '보고', '분석', '하고', '쿨하게', '가져와서', '튜닝', '도', '하고', '멋지다', '멋져']",7.861358754759777,2.96
23,f4i0OJTcdAc,걸작 하니 생각나는건데 <br>분명 준윅3는 거이없다 님 이 만저주실겁니다 후드러까기 전문가 <br><b>거이없다</b><br>기대를 많이해서 그런지 존윅3는 너무 아쉬운 영화였습니다 <br>거이없다님 만저주세요 제발,"['걸작', '하니', '생각나는건데', '분명', '준윅', '3', '는', '거', '이', '없다', '님', '이', '만', '저', '주', '실', '겁니다', '후', '드러까', '기', '전문가', '거', '이', '없다', '기대', '를', '많이', '해', '서', '그런지', '존윅', '3', '는', '너무', '아쉬운', '영화', '였습니다', '거', '이', '없', '다님', '만', '저', '주', '세', '요', '제발']",2.4009309477041954,0.9
24,f4i0OJTcdAc,집행관이 먼가 넘사벽 카리스마가 있어야 했는데<br>그냥 통보만하고 실제적인 처리는 다 하청만 줘서 처리함<br>말빨로만 끝낼려고 함,"['집행', '관', '이', '먼가', '넘사벽', '카리스마', '가', '있어야', '했는데', '그냥', '통보', '만', '하고', '실제', '적', '인', '처리', '는', '다', '하청만', '줘서', '처리', '함말', '빨', '로만', '끝낼려고', '함']",4.416421486527956,1.82
25,f4i0OJTcdAc,키아누에겐 아직 &#39;존윅4 : 뎃 뿨킹 노바디&#39;  가 있습니다,"['키', '아누', '에겐', '아직', '39', '존윅', '4', '뎃', '뿨킹', '노바디', '39', '가', '있습니다']",1.6212065342270556,0.77
26,f4i0OJTcdAc,2편을 봤을땐 수트에 권총든 느낌이 영화 아저씨 느낌도 난다 라는 생각이 들더군요 주먹교환 칼싸움 씬이 있는 지하철 싸움에서도 그런 느낌을 개인적으론 받았습니다,"['2', '편', '을', '봤을', '땐', '수트', '에', '권총', '든', '느낌', '이', '영화', '아저씨', '느낌', '도', '난다', '라는', '생각', '이', '들더군요', '주먹', '교환', '칼', '싸움', '씬', '이', '있는', '지하철', '싸움', '에서도', '그런', '느낌', '을', '개인', '적', '으론', '받았습니다']",-0.10044928972773945,-0.04
27,f4i0OJTcdAc,초반 30분은 ㄹㅈㄷ 후반부 라운지부턴 딱히....그래도 다른 액션영화보단 훨씬나음,"['초반', '30분', '은', '후반', '부', '라운지', '부턴', '딱히', '그래도', '다른', '액션영화', '보단', '훨씬', '나음']",1.6193172563902183,0.75
28,f4i0OJTcdAc,한마디로 더울버린 존윅버전임,"['한마디', '로', '더울버린', '존윅', '버전', '임']",0.2157133988977129,0.12
29,f4i0OJTcdAc,액션 합이 굉장히 어색하던대 나만 그리 느낀건가?,"['액션', '합', '이', '굉장히', '어색하던대', '나', '만', '그리', '느낀', '건가']",1.051810599104266,0.53
30,f4i0OJTcdAc,이번 키아누리브스 맨손 격투신은 완전 느릿느릿해서 별로...,"['이번', '키', '아누', '리브', '스', '맨손', '격투', '신은', '완전', '느릿느릿', '해서', '별로']",-0.16271644327290813,-0.08
31,f4i0OJTcdAc,집행관 아쉬움 인정. 집행관에 걸맞는 디그니티나 냉정함은 없고 뉴욕 카페에서 시크한척 하는 모델 같이 연기함,"['집행', '관', '아쉬움', '인정', '집행', '관', '에', '걸', '맞는', '디그', '니', '티나', '냉정함은', '없고', '뉴욕', '카페', '에서', '시크', '한', '척', '하는', '모델', '같이', '연', '기함']",0.7911016137596287,0.33
32,f4i0OJTcdAc,액션이 아무리 빛이 나도 최소한의 인과관계는 있어야 하지 않나 싶네요. 솔직히 마지막 닌자들과의 싸움은 너무 보기가 힘들었습니다. ㅠ...ㅠ,"['액션', '이', '아무리', '빛', '이', '나도', '최소한', '의', '인과관계', '는', '있어야', '하지', '않나', '싶네요', '솔직히', '마지막', '닌자', '들', '과의', '싸움', '은', '너무', '보기', '가', '힘들었습니다']",1.8028232508495474,0.75
33,f4i0OJTcdAc,애니멀액션은 좋았음... 그리고 일본킬러가 일본스럽지 않은것 같음 .... 마지막 추락신은 너무 비현실적이고 한국영화 악녀가 생각나지만 전반적으로 아저씨에서 원빈 액션이 많이 묻어있는것 같네요,"['애니멀', '액션', '은', '좋았음', '그리고', '일', '본', '킬러', '가', '일본', '스럽지', '않은것', '같음', '마지막', '추락', '신은', '너무', '비현실적', '이고', '한국영', '화', '악녀', '가', '생각나지만', '전반', '적', '으로', '아저씨', '에서', '원빈', '액션', '이', '많이', '묻어있는것', '같네요']",-4.119313571120978,-1.62
34,f4i0OJTcdAc,"마카다카스코스 대머리로 올만에 나왔네요. 어벤져 4에 샤샤미첼이 배역했고, 5탄에서 마카다카스코스가 주연이였는데,  예전 카포에라 영화에도 출연했었어요,팬이였는데..","['마카', '다', '카스', '코스', '대머리', '로', '올만에', '나왔네요', '어벤져', '4', '에', '샤샤', '미첼', '이', '배역', '했고', '5', '탄에서', '마카', '다', '카스', '코스', '가', '주연', '이', '였는데', '예전', '카포에라', '영화', '에도', '출연', '했었어요', '팬', '이', '였는데']",2.4685436254198274,0.97
35,f4i0OJTcdAc,진짜 집행관 왜 나온건지 이해가...그것도 여자가 나와서 보는내내 방해되더군요,"['진짜', '집행', '관', '왜', '나온', '건지', '이해', '가', '그것', '도', '여자', '가', '나와서', '보는내내', '방해', '되더군요']",1.2279700380181389,0.56
36,f4i0OJTcdAc,이퀼리임 이나봐야지 아쉬운  마음에,"['이퀼리임', '이나', '봐야지', '아쉬운', '마음', '에']",0.8032262093702501,0.45
37,f4i0OJTcdAc,시 비스 파쳄 아닌가요?? 라틴어라면 파쳄으로 읽어야 할 것 같은데,"['시', '비스', '파쳄', '아닌가요', '라틴어', '라면', '파쳄', '으로', '읽어야', '할', '것', '같은데']",1.2961753523114807,0.62
38,f4i0OJTcdAc,동물 액션! 좋았어요~ 사실 준윅의 강아지에게도 살짝기대 했었는데...뭐 그래도 초반  옆에같이 쫄래쫄래 따라다니는거 나름 귀여웠어요^^,"['동물', '액션', '좋았어요', '사실', '준윅', '의', '강아지', '에게도', '살짝', '기대', '했었는데', '뭐', '그래도', '초반', '옆', '에', '같이', '쫄래쫄래', '따라다니는거', '나름', '귀여웠어요']",6.099534511614806,2.63
39,f4i0OJTcdAc,푸블리우스 플라비우스 베게티우스 레나투스 시부레 이 사람이름 누가 지엇냐,"['푸블', '리', '우스', '플', '라비', '우스', '베게', '티', '우스', '레나', '투스', '시', '부레', '이', '사람이름', '누가', '지엇', '냐']",0.03563993722011857,0.02
40,f4i0OJTcdAc,무조건 봐야겠네 그래도 명작 마스터피스,"['무조건', '봐야겠네', '그래도', '명작', '마스터피스']",2.9888997887461812,1.76
41,f4i0OJTcdAc,영화보고왔는데 그래서  환타 먹은 이유가 뭐야 형???,"['영화', '보고왔는데', '그래서', '환타', '먹은', '이유', '가', '뭐', '야', '형']",0.1081141576578879,0.05
42,f4i0OJTcdAc,@민호타우르스 아 맞다 ㅋㅋㅋㅋ 마지막에 법큐밖에 기억이안났오서,"['민호', '타', '우르', '스', '아', '맞다', '마지막', '에', '법큐', '밖에', '기', '억', '이안', '났오서']",0.7370739724991645,0.34
43,f4i0OJTcdAc,바워리 킹이 마지막에 존 윅 앞에서 환타 먹으면서 영화 끝남,"['바워리', '킹', '이', '마지막', '에', '존', '윅', '앞', '에서', '환타', '먹으면서', '영화', '끝남']",0.18795162641000224,0.09
44,f4i0OJTcdAc,영화 보고 왔습니다 역시 연필친구 책입니다 ㅋㅋ,"['영화', '보고', '왔습니다', '역시', '연필', '친구', '책', '입니다']",3.1450565925110228,1.65
45,f4i0OJTcdAc,액션은 더 길어졌지만 1 2 편에 비해 훨씬 임팩트가 덜했음. 악당들도 매력적인 맛이 덜했고. 강하고 약하고를 떠나서 2편 벙어리녀가 훨씬 매력적인 악역이었는듯. 초반부는 존윅이었지만 중반 이후부터는 그냥 액션영화 주인공이더라. 홍콩 무협영화 일본 닌자영화랑 별반 차이가 없었다고 봄. 소문난 잔치에 먹을게 영.,"['액션', '은', '더', '길어졌지만', '1', '2', '편', '에', '비해', '훨씬', '임팩트', '가', '덜했음', '악당', '들', '도', '매력', '적', '인', '맛', '이', '덜했고', '강하고', '약하고를', '떠나서', '2', '편', '벙어리', '녀', '가', '훨씬', '매력', '적', '인', '악역', '이었는듯', '초반', '부는', '존윅이었', '지만', '중반', '이후', '부터는', '그냥', '액션영화', '주인공', '이', '더', '라', '홍콩', '무협', '영화', '일본', '닌자', '영화', '랑', '별반', '차이', '가', '없었다고', '봄', '소문난', '잔치', '에', '먹을게', '영']",2.5805076624404237,0.92
46,f4i0OJTcdAc,최고회의집행관 누구인지도설명도없어요ㅋㄲ,"['최고', '회의', '집행', '관', '누구', '인지', '도설', '명', '도', '없어요']",3.2760822582092275,1.64
47,f4i0OJTcdAc,아저씨 목소리 죽이네요,"['아저씨', '목소리', '죽이네요']",0.9712650109138352,0.66
48,f4i0OJTcdAc,닌자씬에서 너무 지루함을 느꼈습니다;;,"['닌자씬', '에서', '너무', '지루함', '을', '느꼈습니다']",-0.10370517361092524,-0.06
49,f4i0OJTcdAc,"정말 1,2를 수도 없이 보고 머리에 영어 대사까지 남아있을 정도로 좋아했는데...이번 작은 많이 아쉽더라구요..1,2에서 액션의 담백함, 이 맛에 존 윅에 굉장히 빠져버렸는데 이번에는 무술 종류부터 시작해서 너무 다양하고, 거의 윅과 동급으로 싸울 줄 아는 다른 캐릭터들까지...또한, 존 윅을 좋아하는 사람들이 만들어낸 밈적인 요소도 너무 들어간 듯해서...아쉬웠습니다..4편에서는 완급조절 잘해서 다시, 윅 만의 고독하고 절제된 그리고 담백한 액션씬들이 다시 나왔으면 좋겠네요.","['정말', '12', '를', '수도', '없이', '보고', '머리', '에', '영어', '대사', '까지', '남아있을', '정도', '로', '좋아했는데', '이번', '작은', '많이', '아쉽더라구요', '12', '에서', '액션', '의', '담백함', '이', '맛', '에', '존', '윅', '에', '굉장히', '빠져', '버렸는데', '이번', '에는', '무술', '종류', '부터', '시작', '해서', '너무', '다양하고', '거의', '윅', '과', '동', '급', '으로', '싸울', '줄', '아는', '다른', '캐릭터', '들', '까지', '또한', '존', '윅', '을', '좋아하는', '사람', '들', '이', '만들어', '낸', '밈적', '인', '요소', '도', '너무', '들어간', '듯', '해서', '아쉬웠습니다', '4', '편', '에서는', '완', '급', '조절', '잘', '해서', '다시', '윅', '만의', '고독', '하고', '절제', '된', '그리고', '담백한', '액션', '씬', '들', '이', '다시', '나왔으면', '좋겠네요']",15.136948530454728,5.06
50,f4i0OJTcdAc,"<a href=""https://www.youtube.com/watch?v=f4i0OJTcdAc&amp;t=3m07s"">3:07</a> ㅋㅋㅋㅋ 존윅 따라하는거양?ㅋㅋ<br>젓가락이 아니라 연필로 스시를 잡네 ㅋㅋ","['307', '존윅', '따라하는', '거양', '젓가락', '이', '아니라', '연필', '로', '스시', '를', '잡네']",0.7270786075016833,0.35
51,f4i0OJTcdAc,일단 탄탄한 스토리를 기대하면서 존윅을보면<br>그건 첫 도입부터 관점을 잘못뒀다 해야할까<br>스토리에 기대하기보다는<br>어떤 창의적인방법으로 사람을 두들겨패 잡는지에 관점을둔다면 재밌게볼듯,"['일단', '탄탄한', '스토리', '를', '기대하면서', '존윅', '을', '보면', '그건', '첫', '도입', '부터', '관점', '을', '잘', '못', '뒀다', '해야', '할까', '스토리', '에', '기대하기보다는', '어떤', '창의', '적', '인', '방법', '으로', '사람', '을', '두', '들', '겨패', '잡는지에', '관점', '을', '둔다면', '재밌게', '볼듯']",4.536881384306042,1.75
52,f4i0OJTcdAc,미국 영화에 닌자가 나오면  영.....,"['미국', '영화', '에', '닌자', '가', '나오면', '영']",0.31422763752207417,0.17
53,f4i0OJTcdAc,"집행관은 중립입니데이<br>자기손에 피,안뭇이는 화이트칼라 정도죠","['집행', '관', '은', '중립', '입니데이자', '기손', '에', '피안', '뭇', '이', '는', '화이트칼라', '정도', '죠']",0.3922532737097232,0.18
54,f4i0OJTcdAc,정보)레슬링처럼보이지만 사실은 삼보라는 러시아전통유술.,"['정보', '레슬링', '처럼', '보이', '지만', '사실', '은', '삼보', '라는', '러시아', '전통', '유술']",1.7173867691525366,0.83
55,f4i0OJTcdAc,그냥 시원합니다! 생각할거 없어요!<br>싸움씬에서 약간의 시간차가있어도 볼만함,"['그냥', '시원합니다', '생각', '할거', '없어요', '싸움', '씬', '에서', '약간', '의', '시간', '차가있어도', '볼', '만', '함']",-0.9366317200250229,-0.43
56,f4i0OJTcdAc,"다시 일해요,존?","['다시', '일해', '요', '존']",0.12847899733662926,0.08
57,f4i0OJTcdAc,미친 액션영화!! 보고 나니 내가 다 피곤하네요 ㅋㅋㅋ,"['미친', '액션영화', '보고', '나니', '내', '가', '다', '피곤하네요']",-0.9991408488609899,-0.53
58,f4i0OJTcdAc,개만 안건들고 차만 안훔쳤으면 지금 이 사단이 일어나지도 않음,"['개', '만', '안건', '들', '고', '차만', '안', '훔쳤으면', '지금', '이', '사단', '이', '일어나지', '도', '않음']",0.3634686214699825,0.17
59,f4i0OJTcdAc,개소리,"['개', '소리']",0.6034673375933798,0.46
60,f4i0OJTcdAc,존윅4  100%  출 각!,"['존윅', '4', '100', '출', '각']",0.4341529293448407,0.26
61,f4i0OJTcdAc,혹시 일산 메가박스 킨텍스에서 보셨나요? 거기가 극장 밑의 층에 닌자 스시가 있는데..,"['혹시', '일산', '메가박스', '킨텍스', '에서', '보셨나요', '거기', '가', '극장', '밑', '의', '층', '에', '닌자', '스시', '가', '있는데']",-0.7110354465034869,-0.32
62,f4i0OJTcdAc,안알랴줌,['안알랴줌'],0.0,0.0
63,f4i0OJTcdAc,근데 일부러 아쉬움을 남긴거 아닐까요? 챕터 4를 위해 일부러 챕터 3에다가 아쉬움을 주고 새로운 캐릭터를 보여주는 거죠,"['근데', '일부러', '아쉬움', '을', '남긴거', '아닐까', '요', '챕', '터', '4', '를', '위해', '일부러', '챕', '터', '3', '에다가', '아쉬움', '을', '주고', '새로운', '캐릭터', '를', '보여주는', '거', '죠']",0.37024146663499735,0.15
64,f4i0OJTcdAc,영화는 챕터챕터 이어지는 것도 중요하지만 한 편의 영화는 그 자체로 완벽해야 된다는 생각을 가지고 있는지라...,"['영화', '는', '챕', '터', '챕', '터', '이어지는', '것', '도', '중요하지만', '한', '편의', '영화', '는', '그', '자체', '로', '완벽해야', '된다는', '생각', '을', '가지', '고', '있는지라']",1.6389577752720679,0.69
65,f4i0OJTcdAc,나름 아쉬웠던게 카론(컨티네탈 흑인 관리인)이 적이 방탄복 입을거라고 지가 말해놓고 자기랑 부하들은 소총이 잔득 있는 패닉룸을 뻔히 두고 권총으로 개긴거 왜 그런건지 모르겠네 무장을 못할 시간이 없던 상황도 아니였고,"['나름', '아쉬웠던게', '카론', '컨티', '네', '탈', '흑인', '관리인', '이', '적', '이', '방탄복', '입을거라고', '지가', '말', '해놓고', '자기', '랑', '부하', '들', '은', '소총', '이', '잔득', '있는', '패닉룸', '을', '뻔히', '두고', '권총', '으로', '개긴거', '왜', '그런', '건', '지', '모르겠네', '무장', '을', '못', '할', '시간', '이', '없던', '상황', '도', '아니였고']",-0.3344588644876258,-0.13
66,f4i0OJTcdAc,초반 액션이 정말 엄청났고......후반에 레이드 출연 배우들은 잘하긴 하는데 뭔가 키아누리브스와 합이 안맞는 느낌이 있더군요,"['초반', '액션', '이', '정말', '엄청났고', '후반', '에', '레이드', '출연', '배우', '들', '은', '잘', '하긴', '하는데', '뭔가', '키', '아누', '리브', '스', '와', '합', '이', '안', '맞는', '느낌', '이', '있더군요']",4.250082445115868,1.74
67,f4i0OJTcdAc,액션으로 시작해서 액션으로 끝나는 영화 눈이 쉴틈이 없다,"['액션', '으로', '시작', '해서', '액션', '으로', '끝나는', '영화', '눈', '이', '쉴', '틈', '이', '없다']",-0.5082232619053666,-0.24
68,f4i0OJTcdAc,진짜 액션이 어디서 본듯하고 어색한부분도 많덩데 최고걸작은 아니다...,"['진짜', '액션', '이', '어디서', '본', '듯', '하고', '어색한', '부분', '도', '많', '덩데', '최고', '걸작', '은', '아니다']",0.5616896060188731,0.25
69,f4i0OJTcdAc,거의 대부분의 헐리우드 영화 시리즈가 1회는 와아 ~ 2회는 대박 ᆢ3회는 걍 ㅠㅠ 단 마블 영화 시리즈는 빼구 ᆢ 마블 거는 언제나 3번째 작품이 가장 좋음 ~~~,"['거의', '대부분', '의', '헐리우드', '영화', '시리즈', '가', '1회', '는', '와아', '2회', '는', '대박', '3회', '는', '걍', '단', '마블', '영화', '시리즈', '는', '빼구', '마블', '거', '는', '언제나', '3', '번째', '작품', '이', '가장', '좋음']",3.745599531408377,1.5
70,f4i0OJTcdAc,혼자 극장 가면서 걱정하다가 입장하자마자 동호회 온 느낌 ㅋ,"['혼자', '극장', '가면', '서', '걱정', '하다가', '입장', '하', '자마자', '동호회', '온', '느낌']",-1.9941344837024642,-0.96
