,id,sentence,comment_cut,score,ratio
683,XIYupTmgUCE,처음에는 친동생인지 궁금하게 해놓고<br>후반부는 그런게 중요하지 않다고 없애버림<br>영화 전체적인 플롯이 전혀 자연스럽지 않고<br>카매라 연출도 산만함<br><br>전체적으로 관객이 집중할수 있는 부분이 없음<br><br>마치 예를 들면<br><br>놀자고 친구(영화) 를 불렀는데 친구 혼자서 여기저기 뛰어다니면서<br>난장판(친자) 을 치더니 갑자기 노는건 중요하지 않다면서 혼자서 뛰쳐나감<br><br>감독은 재능없음<br>소재만 좋고 전혀 흐름이 안됨,"['처음', '에는', '친', '동생', '인지', '궁금하게', '해놓고', '후반', '부는', '그런게', '중요하지', '않다고', '없애', '버림', '영화', '전체', '적', '인', '플롯', '이', '전혀', '자연', '스럽지', '않고', '카', '매라', '연출', '도', '산만함', '전체', '적', '으로', '관객', '이', '집중', '할수', '있는', '부분', '이', '없음', '마치', '예', '를', '들면', '놀자고', '친구', '영화', '를', '불렀는데', '친구', '혼자', '서', '여기저기', '뛰어다니면서', '난장판', '친자', '을', '치더니', '갑자기', '노는건', '중요하지', '않다면서', '혼자', '서', '뛰', '쳐', '나감', '감독', '은', '재능', '없음', '소재', '만', '좋고', '전혀', '흐름', '이', '안됨']",12.18032503037912,4.21
684,XIYupTmgUCE,저도 아쉬운점이 있다면 유진의 시점과<br>마지막에 유진은 어떻게 되는지 장면등이 나왔으면 좋겠다는 생각이 들네요.,"['저', '도', '아쉬운', '점', '이', '있다면', '유진', '의', '시점', '과', '마지막', '에', '유진', '은', '어떻게', '되는지', '장면', '등', '이', '나왔으면', '좋겠다는', '생각', '이', '들네요']",-0.11354249795765624,-0.05
685,XIYupTmgUCE,명쾌한 설명 좋았습니다.,"['명쾌한', '설명', '좋았습니다']",1.0468288764978333,0.71
686,XIYupTmgUCE,그리 치자면 온갖 역대급 망작들도 작가 의도로 설명된다.,"['그리', '치자', '면', '온갖', '역대', '급', '망작', '들', '도', '작가', '의도', '로', '설명', '된다']",0.6792967996808323,0.32
687,XIYupTmgUCE,영화가 아니라.. <br>소설이었다면 등장인물들의 감정라인을 따라가는데.. 더 쉽게.. 이해할수있었을것 같네요..^^;;,"['영화', '가', '아니라', '소설', '이었다면', '등장인물', '들', '의', '감정', '라인', '을', '따라가는데', '더', '쉽게', '이해', '할수있었을것', '같네요']",3.693234545996927,1.66
688,XIYupTmgUCE,역시 영화보다 더 재밌는 설명이네요. ^^,"['역시', '영화', '보다', '더', '재밌는', '설명', '이네', '요']",4.033412880392644,2.12
689,ETZ6DAqcy5w,"절벽에서 했던 대화를 보면 친동생이 맞는것 같은데...<br>친동생은 맞지만 그동안 벌인 짓이나 가족을 망치려는 걸 용서할 수 없어서 절벽에서 손을 놓는 정당함?을 만들기위해(친동생임을 부정하고싶어서) 일부러 풍선 색이 달랐다고 거짓말을 했을 수도 있지 않을까요...?<br>마지막 유전자결과를 보지 않고 없앤건 볼 필요도 없이 친동생이 아니라 그런 걸 수도 있지만, 결과를 보고싶지않아서(친동생이 확실하다는걸 알고싶지않아서) 또는 이미 끝난 일이라 볼 필요가 없어서(친동생이지만 자기가 손을 놓음으로써 가족이란 틀 밖으로 간주했기때문에) 그랬을 수도 있을거 같아요. 처음에 무열님이 집이란 어떤 의미냐는 질문을 받았을 때 대답을 못했지만, 마지막에 지효언니의 손을 놓으면서 집(가족)을 완성?한게 아닌가 싶기도하고...<br>하... 이래서 닫힌 결말이 좋은데ㅠㅠㅠ","['절벽', '에서', '했던', '대화', '를', '보면', '친', '동생', '이', '맞는것', '같은', '데친', '동생', '은', '맞지만', '그동안', '벌인', '짓', '이나', '가족', '을', '망치려는', '걸', '용서', '할', '수', '없어서', '절벽', '에서', '손', '을', '놓는', '정당함을', '만들기', '위해', '친', '동생', '임', '을', '부정', '하고싶어서', '일부러', '풍선', '색', '이', '달랐다고', '거짓말', '을', '했을', '수도', '있지', '않을까요', '마지막', '유전자', '결과', '를', '보지', '않고', '없앤건', '볼', '필요', '도', '없이', '친', '동생', '이', '아니라', '그런', '걸', '수도', '있지만', '결과', '를', '보고싶지', '않아서', '친', '동생', '이', '확실하다는걸', '알고싶지', '않아서', '또는', '이미', '끝난', '일이', '라', '볼', '필요', '가', '없어서', '친', '동생', '이지만', '자기', '가', '손', '을', '놓', '음', '으로써', '가족', '이란', '틀', '밖', '으로', '간주', '했기', '때문', '에', '그랬을', '수도', '있을거', '같아요', '처음', '에', '무열', '님', '이', '집', '이란', '어떤', '의미', '냐', '는', '질문', '을', '받았을', '때', '대답', '을', '못', '했지만', '마지막', '에', '지', '효언니', '의', '손', '을', '놓으면서', '집', '가족', '을', '완성', '한', '게', '아닌가', '싶기도', '하고하', '이래서', '닫힌', '결말', '이', '좋은데']",-2.3555180900849595,-0.74
690,ETZ6DAqcy5w,동생의 정체와 유전자 결과를 보지 않는 이유는 저랑 생각이 같네요ㅋㅋㅋ,"['동생', '의', '정체', '와', '유전자', '결과', '를', '보지', '않는', '이유', '는', '저', '랑', '생각', '이', '같네요']",0.6735470309435965,0.31
691,ETZ6DAqcy5w,잘 보고감니당 영상 추출은 1080 부탁드림니앙 720 아숩,"['잘', '보고', '감니당', '영상', '추출', '은', '1080', '부탁드림니', '앙', '720', '아숩']",1.5653472598304967,0.77
692,ETZ6DAqcy5w,아숩지 않게 다음 영상은 1080으로 추출가겠습니다.,"['아숩', '지', '않게', '다음', '영상', '은', '1080', '으로', '추출', '가겠습니다']",-0.02640836698624352,-0.01
693,ETZ6DAqcy5w,차라리 주인공이 정신병으로 착란증을 보인 것이였다. 송지효는 자신의 진짜 여동생이였다. 모든것은 주인공의 망각이였고 눈을 떠보니 자신 앞에 피투성이가 된 가사 도움직원들과 가족들이 자신의 앞에 있었다.<br>이런식으로만 끝났어도 망작 소리까지는 안 들었을거다.,"['차라리', '주인공', '이', '정신병', '으로', '착란', '증', '을', '보인', '것', '이', '였다', '송지효', '는', '자신', '의', '진짜', '여동생', '이', '였다', '모든', '것', '은', '주인공', '의', '망각', '이', '였고', '눈', '을', '떠보니', '자신', '앞', '에', '피', '투성이', '가', '된', '가사', '도움', '직원', '들', '과', '가족', '들', '이', '자신', '의', '앞', '에', '있었다', '이런', '식', '으로만', '끝났어도', '망작', '소리', '까지는', '안', '들었을거다']",-0.8202869885924505,-0.3
694,ETZ6DAqcy5w,오누이간 애증의 팽팽한 갈등구조가 이야기의 중심축인줄 알았는데 중간에 여동생의 정체를 적나라하게 보여주면서 갑자기 긴장감이 깨저버리더군요.,"['오누이', '간', '애증', '의', '팽팽', '한', '갈등', '구조', '가', '이야기', '의', '중심', '축', '인', '줄', '알았는데', '중간', '에', '여동생', '의', '정체', '를', '적나라하게', '보여주면서', '갑자기', '긴장감', '이', '깨저', '버리더군요']",,
695,ETZ6DAqcy5w,공감합니다. 좋은 길이 있는데 자극적인 선택을 한 느낌이었습니다.,"['공감', '합니다', '좋은', '길이', '있는데', '자극', '적', '인', '선택', '을', '한', '느낌이었습니다']",2.509911811414829,1.21
696,ETZ6DAqcy5w,"예고편 보자마자, 뻔한 스토리에 진부한 연출을 나타낼거 같아서 안 봤는데, 역시........... 그런 영화가 맞았네요.<br>왜 예고편만 봐도 이런 느낌이 오는지 아는 이유가, 한국 영화는 이런 작위적인 틀이 변화지 않아서였네요.<br>결국.......변화하지 않는 게으름이 문제였네요<br>좋은 영상 감사합니다^^","['예고편', '보자마자', '뻔한', '스토리', '에', '진부한', '연출', '을', '나타낼거', '같아서', '안', '봤는데', '역시', '그런', '영화', '가', '맞았네요', '왜', '예고편', '만', '봐도', '이런', '느낌', '이', '오는지', '아는', '이유', '가', '한국', '영화', '는', '이런', '작위', '적', '인', '틀', '이', '변화', '지', '않아서', '였네요', '결국', '변화', '하', '지', '않는', '게으름', '이', '문제', '였네요', '좋은', '영상', '감사합니다']",5.152768038202008,1.89
697,ETZ6DAqcy5w,"@영화제작기초 아 ㅎㅎ<br>당연히 작품을 만드는데 있어서 게으름을 했다고하는게 아니라, 저도 변화하지 않는 것에 대한 게으름부분에 대해서 말했습니다 ㅎㅎ<br>오해의 소지가 있는것에 대한 친절한 부연설명까지 감사합니다 ㅎㅎ","['영화제작', '기초', '아', '당연히', '작품', '을', '만드는데', '있어서', '게으름', '을', '했다고하는게', '아니라', '저', '도', '변화', '하지', '않는', '것', '에', '대한', '게으름', '부분', '에', '대해', '서', '말', '했습니다', '오해', '의', '소지', '가', '있는것에', '대한', '친절한', '부연', '설명', '까지', '감사합니다']",2.874487159232447,1.11
698,ETZ6DAqcy5w,"우선 영상을 좋게 봐주셔서 너무나 감사합니다.<br>그런데 댓글을 읽다 아차 했습니다.<br>결과론적으론 각본이 게을러 보인다고 표현했는데, 감독과 스텝들이 게으르다고는 생각하지 않습니다. 저는 이 영화를 찍는 과정에서 발생한 변수를 알 순 없습니다. 영화를 찍다 보면 예상치 못한 상황과 위기가 분명히 오게 됩니다. 그 과정에서 감독은 작품의 완성을 위해 포기와 선택을 하게 되죠. 제가 신중치 못하게 이러한 변수를 통틀어서 &#39;게으르다&#39;라는 단어를 선택했네요. 감독님과 스텝들은 어떠한 상황이든 최선의 노력을 다한다고 생각합니다. 다만 god3254835님 말처럼 한국 영화에서 공통적으로 느껴지는 특유의 틀이 있습니다. 그것이 과한 안정지향성이던가, 조금의 안일함 일순 있습니다. 그러한 지점은 좀 더 도전적이고 과감성이  필요해 보입니다. 변화는 새로움이고 그 새로움은 즐거움이니까요. 오해의 소지가 있을까 봐 글이 길어졌네요. 좀 더 신중하게 영상을 만들겠습니다. 감사합니다.","['우선', '영상', '을', '좋게', '봐주셔서', '너무나', '감사합니다', '그런데', '댓글', '을', '읽다', '아차', '했습니다', '결과', '론', '적', '으론', '각본', '이', '게을러', '보인다고', '표현', '했는데', '감독', '과', '스텝', '들', '이', '게으르다고는', '생각', '하지', '않습니다', '저', '는', '이', '영화', '를', '찍는', '과정', '에서', '발생', '한', '변수', '를', '알', '순', '없습니다', '영화', '를', '찍다', '보면', '예', '상치', '못', '한', '상황', '과', '위기', '가', '분명히', '오게', '됩니다', '그', '과정', '에서', '감독', '은', '작품', '의', '완성', '을', '위해', '포기', '와', '선택', '을', '하게', '되죠', '제', '가', '신중', '치', '못', '하게', '이러한', '변수', '를', '통틀어', '서', '39', '게으르다', '39', '라는', '단어', '를', '선택', '했네요', '감독', '님', '과', '스텝', '들', '은', '어떠한', '상황', '이든', '최선', '의', '노력', '을', '다', '한다고', '생각', '합니다', '다만', 'god', '3254835', '님', '말', '처럼', '한국', '영화', '에서', '공통', '적', '으로', '느껴지는', '특유', '의', '틀', '이', '있습니다', '그것', '이', '과', '한', '안정', '지향성', '이던', '가', '조금', '의', '안일함', '일', '순', '있습니다', '그러한', '지점', '은', '좀', '더', '도전', '적', '이고', '과감', '성', '이', '필요해', '보입니다', '변화', '는', '새', '로움', '이고', '그', '새', '로움', '은', '즐거움', '이니까', '요', '오해', '의', '소지', '가', '있을까', '봐', '글', '이', '길어졌네요', '좀', '더', '신중하게', '영상', '을', '만들겠습니다', '감사합니다']",16.656464448559184,5.09
699,ETZ6DAqcy5w,"저도 어제 영화 &#39;침입자&#39; 봤는데, 연출면에서 많이 아쉬운 영화입니다.<br>송지효씨가 분한 &#39;유진&#39;이라는 캐릭터가 지은죄(극중에서 드러난 서진의 아내에 대한 살인교사죄, 가정부 이모와 하연이 아빠에 대한 살인죄, 하연이에 대한 아동유괴죄 및 종교단체에서 &#39;백성연&#39;이라는 이름으로 지었을 여죄들)가 많기 때문에 비참한 최후를 맞는 것은 어쩔수 없다고 생각은 하는데, 배역을 담당한 송지효씨의 선하고 예쁜 이미지를 생각하면 유진을 &#39;나름 사연 있는 여성 악역&#39;이라는 캐릭터로서 절벽씬에서 슬프게 연출해서 유진의 최후를 표현했으면 영화 마무리가 매끄럽고 여운이 많이 남았을 것이라고 생각합니다.<br>또한, 김무열씨가 분한 &#39;서진&#39; 캐릭터도 사고로 잃은 부인에 대한 아픔과 어린 딸 &#39;예나&#39;를 지키고자 하는 부성애를 가진 사람(가족애가 있는 사람)인데,  절벽씬에서 유진의 손을 놔버리고 죽게 한것과 2번째 유전자 검사결과 서류를 바로 파쇄하는 것을 보면서 극중에서 유진이 친여동생이 맞는지 아닌지 여부를 확실하게 표현하지 못한 부분이  많이 아쉬웠습니다.<br>저는 개인적으로 유진이 친여동생이 맞다고 생각하는데, 영화의 예고편에서 서진이 &quot;이 여자 실은 제 여동생이 아닐수도 있습니다.&quot;라고 말하면서 관객들에게 유진을 처음부터 의심하도록 상황을 만들지만, 극중에서 유진의 최후이후에 서진이 2번째 유전자 검사 결과(2번다 동일한 기관에서 발행함.)를 굳이 파쇄하는 부분을 넣은 것과, 영화 말미에 두분 부모님이 &quot;이 세상 어딘가 살아있을 유진을 기다린다.&quot;라고 대사하는 부분을 보면서, 비록 악역으로서 많은 악행을 저지르고 비참한 최후를 맞았지만 유진이 친여동생은 맞다라고 암시하는 것이라고 생각합니다.<br>영화 후반부에서 유진이 예나를 데리고 종교단체로 갈때 서진이 나타나자 칼을 휘두르며, &quot;그날 오빠가 나를 잃어버릴 때 내 운명이 이렇게 되어 버렸어. 이 모든 것이 오빠 잘못이야.&quot;라고 서진에 대해 원망하고, 유진이 최후의 절벽씬에서 간절하게 &quot;오빠, 엄마가 내손 꼭 잡고 놓지말라고 했잖아, 나를 버리면 오빠 평생 후회할 꺼야&quot;라고 말하면서 서진에게 목숨을 구걸합니다. 관객들에게 한번더 유진이 친여동생이 맞을지도 모른다고 복선을 줍니다.<br>따라서 이 영화는 관객들에게 유진이 친여동생은 맞지만, 지은죄가 많아서 결국 비참한 최후를 맞이한다라고 결론을 맺는 것 같은데,  두 주연 배우의 내면 심리 묘사(부연설명)를 좀 더 했으면 결말에 대한 여운이 크게 남았을 것이라고 생각해요.","['저', '도', '어제', '영화', '39', '침입', '자', '39', '봤는데', '연출', '면', '에서', '많이', '아쉬운', '영화', '입니다', '송지효', '씨', '가', '분한', '39', '유진', '39', '이라는', '캐릭터', '가', '지은', '죄', '극', '중', '에서', '드러난', '서진', '의', '아내', '에', '대한', '살인', '교사', '죄', '가정부', '이모', '와', '하연', '이', '아빠', '에', '대한', '살인죄', '하연', '이', '에', '대한', '아동', '유괴', '죄', '및', '종교', '단체', '에서', '39', '백', '성연', '39', '이라는', '이름', '으로', '지었을', '여', '죄', '들', '가', '많기', '때문', '에', '비참한', '최후', '를', '맞는', '것', '은', '어쩔', '수', '없다고', '생각', '은', '하는데', '배역', '을', '담당', '한', '송지효', '씨', '의', '선하고', '예쁜', '이미지', '를', '생각', '하면', '유진', '을', '39', '나름', '사연', '있는', '여성', '악역', '39', '이라는', '캐릭터', '로서', '절벽씬', '에서', '슬프게', '연출', '해서', '유진', '의', '최후', '를', '표현', '했으면', '영화', '마무리', '가', '매끄럽고', '여운', '이', '많이', '남았을', '것', '이라고', '생각', '합니다', '또한', '김무열', '씨', '가', '분한', '39', '서진', '39', '캐릭터', '도', '사고', '로', '잃은', '부인', '에', '대한', '아픔', '과', '어린', '딸', '39', '예나', '39', '를', '지키고자', '하는', '부', '성', '애', '를', '가진', '사람', '가족', '애가', '있는', '사람', '인데', '절벽씬', '에서', '유진', '의', '손', '을', '놔', '버리고', '죽게', '한', '것', '과', '2', '번째', '유전자', '검사', '결과', '서류', '를', '바로', '파쇄', '하는', '것', '을', '보면서', '극', '중', '에서', '유진', '이', '친', '여동생', '이', '맞는지', '아닌지', '여부', '를', '확실하게', '표현', '하지', '못', '한', '부분', '이', '많이', '아쉬웠습니다', '저', '는', '개인', '적', '으로', '유진', '이', '친', '여동생', '이', '맞다고', '생각', '하는데', '영화', '의', '예고편', '에서', '서진', '이', 'quot', '이', '여자', '실', '은', '제', '여동생', '이', '아닐수도', '있습니다', 'quot', '라고', '말', '하면서', '관객', '들', '에게', '유진', '을', '처음', '부터', '의심', '하도록', '상황', '을', '만들지만', '극', '중', '에서', '유진', '의', '최후', '이후', '에', '서진', '이', '2', '번째', '유전자', '검사', '결과', '2', '번', '다', '동일한', '기관', '에서', '발행', '함를', '굳이', '파쇄', '하는', '부분', '을', '넣은', '것', '과', '영화', '말미', '에', '두', '분', '부모님', '이', 'quot', '이', '세상', '어딘가', '살아있을', '유진', '을', '기다린다', 'quot', '라고', '대사', '하는', '부분', '을', '보면서', '비록', '악역', '으로서', '많은', '악행', '을', '저지르고', '비참한', '최후', '를', '맞았지만', '유진', '이', '친', '여동생', '은', '맞다라고', '암시', '하는', '것', '이라고', '생각', '합니다', '영화', '후반', '부', '에서', '유진', '이', '예나', '를', '데리', '고', '종교', '단체', '로', '갈', '때', '서진', '이', '나타나자', '칼', '을', '휘두르며', 'quot', '그날', '오빠', '가', '나를', '잃어버릴', '때', '내', '운명', '이', '이렇게', '되어', '버렸어', '이', '모든', '것', '이', '오빠', '잘못', '이야', 'quot', '라고', '서진', '에', '대해', '원망하고', '유진', '이', '최후', '의', '절벽씬', '에서', '간절하게', 'quot', '오빠', '엄마', '가', '내', '손', '꼭', '잡고', '놓지말라고', '했잖아', '나를', '버리면', '오빠', '평생', '후회', '할', '꺼야', 'quot', '라고', '말', '하면서', '서진', '에게', '목숨', '을', '구걸', '합니다', '관객', '들', '에게', '한번', '더', '유진', '이', '친', '여동생', '이', '맞을지도', '모른다고', '복선', '을', '줍니다', '따라서', '이', '영화', '는', '관객', '들', '에게', '유진', '이', '친', '여동생', '은', '맞지만', '지은', '죄', '가', '많아서', '결국', '비참한', '최후', '를', '맞이', '한', '다라', '고', '결론', '을', '맺는', '것', '같은데', '두', '주연', '배우', '의', '내면', '심리', '묘', '사부', '연설', '명', '를', '좀', '더', '했으면', '결말', '에', '대한', '여운', '이', '크게', '남았을', '것', '이라고', '생각', '해요']",-13.076433497118005,-3.54
700,ETZ6DAqcy5w,"공감이 많이 가는 말씀입니다. 유진을 너무 단편적으로 소모했다는 생각이 들어요.<br>개인적으로는 지금의 이야기는 너무 타이트해 보입니다. 주인공 서진은 외적으론 25년 만에 돌아온 동생의 정체를 밝혀야 하고, 내적으로는 동생을 잃어버린 죄책감, 그리고 죽은 아내와 자신의 딸에게 잘해주지 못한 죄책감을 해결하여 성장을 마쳐야 합니다. 캐릭터는 변화해야 하니까요. 차라리 내적인 문제 둘 중, 하나를 덜어내고 다른 하나에 집중했다면 어땠을까라는 생각이 들어요. 동생 유진의 캐릭터가 얇은 건, 관객이 얻을 수 있는 진실된 유진의 정보가 너무 적기 때문이라 생각합니다. 말씀대로 &#39;나름 사연 있는&#39; 이 부분이 거의 없는 거나 마찬가지죠.(두 가지 내적 문제 중 하나를 덜어내고 &#39;나름 사연 있는&#39; 정보가 들어갈 여백이 필요해 보입니다.)<br>지금의 이야기를 봤을 때 &#39;뺑소니를 당한 아내 하지만 범인은 찾지 못했다&#39;와 &#39;25년 만에 돌아온 동생의 진실 찾기&#39;의 두 가지를 굳이 하나의 이야기로 묶을 필요가 있었나라는 생각이 들어요. 두 문장 자체를 봐도 자연스럽게 엮이지 않는 이야기라 생각됩니다. 하고 싶은 말, 이 영화를 통해 전달하고 싶은 메시지가 너무 많은 것 같더군요. 하나의 이야기를 최적화시켜도 90분이란 시간은 길지 않습니다. 만약 시나리오를 봤다면 선택과 집중이 필요하다는 생각이 가장 먼저 들었을 것 같았습니다. 물론 제 개인적인 생각입니다.","['공감', '이', '많이', '가는', '말씀', '입니다', '유진', '을', '너무', '단편', '적', '으로', '소모', '했다는', '생각', '이', '들어요', '개인', '적', '으로는', '지금', '의', '이야기', '는', '너무', '타이', '트해', '보입니다', '주인공', '서진', '은', '외적', '으론', '25년', '만에', '돌아온', '동생', '의', '정체', '를', '밝혀야', '하고', '내적', '으로는', '동생', '을', '잃어버린', '죄책감', '그리고', '죽은', '아내', '와', '자신', '의', '딸', '에게', '잘해주지', '못', '한', '죄책감', '을', '해결', '하여', '성장', '을', '마쳐야', '합니다', '캐릭터', '는', '변화', '해야', '하니', '까요', '차라리', '내적인', '문제', '둘', '중', '하나', '를', '덜어내고', '다른', '하나', '에', '집중', '했다면', '어땠을까', '라는', '생각', '이', '들어요', '동생', '유진', '의', '캐릭터', '가', '얇은', '건', '관객', '이', '얻을', '수', '있는', '진실된', '유진', '의', '정보', '가', '너무', '적기', '때문', '이라', '생각', '합니다', '말씀', '대로', '39', '나름', '사연', '있는', '39', '이', '부분', '이', '거의', '없는', '거나', '마찬가지', '죠', '두', '가지', '내적', '문제', '중', '하나', '를', '덜어내고', '39', '나름', '사연', '있는', '39', '정보', '가', '들어갈', '여백', '이', '필요해', '보입니다', '지금', '의', '이야기', '를', '봤을', '때', '39', '뺑소니', '를', '당한', '아내', '하지만', '범인', '은', '찾지', '못', '했다', '39', '와', '3925년', '만에', '돌아온', '동생', '의', '진실', '찾기', '39', '의', '두', '가지', '를', '굳이', '하나', '의', '이야기', '로', '묶을', '필요', '가', '있었나라는', '생각', '이', '들어요', '두', '문장', '자체', '를', '봐도', '자연', '스럽게', '엮', '이지', '않는', '이야기', '라', '생각', '됩니다', '하고', '싶은', '말', '이', '영화', '를', '통해', '전달', '하고', '싶은', '메시지', '가', '너무', '많은', '것', '같더군요', '하나', '의', '이야기', '를', '최적화', '시켜도', '90분', '이란', '시간', '은', '길지', '않습니다', '만약', '시나리오', '를', '봤다면', '선택', '과', '집중', '이', '필요하다는', '생각', '이', '가장', '먼저', '들었을', '것', '같았습니다', '물론', '제', '개인', '적', '인', '생각', '입니다']",3.3819622023802696,0.99
701,ETZ6DAqcy5w,영화의 유일한 교훈 신천지는 사회의 악이다..,"['영화', '의', '유일한', '교훈', '신천지', '는', '사회', '의', '악', '이다']",3.922110600175486,1.96
702,ETZ6DAqcy5w,생각해보니 현대 이슈를 관통하는 영화네요ㅋㅋㅋ,"['생각', '해보니', '현대', '이슈', '를', '관통', '하는', '영화', '네', '요']",0.4366719814940644,0.22
703,ETZ6DAqcy5w,영화를보면서 모든게 김무열의 허상일거라고 내내기대ㅎㅎㅎ저만그랬을까요?ㅎㅎ<br>그리고 진짜 친동생? 어찌생각하세용<br>리뷰잘봤습니다.^^~~항상행복하세요,"['영화', '를', '보면서', '모든', '게', '김무열', '의', '허상', '일거라고', '내', '내', '기', '대저', '만', '그랬을까요', '그리고', '진짜', '친', '동생', '어찌', '생각', '하', '세용', '리뷰', '잘', '봤습니다', '항상', '행복하세요']",4.575731431967065,1.87
