,id,sentence,comment_cut,score,ratio
1467,CDcwymmo5Xs,그 마지막 일본애들이 전투에서 확실히 때리지도않았는데 막고있고 그런부분에선 좀 실망이었고<br>그 버스2대로 온 호텔전투는 확실히 전작보다 나았다고 생각합니다.,"['그', '마지막', '일', '본', '애', '들', '이', '전투', '에서', '확실히', '때리지도', '않았는데', '막고있고', '그런', '부분', '에선', '좀', '실망', '이었고', '그', '버스', '2', '대로', '온', '호텔', '전투', '는', '확실히', '전작', '보다', '나았다고', '생각', '합니다']",-1.0706116841380644,-0.43
1468,CDcwymmo5Xs,"존윅 1,2편의 액션과 진행성등이 뛰어나서 3편도 좋았지만 비교적 안좋게 보얐다고 생각합니다. 그래도 재밌게봤습니다^^ 특히 칼을 던지는 전투와 개를 이용한 전투가 <br>재밌었습니다","['존윅', '12', '편의', '액션', '과', '진행', '성', '등', '이', '뛰어나서', '3', '편도', '좋았지만', '비교', '적', '안좋게', '보얐다고', '생각', '합니다', '그래도', '재밌게', '봤습니다', '특히', '칼', '을', '던지는', '전투', '와', '개', '를', '이용', '한', '전투', '가', '재밌었습니다']",2.1144915188257403,0.83
1469,CDcwymmo5Xs,존윅 팬으로써 앞으로의 스토리 전개를 위한 텔링은 괜찮았다고 생각하고 더욱더 기대를 하게만드는 부분이라고 생각해 라이너님 말을 부정하겠지만<br>확실히 존윅의 카리스마를 하락시킨다던지 택티컬한 싸움을 하지 않는다 일본애들을 부각시킨다 는 확실히 동감한다고 생각합니다<br>저도 지루해지더라구요<br>카리스마 하락도 굉장히 좀 그렇던데 차라리 저격을 한다던지 폭발물을 쓴다던지 이런걸쓴다면 확실히 존윅의 전술적인면을 돋보이면서<br>역시 무서워서 바로 달려들지 못한다 이런 인상을 남길수 있었을텐데<br>그렇다면 액션씬이 별로 재미가 없어질꺼같기도하고 딜레마네요<br>확실히 콘티넨탈 호텔에서 벌어졌던 전투가 나았던것 같습니다<br>정규군은 어쩔수 없이 두려워하지 않고 제압을 해야하는거니까요,"['존윅', '팬', '으로써', '앞', '으로의', '스토리', '전개', '를', '위', '한', '텔링', '은', '괜찮았다고', '생각', '하고', '더욱더', '기대', '를', '하게', '만드는', '부분', '이라고', '생각', '해', '라이너', '님', '말', '을', '부정', '하겠지만', '확실히', '존윅', '의', '카리스마', '를', '하락', '시킨다던지', '택티컬', '한', '싸움', '을', '하지', '않는다', '일', '본', '애', '들', '을', '부각시킨다', '는', '확실히', '동감', '한다고', '생각', '합니다', '저', '도', '지루해지더라구요', '카리스마', '하락', '도', '굉장히', '좀', '그렇던데', '차라리', '저격', '을', '한다던지', '폭발물', '을', '쓴다던지', '이런', '걸', '쓴다면', '확실히', '존윅', '의', '전술', '적인면을', '돋보이면서', '역시', '무서워서', '바로', '달려들지', '못', '한다', '이런', '인상', '을', '남길수', '있었을텐데', '그렇다면', '액션씬', '이', '별로', '재미', '가', '없어질꺼', '같', '기도', '하고', '딜레마', '네', '요', '확실히', '콘티', '넨탈', '호텔', '에서', '벌어졌던', '전투', '가', '나았던것', '같습니다', '정규', '군', '은', '어쩔', '수', '없이', '두려워하지', '않고', '제압', '을', '해야하는거니까', '요']",3.930663550145234,1.27
1470,CDcwymmo5Xs,세계관을 설명하지 않으면 존윅이 살아 있는 것자체를 이해시킬 방법이 없음.,"['세계관', '을', '설명', '하지', '않으면', '존윅', '이', '살', '아', '있는', '것', '자체', '를', '이해', '시킬', '방법', '이', '없음']",3.3219477221350355,1.47
1471,CDcwymmo5Xs,영화관에서 처음으로 잠시 졸뻔함,"['영화관', '에서', '처음', '으로', '잠시', '졸', '뻔함']",1.045981437690668,0.57
1472,CDcwymmo5Xs,존윅 대역도 너무 티가나 몰입도를 떨어뜨림 마지막 호텔 전투신은 괜찮았음.,"['존윅', '대역', '도', '너무', '티', '가나', '몰입도', '를', '떨어뜨림', '마지막', '호텔', '전', '투신', '은', '괜찮았음']",0.6759529711654878,0.31
1473,CDcwymmo5Xs,"저는 존윅 3도 1, 2 와 같은 액션만 보여줬더라면 그것대로 식상해질것 같았는데 1, 2와 같은 액션과 동물과 하는 액션 등 다양한 시도를 한것이 눈에 보여서 좋았습니다 ㅎㅎ","['저', '는', '존윅', '3', '도', '1', '2', '와', '같은', '액션', '만', '보여줬더라면', '그것', '대로', '식상해질', '것', '같았는데', '1', '2', '와', '같은', '액션', '과', '동물', '과', '하는', '액션', '등', '다양한', '시도', '를', '한', '것', '이', '눈', '에', '보', '여서', '좋았습니다']",3.58574090856669,1.38
1474,CDcwymmo5Xs,빡빡이가 입을 안열었어야.....,"['빡빡이', '가', '입', '을', '안', '열었어야']",0.25540227109958363,0.14
1475,CDcwymmo5Xs,저는 액션영화의 마스터피스가 탄생했다고 생각합니다.진짜 정점을 찍은 것 같아요.쌈마이한 부분부터 세계관 확장까지 종합 선물세트라는 생각이 들어요.지적하신 것처럼 택티컬한 액션이 좀 줄어든 것은 살짝 아쉽다고는 생각하지만 후반부 동양 무술 영화를 오마주한듯한 장면들도 꽤나 좋았습니다<br>4편을 안보고선 못 배기게 만들어 버렸어요~,"['저', '는', '액션영화', '의', '마스터피스', '가', '탄생', '했다고', '생각', '합니다', '진짜', '정점', '을', '찍은', '것', '같아요', '쌈', '마이', '한', '부분', '부터', '세계관', '확장', '까지', '종합', '선물', '세트', '라는', '생각', '이', '들어', '요지', '적', '하신', '것', '처럼', '택티컬', '한', '액션', '이', '좀', '줄어든', '것', '은', '살짝', '아쉽다고는', '생각', '하지만', '후반', '부', '동양', '무술', '영화', '를', '오마주', '한', '듯', '한', '장면', '들', '도', '꽤', '나', '좋았습니다', '4', '편', '을', '안', '보고선', '못', '배기', '게', '만들어', '버렸어요']",13.696086580821568,4.77
1476,CDcwymmo5Xs,"전 재미있게 봤습니다.<br>2회차 했고요.<br>개연성을 맞출 시간에 존윅은 4명을 더 죽입니다.<br>그리고 그 전작들은 적들이 마피아조직이었지만, 이번엔 동업자들입니다. 동업자들은 존윅을 전설이라 생각하지만 &quot;은퇴&quot;한 전설. 퇴역군인같은 존재입니다. 이런 차이는 존윅1에서도 나와요. 호텔에서 동업자들의 반응을 보세요. 되게 건조합니다. 동업자세계밖에서는 마피아보스도 적으로 두고 싶지않은 바바예가이지만 킬러들세계에서는 [저 사람을 죽이면 그 명예는 내것이다]입니다.<br>마치 원피스같은 존재에요. 그러니 핫바리부터 이름있는 킬러들까지 다 덤비는거지요.<br>그리고 이번엔 상대가 전세계 킬러입니다. 그러니 어쌔신의 어원이라는 학설이 유력한 중동부터 아시아계 암살자집단을 보여줘야 했지요. 그래야 전세계가 널 노린다는걸 확인시켜줄 수 있으니까요.<br>와패니즈는 어쩔 수 없습니다.<br>동양의 암살자 이미지는 일본닌자라는게 할리우드에 깊숙이 박혀 있으니까요. <br>윈스턴의 말에 생각을 바꾸는것도 납득이 가는게 존윅은 무뚝뚝하지만 기브앤테이크는 확실합니다.<br>1편에서 마커스가 죽었을 때 자신을 돕다가 죽었기에 복수한거고<br>이번에도 윈스턴이 고의적으로 존윅이 도망가게 하고 파면까지 시간을 주게 되어서 심판관에게 퇴출명령당한거잖아요. 존윅도 그걸 알고 있었을거라 생각합니다.<br>그리고 존윅은 이 룰에서 벗어나고 싶어합니다. 이건 한결같아요. 그런데 장로를 따르면 자신은 평생 여기에 얽매여야 하는다는걸 생각했을겁니다.<br>세상 모든이가 적이고 자기 혼자인줄 알고 있었기에 장로 앞에서는 굴복했는데<br>막상ㅂ 윈스턴을 죽이려고 왔더니<br>혼자가 아니네? 내게 싸울 총을 줄 아군이 있네?<br> ㅅㅂ 최고의회 X까 함 해보자였지않았을까 합니다.<br>물론 전부 감독 오피셜이 아닌 제 뇌피셜입니다만, 존윅은 이렇게 보는게 마음이 편하다고 생각합니다.<br>마음편히 존윅이 사람 죽이는걸 보면 되는거지요.","['전', '재미있게', '봤습니다', '2회', '차', '했고요', '개연', '성', '을', '맞출', '시간', '에', '존윅', '은', '4', '명', '을', '더', '죽입니다', '그리고', '그', '전작', '들', '은', '적', '들', '이', '마피아', '조직', '이었지만', '이번', '엔', '동', '업자', '들입니다', '동', '업자', '들', '은', '존윅', '을', '전설', '이라', '생각', '하지만', 'quot', '은퇴', 'quot', '한', '전설', '퇴역군인', '같은', '존재', '입니다', '이런', '차이는', '존윅', '1', '에서도', '나와요', '호텔', '에서', '동', '업자', '들', '의', '반응', '을', '보세요', '되게', '건조합니다', '동', '업자', '세계', '밖', '에서는', '마피아', '보스', '도', '적', '으로', '두고', '싶지', '않은', '바바예', '가', '이지만', '킬러', '들', '세계', '에서는', '저', '사람', '을', '죽이면', '그', '명예', '는', '내', '것', '이다', '입니다', '마치', '원피스', '같은', '존재', '에요', '그러니', '핫', '바리', '부터', '이름있는', '킬러', '들', '까지', '다', '덤비는거지요', '그리고', '이번', '엔', '상대', '가', '전세계', '킬러', '입니다', '그러니', '어쌔신', '의', '어원', '이라는', '학설', '이', '유력한', '중동', '부터', '아시아', '계', '암살자', '집단', '을', '보여줘야', '했지요', '그', '래야', '전세계', '가', '널', '노린다는걸', '확인', '시켜줄', '수', '있으니까', '요', '와', '패', '니', '즈', '는', '어쩔', '수', '없습니다', '동양', '의', '암살자', '이미지', '는', '일', '본', '닌자', '라는', '게', '할리우드', '에', '깊숙이', '박혀', '있으니까', '요', '윈스턴', '의', '말', '에', '생각', '을', '바꾸는것도', '납득', '이', '가는게', '존윅', '은', '무뚝뚝하지만', '기', '브', '앤테이', '크는', '확실합니다', '1', '편', '에서', '마커스', '가', '죽었을', '때', '자신', '을', '돕다가', '죽었기에', '복수', '한거고', '이번', '에도', '윈스턴', '이', '고', '의적', '으로', '존윅', '이', '도망가게', '하고', '파면', '까지', '시간', '을', '주게', '되어서', '심판', '관', '에게', '퇴', '출', '명령', '당한거잖아요', '존윅', '도', '그걸', '알', '고', '있었을거라', '생각', '합니다', '그리고', '존윅', '은', '이', '룰', '에서', '벗어나고', '싶어', '합니다', '이건', '한결같아요', '그런데', '장로', '를', '따르면', '자신', '은', '평생', '여기', '에', '얽매여야', '하는다는걸', '생각', '했을', '겁니다', '세상', '모든', '이', '가', '적', '이고', '자기', '혼자', '인', '줄', '알', '고', '있었기에', '장로', '앞', '에서는', '굴복', '했는데', '막상', '윈스턴', '을', '죽이려고', '왔더니', '혼자', '가', '아니네', '내게', '싸울', '총', '을', '줄', '아군', '이', '있네', '최고', '의회', 'X', '까', '함', '해보자였지', '않았을까', '합니다', '물론', '전부', '감독', '오피셜', '이', '아닌', '제', '뇌피셜', '입니다만', '존윅', '은', '이렇게', '보는게', '마음', '이', '편하다고', '생각', '합니다', '마음', '편히', '존윅', '이', '사람', '죽이는걸', '보면', '되는거지요']",27.756426411655195,7.88
1477,CDcwymmo5Xs,문제점은 억지스러운 유머를 넣는 부분이입니다.<br>그점은 공감합니다.<br>&quot;내 개를 쐈어&quot;<br>&quot;이해해&quot;<br>이정도까지가 딱 괜찮았을 개그수준인데<br>무슨 빡빡이 빠돌이를 등장시킨건 좀 그랬어요.<br>일본 오타쿠들이 그런 면이 있는건 알지만 너무 오바스러운 유머포인트였습니다.,"['문제점', '은', '억지스러운', '유머', '를', '넣는', '부분', '이', '입니다', '그', '점', '은', '공감', '합니다', 'quot', '내', '개', '를', '쐈어', 'quotquot', '이해해', 'quot', '이', '정도', '까지가', '딱', '괜찮았을', '개그', '수준', '인데', '무슨', '빡빡이', '빠돌이', '를', '등장', '시킨건', '좀', '그랬어요', '일본', '오타쿠', '들', '이', '그런', '면', '이', '있는건', '알', '지만', '너무', '오', '바', '스러운', '유머', '포인트', '였습니다']",0.8183652681235639,0.3
1478,CDcwymmo5Xs,까는사람이까서그렇지 좋은영화구요 와패니즘이랄것까지없고 존윅세계관속의 일본암살자에 데한 깊은 설정을 드러낸것에 불과하다고 봅니다 설명이많은건 이제서야 뒤를생각하고 영화를 만들었기떄문이죠 꼭 영화관에가서 보시는걸 추천합니다,"['까는', '사람', '이', '까서', '그렇지', '좋은', '영', '화구', '요', '와', '패', '니', '즘', '이', '랄것', '까지', '없고', '존윅', '세계', '관속', '의', '일', '본', '암살자', '에', '데', '한', '깊은', '설정', '을', '드러낸것에', '불과하다고', '봅니다', '설명', '이', '많은건', '이제', '서야', '뒤', '를', '생각', '하고', '영화', '를', '만들었기', '떄', '문이죠', '꼭', '영화관', '에가', '서', '보시는걸', '추천', '합니다']",6.56186402999468,2.4
1479,CDcwymmo5Xs,"저도 보면서 1,2편에서 보여줄만한건 다 보여줬고 소재도 떨어져서 동물액션도 넣고 닌자도 넣고 이것저것 열심히 새로운 시도를 한것까지는 좋았는데... 그게 존윅스러운지 아닌지 까지는 생각하지 못한게 아닌가 싶었네요. 무엇보다 아쉬웠던건 1,2편은 존윅의 감정에 공감이 되서 스토리를 따라갈수있었는데 이번편은 존윅이 어떤 감정상태인지 모르겠더군요. 존윅이 뭘해야할지 몰라서 혼란스러워하는것처럼 보였어요. 존윅이... 살고싶어서 이것도 시도해보고 저것도 시도해보면서 길을 잃고 헤매는 느낌이랄까요? 그래서 여기저기 돌아다니니까 볼거리는 많은데 내용은 산만하고 지루해졌다고 생각합니다. 저는 제일 어처구니 없었던 부분이 마지막 전투장면에서 지배인이 존윅에게 &#39;은퇴해 계신동안 최고회의 정예병의 방어력이 올라갔다&#39;고 얘기하고 그래서 존윅에게는 산탄총같은걸 쥐어주면서 정작 자기들, 콘티넨탈 호텔의 직원들은 권총을 들고가서 아무것도 못하고 몰살당하는 부분이었습니다. 총이 아까웠던 걸까요? 벽에 그렇게 많이 걸려있었는데?? 존윅이 활약해야되니까 엑스트라들에게 줄 총은 없다는 느낌이었는데... 그럴거면 적들의 방탄장비 성능이 높다는걸 모르고 갔다가 죽게들 만들던가 아니면 차라리 투입시키지 않는게 나았을것같아요. 아내도 잃고 개도 잃고 차도 잃고 집도 잃고 친구도 제손으로 죽이고... 모든걸 다 잃은것 같지만 킬러로서의 명성만큼은 남아있는 존윅, 부디 4편에서는 존윅이 싸울 이유를 만들어주고 시리즈를 잘 마무리해줬으면 좋겠습니다.","['저', '도', '보면서', '12', '편', '에서', '보여줄만', '한', '건', '다', '보여줬고', '소재', '도', '떨어져서', '동물', '액션', '도', '넣고', '닌자', '도', '넣고', '이', '것', '저', '것', '열심히', '새로운', '시도', '를', '한', '것', '까지는', '좋았는데', '그게', '존윅', '스러운', '지', '아닌지', '까지는', '생각', '하지', '못', '한게', '아닌가', '싶었네요', '무엇', '보다', '아쉬웠던건', '12', '편', '은', '존윅', '의', '감정', '에', '공감', '이', '되서', '스토리', '를', '따라갈수있었는데', '이번', '편', '은', '존윅', '이', '어떤', '감정', '상태', '인지', '모르겠더군요', '존윅', '이', '뭘', '해야', '할지', '몰라서', '혼란', '스러워하는것처럼', '보였어요', '존윅', '이', '살고싶어서', '이', '것', '도', '시도', '해보고', '저', '것', '도', '시도', '해보면서', '길', '을', '잃고', '헤매는', '느낌', '이', '랄', '까요', '그래서', '여기저기', '돌아다니니까', '볼거리', '는', '많은데', '내용', '은', '산만하고', '지루해졌다고', '생각', '합니다', '저', '는', '제일', '어처구니', '없었던', '부분', '이', '마지막', '전투', '장면', '에서', '지배인', '이', '존윅', '에게', '39', '은퇴', '해', '계신', '동안', '최고', '회의', '정예', '병', '의', '방어', '력', '이', '올라갔다', '39', '고', '얘기', '하고', '그래서', '존윅', '에게는', '산탄총', '같은걸', '쥐어주면서', '정작', '자기', '들', '콘티', '넨탈', '호텔', '의', '직원', '들', '은', '권총', '을', '들고가서', '아무', '것', '도', '못', '하고', '몰살', '당하는', '부분', '이었습니다', '총', '이', '아까웠던', '걸까', '요', '벽', '에', '그렇게', '많이', '걸려있었는데', '존윅', '이', '활약', '해야', '되니까', '엑스트라', '들', '에게', '줄', '총', '은', '없다는', '느낌이었는데', '그럴거면', '적', '들', '의', '방탄', '장비', '성능', '이', '높다는걸', '모르고', '갔다가', '죽게', '들', '만들던가', '아니면', '차라리', '투입', '시키지', '않는게', '나았을것', '같아요', '아내', '도', '잃고', '개도', '잃고', '차도', '잃고', '집도', '잃고', '친구', '도', '제', '손', '으로', '죽', '이고', '모든', '걸', '다', '잃은것', '같지만', '킬러', '로서', '의', '명성', '만큼은', '남아있는', '존윅', '부디', '4', '편', '에서는', '존윅', '이', '싸울', '이유', '를', '만들어주고', '시리즈', '를', '잘', '마무리', '해줬으면', '좋겠습니다']",18.325508337078382,5.36
1480,CDcwymmo5Xs,그 빡빡이...<br>입 다물고 쫓을때만 해도 그러려니 했는데 콘티넨탈 호텔에서 당신의 왕팬이에요 ! 하는거 보고... 엥..?,"['그', '빡빡', '이입', '다물고', '쫓을', '때', '만', '해도', '그러려니', '했는데', '콘티', '넨탈', '호텔', '에서', '당신', '의', '왕팬', '이에요', '하는거', '보고', '엥']",1.7909438624333898,0.77
1481,CDcwymmo5Xs,그게 존윅 세계관의 묘미아닐까요?,"['그게', '존윅', '세계관', '의', '묘미', '아닐까', '요']",0.6951254627697794,0.38
1482,CDcwymmo5Xs,개인적으론 2편이 왜 존윅이 <br>서약을 했는가?에 대해 이해만<br>더 시켜줄수있었다면 1편과 동급으로 <br>잘만들었다고 생각해서 2편을 <br>상당히 좋게 생각했는데<br>이번편은... 잘모르겠네요...,"['개인', '적', '으론', '2', '편이', '왜', '존윅', '이', '서약', '을', '했는가에', '대해', '이해만', '더', '시켜줄수있었다면', '1', '편', '과', '동', '급', '으로', '잘', '만들었다고', '생각', '해서', '2', '편', '을', '상당히', '좋게', '생각', '했는데', '이번', '편', '은', '잘', '모르겠네요']",6.074482103731692,2.37
1483,CDcwymmo5Xs,@Hw S 아니면 같이 술마시다가 <br>존윅이 엄청 취해서 별것도 아닌거에 <br>보증서준거일수도?,"['Hw', 'S', '아니면', '같이', '술', '마시다가', '존윅', '이', '엄청', '취해', '서', '별것', '도', '아닌거에', '보증', '서준거', '일수', '도']",1.2060621760366417,0.53
1484,CDcwymmo5Xs,2편에서 나오는 서약을 한 이유는 왕게임에서 졌기 때문입니다,"['2', '편', '에서', '나오는', '서약', '을', '한', '이유', '는', '왕게임', '에서', '졌기', '때문', '입니다']",0.9599673963964921,0.45
1485,CDcwymmo5Xs,전문가의 시선으로 본 영화는 완전히 틀리네요!,"['전문가', '의', '시선', '으로', '본', '영화', '는', '완전히', '틀리네요']",2.544123041540663,1.3
1486,CDcwymmo5Xs,존윅 시리즈같은 액션 영화가 있었던가. 나에게는 시리즈가 몇 편까지 나오더라도 인생 액션 영화♡ 근데 제로의 얼굴에서 도올 김용옥 선생님이 보였던 건 나 혼자인가봉가~ ㅋㅋㅋㅋㅋㅋㅋ,"['존윅', '시리즈', '같은', '액션', '영화', '가', '있었던가', '나', '에게는', '시리즈', '가', '몇', '편', '까지', '나오더라도', '인생', '액션', '영화', '근데', '제로', '의', '얼굴', '에서', '도올', '김용옥', '선생님', '이', '보였던', '건', '나', '혼자', '인', '가봉', '가']",4.128002792382056,1.63
1487,CDcwymmo5Xs,중간쯤 개노잼이라 맨뒤에서 현진이 경기봤었는데 희유........,"['중간', '쯤', '개', '노잼', '이라', '맨뒤', '에서', '현', '진', '이', '경기', '봤었는데', '희', '유']",-1.2414109980499308,-0.58
1488,CDcwymmo5Xs,빡빠기는 입만 안 열었으면 좋았을 뻔 했어요,"['빡빠기', '는', '입', '만', '안', '열었으면', '좋았을', '뻔', '했어요']",0.14502909102285272,0.07
1489,CDcwymmo5Xs,갓 라이너님 다크소울 비유는 너무 공감이 확가네요,"['갓', '라이너', '님', '다크', '소울', '비유', '는', '너무', '공감', '이', '확', '가네요']",-0.05327013076698095,-0.03
1490,CDcwymmo5Xs,힘을 너무 준거같아요. 과하게 스타일리쉬하고...액션도 부자연스럽고 맞춘 느낌이 강하더라고요.<br>음향이나 음악도 뻔했던거같은...전작에 비해 액션이 많음에도 인상깊은 장면이 없었어요.,"['힘', '을', '너무', '준거', '같아요', '과', '하게', '스타', '일리', '쉬', '하고', '액션', '도', '부자연스럽고', '맞춘', '느낌', '이', '강하더라고요', '음향', '이나', '음악', '도', '뻔했던거', '같은', '전작', '에', '비해', '액션', '이', '많음에도', '인상', '깊은', '장면', '이', '없었어요']",3.3924172876402476,1.33
1491,CDcwymmo5Xs,유혈낭자한 액션영화 보러오면서 &#39;아흐~~~~&#39;하는 것들! 내숭이냐? 이정도인줄 몰랐던거냐?? 집중이 안되~~~,"['유혈', '낭자', '한', '액션영화', '보러오면서', '39', '아흐', '39', '하는', '것', '들', '내숭', '이냐', '이', '정도', '인', '줄', '몰랐던거냐', '집중', '이', '안되']",1.5620762419593686,0.67
1492,CDcwymmo5Xs,초중반에서에서너무 탕탕탕 월월월 챙챙챙 탕탕탕 하다가 후반부에 퍽퍼퍽퍼거퍽,"['초', '중반', '에서', '에서', '너무', '탕탕', '탕', '월월월', '챙챙챙', '탕탕', '탕', '하다가', '후반', '부', '에', '퍽퍼퍽퍼거퍽']",0.05716970689903447,0.03
1493,CDcwymmo5Xs,쉴세없이 휘몰아치는 액션 <br>저는 이거 하나만으로도 너무 재미있게 봤어요,"['쉴세', '없이', '휘', '몰아치는', '액션', '저', '는', '이', '거', '하나', '만으로도', '너무', '재미있게', '봤어요']",4.25694845003118,1.98
1494,CDcwymmo5Xs,액션 너무 느리고 현실감없이 합맞추려고 기다리는거 티나고 액션만 주구장창 나오니 질려서 지루하고<br>레지던트 이블 전처를 밟고 있는거같은. 존윅의 카리스마가 사라진 편,"['액션', '너무', '느리고', '현', '실감', '없이', '합', '맞추려고', '기다리는거', '티나', '고', '액션', '만', '주', '구', '장창', '나오니', '질려서', '지루하고', '레지던트', '이블', '전', '처', '를', '밟고', '있는거', '같은', '존윅', '의', '카리스마', '가', '사라진', '편']",0.08663174678950608,0.03
1495,CDcwymmo5Xs,존윅3 을 보고 뭔가 찝찝하고 재미없다는 느낌을 받았었는데 제가 느낀 그 느낌을 잘 설명해주신거 같네요 채널 즐겨보고있습니다. 앞으로도 많은 리뷰 영상 부탁드립니다.,"['존윅', '3', '을', '보고', '뭔가', '찝찝하고', '재미없다는', '느낌', '을', '받았었는데', '제', '가', '느낀', '그', '느낌', '을', '잘', '설명', '해주신거', '같네요', '채널', '즐겨', '보고있습니다', '앞', '으로도', '많은', '리뷰', '영상', '부탁드립니다']",7.844004200827622,3.19
