,id,sentence,comment_cut,score,ratio
151,A6Vn67Sdmig,이번 리뷰도 너무 잘 봤습니다~ㅎㅎ 다음엔 더 좋은 캐릭터로 만나기를...^^;;ㅎㅎ,"['이번', '리뷰', '도', '너무', '잘', '봤습니다', '다음', '엔', '더', '좋은', '캐릭터', '로', '만나기를']",7.395299843293429,3.5
152,A6Vn67Sdmig,아이구 우리 미남 배우 일주님! 저야말로 영화 잘 봤지용 ㅎㅎ 항상 기대하고 있답니다~ 지일주 파이팅!,"['아이구', '우리', '미남', '배우', '일주', '님', '저', '야말로', '영화', '잘', '봤지용', '항상', '기대하고', '있답니다', '지일주', '파이팅']",4.90782223608543,2.23
153,A6Vn67Sdmig,앗! 일주님이다♡ 진짜 일주님 맞으세요??!! 영화 재밌게 잘 봤습니다^^! 일주님 나오셔서 정말 반가웠어요! 일주님이 주인공이었으면 좋겠다는 생각을 했는데ㅎㅎ<br>일주님 웃으실때 진짜 너무너무 선하고 환하고 이쁘신데 그 미소가 돋보일 역 많이 맡으시면 좋겠어요^^!<br>앞으로도 좋은 활동 기대할게요~ 항상 응원합니다^^!<br>(알앤제이 연극도 정말 잘 봤어요🤗),"['앗', '일주', '님', '이다', '진짜', '일주', '님', '맞으세요', '영화', '재밌게', '잘', '봤습니다', '일주', '님', '나오셔서', '정말', '반가웠어요', '일주', '님', '이', '주인공', '이었으면', '좋겠다는', '생각', '을', '했는데', '일주', '님', '웃으실', '때', '진짜', '너무', '너무', '선하고', '환하고', '이쁘신', '데', '그', '미소', '가', '돋보일', '역', '많이', '맡으시면', '좋겠어요', '앞', '으로도', '좋은', '활동', '기대할게요', '항상', '응원', '합니다', '알', '앤제이', '연극', '도', '정말', '잘', '봤어요']",15.749506560849348,5.67
154,A6Vn67Sdmig,공효진씨 술취한척 하는 상태의 연기들이 러블리하고 섹시했습니다~,"['공효진', '씨', '술', '취한', '척', '하는', '상태', '의', '연기', '들', '이', '러블리', '하고', '섹시했습니다']",1.0406554022808554,0.48
155,A6Vn67Sdmig,"라이너님 말씀대로 명백히 단점도 있는 영화였지만, <br>기존의 병림픽같던 한국영화중에서 그나마 괜찮은 영화였어요.<br>아무생각없이 2시간 웃을 수 있었던 영화였네요~<br>한국영화가 이 정도만 돼도, 매 주말마다 영화관 가는건데.....<br>영화관은 이렇게 많은 나라가 왜 볼만한 영화는 없을까요....","['라이너', '님', '말씀', '대로', '명백히', '단점', '도', '있는', '영화', '였지만', '기존', '의', '병림픽같던', '한국영', '화중', '에서', '그나마', '괜찮은', '영화', '였어요', '아무', '생각', '없이', '2시간', '웃', '을', '수', '있었던', '영화', '였네요', '한국영', '화', '가', '이', '정도', '만', '돼도', '매', '주말', '마다', '영화관', '가는건데', '영화관', '은', '이렇게', '많은', '나라', '가', '왜', '볼', '만', '한', '영화', '는', '없을까요']",-4.754781324948148,-1.74
156,A6Vn67Sdmig,이정도면 잘 만들었다 정도가 아니라 그냥 잘만들었다 할수있는 작품<br>후반에 &#39;으잉?&#39;하는 장면들만 없었어도 더 좋았을걸 하는 아쉬움이 있지만 감독님의 첫 장편이라 생각하면 다음 작품이 기대됩니다,"['이', '정도', '면', '잘', '만들었다', '정도', '가', '아니라', '그냥', '잘', '만들었다', '할수있는', '작품', '후반', '에', '39', '으잉', '39', '하는', '장면', '들', '만', '없었어도', '더', '좋았을걸', '하는', '아쉬움', '이', '있지만', '감독', '님', '의', '첫', '장편', '이라', '생각', '하면', '다음', '작품', '이', '기대', '됩니다']",6.224514138999369,2.37
157,A6Vn67Sdmig,리뷰보니 오늘 당장 영화보고싶어지네요^^ 두 주연배우보고 러블리한 밤 보내겠습니다~~♥,"['리뷰', '보니', '오늘', '당장', '영화', '보고싶어지네요', '두', '주연', '배우', '보고', '러블리', '한', '밤', '보내겠습니다']",4.34684174736172,2.03
158,A6Vn67Sdmig,이영화 잼있어요♡♡ 공효진 김래원 매력터짐!! 라이너님도 이영화처럼 매력넘치는 분 얼릉 만나셔서 알콩달콩지지고볶는깨소금연애하세요!!♡♡라이너님 인연이여 어서 오라~~~!!!^^,"['이영화', '잼있어요', '공효진', '김래원', '매력', '터짐', '라이너', '님', '도', '이영화', '처럼', '매력', '넘치는', '분', '얼릉', '만나셔서', '알콩달콩', '지지', '고', '볶는', '깨소금', '연애', '하세요', '라이너', '님', '인연', '이여', '어서', '오라']",3.993466568853904,1.62
159,A6Vn67Sdmig,로코는 역시 공효진👍,"['로코', '는', '역시', '공효진']",1.488450984174813,0.93
160,A6Vn67Sdmig,솔로라 로코는 보러가기 힘들다 ㅜ ㅜ,"['솔로', '라', '로코', '는', '보러가기', '힘들다']",-1.7133990944217454,-0.96
161,A6Vn67Sdmig,6점~7점 기대했는데 5점이라 아쉬워요 ㅎㅎ 영화는 재미있었습니다,"['6', '점', '7', '점', '기대했는데', '5', '점', '이라', '아쉬워요', '영화', '는', '재미있었습니다']",0.9341205556111761,0.45
162,A6Vn67Sdmig,마지막 소주 비유 너무 좋아요 레몬소주 인정합니다 ㅎㅎ,"['마지막', '소주', '비유', '너무', '좋아요', '레몬', '소주', '인정', '합니다']",4.607802578336726,2.36
163,A6Vn67Sdmig,그냥 뻔한 사랑타령 그 이상 그 이하도 아닌듯. 막장 로맨스가 아니다 뿐이지 뭐 특이점도 없는듯. 그리고 성인이랍시고 애들도 아니고 뒷담화 왕따 시키는 애들은 참 인생 헛 사는듯. 그러고 자기자식 앞에선 떳떳하고 착한척 할거 생각하면 구역질 나옴,"['그냥', '뻔한', '사랑', '타령', '그', '이상', '그', '이하', '도', '아닌듯', '막장', '로맨스', '가', '아니다', '뿐', '이지', '뭐', '특이점', '도', '없는듯', '그리고', '성인', '이', '랍시고', '애', '들', '도', '아니고', '뒷담화', '왕따', '시키는', '애', '들', '은', '참', '인생', '헛', '사는듯', '그러고', '자기', '자식', '앞', '에선', '떳떳하고', '착한', '척', '할거', '생각', '하면', '구역질', '나옴']",5.305021137980961,1.96
164,A6Vn67Sdmig,술 마시는 장면이 너무 많이 나와서 좀..그래도 볼만은 했어요ㅎㅎ,"['술', '마시는', '장면', '이', '너무', '많이', '나와서', '좀', '그래도', '볼', '만은', '했어요']",2.7429668703200614,1.32
165,A6Vn67Sdmig,한국영화에 대한 기대치가 낮아서 그런지 나쁘지않았습니다. 혹시 애드 아스트라도 리뷰계획있으신가요?,"['한국영', '화', '에', '대한', '기', '대', '치가', '낮아서', '그런지', '나쁘지', '않았습니다', '혹시', '애드', '아스트', '라도', '리뷰', '계획', '있으신', '가요']",-3.6360606513617784,-1.6
166,A6Vn67Sdmig,그래도 2천년대 중반에 명작이 많이 나왔죠. 타짜 태그끼 휘날리며 해바라기 추격자 등등 요,"['그래도', '2천년', '대', '중반', '에', '명작', '이', '많이', '나왔죠', '타짜', '태그', '끼', '휘날리며', '해바라기', '추격자', '등등', '요']",1.960239191445095,0.88
167,A6Vn67Sdmig,저 이거 개봉 날 보고 라이너님께 댓글로 리뷰 기대한다고 달았었는데! ^^ 전 이거 넘나 재밌게 봤어요 ㅋ,"['저', '이', '거', '개봉', '날', '보고', '라이너', '님', '께', '댓글', '로', '리뷰', '기대한다고', '달았었는데', '전', '이', '거', '넘나', '재밌게', '봤어요']",3.5290556237829307,1.53
168,A6Vn67Sdmig,@홍탁tv우파시인 네 다음 부계정,"['홍탁', 'tv', '우파', '시인', '네', '다음', '부', '계정']",-0.1486267810124956,-0.08
169,A6Vn67Sdmig,나도 노재팬 별로인데도  이거는  아니야,"['나도', '노', '재팬', '별로', '인데', '도', '이', '거', '는', '아니야']",0.15927943745924078,0.08
170,A6Vn67Sdmig,@김Angela 본인이 정치적 프사다는건 자유입니다 그리고 그 글밑에 리플다는거도 제 자유구요 시비라고 얼버무리시지말고 정확하게 이야기하시죠 본인이 발끈한게없었으면 무대응이나 당신의 의견을존중합니다 선에서 끝날수있일을 기어코 저보고 일본에가서 살라는 말도안되는 인신공격으로 되받아치는순간 당신이 시비를 건거죠 아닙니까?,"['김', 'Angela', '본인', '이', '정치', '적', '프사', '다는건', '자유', '입니다', '그리고', '그', '글밑', '에', '리플', '다는거도', '제', '자유', '구', '요', '시비', '라고', '얼버무리시지말고', '정확하게', '이야기', '하시죠', '본인', '이', '발끈', '한', '게', '없었으면', '무대', '응', '이나', '당신', '의', '의견', '을', '존중', '합니다', '선', '에서', '끝날수있', '일', '을', '기어', '코', '저', '보고', '일본', '에가', '서', '살라', '는', '말', '도', '안되는', '인신공격', '으로', '되', '받아치는', '순간', '당신', '이', '시비', '를', '건거', '죠', '아닙니까']",1.4779645960396697,0.52
171,A6Vn67Sdmig,@불쌍한세입자 내가 내 맘대로 프사도 못 답니까. 이게 시비거는 거에요. 다른데 가서 노세요. 여기선 아무도 정치 얘기 안합니다.,"['불쌍한세', '입자', '내', '가', '내', '맘대로', '프사', '도', '못', '답', '니까', '이', '게', '시', '비거', '는', '거', '에요', '다른데', '가서', '노세요', '여', '기선', '아무', '도', '정치', '얘기', '안', '합니다']",-1.4452536845049138,-0.59
172,A6Vn67Sdmig,@김Angela 뭐가 시비죠? 먼저 본인이 프사단거 다분히 정치적의도 가지고있길래 저는 제가 삽니다 갑니다 라고 리플단거고 님이 저보고 다짜고짜 조국인 대한민국을 떠나라면서요 그래서 제입장 이야기한겁니다 무슨 근거로 신고를 하신다는거죠?  지금은 한국떠나라는 도발 리플지우셨네요? 이미 캡쳐해놔서 별소용없습니다 . 이거도 시비식으로 이야기하시는데 알아서 판단하십시오,"['김', 'Angela', '뭐', '가', '시비', '죠', '먼저', '본인', '이', '프사', '단거', '다분히', '정치', '적', '의도', '가지고있길래', '저', '는', '제', '가', '삽니다', '갑니다', '라고', '리플', '단거고', '님', '이', '저', '보고', '다짜고짜', '조국', '인', '대한민국', '을', '떠나라면서요', '그래서', '제', '입장', '이야기', '한', '겁니다', '무슨', '근거', '로', '신고', '를', '하신다는거죠', '지금', '은', '한국', '떠나라는', '도발', '리플', '지우셨네요', '이미', '캡쳐', '해', '놔서', '별', '소용없습니다', '이', '거도', '시비', '식', '으로', '이야기', '하시는데', '알아서', '판단', '하십시오']",-5.696282941756942,-2.0
173,A6Vn67Sdmig,어제 남편과 보고왔어요~~ 가볍게 웃고 즐길수있는 영화예요~~저는 괜찮더라구요~,"['어제', '남편', '과', '보고왔어요', '가볍게', '웃고', '즐길수있는', '영화', '예요', '저', '는', '괜찮더라구요']",-0.25426703395622263,-0.12
174,A6Vn67Sdmig,오 국내 로맨틱 코미디 영화가 라이너님으로부터 5점을 받다니.. 이번 달에 보러가겠습니다,"['오', '국내', '로맨틱', '코미디', '영화', '가', '라이너', '님', '으로부터', '5', '점', '을', '받다니', '이번', '달', '에', '보러가겠습니다']",4.39269856809534,1.97
175,A6Vn67Sdmig,막내리기전에 꼭 보세요. 수위가 높은게 일부사람들에겐 흠이라면 흠이겠지만요.,"['막내리', '기전', '에', '꼭', '보세요', '수위', '가', '높은게', '일부', '사람', '들', '에겐', '흠', '이', '라면', '흠', '이', '겠지', '만요']",0.2972535620249944,0.13
176,A6Vn67Sdmig,"다음 영화 뭐 볼지 고민하고 있었는데, 다음 영화는 이걸로 해야 겠내요. ㅎㅎ","['다음', '영화', '뭐', '볼', '지', '고민', '하고', '있었는데', '다음', '영화', '는', '이', '걸', '로', '해야', '겠내요']",0.3374302575113434,0.15
177,A6Vn67Sdmig,????,[],0.0,-0.0
178,A6Vn67Sdmig,쉽고 가볍게 볼수 있는 영화인가 보네요,"['쉽고', '가볍게', '볼수', '있는', '영화', '인가', '보네요']",1.1888034764988475,0.64
179,A6Vn67Sdmig,너무 괜찮아요 진짜 깨알웃음,"['너무', '괜찮아요', '진짜', '깨알', '웃음']",2.5836874328608284,1.52
180,A6Vn67Sdmig,맞아요,['맞아요'],0.0,0.0
181,A6Vn67Sdmig,10번째 좋아요는 나꺼다 쿠쿸,"['10', '번째', '좋아요', '는', '나꺼다', '쿠쿸']",0.0,0.0
182,A6Vn67Sdmig,난 이영화 아주 재밌게 봤음 ㅋㅋㅋ,"['난', '이영화', '아주', '재밌게', '봤음']",2.01065265644674,1.18
183,A6Vn67Sdmig,조회수 3에 온 내 인생이 레전드,"['조', '회수', '3', '에', '온', '내', '인생', '이', '레전드']",0.14862678101249593,0.08
184,A6Vn67Sdmig,1빠,"['1', '빠']",0.0,0.0
185,A6Vn67Sdmig,설마 1등?<br>영화 보고 다시 올게요,"['설마', '1등', '영화', '보고', '다시', '올게요']",2.6171703313284005,1.47
186,A6Vn67Sdmig,일등인가.,"['일등', '인가']",0.0,0.0
187,QPAHDHyxyiQ,ㅋㅋㅋ 박지선님은 뭔죄야 ㅋㅋㅋㅋㅋ,"['박지선', '님', '은', '뭔', '죄', '야']",-2.0,-1.12
188,QPAHDHyxyiQ,둘다 부채질을 그렇게ㅋㅋㅋㅋㅋㅋㅋㅋ진짜 당황스러운가,"['둘다', '부채질', '을', '그렇게', '진짜', '당황', '스러운', '가']",3.244030264440935,1.7
189,QPAHDHyxyiQ,English sub please,"['English', 'sub', 'please']",0.0,0.0
190,QPAHDHyxyiQ,"@Nyai Sumie it is not drama, but movie. Ordinary romance. But there is a new drama where gong hyo jin is the main actress:- &quot;when the camellia blooms&quot;","['Nyai', 'Sumie', 'it', 'is', 'not', 'drama', 'but', 'movie', 'Ordinary', 'romance', 'But', 'there', 'is', 'a', 'new', 'drama', 'where', 'gong', 'hyo', 'jin', 'is', 'the', 'main', 'actress', 'quotwhen', 'the', 'camellia', 'bloomsquot']",0.0,0.0
191,QPAHDHyxyiQ,What the name drama,"['What', 'the', 'name', 'drama']",0.0,0.0
192,QPAHDHyxyiQ,걍 대놓고 까넼ㅋㅋㅋㅋㅋ장난반 진담반으로,"['걍', '대놓고', '까', '넼', '장', '난', '반', '진담', '반', '으로']",0.29648874244251144,0.15
193,QPAHDHyxyiQ,그 친화력 좋다던 공효진이 ㅋㅋㅋㅋㅋㅋㅋㅋㅋㅋㅋ ^^,"['그', '친화력', '좋다던', '공효진', '이']",0.33701437057989725,0.2
194,QPAHDHyxyiQ,오태식이 돌아왔구나~,"['오태식', '이', '돌아왔구나']",0.0,0.0
195,QPAHDHyxyiQ,그냥 둘다 다르게 사랑스럽❤️,"['그냥', '둘다', '다르게', '사랑스럽']",1.4324178540083308,0.89
196,QPAHDHyxyiQ,갑자기 레이첼맥아담스랑 라이언고슬링 생각나네ㅋㅋㅋ,"['갑자기', '레이첼', '맥', '아담', '스랑', '라이언', '고', '슬링', '생각나네']",0.14862678101249593,0.08
197,vBGnr2i_EeI,다 좋았다. 무조건 좋았다.<br>억수로 좋았습니당~^^,"['다', '좋았다', '무조건', '좋았다', '억', '수로', '좋았', '습', '니당']",0.0,0.0
198,vBGnr2i_EeI,댓글들에보니 비평인가? 평가인가?<br>영화는 영화~~어찌해서  보고 즐길줄 모를까요~<br>그런심리들은 현실에서두  불평 불만 투성이가 아닐까요~ 남일이지만 괜히 걱정 일프로~^^,"['댓글', '들', '에보니', '비평', '인가', '평가', '인가', '영화', '는', '영화', '어찌', '해서', '보고', '즐길줄', '모를까', '요', '그런', '심리', '들', '은', '현실', '에', '서두', '불평', '불만', '투성이', '가', '아닐까', '요', '남일', '이지만', '괜히', '걱정', '일', '프로']",-4.883726028050047,-1.92
199,vBGnr2i_EeI,엄마랑 보고 왔는데 둘 다 야해서 좋다고 함ㅋ...ㅋㅋㅋ...ㅋㅋ,"['엄마', '랑', '보고', '왔는데', '둘', '다', '야해서', '좋다고', '함']",3.3038552192929536,1.69
200,vBGnr2i_EeI,김래원달릴 때 소름돋았고 공효진이 ㅂㄱㅅㅇㅇ할 때 눈물 핑돔,"['김래원', '달릴', '때', '소름', '돋았고', '공효진', '이', '할', '때', '눈물', '핑돔']",-1.7981499214034415,-0.88
201,vBGnr2i_EeI,가장 보통의 연애가 아니라 가장 진상의 연애아닌가요 <br>술만 처먹다가 필름 끊기고 아니면 안끊기고 충동적으로만 굴다가 끝나는 영화,"['가장', '보통', '의', '연애', '가', '아니라', '가장', '진상', '의', '연애', '아닌가요', '술', '만', '처', '먹다가', '필름', '끊기고', '아니면', '안', '끊기고', '충', '동', '적', '으로만', '굴다', '가', '끝나는', '영화']",5.942590038008072,2.43
202,vBGnr2i_EeI,유튜브도 <br>관계자가 하는건가요?,"['유튜브', '도', '관계자', '가', '하는건', '가요']",0.0,0.0
203,vBGnr2i_EeI,노래 뭐에요..???,"['노래', '뭐', '에요']",0.0,0.0
204,vBGnr2i_EeI,한국영화에 트라우마 생겼다,"['한국영', '화', '에', '트라우마', '생겼다']",-4.0,-2.35
205,vBGnr2i_EeI,아직20대라그런가 공감도안되고 재미없었는데 평이너무좋더라구요,"['아직', '20', '대', '라그', '런가', '공감', '도', '안되고', '재미없었는데', '평이', '너무', '좋더라구요']",1.1592349228163927,0.56
206,vBGnr2i_EeI,"공효진은 홍콩영화같은 느낌도 잘어울릴 것 같은뎁 조금만 더 예술성있는 영화가 들어오길,,","['공효진', '은', '홍콩영화', '같은', '느낌', '도', '잘', '어울릴', '것', '같은뎁', '조금', '만', '더', '예술', '성', '있는', '영화', '가', '들어오길']",4.549932992554641,2.0
207,vBGnr2i_EeI,공효진 연기 진짜 자연스럽고 현실적이게 잘함 주근의 태양 때 처음 접했었는데 여전히 사랑스럽네,"['공효진', '연기', '진짜', '자연스럽고', '현', '실적', '이', '게', '잘', '함', '주근', '의', '태양', '때', '처음', '접', '했었는데', '여전히', '사랑스럽네']",4.432417854008337,1.95
208,vBGnr2i_EeI,하하... 정말 개연성 연출 스토리 <br>쥐뿔 뜯어먹은듯한<br>최악의 영화인데.. <br>이런 리뷰가 도대체 어떻게 나올 수 있는거지...?<br>광고겠지.... 스크립트가 있는것 처럼 보이는데<br>그렇지않다면 주관을 넘어 이건 영화보는 안목이 없는거지.<br>여러분들 영화관가서 만원 날리지마세요.<br>제발 부탁인데 이런영화는 망해야됩니다.,"['하하', '정말', '개연', '성', '연출', '스토리', '쥐뿔', '뜯어', '먹은듯', '한', '최악', '의', '영화', '인데', '이런', '리뷰', '가', '도대체', '어떻게', '나올', '수', '있는거지', '광고', '겠지', '스크립트', '가', '있는것', '처럼', '보이는데', '그렇지', '않다면', '주관', '을', '넘어', '이건', '영', '화보', '는', '안목', '이', '없는거지', '여러분', '들', '영화관', '가서', '만원', '날리지', '마세요', '제발', '부탁', '인데', '이런', '영화', '는', '망해야', '됩니다']",5.39960074962612,1.96
209,vBGnr2i_EeI,다른 유튜버 리뷰 영상에도 이런 비슷한 댓글 남기더니 여기도 남기셨네 이 영화 관계자랑 무슨 원수라도 지셨나요?ㅋㅋ 정말 순수하게 궁금함 왜 그렇게까지 악담을 하는지,"['다른', '유튜버', '리뷰', '영상', '에도', '이런', '비슷한', '댓글', '남기더니', '여기', '도', '남기셨네', '이', '영화', '관계자', '랑', '무슨', '원수', '라도', '지셨나요', '정말', '순수하게', '궁금함', '왜', '그렇게', '까지', '악담', '을', '하는지']",7.131604286108045,2.9
210,vBGnr2i_EeI,-까넹 사람들마다 영화보는 눈은 다른데 님이 뭔데 보지말라 망해라 그러시는지 ㅋㅋㅋㅋ 재밌게본사람 댓글 수두룩한데 재미는 없을지몰라도 공감은 충분히 느껴질수있는 영화고 님이 재미없다고 까내리고 이걸보고 재밌다고? 안목이없네 이런 말은 ㄹㅇ 사람 저급해보여요.,"['까넹', '사람', '들', '마다', '영', '화보', '는', '눈', '은', '다른데', '님', '이', '뭔', '데', '보지말라', '망해라', '그러시는지', '재밌게', '본', '사람', '댓글', '수두', '룩', '한', '데', '재미', '는', '없을지', '몰라도', '공감', '은', '충분히', '느껴질수있는', '영화', '고', '님', '이', '재미없다고', '까', '내리고', '이', '걸', '보고', '재밌다고', '안목', '이', '없네', '이런', '말', '은', '사람', '저급', '해보여요']",7.9055775140139755,2.9
211,vBGnr2i_EeI,아직 청소년인데 혼자 보고 와버렸습니다. 제 티켓 봐주시던 분이 절 굉장히 이상하게 보시던데... 그 때 저는 뛰쳐나왔어야 했습니다. 엄마가 무슨 영화 보고 왔냐고 물으시는데.... 엄마 미안.... 나 이거 봤어......,"['아직', '청소년', '인데', '혼자', '보고', '와', '버렸습니다', '제', '티켓', '봐주시던', '분', '이', '절', '굉장히', '이상하게', '보시던데', '그', '때', '저', '는', '뛰', '쳐', '나왔어야', '했습니다', '엄마', '가', '무슨', '영화', '보고', '왔냐고', '물으시는데', '엄마', '미안', '나', '이', '거', '봤어']",-0.6155806181332135,-0.24
212,vBGnr2i_EeI,나만 김래원보면 꼬치 떠오름?,"['나', '만', '김래원', '보면', '꼬치', '떠오름']",1.7296714160333249,0.97
213,vBGnr2i_EeI,30대 중후반 싱글인 나의 모습이 투영된 것 같은 영화...<br><br>보는 내내 씁쓸했네요,"['30', '대', '중후', '반', '싱글', '인', '나', '의', '모습', '이', '투영', '된', '것', '같은', '영', '화보', '는', '내내', '씁쓸했네요']",3.239427713101617,1.42
214,vBGnr2i_EeI,저는 집에 가져다두는 물건들 특히 고양이가 전 처에대한 미련이라구 생각되요~,"['저', '는', '집', '에', '가져다', '두는', '물건', '들', '특히', '고양이', '가', '전', '처', '에', '대한', '미련', '이라', '구', '생각', '되요']",1.056927723892432,0.46
215,vBGnr2i_EeI,진짜 ㄹㅇ 공효진너무 사랑스럽던데 크...,"['진짜', '공효진', '너무', '사랑스럽던데', '크']",2.055866095424064,1.21
216,vBGnr2i_EeI,굥효진의 섹드립과 김래원의 염세주의적 윾쾌함을 볼수 있는 대목이었다.<br><br>그리고 내가 봤는데 주조연. 단역 거의 안버리고 잘 써먹었다. 감독이 능력 존나 조음<br><br>P.s 비둘기랑 고양이한테 존나 고맙다.,"['굥효진', '의', '섹드립', '과', '김래원', '의', '염세', '주의', '적', '윾쾌함', '을', '볼수', '있는', '대목', '이었다', '그리고', '내', '가', '봤는데', '주', '조연', '단역', '거의', '안', '버리고', '잘', '써', '먹었다', '감독', '이', '능력', '존나', '조음', 'Ps', '비둘기', '랑', '고양이', '한테', '존나', '고맙다']",9.621041646815359,3.7
217,vBGnr2i_EeI,"비둘기랑 고양이,옥수수,주차금지 ㅋㅋㅋㅋ","['비둘기', '랑', '고양이', '옥수수', '주차', '금지']",0.0,0.0
218,vBGnr2i_EeI,이영화는 조연두 빛나지않앗음 신기하오 이런영화를 극칭찬하시니~,"['이영화', '는', '조연', '두', '빛나지', '않앗음', '신기하오', '이런', '영화', '를', '극', '칭찬', '하시니']",3.610568674060436,1.71
219,vBGnr2i_EeI,오늘 엄마랑 보고왔어요.<br>잠이 오지 않아요,"['오늘', '엄마', '랑', '보고왔어요', '잠', '이', '오지', '않아요']",-0.5675821459916693,-0.3
220,vBGnr2i_EeI,공효진은 통속적 멜로나 코미디영화의 틀에 묶기엔 아까운 배우다.거장하고 작업해서 그 진가를 제대로 발휘됐음 좋겠다.작품복이 없어 저평가된 배우중의 하나가 아닐까 싶다.연기는 좋은데 이제는 자기 진가를 드러낼 수 있는 작품을 골라서 출연했음 좋겠다.성격이 좋아 의리로 출연하는 경우도 많을거 같다.,"['공효진', '은', '통속', '적', '멜로', '나', '코미디', '영화', '의', '틀', '에', '묶기엔', '아까운', '배우다', '거장', '하고', '작업', '해서', '그', '진가', '를', '제대로', '발휘', '됐음', '좋겠다', '작품', '복', '이', '없어', '저', '평가', '된', '배우', '중', '의', '하나', '가', '아닐까', '싶다', '연기', '는', '좋은데', '이제', '는', '자기', '진가', '를', '드러낼', '수', '있는', '작품', '을', '골', '라서', '출연', '했음', '좋겠다', '성격', '이', '좋아', '의리', '로', '출연', '하는', '경우', '도', '많을거', '같다']",19.2811256608465,6.81
221,vBGnr2i_EeI,이뿌고멋있고말고  현실적이야,"['이뿌고', '멋있고말고', '현실', '적', '이야']",-0.1486267810124956,-0.09
222,vBGnr2i_EeI,엄마와 보면 안되는 그런 영화입니다,"['엄마', '와', '보면', '안되는', '그런', '영화', '입니다']",0.5818509772452221,0.32
223,vBGnr2i_EeI,전 아빠한테 추천해서 같아 보러 같은데 갑분싸..,"['전', '아빠', '한테', '추천', '해서', '같아', '보러', '같은데', '갑', '분', '싸']",1.1620892700416583,0.57
224,vBGnr2i_EeI,@김유정 섹드립 난무,"['김유정', '섹', '드립', '난무']",0.0,0.0
225,vBGnr2i_EeI,왜요 ?,"['왜', '요']",0.0,0.0
226,vBGnr2i_EeI,오늘 보고 왔어요ㅡ 완전 재미있어요. 꼭 보세요~.,"['오늘', '보고', '왔어요', '완전', '재미있어요', '꼭', '보세요']",0.7362730733012841,0.4
227,vBGnr2i_EeI,너무너무 재밌어요ㅠㅠ 유튜브에 풀리면 한번더 봐야지 ㅎㅎㅎ,"['너무', '너무', '재밌어요', '유튜브', '에', '풀리면', '한번', '더', '봐야지']",1.1910303874074006,0.61
