	Unnamed: 0	id	sentence	comment_cut	score	ratio
187	187	fCyf3HhvE1c	박상우 ㅋㅋㅋㅋ 님생각이 진리인냥 생각하니까 자낳괴소리나 하는거죠.	['박상우', '님생각', '이', '진리', '인', '냥', '생각', '하니까', '자낳괴소리', '나', '하는거죠']	1.1595893389660832	0.57
188	188	fCyf3HhvE1c	지금보러갑니다	['지금', '보러', '갑니다']	0.0	0.0
189	189	fCyf3HhvE1c	코미디보다  더재밌다고  느낀것이   저뿐인가요   ㅋㅋ   8점이상드림	['코미디', '보다', '더', '재밌다고', '느낀것이', '저', '뿐', '인가요', '8', '점', '이상', '드림']	-0.298776680736647	-0.14
190	190	fCyf3HhvE1c	요번 더킹이나 공조는..ㅠ	['요', '번', '더킹', '이나', '공조', '는']	0.05413528956063085	0.03
191	191	fCyf3HhvE1c	이 작품도 좀 취향이 타는 느낌이 드네요. 제 주변 지인들은 한재림 감독의&#39;관상&#39;이 예측 가능한 이여기임에도 후반까지 이어지는 긴장감에 높은 점수를주는 반면 &#39;더 킹&#39;은 이야기가 어떻게 마무리 될지 예측이 더 어려움에도 긴장감이&#39;관상&#39; 보다 많이 낮아 좀 불평하더군요. 저는 두 작품 다 대중 영화로써의 기본은충실히 이행한 작품이라 별 차이는 없다고 생각하는 입장이구요... 연기에 있어서&#39;관상&#39;이 조금 더 송강호, 이정재 매력에 기댄 점이 많은 걸 감안하면 &#39;관상&#39;은 조인성만제 몫을 했고 정우성과 배성우는 조금 밋밋한 느낌이었습니다. 류준열 씨는 좀 많이 과유 불급... 조연으로써 안희연 검사 역할을 맡은 김소진씨가 눈에 띄어 좋았습니다.	['이', '작품', '도', '좀', '취향', '이', '타는', '느낌', '이', '드네', '요', '제', '주변', '지인', '들', '은', '한재림', '감독', '의', '39', '관상', '39', '이', '예측', '가능한', '이여기', '임', '에도', '후반', '까지', '이어지는', '긴장감', '에', '높은', '점수', '를', '주는', '반면', '39', '더', '킹', '39', '은', '이야기', '가', '어떻게', '마무리', '될지', '예측', '이', '더', '어려움', '에도', '긴장감', '이', '39', '관상', '39', '보다', '많이', '낮아', '좀', '불평', '하더군요', '저', '는', '두', '작품', '다', '대중', '영화', '로써', '의', '기본', '은', '충실히', '이행', '한', '작품', '이라', '별', '차이는', '없다고', '생각', '하는', '입장', '이구', '요', '연기', '에', '있어서', '39', '관상', '39', '이', '조금', '더', '송강호', '이정재', '매력', '에', '기댄', '점', '이', '많은', '걸', '감안', '하면', '39', '관상', '39', '은', '조인', '성만제', '몫', '을', '했고', '정우성', '과', '배성우', '는', '조금', '밋밋한', '느낌이었습니다', '류준열', '씨', '는', '좀', '많이', '과유', '불급', '조연', '으로써', '안', '희', '연', '검사', '역할', '을', '맡은', '김소진', '씨', '가', '눈', '에', '띄어', '좋았습니다']	-24.112070064576997	-7.61
192	192	fCyf3HhvE1c	우리 두일이ㅠ...영화보면서 가장 멋있었던것 같네요..	['우리', '두', '일이', '영화', '보면서', '가장', '멋있었던것', '같네요']	-0.8630985440530358	-0.45
193	193	fCyf3HhvE1c	그물해주세요~	['그물', '해주세요']	0.0	0.0
194	194	fCyf3HhvE1c	류준열,김소진 두 배우를 발견한 것만으로도 감사하게 생각합니다. 더킹을 보기 전 공조를 보고 실망했던터라 아주 만족스러웠습니다. 자~ 이제 공조를 까봅시다 ㅋㅋ	['류준', '열', '김소진', '두', '배우', '를', '발견', '한', '것', '만으로도', '감사하게', '생각', '합니다', '더킹', '을', '보기', '전', '공조', '를', '보고', '실망했던', '터', '라', '아주', '만족스러웠습니다', '자', '이제', '공조', '를', '까', '봅시다']	-0.16418898277377306	-0.07
195	195	fCyf3HhvE1c	그 동안 평론으로 미리 짐작했을 때 대열차게 까일거라 예상했는데 의외의 평가네요. 그리고 정우성의 연기가 몰입에 방해가 될 정도로 아쉬웠습니다. 이제 중견 연기자인데 어찌 이리 연기가 안느시는지... 오랜 팬으로 좀 안타깝기까지 했습니다.	['그', '동안', '평론', '으로', '미리', '짐작', '했을', '때', '대', '열차', '게', '까', '일거라', '예상', '했는데', '의외', '의', '평가', '네', '요', '그리고', '정우성', '의', '연기', '가', '몰입', '에', '방해', '가', '될', '정도', '로', '아쉬웠습니다', '이제', '중견', '연기자', '인데', '어찌', '이리', '연기', '가', '안느시는지', '오랜', '팬', '으로', '좀', '안타깝기까지', '했습니다']	-0.7250786869324279	-0.27
196	196	fCyf3HhvE1c	느낌은 아수라느낌이 나는 영화인것<br>같습니다	['느낌', '은', '아수라', '느낌', '이', '나', '는', '영화인', '것', '같습니다']	1.4897118494456116	0.74
197	197	fCyf3HhvE1c	아노하나리뷰해주실수있으시나요?<br>엄청난 감동과 여훈을 줍니다.	['아노하나', '리뷰', '해주실수있으시나요', '엄청난', '감동', '과', '여훈', '을', '줍니다']	2.930708014618138	1.5
198	198	fCyf3HhvE1c	ㅕ영주 개뜬금 ㅋㅋㅋ	['영주', '개', '뜬금']	0.0	0.0
199	199	fCyf3HhvE1c	아노하나리뷰해주실수있으시나요?<br>엄청난 감동과 여훈을 줍니다.	['아노하나', '리뷰', '해주실수있으시나요', '엄청난', '감동', '과', '여훈', '을', '줍니다']	2.930708014618138	1.5
200	200	fCyf3HhvE1c	조인성의 인품이 초반부터 썩 좋게 그려지지 않았음에도 불구하고 선한모습으로 끝맺는 전개는 이런 시국에서 공감하기가 매우 어려울것 같습니다 류준열도 맡은바 충실히 연기했지만..이영화는  각본 탓이 큰것 같아요..	['조인성', '의', '인품', '이', '초반', '부터', '썩', '좋게', '그려지지', '않았음에도', '불구', '하고', '선한', '모습', '으로', '끝', '맺는', '전개', '는', '이런', '시국', '에서', '공감', '하기가', '매우', '어려울것', '같습니다', '류준', '열도', '맡은바', '충실히', '연기', '했지만', '이영화', '는', '각본', '탓', '이', '큰것', '같아요']	1.4029639159406797	0.54
201	201	fCyf3HhvE1c	조인성이 생각보다 급이 높은 배우였다는걸 알게 됨	['조인성', '이', '생각', '보다', '급', '이', '높은', '배우였다는걸', '알', '게', '됨']	1.0588436691930383	0.52
202	202	fCyf3HhvE1c	공조도 리뷰 해 주실 수 있으신가요?	['공조', '도', '리뷰', '해', '주실', '수', '있으신', '가요']	-2.6785417140939005	-1.41
203	203	fCyf3HhvE1c	안그래도 더킹에서 울프 오브 월스트리트 냄새가 많이 난다는 얘기를 들었네요 많이 참고했던 것 같습니다.	['안', '그래도', '더킹', '에서', '울프', '오브', '월스트리트', '냄새', '가', '많이', '난다는', '얘기', '를', '들었네요', '많이', '참고', '했던', '것', '같습니다']	0.5024958855911182	0.22
204	204	fCyf3HhvE1c	앵 그냥 쓰레기를 쓰레기로 덮으니 수읍읍  생각나던디 제가 아직 모자란가 보네여	['앵', '그냥', '쓰레기', '를', '쓰레기', '로', '덮으니', '수', '읍읍', '생각나던디', '제', '가', '아직', '모자란가', '보네여']	0.930708014618138	0.43
205	205	fCyf3HhvE1c	확실히 예고만봐도 더 울프오브월스트리트의 막장파티장면을 오마주한걸로 보입니다 캬 조인성이 디카프리오가 된거 같네요	['확실히', '예고', '만', '봐도', '더', '울프', '오브', '월스트리트', '의', '막장', '파티', '장면', '을', '오마주', '한', '걸', '로', '보입니다', '캬', '조인성', '이', '디카프리오', '가', '된거', '같네요']	0.7239049244328037	0.3
206	206	fCyf3HhvE1c	저도딱보고떠올렷어요	['저', '도딱', '보고', '떠', '올', '렷', '어', '요']	1.1665773265724253	0.61
207	207	fCyf3HhvE1c	박세열 저도 더 울프오브월스트릿 생각났는데	['박세', '열', '저', '도', '더', '울프', '오브', '월', '스트릿', '생각났는데']	0.0	0.0
208	208	fCyf3HhvE1c	박세열 딱히 졸작이라고 느껴지진 않네요	['박세', '열', '딱히', '졸작', '이라고', '느껴지진', '않네요']	0.9875924071061136	0.54
209	209	fCyf3HhvE1c	으아 더 킹 예고편 브금을 알고 싶네요	['으아', '더', '킹', '예고편', '브금', '을', '알', '고', '싶네요']	0.19803101096360495	0.1
210	210	fCyf3HhvE1c	무엇보다 음악이 너무 좋았음 ㅠㅠ	['무엇', '보다', '음악', '이', '너무', '좋았음']	-2.578507269975994	-1.45
211	211	fCyf3HhvE1c	임윤아 때문에 공조를 볼까 했는데 더킹볼지 공조볼지 고민되네요	['임윤아', '때문', '에', '공조', '를', '볼까', '했는데', '더킹', '볼', '지', '공', '조', '볼', '지', '고민', '되네요']	-0.04661038021241126	-0.02
212	212	fCyf3HhvE1c	양유 저는 오히려 임윤아씨 때문에 공조를 좀 꺼렸는데 반대네요..^^	['양유', '저', '는', '오히려', '임윤아', '씨', '때문', '에', '공조', '를', '좀', '꺼렸는데', '반대', '네', '요']	-2.1438957214029704	-0.99
213	213	fCyf3HhvE1c	공조보다는 더킹이 볼만해요!	['공조', '보다는', '더킹', '이', '볼', '만해', '요']	0.482723861839272	0.26
214	214	fCyf3HhvE1c	졸작이라고 느끼시는 분들은 그 약간 B급코드 같은 해학적인 전개를 보고 그러시는거 아닐까요?? 파티장면이라든가 조인성이 정우성 줄을 잡게되는 비밀의 방씬이라든가	['졸작', '이라고', '느끼시는', '분', '들', '은', '그', '약간', 'B', '급', '코드', '같은', '해학', '적', '인', '전개', '를', '보고', '그러시는거', '아닐까', '요', '파티', '장면', '이', '라든가', '조인성', '이', '정우성', '줄', '을', '잡게', '되는', '비밀', '의', '방씬이', '라든가']	2.062021839213972	0.81
215	215	fCyf3HhvE1c	하민호 류준열은 각본이 부여한 역할을  잘 수행했는데 작가의 각본 탓이 큰거죠	['하', '민호', '류준', '열은', '각본', '이', '부여', '한', '역할', '을', '잘', '수행', '했는데', '작가', '의', '각본', '탓', '이', '큰거죠']	1.09728534119056	0.48
216	216	fCyf3HhvE1c	류준열이 좀 전개를 산만하게 만드는게 있긴했죠	['류준열', '이', '좀', '전개', '를', '산만하게', '만드는게', '있긴', '했죠']	0.09197359055131438	0.05
217	217	fCyf3HhvE1c	하민호 그런건 좋았는데요<br>류준열 비중이 중반넘어가면서 너무 커지니까 몰입도가 떨어지던데요	['하', '민호', '그런건', '좋았는데요', '류준열', '비중', '이', '중반', '넘어가면서', '너무', '커지니까', '몰입도', '가', '떨어지던데요']	-1.0124075928938865	-0.47
218	218	fCyf3HhvE1c	로건해주세요	['로건', '해주세요']	0.0	0.0
219	219	fCyf3HhvE1c	헷음	['헷음']	0.0	0.0
220	220	fCyf3HhvE1c	ㅎ	[]	0.0	-0.0
221	221	fCyf3HhvE1c	왔당께	['왔', '당', '께']	0.0	0.0
222	222	fCyf3HhvE1c	2	['2']	0.0	0.0
223	223	fCyf3HhvE1c	와 해주셨네요	['와', '해주셨네요']	0.0	0.0
224	224	fCyf3HhvE1c	사람마다 다르죠	['사람', '마다', '다르죠']	-0.1060574204122906	-0.07
225	225	fCyf3HhvE1c	이정민 별로였음	['이정민', '별로', '였음']	0.6266195832422436	0.42
226	226	fCyf3HhvE1c	근데 관상 별로였나요?전 괜찮단데	['근데', '관상', '별로', '였나', '요전', '괜찮단', '데']	0.2846928508756683	0.15
227	227	fCyf3HhvE1c	감사합니다	['감사합니다']	0.0	0.0
228	228	VV0wrW_Wsuo	!	[]	0.0	-0.0
229	229	7LfHzg2PbUI	영화보는 내내 진짜 정우성 잘생겼다는 생각만...  평소 이미지가 좋아서 그런가 악역이 좀 안어울리는거같기도	['영', '화보', '는', '내내', '진짜', '정우성', '잘생겼다는', '생각', '만', '평소', '이미지', '가', '좋아서', '그', '런가', '악역', '이', '좀', '안', '어울리는거', '같기도']	5.024640881874516	2.16
230	230	7LfHzg2PbUI	김아중 아름다웠습니다. 하하하	['김아중', '아름다웠습니다', '하하', '하']	0.19803101096360495	0.12
231	231	7LfHzg2PbUI	스포있을 수도 있음...<br><br><br>이젠 형사물보다 정치 경제쪽으로 권력이야기가 많은 흥미를 끄는거같음 몰입도도 생기고. 그치만 더킹은 좀 이상함...;;; 초반 권력욕이 채워지는 부분은 재밌는데 중후반은 별로고 설득력도 없고...  일진짱 출신에 러브샷한번 하고 풀자! 이러던 모습이 그 후로 전혀 보이지 않음 갑자기 순한양이자 보조역할만 하고.. <br>거기에 조인성은 한강식 밑에서 충성하며 살고 싶어하던 인물인데 괜히 류준열이 깝치다가 다 망하고;;; 류준열도 그냥 들개파 보스 밑에 있으면 조인성 뒤 잘봐주면서 컸을텐데 뭐하는거지 싶기도 하고.. 그리고 조인성 찾으로 정우성이랑 배성우가 직접 내려온것도 완전 이해불가;; 걍 조폭 시키지 왜 그런 알리바이를 만들며 왜??? 그래도 마지막 투표장려는 좋았음	['스포', '있을', '수도', '있음', '이', '젠', '형사물', '보다', '정치', '경', '제', '쪽', '으로', '권력', '이야기', '가', '많은', '흥미', '를', '끄는거', '같음', '몰입도', '도', '생기', '고', '그치만', '더킹', '은', '좀', '이상함', '초반', '권력', '욕', '이', '채워지는', '부분', '은', '재밌는데', '중후', '반', '은', '별로', '고', '설득', '력', '도', '없고', '일진', '짱', '출신', '에', '러브', '샷', '한번', '하고', '풀자', '이러던', '모습', '이', '그', '후', '로', '전혀', '보이지', '않음', '갑자기', '순', '한', '양', '이자', '보조', '역할', '만', '하고', '거기', '에', '조인성', '은', '한강', '식', '밑', '에서', '충성', '하며', '살', '고', '싶어하던', '인물', '인데', '괜히', '류준열', '이', '깝', '치다가', '다', '망하고', '류준', '열도', '그냥', '들개', '파', '보스', '밑', '에', '있으면', '조인성', '뒤', '잘', '봐주면서', '컸을텐데', '뭐', '하는거지', '싶기도', '하고', '그리고', '조인성', '찾으로', '정우성', '이랑', '배성우', '가', '직접', '내려온것도', '완전', '이해', '불가', '걍', '조폭', '시키지', '왜', '그런', '알리바이', '를', '만들며', '왜', '그래도', '마지막', '투표', '장려', '는', '좋았음']	-27.60996398871573	-8.77
232	232	7LfHzg2PbUI	진짜 엉준님은 공감 리뷰어!!!	['진짜', '엉', '준', '님', '은', '공감', '리뷰', '어']	3.0279933558087	1.59
233	233	7LfHzg2PbUI	나쁘진않았는데 중간중간마다 작품분위기를 망치는 씬과 쓸데없이 시간잡아먹는 요소가 너무 많아서 몰입에 매우 방해가됐었어요....<br>이것들때문에 영화시간도 엄청 길어져서 후반부가면 지루해지는 그런 영화입니다 ㅉ	['나쁘진', '않았는데', '중간', '중간', '마다', '작품', '분위기', '를', '망치는', '씬', '과', '쓸데없이', '시간', '잡아먹는', '요소', '가', '너무', '많아서', '몰입', '에', '매우', '방해', '가', '됐었어요', '이', '것', '들', '때문', '에', '영화', '시간', '도', '엄청', '길어져서', '후반', '부가', '면', '지루해지는', '그런', '영화', '입니다']	-8.711677913301834	-3.33
234	234	7LfHzg2PbUI	그래서 내가 다큐를 보고 있나? 드라마를 보고 있나 헷갈리기도 하더군요. 연출이 굉장히 다큐멘터리 같아서요	['그래서', '내', '가', '다큐', '를', '보고', '있나', '드라마', '를', '보고', '있나', '헷갈리', '기도', '하더군요', '연출', '이', '굉장히', '다큐멘터리', '같아서요']	1.2207126161330573	0.54
235	235	7LfHzg2PbUI	물론 공감하는 부분이 있지만 <br>영화를 보면서 본 인상은 이거였어요. 감독은 권력의 매커니즘이 어떻게 굴러가는가를 보여주기 위한 설계도를 보여준 연출이었다고 봐요. 그래서 후반부의 카타르시스가 없고. 즉 주인공은 관찰자의 역할을 준 거 같아요	['물론', '공감', '하는', '부분', '이', '있지만', '영화', '를', '보면서', '본', '인상', '은', '이거였어요', '감독', '은', '권력', '의', '매커니즘', '이', '어떻게', '굴러가는가를', '보여주기', '위', '한', '설계도', '를', '보여준', '연출', '이었다고', '봐요', '그래서', '후반', '부의', '카타르', '시스', '가', '없고', '즉', '주인공', '은', '관찰자', '의', '역할', '을', '준', '거', '같아요']	-3.186273494786055	-1.19
236	236	7LfHzg2PbUI	좋아요 누르고 구독 눌렀어요~<br>더킹 갠적으론 시국이 시국인지라 자꾸 현실과 <br>오버랩되서 저는 좀 더 재밌게 본거같아요~	['좋아요', '누르고', '구독', '눌렀어요', '더킹', '갠', '적', '으론', '시국', '이', '시국', '인지', '라', '자꾸', '현실', '과', '오버', '랩', '되서', '저', '는', '좀', '더', '재밌게', '본거', '같아요']	-3.2078759561455814	-1.33
237	237	7LfHzg2PbUI	거울을 보면 안되늨ㅋㅋㅋㅋㅋㅋㅋ	['거울', '을', '보면', '안되늨']	-0.23055756131503624	-0.14
238	238	7LfHzg2PbUI	엉준님 공조 리뷰 해주셨나요 <br>안해주셨으면 리뷰 해주세요~~^^	['엉', '준', '님', '공조', '리뷰', '해주셨나요', '안', '해주셨으면', '리뷰', '해주세요']	0.5887812822515626	0.29
239	239	7LfHzg2PbUI	전 정우성의 연기가 너무 어색하더라구요 처음 등장해서 혼자 긴 대사 칠때 오그라들었습니다 아수라의 황정민처럼 좀더 악랄하게 그려내도 좋았을거 같아요 그리고 조인성과 류준열이 친구라니 ㅜㅜ 따로 나올땐 괜찮다가 같이 한장면에 나오니 몰입이 딱 끊기네요 게다가 어릴때 버스에서 마주치는거 한장면 보여주고 마지막에 그렇게 나오니 둘이 우정이 그렇게 깊었나 했습니다 소재는 좋았으나 전체적으로 아쉬움이 많이 남는 작품이었네요	['전', '정우성', '의', '연기', '가', '너무', '어색하더라구요', '처음', '등장', '해서', '혼자', '긴', '대사', '칠', '때', '오그라들었습니다', '아수라', '의', '황정민', '처럼', '좀더', '악랄하게', '그려내도', '좋았을거', '같아요', '그리고', '조인성', '과', '류준열', '이', '친구', '라니', '따로', '나올', '땐', '괜찮다가', '같이', '한', '장면', '에', '나오니', '몰입', '이', '딱', '끊기네요', '게다가', '어릴', '때', '버스', '에서', '마주치는거', '한장', '면', '보여주고', '마지막', '에', '그렇게', '나오니', '둘', '이', '우정', '이', '그렇게', '깊었나', '했습니다', '소재', '는', '좋았으나', '전체', '적', '으로', '아쉬움', '이', '많이', '남는', '작품', '이었네요']	-13.877235287075633	-4.81
240	240	7LfHzg2PbUI	인물 관계나 밸런스 부족 ㅠㅠㅠ 후반부 뒷심 부족 ㅠㅠㅠ 너무 공감가요, 하지만 그럼에도 불구하고 굵직한 정치적 사건을 권력자들의 입장에서 보여줘서 재밌게 보았어여!! 무엇보다 연출이 재밌어서 몰입하기가 더 수월했던 거 같아요! 밸런스의 균형ㅋㅋㅋㅋㅋㅋㅋㅋ빵터졌습니다!!! 오늘 리뷰도 전설의 레전드네요^^/	['인물', '관계', '나', '밸런스', '부족', '후반', '부', '뒷', '심', '부족', '너무', '공감', '가요', '하지만', '그럼에도', '불구', '하고', '굵직한', '정치', '적', '사건', '을', '권력자', '들', '의', '입장', '에서', '보여줘서', '재밌게', '보았어여', '무엇', '보다', '연출', '이', '재밌어서', '몰입', '하기가', '더', '수월했던', '거', '같아요', '밸런스', '의', '균형', '빵터졌습니다', '오늘', '리뷰', '도', '전설', '의', '레전드', '네', '요']	-8.748354937094716	-3.21
241	241	7LfHzg2PbUI	안전빵이란 느낌	['안전', '빵', '이란', '느낌']	2.5590038348274757	1.6
242	242	7LfHzg2PbUI	오랜만에 엉큼엉준이 나왔네요~	['오랜', '만', '에', '엉', '큼', '엉', '준', '이', '나왔네요']	0.0	0.0
243	243	7LfHzg2PbUI	엉준님 말처럼 통쾌함이 느껴지지 않았어요..약간 영화가 런닝타임이 긴편인데도 불구하고 초반부에 필요없는 이야기들(개인적으로 김아중씨는 굳이 출연을 안해도됐을꺼같네요)을 날리고 뒤로 힘을 줬으면 어땟을까 싶어요ㅎㅎ그리고 이번 영화로 전 김소진씨의 팬이 되었습니다ㅋㅋㅋ	['엉', '준', '님', '말', '처럼', '통쾌함이', '느껴지지', '않았어요', '약간', '영화', '가', '런닝타임', '이', '긴', '편인데도', '불구', '하고', '초반', '부', '에', '필요없는', '이야기', '들', '개인', '적', '으로', '김아중', '씨', '는', '굳이', '출연', '을', '안', '해도', '됐을꺼', '같네요', '을', '날리고', '뒤', '로', '힘', '을', '줬으면', '어땟을까', '싶어요', '그리고', '이번', '영화로', '전', '김소진', '씨', '의', '팬', '이', '되었습니다']	-2.182270263876284	-0.8
244	244	7LfHzg2PbUI	산만하다... 저랑 똑같은 느낌을 받으셨군요! 저도 참 재밌게 봤지만 뒷심이 조금 부족하다는 느낌이 어쩔수 없이 들더군요	['산만하다', '저', '랑', '똑같은', '느낌', '을', '받으셨군요', '저', '도', '참', '재밌게', '봤지만', '뒷', '심', '이', '조금', '부족하다는', '느낌', '이', '어쩔', '수', '없이', '들더군요']	-1.0070958422546328	-0.43
245	245	7LfHzg2PbUI	맞아요ㅠ 뭔가 날려줬으면 했는데 그런 큰 한방 한방이 없어서 조금 아쉽긴 했더랬죠ㅠ 하지만 감독님의 패기에 반했습니다ㅋㅋㅋㅋㅋ 본격 투표독려영화!	['맞아요', '뭔가', '날려', '줬으면', '했는데', '그런', '큰', '한', '방', '한', '방이', '없어서', '조금', '아쉽긴', '했더랬', '죠', '하지만', '감독', '님', '의', '패기', '에', '반했습니다', '본격', '투표', '독려', '영화']	-9.68697058216235	-3.98
246	246	7LfHzg2PbUI	개인적으로 후반부에 뻔한전개가 될줄 알았는데 오히려 차기성이 했던 방법으로 어그로를 끄는게 다른 영화와는 조금 다른 인상을 남겼습니다. 또 정치라는 무대에서 우리에게 투표가 얼마나 중요한지 깨닫게 해주는 부분이 인상에 강하게 닿았습니다 우리에게 주어진 투표권이 얼마나 중요한지말이죠.  마지막으로 초반 한강식이 했던 &quot;역사가 흘러간 대로 하란말이야&quot; 대사는 개인적으로 한국현대사의 부조리를 반영한 것같아 인상에 강렬히 남았습니다 후반에 좀 늘어진감은 있지만 개인적으로 이 3가지 부분은 정말 마음에 들었습니다.	['개인', '적', '으로', '후반', '부', '에', '뻔한', '전개', '가', '될줄', '알았는데', '오히려', '차기', '성', '이', '했던', '방법', '으로', '어그', '로', '를', '끄는게', '다른', '영화', '와는', '조금', '다른', '인상', '을', '남겼습니다', '또', '정치', '라는', '무대', '에서', '우리', '에게', '투표', '가', '얼마나', '중요한지', '깨닫게', '해주는', '부분', '이', '인상', '에', '강하게', '닿았습니다', '우리', '에게', '주어진', '투표', '권', '이', '얼마나', '중요한지말이죠', '마지막', '으로', '초반', '한강', '식이', '했던', 'quot', '역사', '가', '흘러간', '대로', '하란', '말', '이야', 'quot', '대사', '는', '개인', '적', '으로', '한국', '현대', '사의', '부조리', '를', '반영', '한', '것', '같아', '인상', '에', '강렬히', '남았습니다', '후반', '에', '좀', '늘어진', '감은', '있지만', '개인', '적', '으로', '이', '3', '가지', '부분', '은', '정말', '마음', '에', '들었습니다']	-25.024260277209997	-8.25
247	247	7LfHzg2PbUI	저는 더 킹특유의 블랙코미디스타일 너무 좋았는데ㅠㅠ	['저', '는', '더', '킹특유', '의', '블랙코미디', '스타일', '너무', '좋았는데']	-0.9745692919032064	-0.5
248	248	7LfHzg2PbUI	개인적으로 연출이 특이해서 매우 좋았어요~^^	['개인', '적', '으로', '연출', '이', '특이해서', '매우', '좋았어요']	-0.1106923926708232	-0.06
249	249	7LfHzg2PbUI	오 ㅋㅋㅋ저 오늘 영화보고 왔는데 엉준님 리뷰에 공감하는 부분이 많아요 후반부에 좀 더 통쾌한 장면이 아쉽더라는 ㅠ 그래도 전체적으로 만족했던 영화였습니다 ㅎㅎ<br>항상 리뷰 잘보고있습니다~~:)	['오', '저', '오늘', '영화', '보고', '왔는데', '엉', '준', '님', '리뷰', '에', '공감', '하는', '부분', '이', '많아요', '후반', '부', '에', '좀', '더', '통쾌한', '장면', '이', '아쉽', '더', '라는', '그래도', '전체', '적', '으로', '만족했던', '영화', '였습니다', '항상', '리뷰', '잘', '보고있습니다']	4.442565227750579	1.72
250	250	7LfHzg2PbUI	더킹은 카메라 연출이 너무 재밌더군요ㅎㅎ<br>무엇보다도, <br>막판 조인성 말처럼 모든건 우리에게 달렸으니 투표 합시다~	['더킹', '은', '카메라', '연출', '이', '너무', '재밌더군요', '무엇', '보다도', '막판', '조인성', '말', '처럼', '모든', '건', '우리', '에게', '달렸으니', '투표', '합시다']	-2.488679411345192	-1.08
