	Unnamed: 0	id	sentence	comment_cut	score	ratio
377	377	guAyLidoOKY	펭또리 안녕하세요 펭또리님, 라이너님, 저도 영화 하나 추천드립니다 &#39;헌터 킬러&#39;라는 영화인데요. &#39;어떤 정치적 이유로&#39; 개봉관 수도 엄청 적고 그나마 개봉한 극장도 매우 불편한 시간에만 상영하고 있습니다. 영화관에서 내리기 전에 빨리 보시고 리뷰해주시면 감사하겠습니다.	['펭또리', '안녕하세요', '펭또리님', '라이너', '님', '저', '도', '영화', '하나', '추천', '드립니다', '39', '헌터', '킬러', '39', '라는', '영화', '인데', '요', '39', '어떤', '정치', '적', '이유', '로', '39', '개봉관', '수도', '엄청', '적고', '그나마', '개봉', '한', '극장', '도', '매우', '불편한', '시간', '에만', '상영', '하고', '있습니다', '영화관', '에서', '내', '리기', '전', '에', '빨리', '보시', '고', '리뷰', '해주시면', '감사하겠습니다']	-3.0192804927570718	-1.1
378	378	guAyLidoOKY	리뷰 잘 봤습니다~	['리뷰', '잘', '봤습니다']	3.7411439031442364	2.53
379	379	guAyLidoOKY	개인적으론 전 이영화는 스페인 영화인 슬립타이트와 일본의 노숙자 도시괴담을 모티브로 조합한 영화라 생각합니다 그리고 상당히 잘만든 수작이라고 생각합니다 영화의 전반적인 진행에서 이해되지 않는 부분이 없었고 먼가 불만인 주인공 공효진의 행동도 도중에 내가 왜 이러는지 모르겠다는 대사와 함께 마지막에 지금까지완 다르다는 듯이 상대에게 덤벼드는 일갈이 이영화의 백미 라고 생각합니다 기본적으로 부정적으로 본다면 무언가 이영화에서 등장하는 남자배우들은 전부 비이상적으로 보이지만 이영화는 그것을 말하고자 하는건 아니라고 보이며 기본적 상업영화의 틀에서 본다면 괜찮은 수준의 영화 라고 보입니다 영화가 무언가 메세지가 있고 내면에 숨겨진 철학이 있어야 좋은 영화는 아니라고 봅니다 그저 2시간 즐기기에 좋은 스릴러를 누군가 원한다면 충분히 추천해줄 영화이지 싶습니다	['개인', '적', '으론', '전', '이영화', '는', '스페인', '영화인', '슬립타이트', '와', '일본', '의', '노숙자', '도시괴담', '을', '모티브', '로', '조합', '한', '영화', '라', '생각', '합니다', '그리고', '상당히', '잘만', '든', '수작', '이라고', '생각', '합니다', '영화', '의', '전반', '적', '인', '진행', '에서', '이해', '되지', '않는', '부분', '이', '없었고', '먼가', '불만', '인', '주인공', '공효진', '의', '행동', '도', '도중', '에', '내', '가', '왜', '이러는지', '모르겠다는', '대사', '와', '함께', '마지막', '에', '지금', '까지', '완', '다르다는', '듯이', '상대', '에게', '덤벼', '드는', '일', '갈이', '이영화', '의', '백미', '라고', '생각', '합니다', '기본', '적', '으로', '부정', '적', '으로', '본다면', '무언가', '이영화', '에서', '등장', '하는', '남자배우', '들', '은', '전부', '비', '이상', '적', '으로', '보이', '지만', '이영화', '는', '그것', '을', '말', '하고자', '하는건', '아니라고', '보이', '며', '기본', '적', '상업', '영화', '의', '틀', '에서', '본다면', '괜찮은', '수준', '의', '영화', '라고', '보입니다', '영화', '가', '무언가', '메세지', '가', '있고', '내면', '에', '숨겨진', '철학', '이', '있어야', '좋은', '영화', '는', '아니라고', '봅니다', '그저', '2시간', '즐기기에', '좋은', '스릴러', '를', '누군가', '원한다면', '충분히', '추천', '해줄', '영화', '이지', '싶습니다']	25.071260829920355	7.84
380	380	guAyLidoOKY	@Cudi Kim  이런수준의 덧글 다는걸 보니 생각이 없거나 아메바거나	['Cudi', 'Kim', '이런', '수준', '의', '덧글', '다', '는걸', '보니', '생각', '이', '없거나', '아메바', '거나']	-0.059690624298025526	-0.03
381	381	guAyLidoOKY	이런 영화를 보고 수작이라고 하는 사람이 다 있네ㅋㅋ알바거나 아메바거나	['이런', '영화', '를', '보고', '수작', '이라고', '하는', '사람', '이', '다', '있네', '알바', '거나', '아메바', '거나']	1.079286064591729	0.5
382	382	guAyLidoOKY	저도 재밌게 봤어요.ㅎㅎ 그냥 너무 무서워서 사실 그런 개연성을 생각 못했는데 ㅠㅠㅋㅋ근데 너무 무서워서 추천 못해줄듯 ㅠㅠ	['저', '도', '재밌게', '봤어요', '그냥', '너무', '무서워서', '사실', '그런', '개연', '성', '을', '생각', '못', '했는데', '근데', '너무', '무서워서', '추천', '못', '해줄듯']	-0.3751620224869148	-0.16
383	383	guAyLidoOKY	보는 내내 개연성이고 뭐고 우연이라는 가정하에 억지로 밀고 붙이는 꼴 보고 역겹던데 정말 돈 받고 쓴 스토리 맞나 싶기도 하고 철학이고 뭐고가 중요한게 아니라 그냥 못만든 영화 인 것 같네요	['보는', '내내', '개연', '성', '이고', '뭐', '고', '우연', '이라는', '가정', '하', '에', '억지로', '밀고', '붙이는', '꼴', '보고', '역겹던데', '정말', '돈', '받고', '쓴', '스토리', '맞나', '싶기도', '하고', '철학', '이고', '뭐', '고가', '중요한게', '아니라', '그냥', '못', '만든', '영화', '인', '것', '같네요']	-1.5755104525190133	-0.61
384	384	guAyLidoOKY	@풀스윙   각자의 관점은 다르니까, 재밌게 보셨다면 다행입니다. 영화에 대한 부정적인 비판이 불편하실 수도 있지만, 라이너의 컬쳐쇼크는 라이너님의 개인적인 관점에서 비판하는 것이기 때문에 그러한 점은 어느 정도 수용하시면서 보실 준비를 해야 하는 것 같습니다.  저는 저의 개인적인 관점 내에서 컬쳐쇼크 채널의 2차 생산물을 재미있게 감상하고 있기 때문에 그런 생각이 들었습니다. 제 글이 불편하시지 않기를 바랍니다.	['풀', '스윙', '각자', '의', '관점', '은', '다르니까', '재밌게', '보셨다면', '다행', '입니다', '영화', '에', '대한', '부정', '적', '인', '비판', '이', '불편하실', '수도', '있지만', '라이너', '의', '컬쳐쇼크', '는', '라이너', '님', '의', '개인', '적', '인', '관점', '에서', '비판', '하는', '것', '이기', '때문', '에', '그러한', '점', '은', '어느', '정도', '수용', '하시면서', '보실', '준비', '를', '해야', '하는', '것', '같습니다', '저', '는', '저', '의', '개인', '적', '인', '관점', '내', '에서', '컬쳐쇼크', '채널', '의', '2', '차', '생산', '물', '을', '재미있게', '감상', '하고', '있기', '때문', '에', '그런', '생각', '이', '들었습니다', '제', '글', '이', '불편하시지', '않기를', '바랍니다']	12.401751252402756	4.21
385	385	guAyLidoOKY	불안해서 남자물건을 놔두고 누군가 문을 열어보려해서 경찰에 신고하는 사람이 코난 빙의ㅋㅋㅋㅋ<br>심지어 살인범이 있을 가능성이 높은 곳을 열어보고 들어가는 패기라니!<br>현실에서 안드로메다로 달려가는 영화였네요ㅜㅜ	['불안해서', '남자', '물건', '을', '놔두고', '누군가', '문', '을', '열어', '보려', '해서', '경찰', '에', '신고', '하는', '사람', '이', '코난', '빙의', '심지어', '살인', '범', '이', '있을', '가능성', '이', '높은', '곳', '을', '열', '어보', '고', '들어가는', '패기', '라니', '현실', '에서', '안드로메다', '로', '달려가는', '영화', '였네요']	7.888232519929019	3.01
386	386	guAyLidoOKY	용두사미가 되었군요...	['용두사미', '가', '되었군요']	0.0	0.0
387	387	guAyLidoOKY	저는 3점도 아깝다고 생각합니다	['저', '는', '3', '점도', '아깝다고', '생각', '합니다']	0.3889738534560188	0.21
388	388	guAyLidoOKY	영상만 보면 주인공이 이름이 경민인지 정민인지 모르겠어요 ㅠㅠㅠㅠㅠㅠㅠㅠㅠ	['영상', '만', '보면', '주인공', '이', '이름', '이', '경민', '인지', '정민', '인지', '모르겠어요']	1.2774959612489472	0.61
389	389	guAyLidoOKY	경민 입니다	['경민', '입니다']	0.9648827490664578	0.74
390	390	guAyLidoOKY	좋은 리뷰 잘 보고있습니다 감사합니다	['좋은', '리뷰', '잘', '보고있습니다', '감사합니다']	4.623305758668384	2.72
391	391	guAyLidoOKY	참돔을 가지고 매운탕을 끓여버림.. 아쉬운 영화	['참돔', '을', '가지', '고', '매운탕', '을', '끓여', '버림', '아쉬운', '영화']	2.8016933415973417	1.4
392	392	guAyLidoOKY	참돔이 귀하고앗있는줄 아시나보네	['참돔', '이', '귀하고앗있는줄', '아시', '나', '보네']	0.0	0.0
393	393	guAyLidoOKY	예고편에속았다 예고편이 더재밌음	['예고편', '에', '속', '았', '다', '예고편', '이', '더', '재밌음']	0.4525887710618338	0.23
394	394	guAyLidoOKY	레인뮨 ㅇㅈ올해망작오짐	['레인', '뮨', '올해', '망', '작', '오', '짐']	-0.5474112289381662	-0.3
395	395	guAyLidoOKY	맞아요! 제발 그런 영화 그만 좀 나오기를 빕니다.	['맞아요', '제발', '그런', '영화', '그만', '좀', '나오기를', '빕니다']	-0.058172988098087686	-0.03
396	396	guAyLidoOKY	범인이 싸이코패스인것이 반전이네요, 데우스액스마키나 설정. 전반부에 치밀하게 다룬 일상에서 온다는 긴장, 추리물의 트릭, 범죄양상, 피해자 조건 뭐 그런 퍼즐, 관객의 추리 긴장, 쌓아놓은 성을 한숨에 무너트려버리는 싸이코패스 설정! 이제 영화에서 싸이코패스는 그만 봤으면,,, 주인공 자체가 싸이코패스인 설정 아니면 진짜 재미없는것 같아요.	['범인', '이', '싸이코패스', '인', '것', '이', '반', '전이', '네', '요', '데', '우스', '액', '스마', '키', '나', '설정', '전', '반', '부', '에', '치밀하게', '다룬', '일상', '에서', '온다는', '긴장', '추리물', '의', '트릭', '범죄', '양상', '피해자', '조건', '뭐', '그런', '퍼즐', '관객', '의', '추리', '긴장', '쌓아놓은', '성', '을', '한숨', '에', '무', '너트', '려', '버리는', '싸이코패스', '설정', '이제', '영화', '에서', '싸이코패스', '는', '그만', '봤으면', '주인공', '자체', '가', '싸이코패스', '인', '설정', '아니면', '진짜', '재미없는것', '같아요']	-5.4260898268818405	-1.91
397	397	guAyLidoOKY	댓글 공감해요 ! 오늘 보고왔는데 재밌긴한데 뭔가 계속 아쉬운느낌..? 범인이 누군지 알고나서 부터 루즈해진 느낌이 딱 이부분 때문이었던거 같아요ㅠㅠ 데우스액스마키나 설정이 뭔지 몰라서 검색해보고 오니 정말 그렇네요ㅠㅠ아무짝에도 도움 안되는 모형씨씨티비, 사건이 일어나지 않았다고 그냥 돌아가는 경찰들, 무기한계약직전환(ㅅㅂ..), 증거부족으로 용의자 풀어주기 등등 현실 사회 문제를 꼬집는 것도 나름 좋았는데 범인이 싸이코패스 인 설정에서 기시감이 느껴지더라구요ㅠㅠ 나 이장면 진짜 많이 본거같은데... 이런느낌...설마 뻔하게 그놈이겠어 했던 그놈이 범인인걸 알았을때 약간 ㅇr...했습니다..그리고 폐모텔? 세트장에서의 장면은 다른 한국 스릴러 영화의 후반부 장면을 대신 떼어서 붙여놔도 이야기 진행에 큰 무리가 없을거같은 느낌이었어요..그냥 그 은행에서 진상짓 성희롱하는 남자가 범인인게 영화에 더 좋지 않았을까 하는 아쉬움이 남네요..ㅠㅠ 꼭 반전이 있어야 하는거는 아니니깐요ㅠㅠ 덜덜떨면서 보긴 했지만 여러모로 아쉬운 영화..	['댓글', '공감', '해요', '오늘', '보고왔는데', '재밌긴한데', '뭔가', '계속', '아쉬운', '느낌', '범인', '이', '누군지', '알고나서', '부터', '루즈', '해진', '느낌', '이', '딱', '이', '부분', '때문', '이었던거', '같아요', '데', '우스', '액', '스마', '키', '나', '설정', '이', '뭔', '지', '몰라서', '검색', '해보고', '오니', '정말', '그렇네요', '아무', '짝', '에도', '도움', '안되는', '모형', '씨', '씨', '티비', '사건', '이', '일어나지', '않았다고', '그냥', '돌아가는', '경찰', '들', '무기한', '계약', '직', '전환', '증거', '부족', '으로', '용의자', '풀어주기', '등등', '현실', '사회', '문제', '를', '꼬집는', '것', '도', '나름', '좋았는데', '범인', '이', '싸이코패스', '인', '설정', '에서', '기시감', '이', '느껴지더라구요', '나', '이장면', '진짜', '많이', '본거', '같은데', '이런', '느낌', '설마', '뻔하게', '그', '놈', '이', '겠어', '했던', '그', '놈', '이', '범인', '인걸', '알았을', '때', '약간', 'r', '했습니다', '그리고', '폐', '모텔', '세트', '장', '에서의', '장면', '은', '다른', '한국', '스릴러', '영화', '의', '후반', '부', '장면', '을', '대신', '떼어서', '붙여', '놔도', '이야기', '진행', '에', '큰', '무리', '가', '없을거', '같은', '느낌이었어요', '그냥', '그', '은행', '에서', '진상', '짓', '성희롱', '하는', '남자', '가', '범인', '인게', '영화', '에', '더', '좋지', '않았을까', '하는', '아쉬움', '이', '남네요', '꼭', '반전', '이', '있어야', '하는거는', '아니니깐', '요', '덜덜', '떨면서', '보긴', '했지만', '여러', '모로', '아쉬운', '영화']	30.888263320104194	9.51
398	398	guAyLidoOKY	제목의 도어락은 결국 영화의 도입부를 만들 장치 일뿐, 초반부 말곤 후반부 내용과는 동떨어져있네요 ㅋㅋㅋ 한국형 판타지 영화라 다행입니다	['제목', '의', '도어락', '은', '결국', '영화', '의', '도입', '부를', '만들', '장치', '일', '뿐', '초반', '부', '말곤', '후반', '부', '내용', '과는', '동떨어져있네요', '한국', '형', '판타지', '영화', '라', '다행', '입니다']	5.575143790617108	2.28
399	399	guAyLidoOKY	그나마 소재도 원작이 있으니 좋았더거고 후반부는 하품만 나옴 그리고 잘때 손수건으로 입막으면 모르나? 하루이틀도 아니고	['그나마', '소재', '도', '원작', '이', '있으니', '좋았', '더거고', '후반', '부는', '하품', '만', '나옴', '그리고', '잘', '때', '손수건', '으로', '입', '막으면', '모르나', '하루', '이틀', '도', '아니고']	3.017368642086644	1.26
400	400	guAyLidoOKY	차라리 악성 스토커가 범인이었다면 어땠을까 싶네요. 범인이 사이코패스라 이유없이 토막살인했대 끄읕 이건 좀 허무한 거 같아서	['차라리', '악성', '스토커', '가', '범인', '이었다면', '어땠을까', '싶네요', '범인', '이', '사이코패스', '라', '이유', '없이', '토막살인', '했대', '끄읕', '이건', '좀', '허무한', '거', '같아서']	-8.173477144531981	-3.49
401	401	guAyLidoOKY	근인물의 행동의 개연성이 안맞고, 현실성이 부족한걸 &#39;사실 범인은 사이코였음&#39; 이 설정으로 모두 해결할 수 있어요. 이런 설정이 너무 많으니까 지친거고, 뻔한거고, 화나는 거죠	['근', '인물', '의', '행동', '의', '개연', '성', '이', '안', '맞고', '현실', '성', '이', '부족한', '걸', '39', '사실', '범인', '은', '사이코', '였음', '39', '이', '설정', '으로', '모두', '해결', '할', '수', '있어요', '이런', '설정', '이', '너무', '많으니까', '지친거고', '뻔한거고', '화나는', '거', '죠']	-4.442229250895727	-1.71
402	402	guAyLidoOKY	게다가 주인공 집에 맨날 숨어서 살던 싸이코가 토막 살인한 그 싸이코고요	['게다가', '주인공', '집', '에', '맨날', '숨어서', '살던', '싸이코', '가', '토막', '살인', '한', '그', '싸이코', '고요']	-2.5795812149552173	-1.19
403	403	guAyLidoOKY	영화는 보셨나요 범인이 사이코패스라 이유없이 토막 살인 한 게 아니라 주인공을 광적으로 집착하는 미친 싸이코여서 자기가 갖기 위해 다리를 자르는 내용인데요	['영화', '는', '보셨나요', '범인', '이', '사이코패스', '라', '이유', '없이', '토막', '살인', '한', '게', '아니라', '주인공', '을', '광', '적', '으로', '집착', '하는', '미친', '싸이코', '여서', '자기', '가', '갖기', '위해', '다리', '를', '자르는', '내용', '인데', '요']	-8.252203505168296	-3.26
404	404	guAyLidoOKY	그러게요. 그 스토커가 범인이었으면 그게 오히려 반전이었을듯<br>게다가 그게 더 현실적이기도 하고요.	['그러게요', '그', '스토커', '가', '범인', '이었으면', '그게', '오히려', '반전', '이었을듯', '게다가', '그게', '더', '현실', '적', '이기도', '하고요']	-2.261684184690231	-1.01
405	405	guAyLidoOKY	이름 헷갈리셨네요 ㅋㅋ<br>첨엔 제가 잘못 들은건가 했어요 ㅋㅋㅋ	['이름', '헷갈리셨네요', '첨', '엔', '제', '가', '잘못', '들은', '건가', '했어요']	-2.2352112936302126	-1.12
406	406	guAyLidoOKY	말씀처럼 일상을 보여주는 영화초반 20~30분은 정말 스릴있게 연출도 잘하고 했는데.....	['말씀', '처럼', '일상', '을', '보여주는', '영화', '초반', '2030분', '은', '정말', '스릴', '있게', '연출', '도', '잘', '하고', '했는데']	6.323145785562673	2.83
407	407	guAyLidoOKY	오늘 영화를 보고 왔는데 다른 리뷰 봤다가 호평이길래 응? 하고 의문이었는데 이 리뷰보니까 정말 공감가네요 ㅎㅎ	['오늘', '영화', '를', '보고', '왔는데', '다른', '리뷰', '봤다가', '호평', '이길래', '응', '하고', '의문', '이었는데', '이', '리뷰', '보', '니까', '정말', '공감', '가네요']	3.560888578182824	1.53
408	408	guAyLidoOKY	경민인데 정민이라고 하셨군요..ㅜㅜㅜ	['경민', '인데', '정민', '이라고', '하셨군요']	-0.43872249022236104	-0.26
409	409	guAyLidoOKY	너무 의도적으로 남자와 경찰을 무능하게 그리고 주인공과 여자의 도움으로 사건해결하는 장면을 보여주는거같음..	['너무', '의도', '적', '으로', '남자', '와', '경찰', '을', '무능하게', '그리고', '주인공', '과', '여자', '의', '도움', '으로', '사건', '해결', '하', '는', '장면', '을', '보여주는거', '같음']	4.154195144278884	1.75
410	410	guAyLidoOKY	@장백산백산수 여자까고 싶어서 안달난 모습으로 쒸익쒸익 되는거 상상되니까 개 웃기네ㅋㅋㅋ 니가 본건 무개념 인간이고 이 생각은 다른 여경들도 똑같이 한단다 애야ㅋ	['장백산', '백', '산수', '여자', '까고', '싶어서', '안달', '난', '모습', '으로', '쒸익쒸익', '되는거', '상상', '되니까', '개', '웃기', '네', '니', '가', '본건', '무', '개념', '인간', '이고', '이', '생각', '은', '다른', '여경', '들', '도', '똑같이', '한단다', '애', '야']	0.320941991652137	0.13
411	411	guAyLidoOKY	@우삼겹 오구오구 그래쩌염~ 나는 분명히 봤는데 아무도 인정 안해주니까 너무너무 억울해염~ㅜㅜ 그러면 그분은 내가 특별히 칭찬해 줄게요~ 울지 마요~ㅋㅋㅋㅋㅋㅋ	['우삼겹', '오구오구', '그래쩌염', '나', '는', '분명히', '봤는데', '아무', '도', '인정', '안', '해주니까', '너무', '너무', '억울해', '염', '그러면', '그', '분', '은', '내', '가', '특별히', '칭찬', '해', '줄게요', '울', '지', '마', '요']	5.1491934692867245	2.08
412	412	guAyLidoOKY	@장백산백산수 수준나왔네ㅋㅋ 아니 내가 봤다니깐? 귀막고 앵앵앵이야? 여혐ㅅㄲㅋㅋ	['장백산', '백', '산수', '수준', '나왔네', '아니', '내', '가', '봤다니깐', '귀', '막', '고', '앵앵', '앵', '이야', '여혐']	0.1314719276545777	0.06
413	413	guAyLidoOKY	@우삼겹 말이야 방구야 뭔 성별을 바꿔? 뭔 피해의식?ㅋㅋㅋ  팔굽혀펴기 하나 정자세로 못하고 사고현장에서 남자 앞세우고는 뒷짐 지고 쳐놀던건 누구? 한녀들은 필요할 땐 걸스캔두애니팡 불리할 땐 국가공인 중증 장애인 아니냐?ㅋㅋㅋ	['우삼겹', '말', '이야', '방구', '야', '뭔', '성별', '을', '바꿔', '뭔', '피해', '의식', '팔굽혀펴기', '하나', '정자', '세로', '못', '하고', '사', '고현', '장', '에서', '남자', '앞세우고는', '뒷짐', '지고', '쳐', '놀던건', '누구', '한', '녀', '들', '은', '필요할', '땐', '걸스', '캔두', '애니팡', '불리할', '땐', '국가', '공인', '중증', '장애인', '아니냐']	-5.42846565877896	-2.05
414	414	guAyLidoOKY	와우 편집ㄷㄷ..	['와우', '편집']	0.452588771061831	0.35
415	415	guAyLidoOKY	내도혼자살때 새벽에 누가 문을존나 뚜드리샀길래 ㅡ 그런사람없어요 가요 케도 계속 김뭐시기 찾는다케샀고 꼭만나야된다케샀고 철문이 뿌사지라 엄청뚜드리대길래.. 문열어서 누군지 확인시켜주고싶었지만 칼빵밀것같아서.. 한 30~40분 방치했다가 진짜 문을뽀사고 들어올것같아서.. 경찰에 신고했는데.. 했는데.. 한1분이나 됐을까말까 경찰옵하들 둘이서 오가 그아저씨를 양쪽에서 팔짱끼고 대꼬갔뿠다 경찰이 오니까 제정신이 드는지 목소리가 돌아오더라	['내도', '혼자', '살때', '새벽', '에', '누가', '문', '을', '존나', '뚜', '드리', '샀길래', '그런', '사람', '없어요', '가요', '케', '도', '계속', '김', '뭐시기', '찾는다', '케', '샀고', '꼭', '만나야', '된다', '케', '샀고', '철문', '이', '뿌사지', '라', '엄청', '뚜', '드리', '대길', '래', '문', '열', '어서', '누군지', '확인', '시켜주고싶었지만', '칼빵', '밀것', '같아서', '한', '3040분', '방치', '했다가', '진짜', '문을뽀사', '고', '들어올것', '같아서', '경찰', '에', '신고', '했는데', '했는데', '한', '1분', '이나', '됐을까', '말까', '경찰', '옵하', '들', '둘이서', '오가', '그', '아저씨', '를', '양쪽', '에서', '팔', '짱', '끼', '고', '대꼬갔뿠다', '경찰', '이', '오', '니까', '제', '정신', '이', '드는지', '목소리', '가', '돌아오더라']	-2.033345376209976	-0.69
416	416	guAyLidoOKY	거미줄에 걸린 소녀 기다리고 있어요!	['거미줄', '에', '걸린', '소녀', '기다리고', '있어요']	-0.3211168434072493	-0.18
417	417	guAyLidoOKY	라이너님ㅠ이름 실수 안하시다가ㅜ 두분이나 실수하시다니ㅠㅠ	['라이너', '님', '이름', '실수', '안', '하시다가', '두', '분', '이나', '실수', '하시다니']	-1.438722490222358	-0.7
418	418	guAyLidoOKY	근데 공효진역할이 정민이에요?? 경민이에요? 자막은 경민인데..	['근데', '공효진', '역할', '이', '정민', '이에요', '경민', '이에요', '자막', '은', '경민', '인데']	-0.47931682757115995	-0.23
419	419	guAyLidoOKY	경민이요	['경민이', '요']	-0.4104622148683215	-0.32
420	420	guAyLidoOKY	이 분은 보면 볼수록 비판을 너무 잘하셔서 부러움..자칫하면 비난을 할 수도 있는데 철저하게 비판을 하는게 진짜 존경스러움ㅇㅇ	['이', '분', '은', '보면', '볼수록', '비판', '을', '너무', '잘', '하셔서', '부러', '움', '자칫하면', '비난', '을', '할', '수도', '있는데', '철저하게', '비판', '을', '하는게', '진짜', '존경', '스러', '움']	5.5081519451875165	2.28
421	421	guAyLidoOKY	모털엔진 리뷰도 해주세요!!	['모', '털', '엔진', '리뷰', '도', '해주세요']	0.8901944815481031	0.5
422	422	guAyLidoOKY	도어락하고 비교하면 그럴수있을것같아요 모털엔진은 눈은 즐거우니까	['도어락', '하고', '비교', '하면', '그럴수있을것', '같아요', '모', '털', '엔진', '은', '눈', '은', '즐거우니까']	0.17359848384809318	0.08
423	423	guAyLidoOKY	차라리 모털엔진이 재밌던데<br>안지루하고	['차라리', '모', '털', '엔진', '이', '재밌던데안', '지루하고']	-1.4275040917418569	-0.77
424	424	guAyLidoOKY	저는 보다가 중간에 재미없어서 중간에 나옴	['저', '는', '보다가', '중간', '에', '재미없어서', '중간', '에', '나옴']	0.5840606987164167	0.3
425	425	guAyLidoOKY	엄청난 비평이 쏟아질듯 싶네요...	['엄청난', '비평', '이', '쏟아질듯', '싶네요']	-1.0	-0.59
426	426	guAyLidoOKY	라이너님의 번개같은 리뷰! 일요일을 마무리하며 한줄기 빛과 같네요 ㅎㅎ	['라이너', '님', '의', '번개', '같은', '리뷰', '일요일', '을', '마무리', '하며', '한', '줄기', '빛과', '같네요']	1.7576807341312477	0.82
427	427	guAyLidoOKY	라이너님 모털엔진도 리뷰해주세요ㅜ	['라이너', '님', '모', '털', '엔', '진도', '리뷰', '해주세요']	1.1392720560177894	0.6
428	428	guAyLidoOKY	얜 다 형편없고 재미없대	['얜', '다', '형편', '없고', '재미없대']	-1.1102230246251563e-15	-0.0
429	429	guAyLidoOKY	이번 2018한국영화는 망함	['이번', '2018', '한국영', '화', '는', '망함']	-1.636756600399239	-0.92
