	Unnamed: 0	id	sentence	comment_cut	score	ratio
219	219	guAyLidoOKY	어우...듣고 있기 괴로울만큼 끔찍한 영화네요..;;;	['어우듣', '고', '있기', '괴로울만큼', '끔찍한', '영화', '네', '요']	-2.017578650749283	-1.06
220	220	guAyLidoOKY	보는내내 같은 생각을 했습니다ㅋㅋ 항상 리뷰 잘보고 있습니다 감사합니다 :)	['보는내내', '같은', '생각', '을', '했습니다', '항상', '리뷰', '잘', '보고', '있습니다', '감사합니다']	6.124412728073804	3.0
221	221	guAyLidoOKY	리뷰만봐도 정신이 아찔해지는....	['리뷰', '만', '봐도', '정신', '이', '아찔해지는']	0.7725888347329956	0.43
222	222	guAyLidoOKY	잘했어	['잘', '했어']	1.0	0.77
223	223	guAyLidoOKY	한국영화는 진짜 왜 경찰을 바보 무능으로 만드는지... 정작 현실은 검거율 세계1위, 치안도 세계 최상위권인 나라인데 ㅋㅋㅋㅋ 물론 경찰이 현실처럼 뛰어나면 영화가 진행이 안되는게 맞기는 한데... 저런 평범한 인물을 상대로도 무능한 경찰을 그려내면 그냥 불쾌하기만 하네요	['한국영', '화', '는', '진짜', '왜', '경찰', '을', '바보', '무능', '으로', '만드는지', '정작', '현실', '은', '검거', '율', '세계', '1', '위', '치안', '도', '세계', '최', '상위', '권', '인', '나라', '인데', '물론', '경찰', '이', '현실', '처럼', '뛰어나면', '영화', '가', '진행', '이', '안되는게', '맞기는', '한데', '저런', '평범한', '인물', '을', '상대로', '도', '무능한', '경찰', '을', '그려내면', '그냥', '불쾌하기만', '하네요']	6.339033882531968	2.32
224	224	guAyLidoOKY	조선치안이면 세계탑급인데 이런영화만드는새기들도 뭔일나면 경찰부터 찾을듯 ㅋㅋ	['조선', '치안', '이', '면', '세계', '탑', '급', '인데', '이런', '영화', '만드는', '새', '기', '들', '도', '뭔', '일', '나', '면', '경찰', '부터', '찾을듯']	0.7779066225458121	0.33
225	225	guAyLidoOKY	갓치이기(양남이랑결혼할거야)	['갓', '치', '이기', '양', '남', '이랑', '결혼', '할거야']	-0.891311261284192	-0.47
226	226	guAyLidoOKY	소재만 봐서는 &#39;슬립타이트&#39;가 생각났어요.. 전 엄청 공포스럽게 그 영화를 봤었거든요.. 아쉽네요.. 한국 공포영화가 한단계 업그레이드 될수도 있었을텐데..	['소재', '만', '봐', '서는', '39', '슬립타이트', '39', '가', '생각났어요', '전', '엄청', '공포', '스럽게', '그', '영화', '를', '봤었거든요', '아쉽네요', '한국', '공포영화', '가', '한', '단계', '업그레이드', '될수도', '있었을텐데']	-2.2905902345795512	-0.95
227	227	guAyLidoOKY	혼자살면 누구던 무서움 그래서 고양이주인님이랑 삶	['혼자', '살', '면', '누구', '던', '무서움', '그래서', '고양이', '주인', '님', '이랑', '삶']	-2.9485659266212214	-1.42
228	228	guAyLidoOKY	초반부 설정,슬립타이트 베꼈군...<br>진짜 너무들하네..<br>자존심비슷한것도 없는건가<br>울고 싶다..<br>나오는 영화마다<br>돈은 처들인다면서<br>좋은 원작 시나리오는 조져내고<br>설정은 죄다 베껴 붙이고..<br>한국영화 암흑기다...	['초반', '부', '설정', '슬립타이트', '베', '꼈군', '진짜', '너무', '들하네', '자존심', '비슷한것도', '없는건', '가울', '고', '싶다', '나오는', '영화', '마다', '돈', '은', '처', '들인다면서', '좋은', '원작', '시나리오', '는', '조져내고', '설정', '은', '죄다', '베', '껴', '붙이', '고', '한국영', '화', '암흑', '기', '다']	7.509644113467196	2.9
229	229	guAyLidoOKY	숨바꼭질이랑 비슷하네요	['숨바꼭질', '이랑', '비슷하네요']	-1.3439000323460242	-0.91
230	230	guAyLidoOKY	정민..? 경민..?	['정민', '경민']	0.28052250605844753	0.22
231	231	guAyLidoOKY	난 재밌었는데요?	['난', '재밌었는데요']	0.0	0.0
232	232	guAyLidoOKY	아직 영화는 안봤지만. 주인공의 캐릭터 수동적 변화는 오히려 현실반영이 된 거 아닐까요? 처음에는 능동적인 대처를 하다가 그것이 아무 의미 없다는 것을 알게된 이후 자연스럽게 그게 변하게 된 게 아닐까 합니다.	['아직', '영화', '는', '안', '봤지만', '주인공', '의', '캐릭터', '수동', '적', '변화', '는', '오히려', '현실', '반영', '이', '된', '거', '아닐까', '요', '처음', '에는', '능동', '적', '인', '대처', '를', '하다가', '그것', '이', '아무', '의미', '없다는', '것', '을', '알', '게', '된', '이후', '자연', '스럽게', '그게', '변하게', '된', '게', '아닐까', '합니다']	3.6246970954883153	1.36
233	233	guAyLidoOKY	재밌던데왜	['재밌던데', '왜']	0.0	0.0
234	234	guAyLidoOKY	리뷰 잘 봤습니다<br>사실 이런류의 영화는 기대를 안하긴 합니다<br>하지만 혹시나하는 마음은 있었는데..<br>역시나군요 안타깝네요<br>실미도처럼 좋은소재인데 <br>실미도처럼 안타까운 영화네요<br>무능한경찰 답답한주인공<br>아니 왜 항상 혼자 수사를 하냐고요...<br>범인을 찾았다고 쳐도 어떻게 할건데..???<br>깊은 답답함이 올라옵니다<br>완벽한타인처럼 소재가 좋아서<br>공효진이 좋아서 기대했는데<br>아쉬운작품이 되었나봅니다<br>자다가 화장실가다 깨서<br>이런댓글을 쓰는 저도 답답한 사람이네요<br>라이너님 깔끔한 리뷰 잘 봤습니다<br>고맙습니다 늘 응원합니다<br>전 잠이 깼습니다	['리뷰', '잘', '봤습니다', '사실', '이런', '류', '의', '영화', '는', '기대', '를', '안', '하긴', '합니다', '하지만', '혹시', '나하', '는', '마음', '은', '있었는데', '역', '시나', '군', '요', '안타깝네요', '실미도', '처럼', '좋은', '소재', '인데', '실미도', '처럼', '안타까운', '영화', '네', '요', '무능한', '경찰', '답답한', '주인공', '아니', '왜', '항상', '혼자', '수사', '를', '하냐고요', '범인', '을', '찾았다고', '쳐도', '어떻게', '할건데', '깊은', '답답함이', '올라옵니다', '완벽한', '타인', '처럼', '소재', '가', '좋아서', '공효진', '이', '좋아서', '기대했는데', '아쉬운', '작품', '이', '되었나', '봅니다', '자다가', '화장실', '가다', '깨서', '이런', '댓글', '을', '쓰는', '저', '도', '답답한', '사람', '이네', '요', '라이너', '님', '깔끔한', '리뷰', '잘', '봤습니다', '고맙습니다', '늘', '응원', '합니다전', '잠', '이', '깼습니다']	25.117383580315487	8.38
235	235	guAyLidoOKY	진짜 제목이 도어락인데... 처음 도어락 소리 때문에 오싹한거빼곤...  제목이 아깝다....에휴...	['진짜', '제목', '이', '도어락', '인데', '처음', '도어', '락', '소리', '때문', '에', '오싹한거', '빼곤', '제목', '이', '아깝다에', '휴']	3.002552662546882	1.35
236	236	guAyLidoOKY	어제 보고왔는데 공효진까지 무섭더라구요<br>저는 덜덜 떨면서 보고왔네요 ㅠㅎㅎ	['어제', '보고왔는데', '공효진', '까지', '무섭더라구요', '저', '는', '덜덜', '떨면서', '보고왔네요']	2.0482142602365165	1.02
237	237	guAyLidoOKY	뇌 좀 굴리자.<br>도어락에 묻은 DNA나 지문 확인하면 나올텐데.	['뇌', '좀', '굴', '리자도', '어', '락', '에', '묻은', 'DNA', '나', '지문', '확인', '하면', '나올텐데']	-0.3211168434072493	-0.15
238	238	guAyLidoOKY	한국영화에 나오는 경찰들 9할은 개병신찐따로 나옴. 개새끼들 좆나 무능력하게 나옴.	['한국영', '화', '에', '나오는', '경찰', '들', '9', '할은', '개', '병신', '찐', '따로', '나옴', '개새끼', '들', '좆', '나', '무능력하게', '나옴']	-3.696461807342037	-1.62
239	239	guAyLidoOKY	혹시 레드 스패로우 리뷰하셨나요? 안보여서요~	['혹시', '레드', '스패', '로우', '리뷰', '하셨나요', '안', '보여서요']	0.3970113731374673	0.21
240	240	guAyLidoOKY	늘보지만 정말 비판 잘한다 감탄	['늘', '보지', '만', '정말', '비판', '잘', '한다', '감탄']	3.8823943531848975	2.04
241	241	guAyLidoOKY	여자가 아니라 남자인 저도 혼자 살면서 참 무서운 경험을 많이 겪었고, 그래서 더더욱 공감가는 소재였는데 아쉽네요..	['여자', '가', '아니라', '남자', '인', '저', '도', '혼자', '살면서', '참', '무서운', '경험', '을', '많이', '겪었고', '그래서', '더', '더욱', '공감', '가는', '소재', '였는데', '아쉽네요']	-3.83463028856703	-1.62
242	242	guAyLidoOKY	죽ppl인듯...돈아까움 그냥 일인가구가 위험한게 아니라 이쁜여자가 위험한거임	['죽', 'ppl', '인듯', '돈', '아까', '움', '그냥', '일인', '가', '구가', '위험한게', '아니라', '이쁜', '여자', '가', '위험한거', '임']	1.3121999353079543	0.59
243	243	guAyLidoOKY	외국인중에 한국영화 좋아하는 사람들은 한국의 치안율에 의문을 가질듯 이정도면 한국영화계에서 경찰을 진짜 적으로 생각하는게 확실함	['외국인', '중', '에', '한국영', '화', '좋아하는', '사람', '들', '은', '한국', '의', '치안', '율', '에', '의문', '을', '가질듯', '이', '정도', '면', '한국', '영화계', '에서', '경찰', '을', '진짜', '적', '으로', '생각', '하는게', '확실함']	5.152367070294091	2.07
244	244	guAyLidoOKY	처음에는 이분 리뷰비판 너무 좋았는데 몇달지나니까 이분이 그냥 한국영화가 싫어서 싫은 이유를 나열하는건지 진짜 영화가 별로인건지 헷갈림 나오는 족족 별로라고 하니까; 다른 리뷰보면 좋다고 하는 것도 안좋다고도 하고 한 3,4개월 정도는 진짜 한국영화는 다 졸작이라고 까서...근데도 뭐라 말 못하는건 하시는 말씀이 다 맞는말이야ㅋㅋㅋㅋ	['처음', '에는', '이분', '리뷰', '비판', '너무', '좋았는데', '몇', '달', '지나', '니까', '이분', '이', '그냥', '한국영', '화가', '싫어서', '싫은', '이유', '를', '나열하는', '건지', '진짜', '영화', '가', '별로', '인', '건지', '헷갈림', '나오는', '족족', '별로', '라고', '하니까', '다른', '리뷰', '보면', '좋다고', '하는', '것', '도', '안좋다고도', '하고', '한', '34', '개월', '정도', '는', '진짜', '한국영', '화', '는', '다', '졸작', '이라고', '까서', '근', '데', '도', '뭐라', '말', '못', '하는건', '하시는', '말씀', '이', '다', '맞는말이야']	6.834798223146364	2.41
245	245	guAyLidoOKY	ㅋㅋㅋ그냥 공효진이 범인한테 반했다고 하고  차라리 <br>내츄럴 본 킬러를 찍는게 나을듯	['그냥', '공효진', '이', '범인', '한테', '반했다고', '하고', '차라리', '내츄럴', '본', '킬러', '를', '찍는게', '나을듯']	-1.9861337191605253	-0.93
246	246	guAyLidoOKY	돈주고 스트레스 받아보리기	['돈', '주고', '스트레스', '받아', '보리', '기']	-2.3211168434072493	-1.31
247	247	guAyLidoOKY	목격자 꼴 날줄알았다 ㅋㅋㅋ	['목격자', '꼴', '날줄', '알았다']	0.9051775421236647	0.57
248	248	guAyLidoOKY	아 ㅋㅋㅋㅋ제목ㅋㅋㅋㅋㅋㅋㅋㅋㅋㅋㅋ자비란없음	['아', '제목', '자', '비란', '없음']	1.2262943855309132	0.72
249	249	guAyLidoOKY	언제나 영상 감사합니다. 구독 하고갑니다~	['언제나', '영상', '감사합니다', '구독', '하고', '갑니다']	1.5411648709864063	0.87
250	250	guAyLidoOKY	저는이영화를보고 도어락이라는공포보다 오히려 그커피먹자던 스토커분이 더무서웠네요...	['저', '는', '이영화', '를', '보고', '도어', '락', '이라는', '공포', '보다', '오히려', '그', '커피', '먹자던', '스토커', '분', '이', '더', '무서웠네요']	-2.239497997628983	-0.98
251	251	guAyLidoOKY	예고편보고 아...한국양산형 나오겠구나 싶었는데 딱이네요	['예고편', '보고', '아', '한국', '양산', '형', '나오겠구나', '싶었는데', '딱이네요']	2.9455881544694815	1.51
252	252	guAyLidoOKY	라이너님 댓글은 처음 달아보는데 잘 보고 있습니다! 리뷰 항상 재밌고 리뷰하신 영화를 찾아보는 재미도 있네요	['라이너', '님', '댓글', '은', '처음', '달', '아', '보는데', '잘', '보고', '있습니다', '리뷰', '항상', '재밌고', '리뷰', '하신', '영화', '를', '찾아보는', '재미', '도', '있네요']	10.918230981334123	4.66
253	253	guAyLidoOKY	다른 유투버분들 것도 재밌긴한데 내용설명만 많거나 웃기려고 넣는 드립이 너무 많다거나 그런 경우도 있었는데  라이너님 리뷰는 확실한 스포와 그를 바탕으로 한 알찬 비평, 촌철살인 멘트, 편안한 목소리가 저한테는 최고의 영화리뷰인것 같아요 제가 돈낭비안하게 도와주셔서 감사합니다.. 이번 리뷰에서는 &quot;여러모로 얄팍합니다&quot; 란 멘트가 이 영화를 제일 잘 표현한 것 같아서 좋았어요	['다른', '유투', '버', '분들', '것', '도', '재밌긴한데', '내용', '설명', '만', '많거나', '웃기려고', '넣는', '드립', '이', '너무', '많다거나', '그런', '경우', '도', '있었는데', '라이너', '님', '리뷰', '는', '확실한', '스포', '와', '그', '를', '바탕', '으로', '한', '알찬', '비평', '촌철', '살인', '멘트', '편안한', '목소리', '가', '저', '한', '테', '는', '최고', '의', '영화리뷰', '인', '것', '같아요', '제', '가', '돈', '낭비', '안', '하게', '도와주셔서', '감사합니다', '이번', '리뷰', '에서는', 'quot', '여러', '모로', '얄팍합니다', 'quot', '란', '멘트', '가', '이', '영화', '를', '제일', '잘', '표현', '한', '것', '같아서', '좋았어요']	16.4773193850709	5.68
254	254	guAyLidoOKY	숨바꼭질은 뛰어날 수 없을 듯	['숨바꼭질', '은', '뛰어날', '수', '없을', '듯']	-0.7737056144690844	-0.44
255	255	guAyLidoOKY	대부분 스릴러물이 저런식인듯합니다 숨박꼭질또한....	['대부분', '스릴러물', '이', '저런', '식인', '듯', '합니다', '숨박꼭질', '또한']	1.3255963271684448	0.68
256	256	guAyLidoOKY	기대했던 영화인데 무너진 스릴러였다니.....  시골살아서 영화보러가기도 힘든데 망작을 본다는건 괴로운 일이기에 항상 라이너님께 감사함을 느낍니다.	['기대했던', '영화', '인데', '무너진', '스릴러', '였다니', '시골', '살아서', '영화', '보러가', '기도', '힘든데', '망작', '을', '본다는건', '괴로운', '일', '이기', '에', '항상', '라이너', '님', '께', '감사함을', '느낍니다']	1.0489981144177842	0.44
257	257	guAyLidoOKY	오늘 봤는데 완전공감됩니다!<br>딱 김과장까지가 좋았어요.. 다보고 뭐지?싶었는데 딱 찝어 주셨네요!	['오늘', '봤는데', '완전', '공감', '됩니다', '딱', '김', '과장', '까지가', '좋았어요', '다', '보고', '뭐', '지', '싶었는데', '딱', '찝어', '주셨네요']	3.163877205045363	1.4
258	258	guAyLidoOKY	아직도 극장가서 한국영화보는 호구가 있기래?	['아직도', '극', '장가', '서', '한국영', '화보', '는', '호구', '가', '있기래']	0.15973220300861446	0.08
259	259	guAyLidoOKY	매번 느끼지만 라이너님의 탁월한 비판, 분석력에 oo을 탁치고 갑니다!(영상 잘 보고 있어요~)	['매번', '느끼지만', '라이너', '님', '의', '탁월한', '비판', '분석', '력', '에', 'oo', '을', '탁', '치고', '갑니다', '영상', '잘', '보고', '있어요']	5.306257515463264	2.33
260	260	guAyLidoOKY	좋은 소재를 가지고 초반에 독특하게 잘 만들었다가 말아먹은 한국공포영화...어 장산범?	['좋은', '소재', '를', '가지', '고', '초반', '에', '독특하게', '잘', '만들었다가', '말아먹은', '한국', '공포영화', '어', '장산', '범']	5.558594470511126	2.52
261	261	guAyLidoOKY	라이너님 지금 영화 &#39;범블비&#39;가 시사회에서 로튼토마토 신선도 100%나왔답니다.. 안믿기시면 지금 바로 확인해보세요	['라이너', '님', '지금', '영화', '39', '범블비', '39', '가', '시사회', '에서', '로튼토마토', '신선도', '100', '나왔답니다', '안', '믿기시면', '지금', '바로', '확인', '해보세요']	1.771860881578453	0.77
262	262	guAyLidoOKY	100% 공감합니다. 현실적소재, 좋은 배우를 비현실적연출, 뻔한 클리쉐, 개연성 없는 진행, 고구마 캐릭터, 자극적장면, 무능한경찰, 남혐, 페미니즘(사악한 남성, 맞서는여성), 싸이코패스로 범벅해버린 종합 삼류영화 세트.. <br>하지만 정말 놀랍게도 여성분들에겐 꽤 평이 좋은 것 같습니다. 그만큼 현실적 소재의 힘이 강한 것이라면 더더욱 안타깝네요.. <br>그리고 현직 전문의로서.. 코에 대면 몇 시간 잠들어버리는 흡입마취제? 깔끔한 발목절단? 주입하면 경련 후 사망하는 주사제? 뒷목에 못을 찔리고 즉사하는 악역? 등의 장면에선 실로 경악했습니다. 차라리 아브라카다브라 주문을 외우거나, 무협영화 처럼 혈도를 짚어 기절 시키는 것이 더 현실적이지 않았을까... (감독님들.. 영화 제작 전에 제발 누구에게라도 의학 감수 한 번씩만 받으셨으면.. 해줄 사람이 없으면 제가 공짜로 해드릴게요 연락 주세요 ㅠㅠ)	['100', '공감', '합니다', '현실', '적', '소재', '좋은', '배우', '를', '비현실적', '연출', '뻔한', '클리', '쉐', '개연', '성', '없는', '진행', '고구마', '캐릭터', '자극', '적', '장면', '무능한', '경찰', '남혐', '페미니즘', '사악한', '남성', '맞서는', '여성', '싸이코패스', '로', '범벅', '해', '버린', '종합', '삼류', '영화', '세트', '하지만', '정말', '놀랍게도', '여성', '분들', '에겐', '꽤', '평이', '좋은', '것', '같습니다', '그만큼', '현실', '적', '소재', '의', '힘', '이', '강한', '것', '이', '라면', '더', '더욱', '안타깝네요', '그리고', '현직', '전문의', '로서', '코', '에', '대면', '몇', '시간', '잠들어', '버리는', '흡입', '마취제', '깔끔한', '발목', '절단', '주입', '하면', '경련', '후', '사망', '하는', '주', '사제', '뒷', '목', '에', '못', '을', '찔리고', '즉사', '하는', '악역', '등', '의', '장면', '에선', '실로', '경악', '했습니다', '차라리', '아브라카다브라', '주문', '을', '외우거나', '무협', '영화', '처럼', '혈도', '를', '짚어', '기절', '시키는', '것', '이', '더', '현실', '적', '이지', '않았을까', '감독', '님', '들', '영화', '제작', '전', '에', '제발', '누구', '에게라도', '의학', '감수', '한', '번', '씩', '만', '받으셨으면', '해줄', '사람', '이', '없으면', '제', '가', '공짜', '로', '해드릴게요', '연락', '주세요']	23.61986299866577	7.42
263	263	guAyLidoOKY	말빨짱	['말빨', '짱']	0.0	0.0
264	264	guAyLidoOKY	라이너님 리뷰를 보다보니 이제 비판을 하도많이 하다보니 어느 정도의 경지에 올랐다는 느낌을 받네요 ㅎㅎㅎㅎ	['라이너', '님', '리뷰', '를', '보다', '보니', '이제', '비판', '을', '하도', '많이', '하다', '보니', '어느', '정도', '의', '경지', '에', '올랐다는', '느낌', '을', '받네요']	0.6439916378912771	0.27
265	265	guAyLidoOKY	제대로된 공포스릴러가 없냐.. 차라리 해외b급 좀비영화가 낫겠다	['제대로', '된', '공포', '스릴러', '가', '없냐', '차라리', '해외', 'b', '급', '좀비', '영화', '가', '낫겠다']	0.8653670589561339	0.4
266	266	guAyLidoOKY	좋은 리뷰... 감사합니다.	['좋은', '리뷰', '감사합니다']	3.623305758668385	2.45
267	267	guAyLidoOKY	저는 무서워서 재밋었어요! 친구들하고 손붙잡으면서 덜덜 떨며 보기 좋아욤. 그리고 곤지암, 장산범보단..재밋어요.그래서 요즘 볼 공포영화로 친구들한테 추천해줬어요	['저', '는', '무서워서', '재밋었어', '요', '친구', '들', '하고', '손', '붙잡으면서', '덜덜', '떨며', '보기', '좋아욤', '그리고', '곤지암', '장산', '범', '보단', '재밋', '어', '요', '그래서', '요즘', '볼', '공포영화', '로', '친구', '들', '한테', '추천', '해줬어요']	3.0898357705435107	1.23
268	268	guAyLidoOKY	근데제가 생각없이 본거같긴한걸 유튜브본고 깨달았네욯ㅎㅎㅎ..이상하다고 생각은 했는데ㅋㅋㅋㅋㅋㅋㄱㅋㅋ	['근데', '제', '가', '생각', '없이', '본거', '같긴', '한', '걸', '유튜브', '본고', '깨', '달았', '네', '욯', '이상하다고', '생각', '은', '했는데']	0.3805495021242685	0.17
269	269	guAyLidoOKY	많이 공감합니다. 초반만 괜찮았고 그 이후론.... ㅠㅠ <br>그런데 감독 인터뷰 보니 원래 이렇게 답답하게 만들고 싶진 않았는데 투자자들의 입김 때문에 어쩔 수 없이 감독 본인의 생각과는 다르게 연출할 수밖에 없었다고 합니다	['많이', '공감', '합니다', '초반', '만', '괜찮았고', '그', '이후', '론', '그런데', '감독', '인터뷰', '보니', '원래', '이렇게', '답답하게', '만들고', '싶진', '않았는데', '투자자', '들', '의', '입김', '때문', '에', '어쩔', '수', '없이', '감독', '본인', '의', '생각', '과는', '다르게', '연출', '할', '수', '밖에', '없었다고', '합니다']	-1.3888943265415268	-0.53
270	270	guAyLidoOKY	라이너 님이 &#39;여기까지가 이 영화의 베스트라고 생각한다.&#39;는 부분까지 영화소개프로에서 보여주던데, 이 부분만 보고 볼까? 했던 마음이 사라지네요..ㅎ 여자인 제가 느끼는 공포는 평범해보이는 사람이 나를 위협할 수 있다는 공포, 항상 보내던 일상에서 불현듯 드는 위화감에서 오는 공포인데 시나리오 쓰는 분이 뭔가 감을 잘 못 잡은 듯...	['라이너', '님', '이', '39', '여기', '까지가', '이', '영화', '의', '베스트', '라고', '생각', '한다', '39', '는', '부분', '까지', '영', '화소', '개', '프로', '에서', '보여주던데', '이', '부분', '만', '보고', '볼까', '했던', '마음', '이', '사라지네요', '여자', '인', '제', '가', '느끼는', '공포', '는', '평범해', '보이는', '사람', '이', '나를', '위협', '할', '수', '있다는', '공포', '항상', '보내던', '일상', '에서', '불현듯', '드는', '위화', '감', '에서', '오는', '공포', '인데', '시나리오', '쓰는', '분', '이', '뭔가', '감', '을', '잘', '못', '잡은', '듯']	11.278513737031243	3.95
271	271	guAyLidoOKY	영화는 안봣지만.. 뭐지..? 도어락 에 대한 설명인데 말마따나 호텔납치감금토막살인..? 뭔 관계여 이게 ㅋㅋㅋㅋ	['영화', '는', '안봣', '지만', '뭐', '지', '도어', '락', '에', '대한', '설명', '인데', '말', '마따나', '호텔', '납치', '감금', '토막살인', '뭔', '관계', '여', '이', '게']	-3.1182914719154176	-1.32
272	272	guAyLidoOKY	그래도 다행히 녹음기는 안나왔네요. 해외에선 한국형 스릴러는 녹음기로 녹취한걸 틀어서 범인의 자백을 받아 마무리 짓는 거라고 비웃는다던데...(세븐데이즈의 성공이 다들 그렇게 부러웠나.) 스릴러의 기본이 안된 후반부란 소리네요. 스릴러란 후반부로 갈수록 긴장감이 더해지면서 주인공의 행동에 관객들이 일체화할 수 있어야 하는데.... 관객 보다 멍청한 주인공에, 남의 캐릭터를 자기식으로 재해석도 안하고 등장시킨 범인에, 주인공이 그 행동을 할 수밖에 없는 상황설명도 안한체 계속 터지는 우연으로 범인에 접근해가는 방식이라니... 관객들을 바보로 아는 가	['그래도', '다행히', '녹음기', '는', '안', '나왔네요', '해외', '에선', '한국', '형', '스릴러', '는', '녹음기', '로', '녹', '취한', '걸', '틀어서', '범인', '의', '자백', '을', '받아', '마무리', '짓는', '거', '라고', '비웃는다던데', '세븐데이즈', '의', '성공', '이', '다', '들', '그렇게', '부러웠나', '스릴러', '의', '기본', '이', '안된', '후반', '부란', '소리', '네', '요', '스릴러', '란', '후반', '부로', '갈수록', '긴장감', '이', '더해지면서', '주인공', '의', '행동', '에', '관객', '들', '이', '일체', '화할', '수', '있어야', '하는데', '관객', '보다', '멍청한', '주인공', '에', '남', '의', '캐릭터', '를', '자기', '식', '으로', '재해', '석도', '안', '하고', '등장', '시킨', '범인', '에', '주인공', '이', '그', '행동', '을', '할', '수', '밖에', '없는', '상황', '설명', '도', '안', '한', '체', '계속', '터지는', '우연', '으로', '범인', '에', '접근', '해가는', '방식', '이라니', '관객', '들', '을', '바보', '로', '아는', '가']	11.975533961594133	3.9
273	273	guAyLidoOKY	평이 좋길래 뭔가 싶었어요 한국영화는 아직도 한참 부족하네요 참나 ㅋㅋ	['평이', '좋길래', '뭔가', '싶었어요', '한국영', '화', '는', '아직도', '한참', '부족하네요', '참나']	-1.708795869336804	-0.84
274	274	guAyLidoOKY	초중반까지는 좋았는데 후반부가 영...	['초', '중반', '까지는', '좋았는데', '후반', '부가', '영']	1.392114292582544	0.75
