	Unnamed: 0	id	sentence	comment_cut	score	ratio
0	0	E8L7QftcXnE	국민의 영웅을 무정부주의자라 애기하네 좀 웃기는소리하네<br>좀 이상하게 애기하네	['국민', '의', '영웅', '을', '무정부주의자', '라', '애기', '하네', '좀', '웃기는', '소리', '하', '네', '좀', '이상하게', '애기', '하네']	-3.1702102273009567	-1.42
1	1	E8L7QftcXnE	저희지역이문경시입니당 문경시안에<br>마성면이있는데 마성면 에서박열이태어남	['저희', '지역', '이', '문경시', '입니당', '문', '경', '시안', '에', '마성면', '이', '있는데', '마성면', '에서', '박열', '이', '태어남']	1.404120178275534	0.63
2	2	E8L7QftcXnE	김현민기자님 설명잘해줘서 감사합니다.	['김현민', '기자', '님', '설명', '잘해줘서', '감사합니다']	0.0	0.0
3	3	E8L7QftcXnE	제목봐라 이새끼 ㅋㅋㅋ	['제목', '봐라', '이', '새끼']	0.0	0.0
4	4	E8L7QftcXnE	김지운 제목 수준이 ㅋㅋ	['김지운', '제목', '수준', '이']	0.0	0.0
5	5	E8L7QftcXnE	저스디스 생각 나던데 ㅋㅋ	['저스디스', '생각', '나던데']	0.9223904066086704	0.62
6	6	E8L7QftcXnE	박열은 진짜 미쁜사람인거 같아요...... 미친 착한사람....	['박열', '은', '진짜', '미쁜사람', '인거', '같아요', '미친', '착한', '사람']	-2.242939890548015	-1.15
7	7	E8L7QftcXnE	아 진짜 어떻하실거에요 알씨네님! 님때문에 어제보고온거 또보고 싶잖아요!--	['아', '진짜', '어떻하실거에요', '알씨', '네', '님', '님때문', '에', '어제', '보고온거', '또', '보고', '싶잖아요']	0.1072102182466439	0.05
8	8	E8L7QftcXnE	참···묘하고 끌리는 영화네요.<br>울고 있는데 미소를 짓게 만드는 신기한 것 같아요.	['참', '묘', '하고', '끌리는', '영화', '네', '요', '울', '고', '있는데', '미소', '를', '짓게', '만드는', '신기한', '것', '같아요']	3.27533033778512	1.47
9	9	E8L7QftcXnE	전 영화관에서 보다가 울었습니다. 아나키스트이자 애국자 박열... 역대급이었습니다!!	['전', '영화관', '에서', '보다가', '울었습니다', '아나키스트', '이자', '애국자', '박열', '역대', '급', '이었습니다']	1.404120178275534	0.68
10	10	E8L7QftcXnE	제목으로 낚이네ᆢ<br>급실망ᆢ<br>볼려고했는데 <br>제목에 낚인 내가 쪽팔려서 안보기로 작정함ᆢ	['제목', '으로', '낚', '이네', '급', '실망', '볼려고', '했는데', '제목', '에', '낚', '인', '내', '가', '쪽팔려서', '안', '보기로', '작정', '함']	-1.7855795635067122	-0.78
11	11	E8L7QftcXnE	개인적인 생각이지만 박열과 후이코가 고문을 받지 않은 이유는 설정이 아니라 중앙정부에 잡혔고 화제의 중심이었기 때문입니다<br><br>일본은 대학살을 숨겨야했기에 외신의 눈이 아주 중요한데 대역죄인이 민주적 절차를 거치지 않고 처맞은 채 재판장에섰다??  말도 안되는소리죠	['개인', '적', '인', '생각', '이지만', '박열', '과', '후', '이', '코', '가', '고문', '을', '받지', '않은', '이유', '는', '설정', '이', '아니라', '중앙정부', '에', '잡혔고', '화제', '의', '중심', '이었기', '때문', '입니다', '일본', '은', '대', '학살', '을', '숨겨', '야했기에', '외신', '의', '눈', '이', '아주', '중요한데', '대역', '죄인', '이', '민주', '적', '절차', '를', '거치', '지', '않고', '처', '맞은', '채', '재판', '장', '에', '섰다', '말', '도', '안되는', '소리', '죠']	-2.274249166984533	-0.81
12	12	E8L7QftcXnE	김명원 후미코...	['김명원', '후', '미코']	0.0	0.0
13	13	E8L7QftcXnE	이거 완전 감동적이에요..ㅠ 가족과 같이봤어욤..ㅠ	['이', '거', '완전', '감동', '적', '이에요', '가족', '과', '같이', '봤어', '욤']	2.0	0.98
14	14	E8L7QftcXnE	아나키스트 박열은 아나키즘 크로포트킨 의 개인주의자 를 표방한 아나키스트 입니다. 아나키스트의 뜻은 아나키즘 의 사상을 전파하고 설파하는 또는 아나키즘 <br>사회를 건설하사람들을 아나키스트 라고 합니다. 무정부주의자는 일본에 의해 번역된!!잘못된 번역입니다.	['아나키스트', '박열', '은', '아나키즘', '크로포트킨', '의', '개인주의자', '를', '표방', '한', '아나키스트', '입니다', '아나키스트', '의', '뜻', '은', '아나키즘', '의', '사상', '을', '전파', '하고', '설', '파하는', '또는', '아나키즘', '사회', '를', '건설', '하', '사람', '들', '을', '아나키스트', '라고', '합니다', '무정부주의자', '는', '일본', '에', '의해', '번역', '된', '잘못', '된', '번역', '입니다']	-8.474060019140804	-3.17
15	15	E8L7QftcXnE	정확히 무정부주의자는 아닙니다. ㅎㅎ	['정확히', '무정부주의자', '는', '아닙니다']	-1.5231501584774063	-0.95
16	16	E8L7QftcXnE	박열 기대됩니다! 잘봤습니다~	['박열', '기대', '됩니다', '잘', '봤습니다']	2.2193003666375577	1.31
17	17	E8L7QftcXnE	빨리 보러가고 싶네요 멋져요 잘봤습니다❤️	['빨리', '보러가고', '싶네요', '멋져요', '잘', '봤습니다']	1.0	0.56
18	18	E8L7QftcXnE	리뷰를 보니 간만에 기대되는 영화네요~ 미국이라 개봉은 힘들겠지만 나오는데로 바로 시청해야겠네요^^<br>리뷰 잘보고갑니다.	['리뷰', '를', '보니', '간만', '에', '기대', '되는', '영화', '네', '요', '미국', '이라', '개봉', '은', '힘들겠지만', '나오는데로', '바로', '시청', '해야겠네요', '리뷰', '잘', '보고', '갑니다']	2.58406005976924	1.09
19	19	E8L7QftcXnE	오 뭔가 볼까말까 했었는데 기자님 리뷰보니 박열스럽다를 느껴봐야겠네요ㅎㅎ	['오', '뭔가', '볼', '까말까', '했었는데', '기자', '님', '리뷰', '보니', '박열', '스럽다를', '느껴', '봐야겠네요']	0.2193003666375577	0.1
20	20	E8L7QftcXnE	믿고 보는 이준익!! 동주도 너무 좋고 박열도 너무 좋았네여~	['믿고', '보는', '이준익', '동주', '도', '너무', '좋고', '박열', '도', '너무', '좋았', '네', '여']	3.2193003666375577	1.52
21	21	E8L7QftcXnE	최희서 배우님 킹콩을들다 에서 선머슴같은 그 이미지가 너무강했는데 이렇게 미인이셨네요.<br>볼까말까 고민했는데 꼭 봐야겠네요^^	['최희', '서', '배우', '님', '킹콩을들다', '에서', '선머슴', '같은', '그', '이미지', '가', '너무', '강했는데', '이렇게', '미인', '이', '셨', '네', '요', '볼', '까말까', '고민', '했는데', '꼭', '봐야겠네요']	3.292030029884621	1.37
22	22	E8L7QftcXnE	역시 현민 기자님 리뷰 최고! 알씨네 최고!	['역시', '현', '민', '기자', '님', '리뷰', '최고', '알씨', '네', '최고']	2.0	1.0
23	23	E8L7QftcXnE	박열 극장에서 본 후 알씨네  봤는데 영화 또 보고싶네요. 이런 영화는 처음. 강추!	['박열', '극장', '에서', '본', '후', '알씨', '네', '봤는데', '영화', '또', '보고싶네요', '이런', '영화', '는', '처음', '강추']	4.8346697028433185	2.19
24	24	E8L7QftcXnE	리뷰가 너무 알차요! 영화 보러가야겠숩니다	['리뷰', '가', '너무', '알차요', '영화', '보러가야겠', '숩니', '다']	1.6616696531605712	0.87
25	25	E8L7QftcXnE	최희서배우님...애정하게되었습니다<br>앞으로 많은 작품에서 봤으면 좋겠어요~	['최희', '서', '배우', '님', '애정', '하', '게', '되었습니다', '앞', '으로', '많은', '작품', '에서', '봤으면', '좋겠어요']	2.292030029884621	1.05
26	26	E8L7QftcXnE	꿈의 제인부터 챙겨보고 있습니다 <br>정말 몇 안되는, 제대로 된 영화 리뷰네요 	['꿈', '의', '제인', '부터', '챙겨', '보고', '있습니다', '정말', '몇', '안되는', '제대로', '된', '영화', '리뷰', '네', '요']	2.6616696531605712	1.21
27	27	ZH2DHkLBZfg	진짜 일본인인줄 알았습니다..<br>그만큼 너무 잘해주셔서..근데 알고보니 제가 지금까지 본영화들에도 나오셨더라고요..새삼 놀랐습니다♡	['진짜', '일본인', '인', '줄', '알았습니다', '그만큼', '너무', '잘', '해주셔서', '근데', '알', '고', '보니', '제', '가', '지금', '까지', '본', '영화', '들', '에도', '나오셨더라고요', '새삼', '놀랐습니다']	1.2290300208303095	0.52
28	28	ZH2DHkLBZfg	배우님때문에 두번봤습니다.ㅎㅎ좋은연기 감사합니다~	['배우', '님', '때문', '에', '두', '번', '봤습니다', '좋은', '연기', '감사합니다']	2.0	1.0
29	29	q6VVE9m85yM	오대박 오늘봤는데 장면다르니까 신기하네요	['오', '대박', '오늘', '봤는데', '장면', '다르니까', '신기하네요']	0.0	0.0
30	30	q6VVE9m85yM	후미코 졸라 멋있어 ㅋㅋ	['후', '미코', '졸라', '멋있어']	0.0	0.0
31	31	7tPFL3W4oVc	마지막 재판때 잊지 않겠다고 외치는 장면이랑 사형 선고 받고 났을때도 정말 명장면이라고 생각함 ..	['마지막', '재판', '때', '잊지', '않겠다고', '외치는', '장면', '이랑', '사형', '선고', '받고', '났을', '때', '도', '정말', '명', '장면', '이라고', '생각', '함']	0.9223904066086704	0.4
32	32	7tPFL3W4oVc	일본어로 잊지않으리 법정밖에서 다같이외치는거 씹명장면..	['일본어', '로', '잊지', '않으리', '법정', '밖', '에서', '다', '같이', '외치는거', '씹', '명장', '면']	1.1848198116379764	0.56
33	33	7tPFL3W4oVc	진짜 다 명장면이였습니다ㅠㅠㅠ다들 수고많으셨고ㅜㅜ이 영화를 만들어주셔서 감사합니다👍💓💓	['진짜', '다', '명', '장면', '이', '였습니다', '다', '들', '수고', '많으셨고이', '영화', '를', '만들어주셔서', '감사합니다']	1.7688798714072151	0.82
34	34	P5qsnOjyTXE	원래 우물에 있으면 그 우물이 세상의 다인줄 알죠~ 외국에 나와보면 자국의 객관적 모습을 보게 되는게 있는거 같네요~ ㅎㅎ가끔 댓글에 일본 사람들이 한국은 반일의 나라니깐 가면 테러당할까 걱정 하시는 분들 종종 보면 좀 안타깝습니다~ 전혀 그렇지 않잖아요~ 뭐 물론 안그런 사람도 있겠지만 티는 안내죠~ 일본도 마찬가진거 같네요~ 뭐 좀 모자란 사람 빼곤.....	['원래', '우물', '에', '있으면', '그', '우물', '이', '세상', '의', '다인', '줄', '알', '죠', '외국', '에', '나와', '보면', '자국', '의', '객관', '적', '모습', '을', '보게', '되는게', '있는거', '같네요', '가끔', '댓글', '에', '일본', '사람', '들', '이', '한국', '은', '반일', '의', '나라', '니깐', '가면', '테러', '당할까', '걱정', '하시는', '분들', '종종', '보면', '좀', '안타깝습니다', '전혀', '그렇지', '않잖아요', '뭐', '물론', '안', '그런', '사람', '도', '있겠지만', '티', '는', '안내', '죠', '일본도', '마', '찬가진거', '같네요', '뭐', '좀', '모자란', '사람', '빼곤']	-13.201900959918751	-4.61
35	35	P5qsnOjyTXE	저도 보고 싶었었는데, 꼭 봐야겠네요.	['저', '도', '보고', '싶었었는데', '꼭', '봐야겠네요']	0.0	0.0
36	36	P5qsnOjyTXE	이 리뷰 보고나서 방금.. 보고왔어요 박열. 진심 좋았어요 감사합니다 ㅋㄷ	['이', '리뷰', '보고나서', '방금', '보고왔어요', '박열', '진심', '좋았어요', '감사합니다']	0.2193003666375577	0.11
37	37	P5qsnOjyTXE	원레 알고 있었던 박열 영화까지 나와주네요 아직보진 못했지만 당시 일본인 여자분과 후세 다츠지 라는 변호사분 <br>정말 대단한 분들이라 생각됩니다  그당시 시절에서의 의 당당함과 패기 여유 저로선 상상하기 힘들군요<br>그리고 그당시 사진만 봐도 인물들만 봐도 영화를 어둡게 만들면 넌센스라고 생각되네요	['원레', '알', '고', '있었던', '박열', '영화', '까지', '나와주네요', '아직', '보진', '못', '했지만', '당시', '일본인', '여자', '분과', '후세', '다츠', '지', '라는', '변호사', '분', '정말', '대단한', '분', '들', '이라', '생각', '됩니다', '그', '당시', '시절', '에서의', '의', '당당함과', '패기', '여유', '저', '로선', '상상', '하기', '힘들군요', '그리고', '그', '당시', '사진', '만', '봐도', '인물', '들', '만', '봐도', '영화', '를', '어둡게', '만들면', '넌센스', '라고', '생각', '되네요']	4.601840922669325	1.66
38	38	P5qsnOjyTXE	두 사람처럼 다~열린 마음으로 바라보면 한일관계가 좋아질 듯~해요~😃😃😃	['두', '사람', '처럼', '다', '열린', '마음', '으로', '바라보면', '한일관계', '가', '좋아질', '듯', '해요']	-1.04630031695481	-0.49
39	39	P5qsnOjyTXE	감사합니다^^	['감사합니다']	0.0	0.0
40	40	P5qsnOjyTXE	두사람이 좋은 환경 만들고 있어 좋아요	['두', '사람', '이', '좋은', '환경', '만들고', '있어', '좋아요']	0.5081591179591143	0.27
41	41	P5qsnOjyTXE	아니 두사람이 사랑하면 결혼하고 그러는거지 거기에 먼 양국관계를 해결요 ㅎㅎㅎ 정치인들이 할일인 거죠..혐한도 반일도 다 할일없는 멍청이들 뿐일겁다	['아니', '두', '사람', '이', '사랑', '하면', '결혼', '하고', '그러는거지', '거기', '에', '먼', '양국', '관계', '를', '해결', '요', '정치인', '들', '이', '할', '일인', '거', '죠', '혐한', '도', '반일', '도', '다', '할', '일', '없는', '멍청이', '들', '뿐일', '겁', '다']	-11.035489491961483	-4.3
42	42	P5qsnOjyTXE	접하기 힘든 양국의 진솔한 이야기 잘 보았어요... 다음에 군함도 부탁해요.	['접', '하기', '힘든', '양국', '의', '진솔한', '이야기', '잘', '보았어요', '다음', '에', '군함도', '부탁', '해요']	-6.218219195836973	-2.9
43	43	P5qsnOjyTXE	맞아요. 한국은 일본자체를 싫어하는게 아니에요. 위안부 할머니들도 일본인들이 찾아오면 좋아하십니다.<br>일본이 과거의 만행을 인정하고 교육을 시켜 후세대에 또 다른 갈등을 만들지 않는게 현명한 일인데 그걸 감추고 왜곡 시키죠.<br>한국과 일본은 충분히 잘 지낼수 있는 나라인데 일본은 정치인들과 언론들, 한국은 권력을 잡은 친일후손들과 그에 편승하는 세력들 때문에 매듭이 풀어 질 생각을 안 하네요.	['맞아요', '한국', '은', '일', '본', '자체', '를', '싫어하는게', '아니에요', '위안부', '할머니', '들', '도', '일본인', '들', '이', '찾아오면', '좋아하십니다', '일본', '이', '과거', '의', '만행', '을', '인정', '하고', '교육', '을', '시켜', '후세', '대', '에', '또', '다른', '갈등', '을', '만들지', '않는게', '현명한', '일', '인데', '그걸', '감추고', '왜곡', '시키죠', '한국', '과', '일본', '은', '충분히', '잘', '지낼수', '있는', '나라', '인데', '일본', '은', '정치인', '들', '과', '언론', '들', '한국', '은', '권력', '을', '잡은', '친일', '후손', '들', '과', '그', '에', '편승', '하는', '세력', '들', '때문', '에', '매듭', '이', '풀어', '질', '생각', '을', '안', '하네요']		
44	44	P5qsnOjyTXE	국가가 국민을 전시 동원한 것이 불법이 아닌데. 어떻게 징용자에게 배상을 할 수 있을까요? 이게 일본 정부의 입장이고 일응 이해가 갑니다. 물론 한국인들은 경술국치와 합방이 불법이므로 일제가 국가가 아니고 범죄집단이라고 우길 수는 있지만... 제 3자 외국인의 눈에는 일제시대 총독부가 국가 공권력 행사 기관이 아니고 범죄집단이라는 주장을 수긍할 수있을까요?	['국가', '가', '국민', '을', '전시', '동원', '한', '것', '이', '불법', '이', '아닌데', '어떻게', '징용', '자', '에게', '배상', '을', '할', '수', '있을까요', '이', '게', '일본', '정부', '의', '입장', '이고', '일', '응', '이해', '가', '갑니다', '물론', '한국인', '들', '은', '경술국치', '와', '합방', '이', '불법', '이', '므', '로', '일제', '가', '국가', '가', '아니고', '범죄', '집단', '이라고', '우길', '수', '는', '있지만', '제', '3', '자', '외국인', '의', '눈', '에는', '일제시대', '총독부', '가', '국가', '공권력', '행사', '기관', '이', '아니고', '범죄', '집단', '이라는', '주장', '을', '수긍', '할', '수', '있을까요']	-10.693360385778368	-3.67
45	45	P5qsnOjyTXE	전 이런 역사적인 일에 관해서 일본인 한국인이 서로 생각을 말하고 공감하는모습을 보는게 .. 뭐랄까 대리만족이 크네요. 일본인과 한국인은 지금 정부쪽에서 말하는거나 언론이 말하는것만 봐도 서로 이해못하고 그냥 자기말만하고 끝내버리는 느낌인데 일반적인 사람이 정상적인 사고를 가지고 대화하는거 자체가 얼마나 신선합니까.. ^ㅡ^.. 여긴 그런 영상이 많아서 좋아요. 많이많이 올려주세요~일본인과 한국인이 서로 궁금해하는거..일본친구 없어서 영상으로나마 보고싶다는..ㅎㅎㅎㅎ	['전', '이런', '역사', '적', '인', '일', '에', '관해', '서', '일본인', '한국인', '이', '서로', '생각', '을', '말', '하고', '공감', '하는', '모습', '을', '보는게', '뭐랄까', '대리', '만족', '이', '크네요', '일본인', '과', '한국인', '은', '지금', '정부', '쪽', '에서', '말', '하는거나', '언론', '이', '말', '하는것만', '봐도', '서로', '이해', '못', '하고', '그냥', '자기', '말', '만', '하고', '끝내', '버리는', '느낌', '인데', '일반', '적', '인', '사람', '이', '정상', '적', '인', '사고', '를', '가지', '고', '대화', '하는거', '자체', '가', '얼마나', '신선합니까', '여긴', '그런', '영상', '이', '많아서', '좋아요', '많이', '많이', '올려주세요', '일본인', '과', '한국인', '이', '서로', '궁금해하는거', '일본', '친구', '없어서', '영상', '으로나', '마', '보고싶다는']	-25.78312916956332	-8.66
46	46	P5qsnOjyTXE	두 분의 진솔한 대화가 참 편안하게 들려서 좋네요. 가공되지 않은 담백함이 묻어나는 것 같아서 좋아요.	['두', '분', '의', '진솔한', '대화', '가', '참', '편안하게', '들려서', '좋네요', '가공', '되지', '않은', '담백함이', '묻어나는', '것', '같아서', '좋아요']	1.9833003079005005	0.88
47	47	P5qsnOjyTXE	마늘빵은 토마토 파스타 소스 발라먹으면 더 맛있..	['마늘빵', '은', '토마토', '파스타', '소스', '발라', '먹으면', '더', '맛있']	0.0	0.0
48	48	P5qsnOjyTXE	마늘빵 디따 좋아하시네요.   남녀간의 사랑은 국경이 없다는............. ^^	['마늘빵', '디', '따', '좋아하시네요', '남녀', '간', '의', '사랑', '은', '국경', '이', '없다는']	2.0	0.96
49	49	P5qsnOjyTXE	마늘빵을 자주 먹게 되네요..^^	['마늘빵', '을', '자주', '먹게', '되네요']	0.0	0.0
50	50	P5qsnOjyTXE	영상 너무 좋아요~ 구독 !!!	['영상', '너무', '좋아요', '구독']	-0.9390900987081694	-0.59
51	51	P5qsnOjyTXE	두분의 알콩달콩한 모습이 보기가 참 좋네요. 예쁜 사랑 하시길 바래요	['두', '분', '의', '알콩달콩', '한', '모습', '이', '보기', '가', '참', '좋네요', '예쁜', '사랑', '하시길', '바', '래', '요']	3.2920300298846183	1.48
52	52	P5qsnOjyTXE	감사합니다^^	['감사합니다']	0.0	0.0
53	53	P5qsnOjyTXE	윽 유성 cgv? ㅋㅋㅋ<br> 흠.. 마늘빵엔 버터(마가린)계란+설탕+마늘+파슬리 등이 들어가지요.....	['윽', '유성', 'cgv', '흠', '마늘빵', '엔', '버터', '마가린', '계란', '설탕', '마늘', '파슬리', '등', '이', '들어가지요']	0.0	0.0
54	54	P5qsnOjyTXE	이천 cgv 입니다.	['이천', 'cgv', '입니다']	-1.9999999999999984	-1.35
55	55	P5qsnOjyTXE	정권이 바뀌니까 또다시 반일감정 자극목적의 영화가 득세를 할건가? <br>역사문제와 연관되는 내용은 피하는게 좋다고 봅니다.  <br>두분이서 부담되는 이런 내용보다 미래지향적으로 두나라가 경쟁하며 발전하는 방향의 내용으로 이끌었으면 하는 바램이다	['정권', '이', '바뀌니까', '또다시', '반일감정', '자극', '목적', '의', '영화', '가', '득세', '를', '할', '건가', '역사', '문제', '와', '연관', '되는', '내용', '은', '피', '하는게', '좋다고', '봅니다', '두', '분', '이', '서', '부담', '되는', '이런', '내용', '보다', '미래', '지향', '적', '으로', '두', '나라', '가', '경쟁', '하며', '발전', '하는', '방향', '의', '내용', '으로', '이끌었으면', '하는', '바램', '이다']	-15.192798786506632	-5.58
56	56	P5qsnOjyTXE	행복하세요	['행복하세요']	0.0	0.0
57	57	P5qsnOjyTXE	감사합니다. 하하님도 행복하세요!	['감사합니다', '하하', '님', '도', '행복하세요']	0.0	0.0
58	58	P5qsnOjyTXE	아침6시21분 2빠	['아침', '6시', '21분', '2', '빠']	0.0	0.0
59	59	P5qsnOjyTXE	2빠 감사합니다^^	['2', '빠', '감사합니다']	0.0	0.0
60	60	P5qsnOjyTXE	1빠 입니다!! 헤헤	['1', '빠', '입니다', '헤헤']	-1.9999999999999984	-1.25
61	61	P5qsnOjyTXE	1빠 감사합니다^^	['1', '빠', '감사합니다']	0.0	0.0
62	62	boMTGClhb68	※ 재미있으셨다면 ‘좋아요’와 ‘구독’! 댓글은 매너있게! 스포는 삼가 부탁드립니다. :)<br><br>혹시나 혹시나 제목을 오해하실까 적는데<br>박열이 썼던 시의 제목이 ‘개X끼’입니다.<br>영화에도 나오고요.<br><br>아마 그 개X끼는 자신을 낮추는 게 아니라 그만큼 격렬했던 반항정신을 나타내는 의미인 것 같습니다.<br><br>참고로 전 욕을 그닥 좋아하진 않아요.ㅎㅎ	['재미있으셨다면', '좋아요', '와', '구독', '댓글', '은', '매너', '있게', '스포', '는', '삼가', '부탁드립니다', '혹시', '나', '혹시', '나', '제목', '을', '오해', '하실까', '적는데', '박열', '이', '썼던', '시', '의', '제목', '이', '개', 'X', '끼', '입니다', '영화', '에도', '나오고요', '아마', '그', '개', 'X', '끼는', '자신', '을', '낮추는', '게', '아니라', '그만큼', '격렬했던', '반항', '정신', '을', '나타내는', '의미', '인', '것', '같습니다', '참고', '로', '전', '욕', '을', '그닥', '좋아하진', '않아요']	-7.289240207502828	-2.6
63	63	boMTGClhb68	뭅이님!전 올레티비 시청자인데요 !뭅이님 인터뷰들었습니다!앞으로 계속 응원할게요~^^	['뭅이님전', '올레', '티비', '시청자', '인데', '요', '뭅이님', '인터뷰', '들었습니다', '앞', '으로', '계속', '응원', '할게요']	0.6912702780158797	0.32
64	64	boMTGClhb68	맘무프로젝트 크~ 감사합니다!!<br>운 좋게 인터뷰 했는데 응원해주시는 분까지 얻었네요ㅎㅎ😊	['맘무', '프로젝트', '크', '감사합니다운', '좋게', '인터뷰', '했는데', '응원', '해주시는', '분', '까지', '얻었네요']	2.107210218246644	1.01
65	65	boMTGClhb68	엌ㅋㅋㅋㅋ뭅이님 무비 톡에 나오고 있어영ㅋㅋㅋ그리고 1빠	['엌뭅이님', '무비', '톡', '에', '나오고', '있어', '영', '그리고', '1', '빠']	0.0	0.0
66	66	boMTGClhb68	도하 TV 오~~! 축하해요ㅎㅎㅎ<br>무스쇼가 은근히 홍보 됐나ㅎㅎㅎㅎ	['도하', 'TV', '오', '축하', '해요', '무스', '쇼', '가', '은근', '히', '홍보', '됐나']	2.107210218246644	1.01
67	67	F6GhQWxvweI	★★ &#39;박열&#39; 한 줄거리 작성 이벤트 당첨자 발표 ★★<br><br>영화 &#39;박열&#39; 한 줄거리 작성 이벤트 에 당첨되신 분은 &#39;sws2936&#39; 님 입니다. <br><br>7/27(목)까지 닉네임/이름/이메일/연락처를 기재하여<br>event@blossomtv.co.kr 이쪽으로 보내주시면 됩니다. <br><br>다시 한 번 축하 드리며, 참여해주신 모든 분들께 감사 드립니다:-)	['39', '박열', '39', '한', '줄거리', '작성', '이벤트', '당첨', '자', '발표', '영화', '39', '박열', '39', '한', '줄거리', '작성', '이벤트', '에', '당첨', '되신', '분', '은', '39', 'sws', '293639', '님', '입니다', '727', '목', '까지', '닉네임', '이름', '이메일', '연락처', '를', '기재', '하여', 'eventblossomtvcokr', '이', '쪽', '으로', '보내주시면', '됩니다', '다시', '한', '번', '축하', '드리며', '참여', '해주신', '모든', '분', '들', '께', '감사', '드립니다']	6.387420486176039	2.32
68	68	F6GhQWxvweI	한줄거리 : 사람 한 번 제대로 잘못 건드린 일본의 호들갑	['한', '줄거리', '사람', '한', '번', '제대로', '잘못', '건드린', '일본', '의', '호들갑']	-2.9853904156629785	-1.46
69	69	F6GhQWxvweI	나라와 역사를 위해 헌신한 두 연인의 역사적 로맨스	['나라', '와', '역사', '를', '위해', '헌신', '한', '두', '연인', '의', '역사', '적', '로맨스']	-1.4159399402307629	-0.67
70	70	F6GhQWxvweI	한줄평말고 예전처럼 객관적으로 판단할수있는 이벤트하면 안될까요..?ㅠㅠ	['한', '줄평', '말고', '예전', '처럼', '객관', '적', '으로', '판단', '할수있는', '이벤트', '하면', '안될까', '요']	0.5064504663779064	0.24
71	71	F6GhQWxvweI	늘 나오는 일제강점기 이야기 봐도봐도 가슴아프고 슬프다ㅠㅠ	['늘', '나오는', '일제강점기', '이야기', '봐도', '봐도', '가슴', '아프고', '슬프다']	-6.70796997011538	-3.43
