	Unnamed: 0	id	sentence	comment_cut	score	ratio
0	0	L-n2pWf3dAA	최적화ㅡ이것을 볼 바에 <br>중년탐정 김정일과 이건칠의 코미디쇼를  보겠다<br>특징 ㅡ  믿거  성동일	['최적화', '이', '것', '을', '볼', '바', '에', '중년', '탐정', '김정일', '과', '이건', '칠', '의', '코미디', '쇼', '를', '보겠다', '특징', '믿거', '성동일']	2.4759556997835754	1.07
1	1	L-n2pWf3dAA	이걸 보면서 탐정홍길동이 불쌍해지는 생각밖에 안나던데	['이', '걸', '보면서', '탐정', '홍길동', '이', '불쌍해지는', '생각', '밖에', '안나', '던데']	3.1644367702669216	1.55
2	2	L-n2pWf3dAA	애초에 코미디를 목적으로 봤기 때문에 아아아아아아아아주 만족 ㅎㅎ	['애초', '에', '코미디', '를', '목적', '으로', '봤기', '때문', '에', '아아', '아아', '아아', '아아', '주', '만족']	2.160291953530188	0.99
3	3	L-n2pWf3dAA	저도 추리 쪽보다는 코미디 쪽에 좀 더 치중된 영화라고 생각합니다 보면서 부담스럽지 않고 즐겁게 웃으며 볼 수 있었어요	['저', '도', '추리', '쪽', '보다는', '코미디', '쪽', '에', '좀', '더', '치중', '된', '영화', '라고', '생각', '합니다', '보면서', '부담', '스럽지', '않고', '즐겁게', '웃으며', '볼', '수', '있었어요']	5.0138723107438645	2.09
4	4	L-n2pWf3dAA	저는 영화를 전문적으로 분석하고 비교할만큼의 지식은 없는 사람인지라 탐정홍길동은 보면서 씬시티가 많이 생각 났었습니다. 내용이 그렇다는 것이 아니라 연출된 장면장면에서 그런 느낌을 많이 받았는데요.. 저보다 영화에 지식이 뛰어나신 발새(줄이려니 좀 그러네여..?!! 살짝 웃자 정도입니다!)님께서는 더 느끼셨을거라 생각이 드는데 그럼에도 불구하고 탐정홍길동을 높게 평가하는건 단지 탐정리턴즈보단 나은정도의 의미인지 다른 전문가적 의견인지 궁금하네요! 시간이      나서 이 댓글을 보신다면 의견을 듣고 싶습니다! 영상 잘 보고 있구 응원합니다! 편집자 고민을 굳이 하셔야 하나 싶을 정도로 저는 오히려 지금의 방식이 좋네요^^!	['저', '는', '영화', '를', '전문', '적', '으로', '분석', '하고', '비교', '할만큼의', '지식', '은', '없는', '사람인', '지라', '탐정', '홍길동', '은', '보면서', '씬시티', '가', '많이', '생각', '났었습니다', '내용', '이', '그렇다는', '것', '이', '아니라', '연출', '된', '장면', '장면', '에서', '그런', '느낌', '을', '많이', '받았는데요', '저', '보다', '영화', '에', '지식', '이', '뛰어나신', '발', '새줄이려니', '좀', '그러', '네', '여', '살짝', '웃자', '정도', '입니', '다님', '께서는', '더', '느끼셨을거라', '생각', '이', '드는데', '그럼에도', '불구', '하고', '탐정', '홍길동', '을', '높게', '평가', '하는건', '단지', '탐정', '리턴즈', '보단', '나은정', '도의', '의미', '인지', '다른', '전문가', '적', '의견', '인지', '궁금하네요', '시간', '이', '나서', '이', '댓글', '을', '보신다면', '의견', '을', '듣고', '싶습니다', '영상', '잘', '보고', '있구', '응원', '합니다', '편집자', '고민', '을', '굳이', '하셔야', '하나', '싶을', '정도', '로', '저', '는', '오히려', '지금', '의', '방식', '이', '좋네요']	12.892956999946325	4.18
5	5	L-n2pWf3dAA	재밌게 보고 왔어요. 흥행은 괜찮게 할 것 같습니다ㅎㅎ	['재밌게', '보고', '왔어요', '흥행', '은', '괜찮게', '할', '것', '같습니다']	4.797854648889116	2.46
6	6	L-n2pWf3dAA	요즘 tv에서 광고 겁나 자주 때려대는 한국영화는 잘 안보게됨..... 극을 이어가는 방식이나 지향점이 비슷함. 억지로 웃기거나 억지로 울림.	['요즘', 'tv', '에서', '광고', '겁나', '자주', '때려', '대는', '한국영', '화', '는', '잘', '안보', '게', '됨', '극', '을', '이', '어가', '는', '방식', '이나', '지향', '점', '이', '비슷함', '억지로', '웃기거나', '억지로', '울림']	-4.21383954387659	-1.7
7	7	L-n2pWf3dAA	국내에서도 이런 장르의 영화가 계속 있었으면 좋겠어요.<br>응원합니다~	['국내', '에서도', '이런', '장르', '의', '영화', '가', '계속', '있었으면', '좋겠어요', '응원', '합니다']	-0.3818814329053539	-0.18
8	8	L-n2pWf3dAA	근데  요새  탐정물들  거의  코믹요소를  다  넣는데...글고  재밌게  보면  되지  너무  따지고  보면  재미있남?  ㅋㅋ	['근데', '요새', '탐정물', '들', '거의', '코믹', '요소', '를', '다', '넣는데', '글', '고', '재밌게', '보면', '되지', '너무', '따지고', '보면', '재미있', '남']	-2.6888683080843108	-1.17
9	9	L-n2pWf3dAA	재가 이영화 여친한테 볼까 했는데 여친이 4년 동안 사기면서 처음 욕했어요 &quot;오빠 미쳤어?&quot;<br>바로 쥬라기보았다는 ㅠㅠ	['재', '가', '이영화', '여친', '한테', '볼까', '했는데', '여친', '이', '4년', '동안', '사기면서', '처음', '욕', '했어요', 'quot', '오빠', '미쳤어', 'quot', '바로', '쥬라기', '보았다는']	-3.839708046469809	-1.64
10	10	L-n2pWf3dAA	아무생각없이보면 어? 생각보다 재밌다 생각듭니다. 머리비우고 보시면 띵작. 진지한 추리물원하면 글쎄? 정도입니다	['아무', '생각', '없이', '보면', '어', '생각', '보다', '재밌다', '생각', '듭니', '다', '머리', '비우고', '보시', '면', '띵작', '진지한', '추리물', '원하면', '글쎄', '정도', '입니다']	0.8073068640338017	0.34
11	11	L-n2pWf3dAA	탐정 1탄도 그래서 재미있었어요 ㅎㅎ<br>그래서 탐정2탄도 봤는데 엄청 웃었어요<br>잘웃는편이 아닌데도 넘 웃김	['탐정', '1', '탄도', '그래서', '재미있었어요', '그래서', '탐정', '2', '탄도', '봤는데', '엄청', '웃었어요', '잘', '웃는', '편이', '아닌데도', '넘', '웃김']	5.526874074907999	2.45
12	12	L-n2pWf3dAA	탐정홍길동 되게 인상적이게봤는데 진짜 후속편 기다리고있네요	['탐정', '홍길동', '되게', '인상', '적', '이', '게', '봤는데', '진짜', '후', '속편', '기다리고있네요']	3.3152765086524236	1.59
13	13	L-n2pWf3dAA	발없는새님 김지운 감독의 영화 &#39;인랑&#39; 의 티저 예고편이 나왔는데 다음 영상을 인랑에 대해  다루어 주셨스면 좋겠습니다.	['발', '없는', '새', '님', '김지운', '감독', '의', '영화', '39', '인', '랑', '39', '의', '티저', '예고편', '이', '나왔는데', '다음', '영상', '을', '인', '랑', '에', '대해', '다루어', '주셨스', '면', '좋겠습니다']	2.1048415240680707	0.86
14	14	L-n2pWf3dAA	발없는새님 영상 잘 보고있는데요 요즘 &quot;뽂&#39; 소리 너무 자주 나오는거같아요.. 딱히 이펙트도 없는데 좀 안어울려요 죄송해요 그냥 지금대로 하셔도 계속 잘 볼께요	['발', '없는', '새', '님', '영상', '잘', '보고있는데요', '요즘', 'quot', '뽂', '39', '소리', '너무', '자주', '나오는거', '같아요', '딱히', '이펙트', '도', '없는데', '좀', '안', '어울려요', '죄송해요', '그냥', '지금', '대로', '하셔도', '계속', '잘', '볼께요']	0.4543217745374217	0.18
15	15	L-n2pWf3dAA	발새임 혹시 팬더추리시리즈? 흐흐	['발', '새', '임', '혹시', '팬더', '추리', '시리즈', '흐흐']	0.00945221514468808	0.0
16	16	L-n2pWf3dAA	사실보다가 흠칫하리만치 납득안가는 장면이 두개있긴한데 가벼운 웃음은 있는 영화같아요.  추리란 타이틀은 좀 무리지만요	['사실', '보다', '가', '흠칫', '하리', '만치', '납득', '안', '가는', '장면', '이', '두', '개', '있긴한데', '가벼운', '웃음', '은', '있는', '영화', '같아요', '추리란', '타이틀', '은', '좀', '무리', '지만', '요']	0.5915644810414942	0.24
17	17	L-n2pWf3dAA	휘발성 강한 코메디영화는 공장에서 찍어내는것처럼 매번 나오는구만, 딱 아이돌로 점칠화된 가요계나 양산형 오토 RPG게임으로 넘치는 게임시장과 매우 닮아 있음, 국내 대중문화는 맹목적으로 상업성만 추구하는듯, 자본주의에서 마냥 나쁘다고는 못하지만 이러니 발전이 없고 도태되는듯	['휘발', '성', '강한', '코', '메디', '영화', '는', '공장', '에서', '찍어내는것처럼', '매번', '나오는구만', '딱', '아이돌', '로', '점', '칠', '화', '된', '가요', '계', '나', '양산', '형', '오토', 'RPG', '게임', '으로', '넘치는', '게임', '시장', '과', '매우', '닮아', '있음', '국내', '대중문화', '는', '맹목', '적', '으로', '상업성', '만', '추구', '하는듯', '자본주의', '에서', '마냥', '나쁘다고는', '못', '하지만', '이러니', '발전', '이', '없고', '도태', '되는듯']	-10.89418257239207	-3.95
18	18	L-n2pWf3dAA	오리엔탈 특급열차 같은 영화가 나왔으면...	['오리', '엔', '탈', '특급', '열차', '같은', '영화', '가', '나왔으면']	-2.0383485585536576	-1.04
19	19	L-n2pWf3dAA	전 여자친구랑 같이 봤는데 개그물이라 생각하시고 보면 만족스러워요	['전', '여자친구', '랑', '같이', '봤는데', '개그', '물이', '라', '생각', '하시고', '보면', '만족스러워요']	1.4885255163543405	0.72
20	20	L-n2pWf3dAA	그냥 웃으면서 재밌게 봤어요.ㅋㅋㅋㅋ	['그냥', '웃으면서', '재밌게', '봤어요']	3.1337378674770404	1.96
21	21	L-n2pWf3dAA	조선명탐정3같은 영화랑 탐정리턴즈를 비교하기엔 탐정이 너무 아깝지 않나요...?ㅜㅜ 개인차지만 김명민씨 팬이어서 조선명탐정 3봤는데 추리는 1도 없고 흡혈귘ㅋㅋㅋㅋㅋㅋㅋㅋ에 공감 1도 안되는 신파작렬이라 너무 화가났었는데.. 탐정은 실컷 웃고 왔거든요. 취향차이라고 볼 수도 있겠지만 조선명탐정 전편은 모르겠는데 3은 진짜... 어후... 명절에 티비에서 봤으면 이렇게 화나진 않았을텐데..	['조선', '명탐정', '3', '같은', '영화', '랑', '탐정', '리턴즈', '를', '비교', '하기엔', '탐정', '이', '너무', '아깝지', '않나요', '개인', '차지', '만', '김명민', '씨', '팬', '이어서', '조선', '명탐정', '3', '봤는데', '추리', '는', '1', '도', '없고', '흡혈귘', '에', '공감', '1', '도', '안되는', '신파', '작렬', '이라', '너무', '화가', '났었는데', '탐정', '은', '실컷', '웃고', '왔거든요', '취향', '차이', '라고', '볼', '수도', '있겠지만', '조선', '명탐정', '전편', '은', '모르겠는데', '3', '은', '진짜', '어후', '명절', '에', '티비', '에서', '봤으면', '이렇게', '화나진', '않았을텐데']	-6.692912845086251	-2.34
22	22	L-n2pWf3dAA	휴 매번 광고를 논스킵하기위해 노력하고잇죠!	['휴', '매번', '광고', '를', '논', '스킵', '하기', '위해', '노력', '하고', '잇죠']	-0.17559126505773448	-0.09
23	23	L-n2pWf3dAA	1편은 재미있게 봤는데..<br>2편은 망작?!	['1', '편', '은', '재미있게', '봤는데', '2', '편', '은', '망작']	3.3282335628241526	1.7
24	24	L-n2pWf3dAA	그래 이런게 리뷰다운 리뷰지. 그 참을수 없는 얄팍함으로 어줍잖게 저명한 평론가 흉내내면서 비평이 아닌 조롱만 일삼는 역겨운 라이너 쓰레기랑은 격이 다르다.	['그래', '이런게', '리뷰', '다운', '리뷰', '지', '그', '참을수', '없는', '얄팍함으로', '어줍잖게', '저명한', '평론가', '흉내내', '면서', '비평', '이', '아닌', '조롱', '만', '일삼', '는', '역겨운', '라이너', '쓰레기', '랑은', '격', '이', '다르다']	-0.3529850894963844	-0.14
25	25	L-n2pWf3dAA	저는 이 영화 전작포함 볼 생각조차 안나고 1초의 망설임도 안생기던데.. 보신분들 대단..	['저', '는', '이', '영화', '전작', '포함', '볼', '생각', '조차', '안나', '고', '1초', '의', '망설임도', '안', '생기던데', '보신', '분들', '대단']	1.1219433949765316	0.49
26	26	L-n2pWf3dAA	그냥 코미디로 봐야댐ㅋㅋㅋㅋ	['그냥', '코미디', '로', '봐야', '댐']	0.42815492608522976	0.25
27	27	L-n2pWf3dAA	홍길동(이제훈)은 꽤나 재밋게 봤는데, 안타깝게도 흥행 참패 였군요..그것보다는 언급을 계속 못하시는 영화 ..ㄹ,.ㅅ....$가 계속 떠오르네요..	['홍길동', '이제훈', '은', '꽤', '나', '재밋', '게', '봤는데', '안타깝게도', '흥행', '참패', '였군요', '그것', '보다는', '언급', '을', '계속', '못', '하시는', '영화', '가', '계속', '떠오르네요']	6.4065210008390725	2.71
28	28	L-n2pWf3dAA	더 비기닝을 정말 재미있게 봐서 기대하고 갔지만 기대했던 추리부분은 기대이하였네요 ㅜㅜ 물론 웃으면서 재미있게는 봤습니다만 후속작은 좀더 추리에 힘을 실어줬으면 하는 맘 입니다. 그나저나 탐정홍길동은 정말 수작이라 생각하지만 제목이 유치해서 그런가 참 아쉽습니다 ㅠㅠ 시간 나시면 탐정 홍길동도 리뷰해주세여	['더', '비기닝', '을', '정말', '재미있게', '봐서', '기대하고', '갔지만', '기대했던', '추리', '부분', '은', '기대이하였네요', '물론', '웃으면서', '재미있게는', '봤습니다만', '후속작', '은', '좀더', '추리', '에', '힘', '을', '실어', '줬으면', '하는', '맘', '입니다', '그나저나', '탐정', '홍길동', '은', '정말', '수작', '이라', '생각', '하지만', '제목', '이', '유치해서', '그', '런가', '참', '아쉽습니다', '시간', '나시', '면', '탐정', '홍길동', '도', '리뷰', '해주세여']	10.443167279746607	3.83
29	29	L-n2pWf3dAA	좋아요!	['좋아요']	0.0	0.0
30	30	L-n2pWf3dAA	&lt;미씽: 사라진 여자&gt;같은 진지한 영화 만드신 감독님이 맘편하게 웃을수 있는 이 시리즈 맡아서 좀 의외였던	['lt', '미씽', '사라진', '여자', 'gt', '같은', '진지한', '영화', '만드신', '감독', '님', '이', '맘', '편하게', '웃을수', '있는', '이', '시리즈', '맡아서', '좀', '의외', '였던']	2.7424042194269957	1.17
31	31	L-n2pWf3dAA	와 소름 탐정 홍길동 개꿀잼인데...<br>특이한cg처리와 한국적(?)이지않은 전개가 재미있었죠ㅎㄹ	['와', '소름', '탐정', '홍길동', '개꿀잼', '인데', '특이한', 'cg', '처리', '와', '한국', '적', '이지', '않은', '전개', '가', '재미있었죠']	-0.012957054171728322	-0.01
32	32	L-n2pWf3dAA	탐정홍길동 진짜 흥행못해서 아쉬운작품 만약에 속편이 제작될수있다면 후원금이 많아야겠죠?	['탐정', '홍길동', '진짜', '흥행', '못', '해서', '아쉬운', '작품', '만약', '에', '속편', '이', '제작', '될수있다면', '후', '원금', '이', '많아야겠죠']	3.651159727240347	1.62
33	33	L-n2pWf3dAA	한 마리 토끼만 쫓는다.<br>인생 철학을 배우고 갑니다.	['한', '마리', '토끼', '만', '쫓는다', '인생', '철학', '을', '배우고', '갑니다']	0.0	0.0
34	34	L-n2pWf3dAA	오달수는 모자이크<br>해주세여	['오달수', '는', '모자이크', '해주세여']	0.0	0.0
35	35	L-n2pWf3dAA	제발 기사를 보고 말하자	['제발', '기사', '를', '보고', '말', '하자']	1.814956519797576	1.02
36	36	L-n2pWf3dAA	dudwoa k 저기 오달수는 피해자 입니다<br>어디 증거도 없는 무고로 사람 인생 종칠러한 극단 배우를 무고죄로 고소 해야 합니다	['dudwoa', 'k', '저기', '오달수', '는', '피해자', '입니다어디', '증거', '도', '없는', '무고', '로', '사람', '인생', '종', '칠러한', '극단', '배우', '를', '무고죄', '로', '고소', '해야', '합니다']	1.1431900826217285	0.48
37	37	L-n2pWf3dAA	dudwoa k 대뇌피질에 정보 업데이트 부탁드립니다	['dudwoa', 'k', '대뇌피질', '에', '정보', '업데이트', '부탁드립니다']	-0.3358832185879237	-0.18
38	38	L-n2pWf3dAA	웃기긴2편이 웃기나 ...1편이 훨씬 재밌었음 ..	['웃기긴', '2', '편이', '웃기', '나', '1', '편이', '훨씬', '재밌었음']	0.0	0.0
39	39	L-n2pWf3dAA	솔직히 그래도 이번 탐정2가 조선 명탐정 3탄 보다 훨씬 좋았다고 생각합니다 3편에서는 추리를 쌈싸먹고 흡혈귀 나오면서 이게 뭔가 했거든요... 거기에 연출이 스멀스몰스크린에 맞춰졌으니까요	['솔직히', '그래도', '이번', '탐정', '2', '가', '조선', '명탐정', '3', '탄', '보다', '훨씬', '좋았다고', '생각', '합니다', '3', '편', '에서는', '추리', '를', '쌈', '싸', '먹고', '흡혈귀', '나오면서', '이', '게', '뭔가', '했거든요', '거기', '에', '연출', '이', '스', '멀', '스몰', '스크린', '에', '맞춰졌으니까', '요']	1.5192244191442232	0.58
40	40	L-n2pWf3dAA	개인적으로 탐정 홍길동 정말 인상깊었는데 발새님도 그러하시다니 새삼 반갑네요. 저도 그런 영화가 한번 더 나오길 바라고있지만. 안되겠죠 ㅠㅠ	['개인', '적', '으로', '탐정', '홍길동', '정말', '인상', '깊었는데', '발새', '님', '도', '그러하시다니', '새삼', '반갑네요', '저', '도', '그런', '영화', '가', '한번', '더', '나오길', '바라고있지만', '안되겠죠']	2.1846562426014597	0.92
41	41	L-n2pWf3dAA	저도 탐정 홍길동 좋았는데... 아쉬워요.	['저', '도', '탐정', '홍길동', '좋았는데', '아쉬워요']	1.836203207442772	1.03
42	42	L-n2pWf3dAA	흥행 신경썼다고 자꾸 하는데 본인돈으로 영화 만든다고 생각해봐요 ㅋㅋㅋㅋ흥행이 신경안쓰이나 대중영화에서<br>어떻게 자기가만들고싶은 영화만 만드나요  결국은 대중이 이런영화 저런영화  여러영화를 폭넓게 선택해줘야하는거 대중적 흥행적요소를 더욱 귀하게 여기는 감독이됐네?  라고 말하기보단 이제 우리나라사람들도 아무런 메세지도 영화전 예술성도없는것만 1차원적인것만(물론이런영화도 나름에 가치가있습니다) 쫒지말고 영화를 음미해버릇해서 다양한  메세지를 던지는 영화를 다양한 재미 인간으로서 느끼는 유희의 다양성을 추구하는 관객이되어야 더적은 돈으로도 더많은 환희를 느낄수있는 영화시장을 갖게되는거라고 생각함	['흥행', '신경', '썼다고', '자꾸', '하는데', '본인', '돈', '으로', '영화', '만든다고', '생각', '해봐요', '흥행', '이', '신경안', '쓰이나', '대중', '영화', '에서', '어떻게', '자기', '가', '만들고싶은', '영화', '만', '만드나', '요', '결국', '은', '대중', '이', '이런', '영화', '저런', '영화', '여러', '영화', '를', '폭넓게', '선택', '해줘', '야하는거', '대중', '적', '흥행', '적', '요소', '를', '더욱', '귀하게', '여기는', '감독', '이', '됐네', '라고', '말', '하기보단', '이제', '우리나라', '사람', '들', '도', '아무런', '메세지', '도', '영', '화전', '예술', '성', '도', '없는것만', '1', '차원', '적인것만', '물론', '이런', '영화', '도', '나름', '에', '가치가있습니다', '쫒지말고', '영화', '를', '음미', '해', '버릇', '해서', '다양한', '메세지', '를', '던지는', '영화', '를', '다양한', '재미', '인간', '으로서', '느끼는', '유희', '의', '다양성', '을', '추구', '하는', '관객', '이', '되어야', '더', '적', '은', '돈', '으로도', '더', '많은', '환희', '를', '느낄수있는', '영화', '시장', '을', '갖게', '되는거라고', '생각', '함']	-13.878407422532478	-4.48
43	43	L-n2pWf3dAA	전편은 넷플릭스에서 보실 수 있습니다. 새누리 강점기 당시 느낌이 잘 살아있고 평범하게 재미있더군요.	['전편', '은', '넷플릭스', '에서', '보실', '수', '있습니다', '새누리', '강점', '기', '당시', '느낌', '이', '잘', '살아있고', '평범하게', '재미있더군요']	1.6564671256483037	0.74
44	44	L-n2pWf3dAA	TV에서 할 때까지 기다려얄까요?ㅋㅋㅋ 그나저나 권상우는 드라마도 영화도 탐정코미디😂	['TV', '에서', '할', '때', '까지', '기다려', '얄', '까요', '그나저나', '권상우', '는', '드라마', '도', '영화', '도', '탐정', '코미디']	1.1188257935504529	0.5
45	45	L-n2pWf3dAA	??:걸러도된다카더라....	['걸러', '도', '된다', '카더라']	0.0	0.0
46	46	L-n2pWf3dAA	정통 추리면 한국에서 흥행이 될 지 <br>저는 좋아하는 장르가 아니라 본 영화가 없는데 추천하나 부탁드립니다 셜록은 빼구요 <br><br>그리고 탐정리턴즈는 추리는 가볍게 생각하고<br>코미디는 상당히 재미있었습니다ㅋㅋㅋ<br>근데 성동일씨의 진중한 연기는 조금 아쉬웠어요<br>연기력은 좋았는데 분위기가 ㅋ 진지한척하는 개그였다면 좋았을텐데	['정통', '추리', '면', '한국', '에서', '흥행', '이', '될', '지', '저', '는', '좋아하는', '장르', '가', '아니라', '본', '영화', '가', '없는데', '추천', '하나', '부탁드립니다', '셜록', '은', '빼구요', '그리고', '탐정', '리턴즈', '는', '추리', '는', '가볍게', '생각', '하고', '코미디', '는', '상당히', '재미있었습니다', '근데', '성동일', '씨', '의', '진중한', '연기', '는', '조금', '아쉬웠어요', '연기력', '은', '좋았는데', '분위기', '가', '진지한', '척', '하', '는', '개그', '였다면', '좋았을텐데']	1.8136297987486965	0.65
47	47	L-n2pWf3dAA	영화가 재밌는건지아니면 걍 웃기기만한건지 헷갈렸었죠	['영화', '가', '재밌는', '건지아니면', '걍', '웃기', '기만', '한', '건', '지', '헷갈렸었죠']	2.129593050740304	1.04
48	48	L-n2pWf3dAA	개인적인 의견이지만 가이드 리뷰하실때 해당 영화 예고편 링크를 추가정보란(?)에 넣어놔도 좋을것같아요 ㅎㅎ	['개인', '적', '인', '의견', '이지만', '가이드', '리뷰', '하실', '때', '해당', '영화', '예고편', '링크', '를', '추가', '정보', '란', '에', '넣어', '놔도', '좋을것', '같아요']	0.2804327891258054	0.12
49	49	L-n2pWf3dAA	탐정 홍길동 재밌게 봤는데 흥행은 못했군요.	['탐정', '홍길동', '재밌게', '봤는데', '흥행', '은', '못', '했군요']	6.483218117946388	3.41
50	50	L-n2pWf3dAA	추리덕후가 아니라면 라이트하게 즐기기에, 추리물에 입문하기에 더없이 좋은 영화 아닐까합니다. 1편과 더불어 범행소재가 나름 충격적이었구요	['추리', '덕후', '가', '아니라면', '라이트', '하게', '즐기기에', '추리물', '에', '입문', '하기에', '더없이', '좋은', '영화', '아닐까', '합니다', '1', '편', '과', '더불어', '범행', '소재', '가', '나름', '충격', '적', '이었구요']	-1.312558692699361	-0.54
51	51	L-n2pWf3dAA	탐정1은 진짜 추리물처럼 재밋게봤는데 2편은 좀 못미치나봐요???	['탐정', '1', '은', '진짜', '추리물', '처럼', '재밋', '게', '봤는데', '2', '편', '은', '좀', '못', '미치나', '봐요']	1.5192244191442277	0.69
52	52	L-n2pWf3dAA	전 괜찮게 봤습니다. 추리쪽은 아무래도 허술했지만 발새님 말씀처럼 두가지 다 할 자신이 없으면 하나라도 집중하는 게 낫다고 생각합니다. 흥행에 성공해서 감독에게 좀더 권한이 주어진다면 혹시 3편에서 두 가지 모두 ㅅㅌㅊ 로 나올지도 모르죠.	['전', '괜찮게', '봤습니다', '추리', '쪽', '은', '아무래도', '허', '술', '했지만', '발새', '님', '말씀', '처럼', '두', '가지', '다', '할', '자신', '이', '없으면', '하나', '라도', '집중', '하는', '게', '낫다', '고', '생각', '합니다', '흥행', '에', '성공해서', '감독', '에게', '좀더', '권한', '이', '주어진다면', '혹시', '3', '편', '에서', '두', '가지', '모두', '로', '나올지도', '모르죠']	7.606964072303834	2.83
53	53	L-n2pWf3dAA	근데 발새님 탐정 홍길동에 관한건 저도 정말 인정합니다.	['근데', '발새', '님', '탐정', '홍길동', '에', '관', '한', '건', '저', '도', '정말', '인정', '합니다']	4.305824293507733	2.01
54	54	L-n2pWf3dAA	최근에 조성희 감독이 번개호라는 sf영화를 찍는 다고 합니다. 송중기씨를 캐스팅하려고 하네요.	['최근', '에', '조성', '희', '감독', '이', '번개', '호', '라는', 'sf', '영화', '를', '찍는', '다고', '합니다', '송중기', '씨', '를', '캐스팅', '하려고', '하네요']	1.9103458287209567	0.82
55	55	L-n2pWf3dAA	손담비는 있으나 마나한 캐릭 / 광수는 중후반 멱살끌고 캐리 / 두 남주는 전작과 비슷<br>전작보다는 무게는 반삭된 정도로 가벼우나 진지와 스토리도 같이 반이 날아가버린 영화	['손담비', '는', '있으나', '마나', '한', '캐릭', '광수', '는', '중후', '반', '멱살', '끌', '고', '캐리', '두', '남주는', '전작', '과', '비슷전작', '보다는', '무게', '는', '반', '삭', '된', '정도', '로', '가벼우나', '진지', '와', '스토리', '도', '같이', '반', '이', '날아가', '버린', '영화']	2.6086663519499567	1.01
